来源,时间,标题
同花顺,2026-07-01 13:32:21,美联储主席沃什：通胀风险已经下降
同花顺,2026-07-01 13:30:49,美股开盘：美股三大指数集体低开
同花顺,2026-07-01 13:28:46,聚石化学：公司光刻胶、氢能、钙钛矿等项目仅有部分技术储备
同花顺,2026-07-01 13:25:40,美联储主席沃什讲话后 美国国债收益率收窄涨幅 现货黄金短线拉升
同花顺,2026-07-01 13:23:19,报道称微软计划在销售、工程、Xbox领域裁员数千人
同花顺,2026-07-01 13:22:47,瑞典法院裁定谷歌须支付近15亿美元反垄断赔偿金
同花顺,2026-07-01 13:20:11,纽约原油期价盘中创2月27日以来新低
同花顺,2026-07-01 13:13:26,美联储主席沃什：不会给出前瞻性指引
同花顺,2026-07-01 13:01:12,欧盟机构：6月单日全球海面温度破历史同期纪录
同花顺,2026-07-01 13:00:59,20家芯片厂商集体涨价，英飞凌回应
同花顺,2026-07-01 13:00:14,期市夜盘开盘，国内期货主力合约多数下跌，LPG跌超3%
同花顺,2026-07-01 12:56:01,“出口中国”英国专场活动在伦敦举行
同花顺,2026-07-01 12:48:33,美光科技美股盘前跌超6%
同花顺,2026-07-01 12:47:44,美团与梅花创投入股跃瓦创新
同花顺,2026-07-01 12:43:03,Arm Holdings美股盘前跌超6%
同花顺,2026-07-01 12:42:23,Meta美股盘前涨超8%
同花顺,2026-07-01 12:37:01,霍尔木兹海峡一艘集装箱船搁浅
同花顺,2026-07-01 12:35:29,Meta美股盘前涨超4%
同花顺,2026-07-01 12:31:10,先导基电：拟增资取得先导微电子控股权
同花顺,2026-07-01 12:29:53,多家MLCC厂商称“正酝酿涨价”，业内看涨至2027年年底
同花顺,2026-07-01 12:25:39,渤海租赁：控股子公司拟购买11架A321NEO订单飞机，目录价约14.25亿美元
同花顺,2026-07-01 12:23:32,华为与西北政法大学签署合作协议
同花顺,2026-07-01 12:21:19,芯联集成发产品涨价函？公司内部人士回应：产能供不应求
同花顺,2026-07-01 12:15:21,“小非农”人数低于预期
同花顺,2026-07-01 12:13:30,翰宇药业：利拉鲁肽注射液获批上市
同花顺,2026-07-01 12:12:21,深圳辟谣“全域开放无人驾驶出租车”：将严格控制投放规模
同花顺,2026-07-01 12:08:43,工业和信息化部办公厅、农业农村部办公厅开展农业领域机器人典型应用场景遴选工作
同花顺,2026-07-01 12:07:20,行云科技：控股子公司海南行云签订5年总金额55.08亿元算力服务合同
同花顺,2026-07-01 12:06:29,盈方微：控股子公司联合无线香港拟以自有资金1000万美元投资设立全资子公司
同花顺,2026-07-01 12:06:18,思特威新一代高速光互连方案亮相慕尼黑上海电子展，有望2027年商用落地
同花顺,2026-07-01 12:05:24,西麦食品：实际控制人及其一致行动人拟减持不超过0.8927%股份
同花顺,2026-07-01 12:05:09,三瑞智能：预计2026年上半年净利润同比增长51.63%～89.07%
同花顺,2026-07-01 12:03:16,7月1日 周三《新闻联播》要闻13条
同花顺,2026-07-01 11:57:36,97年的孙天祥加入百度，任基础模型研发部负责人
同花顺,2026-07-01 11:56:56,常熟银行：江南商贸集团增持公司0.47%股份
同花顺,2026-07-01 11:56:10,新迅达：鑫兴光电华东区域半导体激光器芯片项目处于刚开工状态，建设完成并投产尚需较长时间
同花顺,2026-07-01 11:55:17,共达电声：副总经理杨志勇、侯杰拟合计减持不超过0.0371%股份
同花顺,2026-07-01 11:33:50,OpenAI前高管回应有没有AI泡沫
同花顺,2026-07-01 11:28:22,华新科技：股东恒易有业拟减持不超过1.3136%股份
同花顺,2026-07-01 11:26:24,多氟多：公司目前没有六氟化钨生产线，未有实质性产品
同花顺,2026-07-01 11:25:20,巴基斯坦与印度交换在押人员名单
同花顺,2026-07-01 11:24:05,天马推出首款3.16英寸Micro-LED透明圆屏
同花顺,2026-07-01 11:21:50,ServiceNow美股盘前涨超5%
同花顺,2026-07-01 11:19:09,现货黄金站上4020美元/盎司
同花顺,2026-07-01 11:13:51,惠康科技：公司目前对欧洲市场的销售占整体营收比例较低
同花顺,2026-07-01 11:13:14,亚通精工：全资子公司签订8.6亿元合同
同花顺,2026-07-01 11:13:02,嘉友国际：回购资金总额调整为不低于人民币1亿元且不超过人民币2亿元
同花顺,2026-07-01 11:09:26,长城汽车：2026年6月销量10.81万台，同比下降2.36%
同花顺,2026-07-01 11:08:52,海程邦达：拟以5500万元-1.1亿元回购公司股份
同花顺,2026-07-01 11:08:30,雷赛智能：预计2026年上半年净利润同比增长55.00%～65.00%
同花顺,2026-07-01 11:02:10,立讯精密：立讯转债转股价格调整为55.86元/股
同花顺,2026-07-01 11:01:52,伊朗称美若无法约束宠物伊朗将出手
同花顺,2026-07-01 11:01:27,永贵电器：拟3314.45万元收购永贵博得31.0001%股权
同花顺,2026-07-01 10:58:12,赛力斯：6月合计销量36194辆，同比下降28.10%
同花顺,2026-07-01 10:57:08,康泰医学：三项医疗器械注册证变更获审批通过
同花顺,2026-07-01 10:56:48,监管纠偏券商分支机构“跑马圈地”，四大苗头遭点名
同花顺,2026-07-01 10:51:59,西部创业：子公司宁东铁路涉及一起1.39亿元的诉讼案件
同花顺,2026-07-01 10:18:42,稳健医疗：对红土一号认缴出资额调整为6428.25万元
同花顺,2026-07-01 10:18:33,稳健医疗：截至6月末已回购约1.29亿元公司股份
同花顺,2026-07-01 10:16:58,君实生物：与复星万邦签订授权许可协议，首付款2.15亿元
同花顺,2026-07-01 10:15:56,广期所调整铂、钯期货合约涨跌停板幅度和交易保证金标准
同花顺,2026-07-01 10:15:10,齐鲁银行：50亿元无固定期限资本债券发行完毕
同花顺,2026-07-01 10:15:03,安乃达：宁波思辉拟减持不超过3%股份
同花顺,2026-07-01 10:14:28,万凯新材：万凯转债预计触发赎回条件，已有10个交易日收盘价不低于转股价130%
同花顺,2026-07-01 10:13:43,仙琚制药：阿更葡糖钠注射液（化学药品1类）获药品注册证书
同花顺,2026-07-01 10:13:36,雅克科技：无六氟化钨相关业务，含氟类特种气体营收占比5.79%
同花顺,2026-07-01 10:13:28,新和成：首次以约2152.61万元回购0.0235%股份
同花顺,2026-07-01 10:11:53,唐山港：2026年1-6月货物吞吐量同比增长5.19%
同花顺,2026-07-01 10:10:07,比亚迪股份：6月新能源汽车销量40.35万辆，去年同期38.26万辆
同花顺,2026-07-01 10:07:21,中远海发：回购实施完成，实际回购4155.61万股并拟全部注销
同花顺,2026-07-01 10:07:12,澳达控股：获海南鸿言提供最高2亿元无息贷款，期限六个月
同花顺,2026-07-01 10:06:27,宇顺电子：剩余交易对价9.9亿元债务转移至控股股东
同花顺,2026-07-01 10:06:20,鲁信创投：股价连续两日涨幅偏离值累计达20%，参股蓝箭航天0.89%股权
同花顺,2026-07-01 10:06:20,财政部有关负责同志就新一期世界银行-中国国别伙伴框架涉华贷款有关问题答记者问
同花顺,2026-07-01 10:06:06,绿色经济：2026年度净利润876.1万港元
同花顺,2026-07-01 10:05:58,鲁信创投：控股股东鲁信集团减持公司1.00%股份，计划实施完毕
同花顺,2026-07-01 10:04:40,润欣科技：控股股东润欣信息减持813.6万股，持股比例降至21.9986%
同花顺,2026-07-01 08:45:57,小鹏集团：6月交付新车40126台，同比增长15.9%
同花顺,2026-07-01 08:45:41,老乡鸡与珍宝餐饮集团将设合资公司，进入新加坡市场
同花顺,2026-07-01 08:43:38,内蒙古通辽往返辽宁丹东直达高铁今日首发
同花顺,2026-07-01 08:41:42,赛隆退：子公司湖南赛隆药业获得氨茶碱注射液药品注册证书
同花顺,2026-07-01 08:40:49,霍莱沃：核心技术人员任振离职
同花顺,2026-07-01 08:40:08,安正时尚：股东陈克川所持4140.63万股股份过户至郑秀萍名下
同花顺,2026-07-01 08:39:13,包头稀交所：今日稀土主流产品价格小幅上涨
同花顺,2026-07-01 08:38:25,美国司法部要求严查“赴美产子游”
同花顺,2026-07-01 08:36:58,厦工股份：公司作为申请执行人申请强制执行，涉案金额合计1.42亿元
同花顺,2026-07-01 08:36:56,青云科技声明：网传高端AI服务器相关案件涉案企业非我司企业
同花顺,2026-07-01 08:36:38,消息人士：美伊将在多哈举行间接会谈
同花顺,2026-07-01 08:33:57,SpaceX美股盘前涨超2%
同花顺,2026-07-01 08:30:53,天正电气：累计回购股份占公司总股本的2.11%
同花顺,2026-07-01 08:30:18,公牛集团：截至2026年6月末累计回购592.13万股，支付金额2.34亿元
同花顺,2026-07-01 08:28:29,嘉亨家化：杭州拼便宜拟要约收购21.10%公司股份
同花顺,2026-07-01 08:28:20,美光科技美股盘前跌超4%
同花顺,2026-07-01 08:27:22,圣元环保：终止转让全资子公司100%股权
同花顺,2026-07-01 08:27:17,金力永磁：预计上半年净利润同比增长31.17%～50.84% 具身机器人电机转子产品已有小批量交付
同花顺,2026-07-01 08:25:40,佳创视讯：上海凌穹昆仑科技合伙企业通过协议转让受让佳创视讯5.0017%股份
同花顺,2026-07-01 08:24:46,韩建河山：子公司清青环保逾期未归还财务资助款本金200万元
同花顺,2026-07-01 07:21:58,抖音今年已处置超34万个直播间
同花顺,2026-07-01 07:15:19,现货黄金失守3960美元/盎司
同花顺,2026-07-01 07:14:56,李学军出任伟巴斯特中国区总裁
同花顺,2026-07-01 07:12:29,2026年1-5月服务贸易逆差6385.6亿元，比上年同期缩小1607.2亿元
同花顺,2026-07-01 07:04:49,软银：对Open AI进行100亿美元后续投资
同花顺,2026-07-01 07:03:50,三峡枢纽2026年上半年通过量达7664.2万吨
同花顺,2026-07-01 07:02:47,A股收评：科创50冲高回落跌2.48% 大金融等传统行业全线走强
同花顺,2026-07-01 07:01:52,欧洲主要股指开盘多数下跌
同花顺,2026-07-01 07:00:47,十多家酒企原酒被拍卖，价格拍出“可乐价”
同花顺,2026-07-01 07:00:18,股指期货午盘收盘 主力合约涨跌互现
同花顺,2026-07-01 06:47:03,沪深京三市成交额超3.5万亿元，较上日此时放量4072亿元
同花顺,2026-07-01 06:35:45,上期所欧线集运主力合约暴跌11%
同花顺,2026-07-01 06:31:36,工信部：1-5月份规模以上电子信息制造业增加值同比增长14.6%
同花顺,2026-07-01 06:31:27,日韩股市收盘涨跌互现
同花顺,2026-07-01 06:28:37,阳光电源股价一度接近跌停 公司称生产经营未现异常
同花顺,2026-07-01 06:24:56,泰国确认其大多数船只已安全驶离霍尔木兹海峡
同花顺,2026-07-01 06:15:43,半导体设备板块短线走低
同花顺,2026-07-01 06:13:56,景林资产“内部信”曝光：核心配置聚焦半导体与AI基础设施
同花顺,2026-07-01 06:10:40,高盛将阿迪达斯目标价从165欧元上调至185欧元
同花顺,2026-07-01 06:08:09,现货黄金跌超1%
同花顺,2026-07-01 05:49:27,阳光电源成交额达200亿元
同花顺,2026-07-01 05:40:18,韩国投资者上半年持续加仓A股
同花顺,2026-07-01 05:38:32,兆易创新成交额达300亿元
同花顺,2026-07-01 05:37:46,吉利在四川成立科技公司
同花顺,2026-07-01 05:30:28,上期所欧线集运主力合约暴跌10%
同花顺,2026-07-01 05:27:55,保险板块午后持续暴力拉升 新华保险涨停
同花顺,2026-07-01 05:15:24,SK海力士近期与客户签下的长期供应合约（LTA）与竞争对手不同，采用的是不设价格上限的独特合约架构
同花顺,2026-07-01 05:13:35,科创50指数午后持续下挫跌幅扩大至2%
同花顺,2026-07-01 05:12:51,光大期货：黄金跌势放缓，本周关注美就业数据
同花顺,2026-07-01 05:06:55,鸿蒙智行6月交付5.06万辆，上半年同比增长18.6%逆势领跑新能源车市
同花顺,2026-07-01 05:03:42,沪深京三市成交额超2.5万亿元，较上日此时放量3005亿元
同花顺,2026-07-01 05:01:46,科创50指数跌幅扩大至1%
同花顺,2026-07-01 04:52:25,JEITA：日本电子零部件企业出货额连续走高 电容出货规模单月破纪录
同花顺,2026-07-01 04:51:43,联合国机构警告刚果（金）埃博拉疫情将冲击地区经济
同花顺,2026-07-01 04:51:35,白宫称特朗普加密币获利无利益冲突
同花顺,2026-07-01 04:47:15,7月1日午间公告一览：新强联向特定对象发行股票申请获审核通过
同花顺,2026-07-01 04:45:53,科瑞技术：已为国内大客户提供液冷相关设备
同花顺,2026-07-01 04:45:46,应对AI时代“用电荒” 韩国拟研究缩短核电站建设周期
同花顺,2026-07-01 04:26:11,昊铂埃安BU 6月销量33682辆
同花顺,2026-07-01 04:25:09,国际金价6月下跌逾11%
同花顺,2026-07-01 04:06:33,国际能源署预计今年美国在煤炭和天然气发电厂的支出将达到500亿美元
同花顺,2026-07-01 04:04:51,欧洲央行管委德马尔科：欧洲央行可以等到下一轮经济预测再决定是否需要进一步收紧政策
同花顺,2026-07-01 04:02:07,美媒称美将在黎以驻军监督停火
同花顺,2026-07-01 03:59:59,消息人士：川崎重工拟通过新股与可转债融资12亿美元
同花顺,2026-07-01 03:57:43,宝盈基金迎新任总经理葛俊杰 原总经理杨凯、副总邹纯余离任
同花顺,2026-07-01 03:43:36,新强联：向特定对象发行股票申请获审核通过
同花顺,2026-07-01 03:34:30,A股午评：上证指数震荡走强涨1.08% 大金融、化工方向全线走强
同花顺,2026-07-01 03:31:44,ETF两市成交额报2857.6亿元，较昨日此时放量113.56亿元
同花顺,2026-07-01 03:30:50,ETF午评：恒生医疗ETF领涨7.61%，新能源电池ETF领跌4.07%
同花顺,2026-07-01 03:30:18,股指期货早盘收盘 主力合约全线上涨
同花顺,2026-07-01 03:27:42,广期所碳酸锂主力合约大涨5%
同花顺,2026-07-01 03:26:08,氟化工概念持续走高
同花顺,2026-07-01 03:21:57,宁德时代“巧克力换电”累计落站2000座
同花顺,2026-07-01 03:15:04,Anthropic：将继续与美国政府协调，扩大“Glasswing”计划下Mythos 5模型的开放范围，使更多美国国内及国际合作伙伴能够获得使用权限
同花顺,2026-07-01 03:12:30,巨头抢购电子级氢氟酸 部分供货商年内已涨价三成
同花顺,2026-07-01 03:06:41,中国宝武太钢钢科公司T1100S级超高强碳纤维一次性试制成功
同花顺,2026-07-01 02:52:33,兆易创新成交额达200亿元
同花顺,2026-07-01 02:49:34,SK与KKR将在韩国启动10GW可再生能源平台
同花顺,2026-07-01 02:48:15,PCB概念冲高回落
同花顺,2026-07-01 02:47:15,小米：某品牌汽车销售公司因造谣抹黑小米汽车被行政处罚40万元
同花顺,2026-07-01 02:35:13,创新药板块触底反弹
同花顺,2026-07-01 02:33:38,保险板块大幅反弹
同花顺,2026-07-01 02:33:27,我国今日全面进入主汛期
同花顺,2026-07-01 02:28:46,泰凌微盛文军：端侧AI产品将改变行业格局 短期看好智能家居、游戏外设等赛道
同花顺,2026-07-01 02:24:19,科创50指数涨幅扩大至2%
同花顺,2026-07-01 02:19:01,沪深京三市成交额超1.5万亿元，较上日此时放量1077亿元
同花顺,2026-07-01 02:15:20,上半年ETF管理人排名出炉 华夏基金守住第一
同花顺,2026-07-01 02:15:20,创业板指跌1%
同花顺,2026-07-01 02:11:43,证券板块震荡走高 华安证券涨停
同花顺,2026-07-01 02:11:30,富创精密成立精芯气体公司 含半导体相关业务
同花顺,2026-07-01 02:06:12,现货黄金失守3970美元/盎司
同花顺,2026-07-01 02:05:54,广州：拟提升退税商店覆盖率 推动各类入境消费重点场所增设退税商店
同花顺,2026-07-01 02:04:12,上期所欧线集运主力合约大跌8%
同花顺,2026-07-01 02:03:50,韩国综指跌幅扩大至3%
同花顺,2026-07-01 02:03:46,顺络电子：价格传导正在落地进行中，目前已经取得初步成效
同花顺,2026-07-01 02:01:30,哈总统：哈萨克斯坦两院制议会已完成使命
同花顺,2026-07-01 01:58:57,沪深京三市成交额超1.1万亿元，较上日此时放量313亿元
同花顺,2026-07-01 01:58:55,富时中国A50指数期货跌1%
同花顺,2026-07-01 01:52:18,机器人板块持续走高
同花顺,2026-07-01 01:50:31,美国股指期货下跌
同花顺,2026-07-01 01:29:18,股指期货早盘开盘 主力合约集体高开
同花顺,2026-07-01 01:28:14,2026中报预增板块大幅高开
同花顺,2026-07-01 01:28:11,华泰期货：当下白银与黄金逻辑类似，白银本身价格预计同样维持震荡格局
同花顺,2026-07-01 01:27:43,芯联集成三季度将价格调整，涨价幅度15%-25%
同花顺,2026-07-01 01:26:11,ETF开盘：中证A50ETF领涨4.68%，科创综指ETF领跌3.34%
同花顺,2026-07-01 01:25:38,A股开盘：三大指数涨跌不一
同花顺,2026-07-01 01:22:15,央行开展1000亿元7天期逆回购操作
同花顺,2026-07-01 01:21:45,上一交易日ETF两市融资融券余额1127.89亿元
同花顺,2026-07-01 01:20:50,中方呼吁国际社会加大对近东救济工程处支持力度
同花顺,2026-07-01 01:18:20,港股今日休市
同花顺,2026-07-01 01:17:18,委内瑞拉强震死亡人数升至1943人 救援仍在继续
同花顺,2026-07-01 01:17:08,现货白银失守58美元/盎司
同花顺,2026-07-01 01:16:41,乌兰察布算力规模占全国8.7% 承接北京外溢算力6.5万P
同花顺,2026-07-01 01:16:23,上期所欧线集运主力合约大跌6%
同花顺,2026-07-01 01:15:22,人民币兑美元中间价报6.8067，较上日调高42点
同花顺,2026-07-01 01:11:32,宁德时代10万吨碳酸锂产能复产
同花顺,2026-07-01 01:11:20,韩国综指跌幅扩大至2%
同花顺,2026-07-01 01:10:39,现货黄金失守3980美元/盎司
同花顺,2026-07-01 01:09:15,COMEX黄金期货跌超1% NYMEX铂金主力合约跌超1%
同花顺,2026-07-01 01:06:52,中药饮片将实现一物一码 全程可追溯
同花顺,2026-07-01 00:30:34,AI模型以更少数据精准预测RNA三维结构
同花顺,2026-07-01 00:28:22,联合国财务规则迎75年来重大调整
同花顺,2026-07-01 00:26:51,2026年1-5月全国国有及国有控股企业经济运行情况
同花顺,2026-07-01 00:26:14,韩国KOSPI指数抹去早盘涨幅，现跌0.55%
同花顺,2026-07-01 00:25:13,全球最大的黄金ETF SPDR Gold Trust持仓较前日持平
同花顺,2026-07-01 00:23:51,韩国投资者上半年借道ETF配置中国资产 半导体、沪深300、通信等产品受青睐
同花顺,2026-07-01 00:18:55,专家：美伊互不信任 “边打边谈”模式难破局
同花顺,2026-07-01 00:18:20,美元兑日元升至162.68，创40年新高
同花顺,2026-07-01 00:13:45,银河证券：市场对AI产业趋势的强烈共识将从主题炒作转向业绩验证
同花顺,2026-07-01 00:06:37,日经225指数涨幅扩大至2%
同花顺,2026-07-01 00:02:26,日韩股市集体高开
同花顺,2026-06-30 23:55:31,Anthropic：我们已收到通知，美国商务部已解除对Claude Fable 5和Mythos 5的出口管制
同花顺,2026-06-30 23:54:53,日本宫崎县北部附近发生5.1级地震
同花顺,2026-06-30 23:54:42,谷歌推出新模型Nano Banana 2 Lite
同花顺,2026-06-30 23:50:52,法国汽车行业组织PFA：6月特斯拉在法国的注册量增长104.99%
同花顺,2026-06-30 23:43:19,人民锐评：中国空调清凉欧洲，不只是贸易更是“中国式赋能”
同花顺,2026-06-30 23:40:31,广州佛山最快18分钟通达 广湛高铁佛山站正式开通运营
同花顺,2026-06-30 23:32:33,钼价高位运行达近三年高点 “以钼代钨”实现“高端半导体战略材料”属性切换
同花顺,2026-06-30 23:28:05,美国最大电网PJM着手管理数据中心电力需求
同花顺,2026-06-30 23:27:27,上交所多维规范机构债券交易申报 要求机构9月底前完成业务和技术准备
同花顺,2026-06-30 23:17:24,微软计划下周宣布裁员消息，裁员将少于其员工总数的2.5%
同花顺,2026-06-30 23:14:54,波音公司：此次IT系统故障影响了计算机系统和应用程序
同花顺,2026-06-30 22:56:11,多地发布脑机接口产业专项扶持政策
同花顺,2026-06-30 22:49:15,全球最大的白银ETF iShares Silver Trust持仓量较前日增加19.69吨
同花顺,2026-06-30 22:39:40,国产存储主控芯片商“竞速”资本市场
同花顺,2026-06-30 22:30:04,巴西国家石油公司将每升柴油价格下调0.35雷亚尔
同花顺,2026-06-30 22:29:43,美国商务部预计将于当地时间今晚解除对Anthropic AI模型Fable的出口管制
同花顺,2026-06-30 22:15:57,首批4只REITs指数基金今日发售
同花顺,2026-06-30 22:11:40,美国联邦基金利率期货进一步下跌，暗示美联储9月加息概率约为80%
同花顺,2026-06-30 22:02:27,COMEX白银期货跌超1%
同花顺,2026-06-30 21:59:39,卡塔尔首相与美特使举行会谈，讨论黎巴嫩问题
同花顺,2026-06-30 21:37:02,两名美国宇航员完成太空行走 更换机械臂故障部件
同花顺,2026-06-30 21:26:06,美国6月就业市场现疲软迹象
同花顺,2026-06-30 21:21:07,特朗普披露超过10亿美元加密货币相关收入
