来源,时间,标题
同花顺,2026-07-01 02:35:13,创新药板块触底反弹
同花顺,2026-07-01 02:33:38,保险板块大幅反弹
同花顺,2026-07-01 02:33:27,我国今日全面进入主汛期
同花顺,2026-07-01 02:28:46,泰凌微盛文军：端侧AI产品将改变行业格局 短期看好智能家居、游戏外设等赛道
同花顺,2026-07-01 02:24:19,科创50指数涨幅扩大至2%
同花顺,2026-07-01 02:19:01,沪深京三市成交额超1.5万亿元，较上日此时放量1077亿元
同花顺,2026-07-01 02:15:20,创业板指跌1%
同花顺,2026-07-01 02:15:20,上半年ETF管理人排名出炉 华夏基金守住第一
同花顺,2026-07-01 02:11:43,证券板块震荡走高 华安证券涨停
同花顺,2026-07-01 02:11:30,富创精密成立精芯气体公司 含半导体相关业务
同花顺,2026-07-01 02:06:12,现货黄金失守3970美元/盎司
同花顺,2026-07-01 02:05:54,广州：拟提升退税商店覆盖率 推动各类入境消费重点场所增设退税商店
同花顺,2026-07-01 02:04:12,上期所欧线集运主力合约大跌8%
同花顺,2026-07-01 02:03:50,韩国综指跌幅扩大至3%
同花顺,2026-07-01 02:03:46,顺络电子：价格传导正在落地进行中，目前已经取得初步成效
同花顺,2026-07-01 02:01:30,哈总统：哈萨克斯坦两院制议会已完成使命
同花顺,2026-07-01 01:58:57,沪深京三市成交额超1.1万亿元，较上日此时放量313亿元
同花顺,2026-07-01 01:58:55,富时中国A50指数期货跌1%
同花顺,2026-07-01 01:52:18,机器人板块持续走高
同花顺,2026-07-01 01:50:31,美国股指期货下跌
同花顺,2026-07-01 01:29:18,股指期货早盘开盘 主力合约集体高开
同花顺,2026-07-01 01:28:14,2026中报预增板块大幅高开
同花顺,2026-07-01 01:28:11,华泰期货：当下白银与黄金逻辑类似，白银本身价格预计同样维持震荡格局
同花顺,2026-07-01 01:27:43,芯联集成三季度将价格调整，涨价幅度15%-25%
同花顺,2026-07-01 01:26:11,ETF开盘：中证A50ETF领涨4.68%，科创综指ETF领跌3.34%
同花顺,2026-07-01 01:25:38,A股开盘：三大指数涨跌不一
同花顺,2026-07-01 01:22:15,央行开展1000亿元7天期逆回购操作
同花顺,2026-07-01 01:21:45,上一交易日ETF两市融资融券余额1127.89亿元
同花顺,2026-07-01 01:20:50,中方呼吁国际社会加大对近东救济工程处支持力度
同花顺,2026-07-01 01:18:20,港股今日休市
同花顺,2026-07-01 01:17:18,委内瑞拉强震死亡人数升至1943人 救援仍在继续
同花顺,2026-07-01 01:17:08,现货白银失守58美元/盎司
同花顺,2026-07-01 01:16:41,乌兰察布算力规模占全国8.7% 承接北京外溢算力6.5万P
同花顺,2026-07-01 01:16:23,上期所欧线集运主力合约大跌6%
同花顺,2026-07-01 01:15:22,人民币兑美元中间价报6.8067，较上日调高42点
同花顺,2026-07-01 01:11:32,宁德时代10万吨碳酸锂产能复产
同花顺,2026-07-01 01:11:20,韩国综指跌幅扩大至2%
同花顺,2026-07-01 01:10:39,现货黄金失守3980美元/盎司
同花顺,2026-07-01 01:09:15,COMEX黄金期货跌超1% NYMEX铂金主力合约跌超1%
同花顺,2026-07-01 01:06:52,中药饮片将实现一物一码 全程可追溯
同花顺,2026-07-01 00:30:34,AI模型以更少数据精准预测RNA三维结构
同花顺,2026-07-01 00:28:22,联合国财务规则迎75年来重大调整
同花顺,2026-07-01 00:26:51,2026年1-5月全国国有及国有控股企业经济运行情况
同花顺,2026-07-01 00:26:14,韩国KOSPI指数抹去早盘涨幅，现跌0.55%
同花顺,2026-07-01 00:25:13,全球最大的黄金ETF SPDR Gold Trust持仓较前日持平
同花顺,2026-07-01 00:23:51,韩国投资者上半年借道ETF配置中国资产 半导体、沪深300、通信等产品受青睐
同花顺,2026-07-01 00:18:55,专家：美伊互不信任 “边打边谈”模式难破局
同花顺,2026-07-01 00:18:20,美元兑日元升至162.68，创40年新高
同花顺,2026-07-01 00:13:45,银河证券：市场对AI产业趋势的强烈共识将从主题炒作转向业绩验证
同花顺,2026-07-01 00:06:37,日经225指数涨幅扩大至2%
同花顺,2026-07-01 00:02:26,日韩股市集体高开
同花顺,2026-06-30 23:55:31,Anthropic：我们已收到通知，美国商务部已解除对Claude Fable 5和Mythos 5的出口管制
同花顺,2026-06-30 23:54:53,日本宫崎县北部附近发生5.1级地震
同花顺,2026-06-30 23:54:42,谷歌推出新模型Nano Banana 2 Lite
同花顺,2026-06-30 23:50:52,法国汽车行业组织PFA：6月特斯拉在法国的注册量增长104.99%
同花顺,2026-06-30 23:43:19,人民锐评：中国空调清凉欧洲，不只是贸易更是“中国式赋能”
同花顺,2026-06-30 23:40:31,广州佛山最快18分钟通达 广湛高铁佛山站正式开通运营
同花顺,2026-06-30 23:32:33,钼价高位运行达近三年高点 “以钼代钨”实现“高端半导体战略材料”属性切换
同花顺,2026-06-30 23:28:05,美国最大电网PJM着手管理数据中心电力需求
同花顺,2026-06-30 23:27:27,上交所多维规范机构债券交易申报 要求机构9月底前完成业务和技术准备
同花顺,2026-06-30 23:17:24,微软计划下周宣布裁员消息，裁员将少于其员工总数的2.5%
同花顺,2026-06-30 23:14:54,波音公司：此次IT系统故障影响了计算机系统和应用程序
同花顺,2026-06-30 22:56:11,多地发布脑机接口产业专项扶持政策
同花顺,2026-06-30 22:49:15,全球最大的白银ETF iShares Silver Trust持仓量较前日增加19.69吨
同花顺,2026-06-30 22:39:40,国产存储主控芯片商“竞速”资本市场
同花顺,2026-06-30 22:30:04,巴西国家石油公司将每升柴油价格下调0.35雷亚尔
同花顺,2026-06-30 22:29:43,美国商务部预计将于当地时间今晚解除对Anthropic AI模型Fable的出口管制
同花顺,2026-06-30 22:15:57,首批4只REITs指数基金今日发售
同花顺,2026-06-30 22:11:40,美国联邦基金利率期货进一步下跌，暗示美联储9月加息概率约为80%
同花顺,2026-06-30 22:02:27,COMEX白银期货跌超1%
同花顺,2026-06-30 21:59:39,卡塔尔首相与美特使举行会谈，讨论黎巴嫩问题
同花顺,2026-06-30 21:37:02,两名美国宇航员完成太空行走 更换机械臂故障部件
同花顺,2026-06-30 21:26:06,美国6月就业市场现疲软迹象
同花顺,2026-06-30 21:21:07,特朗普披露超过10亿美元加密货币相关收入
