来源,时间,标题
财联社,2026-01-03 06:30:01,周六你需要知道的隔夜全球要闻：中国金龙指数涨超4%；特斯拉让出全球电车销冠宝座；LME期铝突破3000美元关口
财联社,2026-01-03 05:49:09,阿根廷政府改革国家情报系统
财联社,2026-01-03 05:01:01,纳斯达克中国金龙指数收盘涨超4% 百度涨超15%
财联社,2026-01-03 05:01:01,纳斯达克中国金龙指数收盘涨超4% 百度上涨15%
财联社,2026-01-03 05:00:33,美股三大指数收盘涨跌不一 阿斯麦、美光科技股价创新高
财联社,2026-01-03 04:32:24,泽连斯基宣布调整乌国防部运作 提名新防长人选
财联社,2026-01-03 04:00:53,乌克兰国防部情报总局局长换人
财联社,2026-01-03 03:51:29,印航一飞行员“酒驾”未遂 加方要求查改
财联社,2026-01-03 03:32:16,国际原油期货结算价小幅收跌
财联社,2026-01-03 03:12:54,铝价自2022年以来首次突破3000美元
财联社,2026-01-03 03:06:42,墨西哥6.5级地震已致1死12伤 余震超400次
财联社,2026-01-03 02:32:07,阿联酋宣布结束在也门反恐军事存在
财联社,2026-01-03 02:30:27,新兴市场股票2026年开局强劲 科技股受亚洲人工智能热潮提振
财联社,2026-01-03 00:41:59,欧洲主要股指集体收涨
财联社,2026-01-03 00:39:58,也门南方过渡委员会宣布启动两年过渡期 拟就南部问题举行公投
财联社,2026-01-03 00:01:29,墨西哥格雷罗州再次发生5.0级地震
财联社,2026-01-02 23:45:37,高市再称不排除引进核潜艇可能性
财联社,2026-01-02 23:42:08,国务院台办主任宋涛：将采取更加有力的行动 反对“台独”分裂和外来干涉
财联社,2026-01-02 23:27:26,标普500指数抹去盘初涨幅
财联社,2026-01-02 23:11:04,比亚迪登顶全球电动汽车销量榜
财联社,2026-01-02 22:47:39,瑞士检方：酒吧火灾可能由烟花棒引起
财联社,2026-01-02 22:43:57,特斯拉：全年储能装机量为46.7吉瓦时
财联社,2026-01-02 22:42:50,惠州亿纬锂能股份有限公司递表港交所
财联社,2026-01-02 22:37:49,Pinecone Wisdom Inc.递表港交所
财联社,2026-01-02 22:34:59,阿斯麦涨超7% 盘中创历史新高
财联社,2026-01-02 22:34:04,纳斯达克中国金龙指数盘初涨3.5%
财联社,2026-01-02 22:30:46,纳指高开1% 百度涨超10%
财联社,2026-01-02 22:28:17,墨西哥总统辛鲍姆的发布会一度因地震中断
财联社,2026-01-02 22:10:36,墨西哥发生6.5级地震
财联社,2026-01-02 22:04:27,新思考电机股份有限公司递表港交所
财联社,2026-01-02 22:01:52,特斯拉第四季度交付量418227辆 同比减少16%
财联社,2026-01-02 21:36:34,浙江凯乐士科技集团股份有限公司递表港交所
财联社,2026-01-02 21:34:52,泽连斯基任命布达诺夫为新任乌总统办公室主任
财联社,2026-01-02 21:33:02,法国拟推动立法进一步限制未成年人使用社交媒体
财联社,2026-01-02 21:28:17,瑞士酒吧火灾仍有80至100名伤者情况危急
财联社,2026-01-02 21:12:42,俄国防部称已大规模打击乌军工企业及能源设施
财联社,2026-01-02 20:45:33,美股矿业股盘前普涨
财联社,2026-01-02 20:15:02,1月2日周五《新闻联播》要闻19条
财联社,2026-01-02 19:58:16,宗馥莉重任宏胜集团法定代表人
财联社,2026-01-02 19:57:03,肯尼亚一在建16层建筑倒塌
财联社,2026-01-02 19:46:49,中央财政5.12亿元支持越冬饲草料储备
财联社,2026-01-02 19:26:35,未名医药股权案二审改判：撤销职务侵占罪 刑期罚金大减
财联社,2026-01-02 19:05:44,臻驱科技（上海）股份有限公司递表港交所
财联社,2026-01-02 18:30:43,伊朗最高领袖顾问：美国干预伊朗内政等同于扰乱地区局势
财联社,2026-01-02 18:26:06,消息人士称沙特空袭也门南方过渡委员会目标
财联社,2026-01-02 18:19:14,突破5亿吨 2025年西江船闸联合调度年过货量创新高
财联社,2026-01-02 18:07:58,12月份27家A股上市公司筹划赴港上市 天孚通信授权管理层启动境外发行股份（H股）并在港交所上市相关筹备工作
财联社,2026-01-02 18:07:41,误报防空警报 以军在以北部拦截“错误目标”
财联社,2026-01-02 17:59:46,DeepSeek发布新论文提出更为高效的AI开发方法
财联社,2026-01-02 17:52:00,新年第一天 海南岛内三大机场运送旅客16.95万人次
财联社,2026-01-02 17:49:50,数字人民币App迎来2.0版本
财联社,2026-01-02 17:34:40,日本确认2026年首起禽流感疫情
财联社,2026-01-02 17:05:46,国家集成电路基金在中芯国际H股的持股比例从4.79%升至9.25%
财联社,2026-01-02 17:01:52,百度美股盘前涨超12%
财联社,2026-01-02 16:57:40,沙特谴责也门南方过渡委员会 称其加剧紧张局势
财联社,2026-01-02 16:48:23,1月2日全社会跨区域人员流动量预计超1.8亿人次
财联社,2026-01-02 16:32:49,上海口岸2025年出入境人员达4280余万人次 同比增长17.9%
财联社,2026-01-02 16:31:30,香港11月零售销售额同比增长6.5%
财联社,2026-01-02 16:27:26,香港元旦出入境人次逾118万
财联社,2026-01-02 16:18:10,以军称以色列北部响起防空警报
财联社,2026-01-02 16:09:46,香港恒生科技指数收涨4% 壁仞科技上市首日大涨超75%
财联社,2026-01-02 16:03:15,欧洲主要股指开盘涨跌不一
财联社,2026-01-02 15:45:46,也门哈德拉毛省省长宣布对南方过渡委员会发起军事行动
财联社,2026-01-02 15:33:44,一架客机在韩国济州岛起飞前冒烟 120名乘客被紧急疏散
财联社,2026-01-02 15:27:31,加蓬总统宣布组建新政府
财联社,2026-01-02 15:22:58,元旦假期首日 全社会跨区域人员流动量超2亿人次
财联社,2026-01-02 15:17:47,2026元旦档总票房破5亿
财联社,2026-01-02 14:57:46,俄侦委会：乌无人机袭击赫尔松地区已致27人死亡
同花顺,2026-01-02 14:52:10,美国12月标普全球制造业PMI终值51.8，预期51.8，前值51.8
同花顺,2026-01-02 14:42:14,据港交所文件：惠州亿纬锂能股份有限公司向港交所提交上市申请书
财联社,2026-01-02 14:40:13,上海南北通道新建工程开工 将成世界最长中心城区地下连续流道路
同花顺,2026-01-02 14:38:36,据港交所文件：Pinecone Wisdom Inc.向港交所提交上市申请书
同花顺,2026-01-02 14:31:32,美股开盘：美股三大指数集体高开
财联社,2026-01-02 14:30:45,瑞士火灾失踪人数不明 遇难者身份确认或需数周
同花顺,2026-01-02 14:28:47,墨西哥南部地区发生6.5级地震
同花顺,2026-01-02 14:28:07,乌克兰哈尔科夫州遭俄军袭击 致19人受伤
财联社,2026-01-02 14:24:50,中国LED影厅数量全球第一
财联社,2026-01-02 14:11:32,香港恒生科技指数午后持续走强涨超4%
同花顺,2026-01-02 14:11:23,也门政府称控制南方过渡委员会37旅位于哈德拉毛省的总部
同花顺,2026-01-02 14:06:31,特斯拉第四季度交付量418227辆，预估440907辆
同花顺,2026-01-02 14:04:16,也门哈德拉毛省遭空袭 多处发生剧烈爆炸
同花顺,2026-01-02 14:02:03,新思考电机股份有限公司向港交所提交上市申请书
同花顺,2026-01-02 14:00:38,WTI原油跌幅扩大至1%
财联社,2026-01-02 13:59:48,长安汽车：2025年销量291.3万辆 同比增长8.5%
财联社,2026-01-02 13:59:41,韩方透露李在明访华安排：前往北京和上海 讨论韩中多领域务实合作
财联社,2026-01-02 13:57:03,《求是》杂志特约评论员：改善和稳定房地产市场预期
同花顺,2026-01-02 13:54:17,木门上市公司也要入场造机器人？江山欧派回应：仅销售不生产
同花顺,2026-01-02 13:34:04,浙江凯乐士科技集团股份有限公司向港交所提交上市申请书
同花顺,2026-01-02 13:15:50,现货黄金站上4400美元/盎司
财联社,2026-01-02 13:11:27,利比亚2025年原油总产量突破5亿桶
同花顺,2026-01-02 13:10:22,也门南方武装称击退大规模进攻 沙特方面对此暂无回应
同花顺,2026-01-02 13:00:42,Sportradar Group美股盘前跌超11%
财联社,2026-01-02 12:55:27,法国拟禁止15岁以下群体使用社交媒体
同花顺,2026-01-02 12:54:34,2025年中国电影全年票房超518.32亿元
财联社,2026-01-02 12:48:58,2025年上海机场异地城市航站楼服务旅客数量突破15万人次
同花顺,2026-01-02 12:47:57,瑞士酒吧火灾遇难者人数仍有可能继续上升
财联社,2026-01-02 12:44:02,马杜罗：委内瑞拉已准备好与美国就打击毒品走私对话
同花顺,2026-01-02 12:36:04,日媒：日本三大经济团体推迟访华
同花顺,2026-01-02 12:19:08,泽连斯基提议由布达诺夫领导乌克兰总统办公室
财联社,2026-01-02 12:16:20,国防部新闻发言人张晓刚就境外炒作“正义使命-2025”演习答记者问
财联社,2026-01-02 12:03:29,港股午评：恒生指数涨2.18% 恒生科技指数涨3.38%
同花顺,2026-01-02 11:57:56,1月2日 周五《新闻联播》要闻15条
财联社,2026-01-02 11:55:20,上汽奥迪：2025年全年零售47258台
同花顺,2026-01-02 11:50:10,阿斯麦美股盘前涨超5%
财联社,2026-01-02 11:40:15,1月2日全国铁路预计发送旅客1260万人次
同花顺,2026-01-02 11:38:26,国内首次！八部门联合行动 保护长江“微笑天使”
财联社,2026-01-02 11:19:27,横琴口岸元旦通关14.7万人次 创历史新高
同花顺,2026-01-02 11:11:15,以军空袭黎巴嫩境内多处目标
同花顺,2026-01-02 11:03:09,据港交所文件：臻驱科技（上海）股份有限公司向港交所提交上市申请书
同花顺,2026-01-02 10:57:32,头部私募2026年新展望：A股牛市仍在进程中 但驱动逻辑可能转向
同花顺,2026-01-02 10:41:33,多国就加沙人道危机发表联合声明，敦促以色列解除封锁
财联社,2026-01-02 10:26:04,集邦咨询：下调2026年全球笔电出货预估至年减5.4%
财联社,2026-01-02 10:17:00,港股半导体股走强 华虹半导体涨近10%
财联社,2026-01-02 10:14:33,上海市第十六届人民代表大会第四次会议将于2026年2月上旬召开
财联社,2026-01-02 10:04:47,恒生科技指数涨幅扩大至3%
同花顺,2026-01-02 09:59:06,特朗普回应手背瘀青：因长期大剂量服用阿司匹林
同花顺,2026-01-02 09:51:19,国家集成电路产业投资基金股份有限公司在中芯国际H股的持股比例于12月29日从4.79%升至9.25%
财联社,2026-01-02 09:50:50,长三角铁路1月1日发送旅客376.6万人次 创元旦假期运输单日客发新高
同花顺,2026-01-02 09:46:15,英伟达美股盘前涨超2%
财联社,2026-01-02 09:35:32,壁仞科技上市首日涨超110%
同花顺,2026-01-02 09:28:39,特朗普称将就伊朗骚乱事件进行干涉
财联社,2026-01-02 09:27:37,港股新股壁仞科技上市首日大涨超80% 公开发售阶段获逾2347倍认购
财联社,2026-01-02 09:21:23,恒生指数开盘涨0.34% 壁仞科技上市首日开盘涨82.14%
同花顺,2026-01-02 09:15:26,韩国法院签发对尹锡悦的追加拘捕令
财联社,2026-01-02 09:06:53,2026元旦档票房破4亿
同花顺,2026-01-02 09:01:17,美股中概股盘前多数上涨，百度涨12%
同花顺,2026-01-02 09:01:09,美股大型科技股盘前普涨，特斯拉涨2%
同花顺,2026-01-02 09:00:46,台积电美股盘前涨超2%
同花顺,2026-01-02 09:00:31,百度美股盘前涨超11%
财联社,2026-01-02 08:56:41,海南自贸港进口“零关税”货物超4亿元
同花顺,2026-01-02 08:54:44,纳指期货涨超1%
财联社,2026-01-02 08:45:48,全岛封关后首个小长假 海南迎旅游“开门红”
同花顺,2026-01-02 08:35:50,纽约期银日内大涨5%
财联社,2026-01-02 08:34:58,马杜罗证实曾与特朗普通话10分钟 重申“要和平不要战争”
同花顺,2026-01-02 08:32:31,韩国一客机起飞前冒烟 122人紧急疏散
同花顺,2026-01-02 08:12:32,现货白银涨4%，报74.34美元/盎司
同花顺,2026-01-02 08:10:28,港股收评：恒生指数涨2.76%，恒生科技指数涨4.0%
同花顺,2026-01-02 08:09:30,越南一河堤坍塌 4人死亡
同花顺,2026-01-02 08:04:10,"LME基准期铝上涨0.1%至每吨3,000美元，创下2022年5月以来的最高水平"
财联社,2026-01-02 08:03:32,中国“人造太阳”实验找到突破密度极限的方法
财联社,2026-01-02 07:55:00,全国最大电网侧独立储能示范项目全容量投运
财联社,2026-01-02 07:40:10,我国海上最大气田“深海一号”完成100船原油外输
财联社,2026-01-02 07:27:44,俄称打击乌方目标 乌称袭击俄炼油设施
同花顺,2026-01-02 07:20:40,2026元旦档电影总票房破5亿元
同花顺,2026-01-02 07:16:48,美国30年期国债收益率上涨3个基点至4.88%
财联社,2026-01-02 07:07:40,周五（1月2日）重点关注财经事件和经济数据
财联社,2026-01-02 07:06:54,百度：计划分拆昆仑芯并于港交所独立上市
同花顺,2026-01-02 06:50:11,兴业证券：2026年港股市场将延续牛市格局，行情节奏如“火炬登山”般震荡上行
同花顺,2026-01-02 06:40:36,韩国综指收涨2.27%
财联社,2026-01-02 06:32:24,我国海上最大气田“深海一号”完成第100船原油外输
财联社,2026-01-02 06:29:59,周五你需要知道的隔夜全球要闻：OpenAI加码音频AI研发；美暂停对软体家具等再加关税；美对部分跨境汇款征收1%汇款税
同花顺,2026-01-02 06:22:37,现货白银站上74美元/盎司
财联社,2026-01-02 06:15:55,库尔斯克2号核电站1号机组投运
财联社,2026-01-02 06:12:23,CME“美联储观察”：美联储1月维持利率不变的概率为85.1%
同花顺,2026-01-02 06:11:27,港股恒生科技指数午后涨幅达4%
同花顺,2026-01-02 06:09:29,“星链”将降低约4400颗卫星轨道高度
财联社,2026-01-02 06:04:30,星链计划于2026年降低卫星轨道高度 提升太空运行安全性
同花顺,2026-01-02 06:01:32,长安汽车：2025年销量291.3万辆，同比增长8.5%
同花顺,2026-01-02 06:01:18,富时中国A50指数期货涨1%
同花顺,2026-01-02 05:59:46,现货黄金站上4380美元/盎司
同花顺,2026-01-02 05:43:01,港股创新药概念股持续走高，晶泰控股涨超6%
同花顺,2026-01-02 05:41:15,韩国综合股价指数（KOSPI）上涨2%
财联社,2026-01-02 05:25:08,也门政府宣布对亚丁国际机场实施管制措施
同花顺,2026-01-02 05:15:38,中国“人造太阳”EAST实验证实托卡马克密度自由区的存在
同花顺,2026-01-02 04:54:04,假期冰雪游热度持续升温 铁路部门将加开多趟冰雪旅游专列
同花顺,2026-01-02 04:42:22,中国赴黎巴嫩维和官兵完成“蓝桶”维护作业
同花顺,2026-01-02 04:41:44,韩国：已就《信息通信网法》修订案与美方交换意见
同花顺,2026-01-02 04:11:01,纽约期金站上4390美元/盎司
财联社,2026-01-02 04:04:09,马克龙：法国已接收瑞士酒吧火灾伤者入院治疗
同花顺,2026-01-02 04:01:23,港股午评：恒生指数涨2.18%，恒生科技指数涨3.38%
财联社,2026-01-02 04:00:54,2025年超3000名巴西人被美国驱逐出境 数量创新高
同花顺,2026-01-02 03:59:20,美国麻疹病例数创1992年以来新高，疾控中心强调接种疫苗的重要性
同花顺,2026-01-02 03:26:32,现货白银日内涨超0.5%，现报73.10美元/盎司
同花顺,2026-01-02 03:25:55,贵州茅台成立新公司“爱茅台”
同花顺,2026-01-02 03:25:36,新加坡基准股指上涨0.5%，创下4669.29点的历史新高
财联社,2026-01-02 03:16:20,美国新一轮限制外国公民入境措施生效
财联社,2026-01-02 03:07:42,冈比亚附近海域一艘载有超200人的船只倾覆
同花顺,2026-01-02 03:01:09,现货黄金涨幅扩大至1%
同花顺,2026-01-02 02:55:29,2026年首日澳门出入境人次达86.6万 创单日历史新高
同花顺,2026-01-02 02:55:07,金风科技大涨超14%，蓝箭航天科创板IPO申请获受理
同花顺,2026-01-02 02:53:08,Robotex世界机器人大赛亚洲总决赛在沪开幕
同花顺,2026-01-02 02:51:13,港股恒生指数涨幅达2%
财联社,2026-01-02 02:33:32,美国对部分跨境汇款征收1%汇款税
同花顺,2026-01-02 02:11:54,港股半导体概念股持续走强 华虹半导体涨近10%
同花顺,2026-01-02 02:07:17,丹麦首相在新年讲话中以“不点名方式”批评美国
同花顺,2026-01-02 02:06:12,韩国KOSPI指数涨幅扩大至1%
同花顺,2026-01-02 02:04:19,港股恒生科技指数涨幅达3%
同花顺,2026-01-02 01:56:28,机构：预计2026年新建商品房销售面积同比下降6.2%
同花顺,2026-01-02 01:52:07,长三角铁路1月1日发送旅客376.6万人次，创元旦假期运输单日客发新高
同花顺,2026-01-02 01:47:56,港股恒生科技指数涨幅达2%
同花顺,2026-01-02 01:46:09,航行警告！渤海部分海域执行军事任务 禁止驶入
同花顺,2026-01-02 01:40:29,港股恒生指数涨幅达1%
同花顺,2026-01-02 01:35:25,港股新股壁仞科技上市首日大涨超110%
同花顺,2026-01-02 01:34:04,港股恒生科技指数涨幅达1%
财联社,2026-01-02 01:32:28,2025年超4.1万人经英吉利海峡偷渡到英国
同花顺,2026-01-02 01:21:40,港股开盘：恒生指数涨0.34%，恒生科技指数涨0.58%
同花顺,2026-01-02 01:17:41,离岸人民币兑美元升破6.97
财联社,2026-01-02 01:16:51,秘鲁一处矿井发现13名矿工遗体
同花顺,2026-01-02 01:04:56,韩国KOSPI指数开盘上涨0.2%
财联社,2026-01-02 01:03:47,美国缩减对意大利面关税
财联社,2026-01-02 01:00:32,瑞士酒吧火灾已造成约40人死亡
同花顺,2026-01-02 00:52:21,酒价内参1月2日价格发布，市场承压下行整体价格创10日新低
同花顺,2026-01-02 00:47:03,全岛封关后首个小长假，海南迎旅游“开门红”
财联社,2026-01-02 00:40:24,厄瓜多尔总统宣布9省3县进入紧急状态
同花顺,2026-01-02 00:33:06,美联储2026年累计降息预测：50的概率23%
同花顺,2026-01-02 00:22:29,景兴纸业：研发项目入选2026年度浙江省“尖兵领雁+X”科技计划
同花顺,2026-01-02 00:21:23,广东连续24年蝉联全国第一票仓
财联社,2026-01-02 00:13:44,俄说将把乌袭击俄总统官邸无人机资料交给美方
同花顺,2026-01-01 23:49:52,现货钯金上涨3%至每盎司1655.95美元
同花顺,2026-01-01 23:37:16,Meta短视频平台Reels据悉寻求向电视领域转型
财联社,2026-01-01 23:36:13,切尔西解雇主教练马雷斯卡
财联社,2026-01-01 23:34:30,《平价医疗法案》补贴到期 大量美国人医保费将上涨
同花顺,2026-01-01 23:26:43,贵金属盘初走强 白银上涨1%
财联社,2026-01-01 23:23:44,Stellantis恢复生产V8动力Ram TRX皮卡
财联社,2026-01-01 23:12:57,新加坡中学今起将实施更严手机管理措施
同花顺,2026-01-01 23:10:10,钯金期货日内涨1%
同花顺,2026-01-01 23:09:12,2026年首个交易日，现货黄金跳空高开
同花顺,2026-01-01 23:07:17,巴西前总统博索纳罗出院后返回监狱
财联社,2026-01-01 23:03:23,OpenAI加码音频人工智能研发 备战首款硬件设备
财联社,2026-01-01 22:54:07,造车新势力仅3家完成年度目标
财联社,2026-01-01 22:42:46,美国纽约新任市长马姆达尼宣誓就职
财联社,2026-01-01 22:41:00,2025年广东全省机场年吞吐量创新高 超1.8亿人次
财联社,2026-01-01 22:35:07,受AI热潮驱动 2025年存储芯片企业闪迪股价飙涨559%
财联社,2026-01-01 22:28:06,2026年元旦节票房超3.2亿元 《疯狂动物城2》领跑
财联社,2026-01-01 22:05:30,乌军袭击俄炼油设施和军事目标
财联社,2026-01-01 22:04:53,北京两机场2025年旅客吞吐量超1.2亿人次
财联社,2026-01-01 21:35:19,南京：跨年夜当天全市文旅消费金额9.1亿元 同比增长32%
财联社,2026-01-01 21:01:38,物价持续上涨 美暂停对软体家具等再加关税
财联社,2026-01-01 20:53:15,2025年全国平均气温再创历史新高 达到11.0℃
财联社,2026-01-01 20:30:58,印度与巴基斯坦互换核设施清单
财联社,2026-01-01 20:27:15,重庆即日起全面启动2026年消费品以旧换新补贴政策
财联社,2026-01-01 20:09:35,1月1日周四《新闻联播》要闻18条
财联社,2026-01-01 19:47:11,奇瑞2025全年累计销量超263万辆 同比增8%
财联社,2026-01-01 19:23:45,益方生物递表港交所
财联社,2026-01-01 19:22:35,Suplay Inc.公司递表港交所
财联社,2026-01-01 19:14:31,深圳宏芯宇电子递表港交所
财联社,2026-01-01 19:13:20,景旺电子递表港交所
财联社,2026-01-01 19:11:19,万怡医学递表港交所
财联社,2026-01-01 19:06:54,比亚迪2025年12月新能源车销量42万辆 全年累计超460万辆
财联社,2026-01-01 19:03:52,导远科技递表港交所
财联社,2026-01-01 18:56:39,xTool递表港交所
财联社,2026-01-01 18:53:44,西北电网年跨区外送电量首次突破4000亿千瓦时
财联社,2026-01-01 18:38:49,乌国防部确认从德国接收两套“爱国者”导弹系统
财联社,2026-01-01 18:12:44,吉利汽车：2026年的销量目标定为345万部 较2025年增长约14%
财联社,2026-01-01 18:08:41,长城汽车：2025年汽车销量为132.4万辆 同比增长7.3%
财联社,2026-01-01 18:07:20,吉利汽车：2025年全年汽车总销量为302万辆 较去年同期增长39%
财联社,2026-01-01 17:54:42,瑞士酒吧爆炸致上百人伤亡 当地官员：没有迹象表明是袭击事件
财联社,2026-01-01 17:21:22,法国酝酿禁止15岁以下群体使用社交媒体
财联社,2026-01-01 17:06:48,《疯狂动物城2》票房破41亿元
财联社,2026-01-01 16:57:34,中信证券：26年家电国补政策符合预期 推算全年补贴规模700亿元
财联社,2026-01-01 16:34:26,商务部：2025年以旧换新相关商品销售额超2.6万亿元 惠及超3.6亿人次
财联社,2026-01-01 16:23:47,2025年三峡船闸年通过量、三峡升船机年客运量双创新高
财联社,2026-01-01 16:05:55,瑞士酒吧爆炸引发火灾已致数十人死亡 近100人受伤
财联社,2026-01-01 15:42:53,上汽乘用车2025年零售总量达91.9万辆 同比增超12%
财联社,2026-01-01 15:41:42,瑞士滑雪胜地爆炸10死10伤
财联社,2026-01-01 15:37:31,i茅台1499元飞天茅台上线即“秒空” 相关人士回应称无固定投放量
财联社,2026-01-01 15:36:06,全球主权财富基金资产创新高至15万亿美元 对科技行业的投资增加
财联社,2026-01-01 15:29:14,极氪：2025年累计销量超22.4万台
财联社,2026-01-01 15:19:12,美元创2017年以来最大年跌幅 美联储动向将左右后市
财联社,2026-01-01 15:03:11,美国阿拉斯加州发生5.7级地震 震源深度10千米
财联社,2026-01-01 14:54:32,交通运输部督促指导重点地区抓好主动防御措施落实
财联社,2026-01-01 14:53:41,起亚中国宣布奕跑、K3车型实行全国一口价
财联社,2026-01-01 14:49:38,瑞士南部一酒吧爆炸造成多人死伤
同花顺,2026-01-01 14:41:46,无人机200米高空破解高层灭火难题 低空经济跑出万亿新动能
同花顺,2026-01-01 14:29:07,2026年1月1日元旦大盘票房已达3.3689亿
财联社,2026-01-01 14:12:21,2025年全国碳市场配额成交量2.35亿吨 同比增长约24%
财联社,2026-01-01 14:11:19,伊朗称成功挫败大规模网络攻击
同花顺,2026-01-01 14:08:10,封关半月客流增长10.9%！琼州海峡迎封关后首个节假日“大考”
财联社,2026-01-01 14:05:39,赫尔松地区遭无人机袭击致20多人死亡
财联社,2026-01-01 14:05:06,元旦假期首日：国内酒店预订热度增长超3倍 三亚入境游客大增5倍
财联社,2026-01-01 13:54:16,中国篮协：2026-2027赛季CBA联赛计划于10月中旬开赛
财联社,2026-01-01 13:46:40,西部航空通报一客机紧急返航：飞机爬升阶段出现警告信息
财联社,2026-01-01 13:39:21,中信建投：2026年A股牛市有望持续
同花顺,2026-01-01 13:38:28,南京：跨年夜当天全市文旅消费金额9.1亿元，同比增长32%
财联社,2026-01-01 13:32:45,胖东来集团2025年全年销售额达235.31亿元
财联社,2026-01-01 13:31:19,预计发送旅客1825万人次 全国铁路迎元旦假期客流最高峰
财联社,2026-01-01 13:04:16,商务部新闻发言人就欧盟碳边境调节机制有关问题答记者问
同花顺,2026-01-01 13:02:16,俄称来袭的乌无人机目标是俄总统官邸内建筑
财联社,2026-01-01 12:49:56,智元发布一体化具身大小脑系统GenieReasoner
同花顺,2026-01-01 12:47:35,金价一年创50多次历史新高
财联社,2026-01-01 12:45:53,今年全国首列跨里海中欧班列从西安发车
财联社,2026-01-01 12:40:06,海南自贸港封关以来新增经营主体近1.2万家
财联社,2026-01-01 12:39:18,1.73亿吨 三峡枢纽2025年通过量再创历史新高
同花顺,2026-01-01 12:27:19,中土旅游往来再升级 中国成土耳其增长最快游客来源地
财联社,2026-01-01 12:24:18,中国驻澳大利亚使馆发言人就澳政府涉台声明答记者问
财联社,2026-01-01 12:14:38,国开行2025年发放城市建设领域贷款1.16万亿元
财联社,2026-01-01 12:11:12,委内瑞拉防长要求军队保持战备状态
同花顺,2026-01-01 12:09:38,海南出台安居房新政：坚持“以需定建”，鼓励“智能建造”
财联社,2026-01-01 12:06:42,印度洋南部发生6.0级地震
同花顺,2026-01-01 12:06:16,伊朗总统发表讲话：“伊朗正处于一场全面战争之中”
财联社,2026-01-01 12:05:40,上汽通用五菱2025累计销量超163.5万辆 新能源年销首超百万 渗透率提升至61%
财联社,2026-01-01 11:59:11,上汽通用五菱2025年累计销量超163.5万辆 同比增长6.2%
财联社,2026-01-01 11:58:46,全国数据工作会议：加快数据产业发展 梯次培育数字产业集群
同花顺,2026-01-01 11:55:23,比亚迪海外年销量首次突破100万辆
财联社,2026-01-01 11:54:52,全国数据工作会议：优化数字消费软硬件环境 培育壮大数据产业
