来源,时间,标题
同花顺,2026-06-02 12:01:46,IBM未来五年投入超100亿美元布局量子计算业务
同花顺,2026-06-02 11:56:26,国家防减救灾委办公室派出工作组赴黑龙江 指导做好救灾工作
同花顺,2026-06-02 11:55:55,金螳螂：孙公司中标2.53亿元越南酒店装修工程
同花顺,2026-06-02 11:51:52,TCL科技：拟以11亿元-12亿元回购公司股份
同花顺,2026-06-02 11:47:34,T1000级小丝束碳纤维实现量产
同花顺,2026-06-02 11:47:13,中欧班列中通道今年班列通行量突破2000列
同花顺,2026-06-02 11:45:07,罗平锌电：全资子公司向荣矿业被责令立即停止作业
同花顺,2026-06-02 11:43:22,瀚蓝环境：拟发行股份及支付现金收购粤丰环保100%股权
同花顺,2026-06-02 11:39:32,退市岩石：黄建山累计增持公司股份1848.31万股，占公司总股本的5.53%
同花顺,2026-06-02 11:35:17,青岛银行：股东海尔产业发展拟减持1.84%股份
同花顺,2026-06-02 11:35:10,*ST万方：公司股票将于2026年6月3日摘牌
同花顺,2026-06-02 11:33:46,北京经开区召开太空算力企业座谈会 研究部署太空算力创新中心建设工作
同花顺,2026-06-02 11:32:36,云顶新耀就希布替尼达成独家授权许可与合作协议，里程碑付款最高可获10.3亿美元
同花顺,2026-06-02 11:30:27,欣灵电气：控股股东及一致行动人拟减持3%股份
同花顺,2026-06-02 11:30:10,苏奥传感：股东汪文巧拟减持1.12%股份
同花顺,2026-06-02 10:47:46,兆易创新：出资4亿元参与的私募基金完成备案
同花顺,2026-06-02 10:47:39,“扬子江”轮在沪交付 高效绿色改装助力全球船舶低碳升级
同花顺,2026-06-02 10:46:05,金龙汽车：控股股东拟首次增持0.8亿元至1.5亿元
同花顺,2026-06-02 10:45:35,阿富汗帕尔万省一客车翻车 致8死16伤
同花顺,2026-06-02 10:45:29,上海制定生活垃圾分类提质增效三年行动计划
同花顺,2026-06-02 10:45:12,银宝山新：股东布拉德已减持0.61%股份
同花顺,2026-06-02 10:41:30,*ST清越：公司可能被实施重大违法强制退市，于2026年5月12日起被实施退市风险警示
同花顺,2026-06-02 10:38:46,全线通水 平陆运河迈入通航冲刺阶段
同花顺,2026-06-02 10:38:40,财政部将发行2026年记账式贴现（三十三期）国债
同花顺,2026-06-02 10:35:45,昊海生科：控股子公司三焦点人工晶状体产品获得医疗器械注册证
同花顺,2026-06-02 10:34:14,日本防卫省：以冲绳为前沿强化“战时医疗”体制
同花顺,2026-06-02 10:33:22,山东黄金：拟确认公允价值变动损失7.05亿元
同花顺,2026-06-02 10:32:44,2026年5月基金新开户21.83万户
同花顺,2026-06-02 10:32:37,云鼎科技：董事徐加利增持0.0015%股份
同花顺,2026-06-02 10:31:45,东吴证券：拟发行股份及支付现金收购东海证券83.68%股权，交易总价115.19亿元
同花顺,2026-06-02 10:31:38,2026年5月A股新开户276.53万户同比增长77.76% 2026年累计新开1729.68万户
同花顺,2026-06-02 10:27:53,锦龙股份：4.99亿元借款被宣布提前到期
同花顺,2026-06-02 10:27:19,华锡有色：公司关注到算力金属价格暴涨和锡市场热度较高 澄清不存在可能或已经对公司产生重大影响的未公开重大信息。
同花顺,2026-06-02 10:27:10,法国外长：以在黎境内军事行动“毫无正当理由”
同花顺,2026-06-02 10:19:58,飞沃科技：因资本公积金转增股本，回购价格上限由43.44元调整为31.06元/股
同花顺,2026-06-02 09:04:16,天音控股：收到江西证监局行政监管措施决定书
同花顺,2026-06-02 09:03:57,昂利康：获得化学原料药上市申请批准通知书
同花顺,2026-06-02 09:00:48,国务院印发《加快农业农村现代化“十五五”规划》
同花顺,2026-06-02 08:59:37,广汽埃安i60 5月销量11020辆
同花顺,2026-06-02 08:59:35,宇通客车：5月销量3480辆，同比增长13.99%
同花顺,2026-06-02 08:58:03,银龙股份：控股股东及一致行动人拟增持
同花顺,2026-06-02 08:57:06,安波福与英伟达扩大合作，加速落地量产级边缘人工智能
同花顺,2026-06-02 08:55:46,积成电子：控股子公司租赁办公区五年，租金及物业费合计约为1447.21万元
同花顺,2026-06-02 08:53:28,税友股份：控股股东已减持0.72%
同花顺,2026-06-02 08:50:16,内蒙古：鼓励使用保障性住房再贷款收购存量商品房用作保障性住房等
同花顺,2026-06-02 08:49:52,第十一次中英战略对话在北京举行
同花顺,2026-06-02 08:47:50,中远海能：投资总额为人民币64.45亿元建造4艘LNG船舶
同花顺,2026-06-02 08:45:25,科力尔：设立注册资本1000万元控股孙公司 持股70%
同花顺,2026-06-02 08:44:32,九洲药业：克立硼罗原料药获上市批准，累计研发投入约310万元
同花顺,2026-06-02 08:44:29,老虎国际：一季度营收1.55亿美元 同比增长26.3%
同花顺,2026-06-02 08:44:12,广西能源：广西贺州抽水蓄能电站项目获核准批复
同花顺,2026-06-02 08:44:11,文远知行携手Uber落地西班牙首个Robotaxi服务
同花顺,2026-06-02 08:40:11,上海建工：股东国盛集团累计减持0.22%股份
同花顺,2026-06-02 08:39:39,五矿发展：李智聪先生担任公司董事长
同花顺,2026-06-02 08:39:26,包头稀交所：今日稀土主流产品价格稳中有涨
同花顺,2026-06-02 07:31:19,墨西哥总统指责美国极右翼势力干涉墨西哥内政
同花顺,2026-06-02 07:30:45,以军称在加沙地带打死五名武装人员
同花顺,2026-06-02 07:30:34,美防长称支持日本扩大军事合作，外交部：绥靖纵容终将养虎为患
同花顺,2026-06-02 07:26:41,市场监管总局等三部门：支持保健食品新功能产品创新，保障产品质量安全有效
同花顺,2026-06-02 07:26:21,外交部：希望菲方别任由个别跳梁小丑，一再破坏双方稳定关系的努力
同花顺,2026-06-02 07:25:59,伊朗称仍在评估谅解备忘录最终文本，尚未回应美方
同花顺,2026-06-02 07:18:28,中国内地航线燃油附加费将下调
同花顺,2026-06-02 07:16:30,星海图发布自研双足人形机器人
同花顺,2026-06-02 07:15:00,美媒：俄2024年底以来首次补给驻叙空军基地
同花顺,2026-06-02 07:13:55,特朗普被曝拟放弃“反武器化”基金计划
同花顺,2026-06-02 07:11:29,美据报或在欧洲增加核部署
同花顺,2026-06-02 07:11:27,现货黄金站上4540美元/盎司
同花顺,2026-06-02 07:08:07,襄阳轴承：巴西工厂落成开业 补齐南美产能板块
同花顺,2026-06-02 07:05:40,韩正将赴俄罗斯出席第二十九届圣彼得堡国际经济论坛并访问白俄罗斯
同花顺,2026-06-02 07:04:15,王文涛部长会见巴西外交部长维埃拉
同花顺,2026-06-02 07:01:49,欧洲主要股指开盘集体上涨
同花顺,2026-06-02 07:01:20,ETF收评：通信ETF领涨6.72%，国企红利ETF领跌6.1%
同花顺,2026-06-02 07:00:54,A股收评：创业板指高开高走涨2.66% 元件、光纤概念、CPO板块领涨
同花顺,2026-06-02 07:00:51,ETF两市成交额5188.39亿元
同花顺,2026-06-02 07:00:17,股指期货午盘收盘 主力合约全线收涨
同花顺,2026-06-02 05:51:50,浦东国际机场口岸今年出入境人员突破1500万人次
同花顺,2026-06-02 05:51:07,中欧班列“中通道”今年通行量突破2000列
同花顺,2026-06-02 05:46:46,教育部等八部门联合开展“国聘行动”
同花顺,2026-06-02 05:46:36,乌称遭俄73枚导弹656架无人机袭击
同花顺,2026-06-02 05:45:36,四部门启动“剑网2026”专项行动  以人工智能领域版权整治为重点
同花顺,2026-06-02 05:41:14,韩正会见英国外交大臣库珀
同花顺,2026-06-02 05:40:34,晶科能源CEO曹海云：以“本土制造，供应本土市场”策略 从五大方向推动全球化布局
同花顺,2026-06-02 05:37:36,字节跳动Seed旗下AI4S团队核心成员顾全全自曝将离职
同花顺,2026-06-02 05:34:38,筹划控制权变更事项“告吹”，和仁科技股价重挫逾17%，公司回应
同花顺,2026-06-02 05:33:09,俄南部一炼油厂遭无人机袭击起火
同花顺,2026-06-02 05:31:10,现货白银涨超2%
同花顺,2026-06-02 05:29:39,铜缆高速连接板块震荡走强，鑫科材料涨停
同花顺,2026-06-02 05:27:38,现货白银站上76美元/盎司
同花顺,2026-06-02 05:27:17,Arm首席执行官：存储芯片供应整体仍吃紧
同花顺,2026-06-02 05:25:56,柬埔寨就海洋问题致函泰国和联合国，启动强制调解程序
同花顺,2026-06-02 05:25:23,创业板指涨3%，元件、CPO、光纤概念板块领涨
同花顺,2026-06-02 05:21:01,高通将发布全新数据中心业务品牌Dragonfly
同花顺,2026-06-02 05:17:51,沪深京三市成交额超2万亿元，较上日此时缩量1297亿元
同花顺,2026-06-02 05:16:59,半导体板块震荡走高，裕太微20cm涨停，源杰科技、江丰电子、杰华特涨幅居前
同花顺,2026-06-02 05:15:27,江西铜业触及涨停
同花顺,2026-06-02 04:03:54,6月2日午间公告一览：帝尔激光提示帝尔转债即将停止转股暨最后半个可转股交易日
同花顺,2026-06-02 04:01:49,现货黄金站上4500美元/盎司
同花顺,2026-06-02 04:01:28,港股午评：恒生指数涨1.46%，恒生科技指数涨3.48%
同花顺,2026-06-02 04:01:28,太空能源发展联盟启动
同花顺,2026-06-02 03:55:14,中央财政下达育儿补贴补助资金999亿元 较上年增长10.6%
同花顺,2026-06-02 03:51:13,日本央行前政策委员称日本央行本月可能按兵不动 与市场预期大相迳庭
同花顺,2026-06-02 03:48:02,哥伦比亚普拉塞火山喷发 火山灰柱高达800米
同花顺,2026-06-02 03:43:01,OpenAI首因安全问题遭美州政府起诉
同花顺,2026-06-02 03:41:09,迈威尔科技美股夜盘涨超12% 黄仁勋称其将成为下一个万亿美元公司
同花顺,2026-06-02 03:33:15,期货午评：能化板块普涨，“算力金属”锡价格暴涨！碳酸锂跌近4%
同花顺,2026-06-02 03:32:12,ETF午评：通信ETF领涨5.81%，国企红利ETF领跌6.25%
同花顺,2026-06-02 03:31:50,ETF两市成交额3286.23亿元
同花顺,2026-06-02 03:30:45,A股午评：创业板指高开高走涨超2%，元件、非金属材料、CPO板块涨幅居前
同花顺,2026-06-02 03:29:41,乌官员称俄空袭基辅造成3人死亡
同花顺,2026-06-02 03:26:44,沪深京三市成交额超1.8万亿元，较上日此时缩量1494亿元
同花顺,2026-06-02 03:26:21,美军42架军机接连损毁
同花顺,2026-06-02 03:24:38,佳能上调部分激光耗材价格
同花顺,2026-06-02 03:21:21,亚美尼亚总理：将继续留在欧亚经济联盟
同花顺,2026-06-02 02:31:17,商务部：对澳大利亚进口的牛肉数量达到规定数量100%的第3日起(含当日)，将在现行适用关税税率基础上加征55%关税
同花顺,2026-06-02 02:29:56,欧洲理事会主席敦促波黑加快入盟改革进程
同花顺,2026-06-02 02:28:15,元件板块持续拉升，风华高科触及涨停
同花顺,2026-06-02 02:23:24,欧洲议会将举行特别会议，讨论表决欧美贸易协议
同花顺,2026-06-02 02:22:12,电力板块局部拉升，韶能股份触及涨停
同花顺,2026-06-02 02:20:52,南向资金净买入超50亿港元
同花顺,2026-06-02 02:20:22,港股恒生科技指数涨幅达3%
同花顺,2026-06-02 02:17:42,港股科网股集体走高，美团涨超8%
同花顺,2026-06-02 02:15:50,快递领域首个国际标准化机构在中国成立
同花顺,2026-06-02 02:15:37,中国移动三波段超低损耗多芯光缆线路开通
同花顺,2026-06-02 02:14:14,全球最大的黄金ETF SPDR Gold Trust持仓较前日减少0.28吨
同花顺,2026-06-02 02:11:38,韩国KOSPI指数再度跌超3%
同花顺,2026-06-02 02:10:15,佳能上涨部分激光耗材的价格
同花顺,2026-06-02 02:04:50,腾讯控股涨超3%
同花顺,2026-06-02 02:02:47,恒生科技指数涨幅扩大至2%
同花顺,2026-06-02 02:01:41,北方华创发布12英寸先进气体团簇离子束刻蚀设备
同花顺,2026-06-02 02:01:14,广期所碳酸锂主力合约跌超4%
同花顺,2026-06-02 02:00:32,聚焦可玩性食品等 两部门发布案例保护未成年人权益
同花顺,2026-06-02 01:59:43,南向资金净买入超30亿港元
同花顺,2026-06-02 01:34:57,俄对乌克兰全境发动空袭
同花顺,2026-06-02 01:34:30,人形机器人板块短线拉升，中大力德涨停
同花顺,2026-06-02 01:32:30,俄副外长：俄制订海湾地区安全构想并准备递交各方
同花顺,2026-06-02 01:31:49,富时中国A50指数期货涨1%
同花顺,2026-06-02 01:30:25,创业板指涨1%
同花顺,2026-06-02 01:29:23,股指期货早盘开盘 主力合约集体高开
同花顺,2026-06-02 01:27:52,AI PC概念高开，春秋电子3连板
同花顺,2026-06-02 01:26:52,ETF开盘：A500增强ETF领涨8.27%，国企红利ETF领跌3.21%
同花顺,2026-06-02 01:25:25,A股开盘：三大指数集体高开
同花顺,2026-06-02 01:24:09,特朗普被曝同以总理通话爆粗口
同花顺,2026-06-02 01:23:13,央行：6月2日开展了2亿元7天期逆回购操作
同花顺,2026-06-02 01:21:46,港股开盘：恒生指数低开0.01%，恒生科技指数高开0.62%
同花顺,2026-06-02 01:20:24,上一交易日ETF两市融资融券余额1108.30亿元
同花顺,2026-06-02 01:17:40,业内人士：苹果考虑采用LG Display的新面板技术
同花顺,2026-06-02 01:15:26,人民币兑美元中间价报6.8187，较上日调低20点
同花顺,2026-06-02 01:15:05,汉钟精机：真空产品已向部分国内芯片制造商批量供货
同花顺,2026-06-02 01:14:53,现货白银、COMEX白银期货涨超1%
同花顺,2026-06-02 01:13:36,华大九天：已与国内头部存储企业建立战略合作关系
同花顺,2026-06-02 01:07:31,中金财富期货：油价上行压制黄金走势，黄金依然是高油价最大的“受害者”
同花顺,2026-06-02 01:05:35,上期所沪锡主力合约涨超4%
同花顺,2026-06-02 00:31:07,全球最大的白银ETF iShares Silver Trust持仓量较前日减少37.99吨
同花顺,2026-06-02 00:29:46,中信建投：算力等高频高速需求快速增长 电子级PTFE有望大规模应用
同花顺,2026-06-02 00:26:23,现货黄金站上4490美元/盎司
同花顺,2026-06-02 00:21:53,中方代表：黎以停火已名存实亡 呼吁立即实现停火止战
同花顺,2026-06-02 00:16:06,韩国KOSPI指数早间大幅波动
同花顺,2026-06-02 00:12:59,李宁与库里达成长期合作
同花顺,2026-06-02 00:08:13,韩国KOSPI指数快速跳水，跌幅扩大至3%
同花顺,2026-06-02 00:04:16,韩国综指涨幅扩大至1%
同花顺,2026-06-02 00:04:12,日韩股市涨跌互现
同花顺,2026-06-01 23:56:59,六连板*ST雅博：公司股票交易存在市场情绪过热、非理性炒作情况
同花顺,2026-06-01 23:54:40,意大利南部海域发生6.2级地震 多地有震感
同花顺,2026-06-01 23:47:44,伊朗议长强调对黎巴嫩的支持立场
同花顺,2026-06-01 23:46:20,特朗普：与伊朗“一周内”达成协议
同花顺,2026-06-01 23:45:38,新工艺实现多层单晶硅电路垂直集成
同花顺,2026-06-01 23:44:49,货币基金“T+1”结算落地 多家中小银行暂停货基申购
同花顺,2026-06-01 23:41:40,非化石能源电力消费核算指南出台 绿证市场迎利好
同花顺,2026-06-01 23:37:31,多因素推升海运价格 集运指数近七周累计涨超60%
同花顺,2026-06-01 23:36:58,华泰证券：AI驱动感光干膜需求爬升，行业头部企业有望受益
同花顺,2026-06-01 23:35:46,阿里发布Qwen3.7-Plus多模态智能体模型
同花顺,2026-06-01 23:20:22,乌克兰首都基辅连续传出剧烈爆炸声
同花顺,2026-06-01 23:16:19,现货白银站上75美元/盎司
同花顺,2026-06-01 23:13:17,白酒消费税纳税申报新规施行，提升征管效能
同花顺,2026-06-01 23:10:11,趁晴抢收 全国小麦收获进度近三成
同花顺,2026-06-01 23:07:12,Anthropic向美国证券交易委员会保密提交IPO文件草案
同花顺,2026-06-01 22:51:59,伊朗：必要情况下“动用一切能力捍卫自身利益”
同花顺,2026-06-01 22:44:34,第勒尼安海发生6.2级地震 震源深度250公里
同花顺,2026-06-01 22:44:12,知名牛散扎堆掘金北交所新三板 长线投资渐成风向
同花顺,2026-06-01 22:39:55,储蓄国债即将纳入个人养老金产品池
同花顺,2026-06-01 22:39:43,白酒消费税纳税申报新规施行
同花顺,2026-06-01 22:34:58,券商密集上线Skills，行业AI竞争走向纵深
同花顺,2026-06-01 22:33:27,第勒尼安海附近发生6.2级左右地震
同花顺,2026-06-01 22:31:38,实际有效汇率指数创1973年以来新低 日元结构性贬值压力难消
同花顺,2026-06-01 22:31:21,端侧AI驱动下一轮增长 国产存储芯片迎新机遇
同花顺,2026-06-01 22:31:02,10年期国债收益率低见1.704% 债市交易逻辑重回基本面
同花顺,2026-06-01 22:30:54,美联储6月维持利率不变的概率为98.4%
同花顺,2026-06-01 22:19:57,韩国数据显示：在韩新注册登记进口汽车数量，中国车史上首超日本车
同花顺,2026-06-01 22:15:24,黎总统重申外交途径是解决冲突的唯一出路
同花顺,2026-06-01 22:09:52,5月多家券商领罚 监管紧盯分支机构合规短板
同花顺,2026-06-01 22:07:13,四大因素推升海运价格 集运指数近七周累计涨超60%
同花顺,2026-06-01 22:05:57,“AI魔改”专项治理见实效 5月份清理违规视频8000余条
同花顺,2026-06-01 21:51:42,特朗普称美伊或于一周内达成协议 延长停火并重开霍尔木兹海峡
同花顺,2026-06-01 21:27:08,哈马斯称其代表团与土耳其情报局局长讨论加沙局势
同花顺,2026-06-01 21:22:10,莫斯科交易所测试用于人工智能代理参与交易的基础设施
同花顺,2026-06-01 21:18:45,以总理称与特朗普通话，将继续在黎南开展行动
同花顺,2026-06-01 21:15:33,富时中国A50指数期货夜盘收跌0.06%，报15533点
同花顺,2026-06-01 21:13:47,今年以来超600只理财产品提前退场
同花顺,2026-06-01 21:04:09,谷歌母公司Alphabet已达成协议，通过私募配售向伯克希尔哈撒韦公司出售100亿美元的股票
同花顺,2026-06-01 21:03:31,慧与股价盘后飙升超30% 预计未来18个月服务器需求增长强劲
同花顺,2026-06-01 21:03:21,标普：上调戴尔科技评级至BBB+，前景展望稳定
同花顺,2026-06-01 20:57:10,Meta上线AI聊天机器人付费订阅业务，用于覆盖其2026年1250亿–1450亿美元的预期资本开支
同花顺,2026-06-01 20:50:36,深圳3D打印机圈粉全球 狂揽近90%市场份额
同花顺,2026-06-01 20:42:19,谷歌母公司拟增加800亿美元股本，伯克希尔将投资100亿美元
同花顺,2026-06-01 20:37:20,美国战略石油储备降至两年多来最低水平
同花顺,2026-06-01 20:27:44,伊朗伊斯兰革命卫队称对美以船只实施打击
同花顺,2026-06-01 20:13:27,以总理：以军将继续按计划在黎南部开展行动
同花顺,2026-06-01 20:13:21,丹麦看守首相宣布新政府组建完成
同花顺,2026-06-01 20:08:57,黎巴嫩总统办公室：真主党已承诺停止打击以色列
同花顺,2026-06-01 20:08:50,2026年全国“服务消费季”在杭州启动
同花顺,2026-06-01 20:08:05,伊朗革命卫队暗示曼德海峡通航将受管控
同花顺,2026-06-01 20:07:50,芝加哥商业交易所集团宣布推出全天候（24/7）加密货币期货和期权交易
同花顺,2026-06-01 20:06:20,美股三大股指集体收涨
同花顺,2026-06-01 18:49:04,特朗普：以军不会前往贝鲁特，黎真主党同意停火
同花顺,2026-06-01 18:28:36,黎官员称真主党已准备好与以色列全面停火
同花顺,2026-06-01 18:28:32,雅加达一居民区发生火灾 消防部门已展开灭火行动
同花顺,2026-06-01 17:55:51,特朗普：与伊朗的谈判正“快速推进”
同花顺,2026-06-01 17:40:39,伊朗外交部：美对以色列违反黎以停火协议负有直接责任
同花顺,2026-06-01 17:38:26,特朗普：以色列和黎真主党的所有交火行动将立即停止
同花顺,2026-06-01 17:36:11,以军称拦截多枚黎巴嫩真主党发射的火箭弹
同花顺,2026-06-01 17:36:01,伦敦股市1日下跌
同花顺,2026-06-01 17:01:16,中国驻柬使馆敦促柬方全力侦办中国公民遇害案件
同花顺,2026-06-01 16:51:08,哥伦比亚一架小型飞机坠毁 4人遇难
同花顺,2026-06-01 16:51:02,Tripo AI完成近2亿美元A+轮和A++轮融资，以推进其AI 3D及世界模型路线图
同花顺,2026-06-01 16:34:38,以军称打死1名黎真主党军事指挥官
同花顺,2026-06-01 16:33:16,195只公募基金正式“换标尺”
同花顺,2026-06-01 16:33:04,3家港股AI企业正在“回A”辅导 “A+H”持续扩容
同花顺,2026-06-01 16:22:46,特朗普称尚未收到伊朗关于暂停谈判的消息
同花顺,2026-06-01 16:13:49,美国总统特朗普在接受NBC新闻记者采访时表示，他尚未收到伊朗关于暂停谈判的消息
同花顺,2026-06-01 16:13:38,特朗普谈及伊朗问题：说实话，我们话说得太多了。保持缄默或许才是上策
同花顺,2026-06-01 16:13:10,上交所：对邦彦技术股份有限公司有关责任人予以监管警示
同花顺,2026-06-01 16:11:10,Anthropic投资方股价跳涨
同花顺,2026-06-01 16:08:53,比特币跌破71000美元，日内跌3.69%
同花顺,2026-06-01 16:07:50,董军同南非国防和退伍军人部部长会谈
同花顺,2026-06-01 16:02:41,黎巴嫩议会议长：真主党已准备好和以色列达成停火协议
同花顺,2026-06-01 16:02:01,意大利交通部数据：5 月特斯拉新车上牌量同比下滑 23.5%
同花顺,2026-06-01 16:01:55,日菲商定尽早实现老旧日舰对菲出口
同花顺,2026-06-01 16:00:33,Anthropic 已向美国证券交易委员会（SEC）秘密递交 S-1 招股说明书草案
同花顺,2026-06-01 15:59:53,SpaceX：马斯克同意接受为期366天的股票锁定期
同花顺,2026-06-01 15:54:47,伊朗最高领袖军事顾问：伊方耐心有限 绝不允许海上封锁继续
同花顺,2026-06-01 15:47:48,乌干达反政府武装袭击刚果（金）东部致16人死亡
同花顺,2026-06-01 15:08:47,消息人士称以军扩大在黎军事行动系与美协调进行
同花顺,2026-06-01 15:06:02,NYMEX取暖油主力合约大涨8%
同花顺,2026-06-01 15:05:56,王毅同巴西外长维埃拉举行中巴外长级全面战略对话
同花顺,2026-06-01 15:04:17,中国电摩出海爆红
同花顺,2026-06-01 15:02:41,澳门完成多边央行数字货币桥对接 11家银行明日“上桥”交易
同花顺,2026-06-01 15:01:49,伊朗媒体发布击落MQ-1无人机视频
同花顺,2026-06-01 15:01:42,埃博拉病毒病诊疗方案发布 我国尚无本土及输入性病例报告
同花顺,2026-06-01 15:00:26,期市夜盘收盘，国内期货主力合约多数上涨，低硫燃油涨超5%
同花顺,2026-06-01 14:55:38,欧佩克+预计将在周日举行的会议上决定，将7月份原油产量配额提高18.8万桶/日
同花顺,2026-06-01 14:50:05,英伟达助力优步与Autobrains，在慕尼黑试水Robotaxi
同花顺,2026-06-01 14:49:48,智谱：建议A股发行并在科创板上市
同花顺,2026-06-01 14:38:30,戴尔科技涨11%、惠普涨近9% 英伟达进军个人电脑市场
同花顺,2026-06-01 14:29:24,WTI原油大涨8%
同花顺,2026-06-01 14:22:56,英伟达高开高走现涨超5%
同花顺,2026-06-01 14:22:21,新易盛：目前公司在光路交换机领域已有充分布局
同花顺,2026-06-01 14:15:39,中美两军在美国夏威夷举行2026年度中美海上军事安全磋商机制工作小组会议
同花顺,2026-06-01 14:14:58,美国供应管理学会5月份制造业指数升至54.0，预估为53.0
同花顺,2026-06-01 14:13:20,以军要求黎巴嫩首都贝鲁特南郊居民撤离
同花顺,2026-06-01 14:08:23,新易盛：1.6T光模块产品订单相对于去年增幅很大，预计在今年呈现出逐季快速增长的趋势
同花顺,2026-06-01 14:00:03,伊朗暂停通过中间人同美国的对话 要求满足前不举行任何谈判
同花顺,2026-06-01 12:55:13,智迪科技：拟以1.52亿元购买丰旭国际100%股权 董事会审议通过
同花顺,2026-06-01 12:49:58,存量公募基金今起调整基准，业内人士：不会引发基金调仓
同花顺,2026-06-01 12:47:27,美军称拦截两枚伊朗向驻科威特美军基地发射的导弹
同花顺,2026-06-01 12:47:13,被控贪污的菲律宾参议员称将自首
同花顺,2026-06-01 12:46:18,汤臣倍健：出资1.3亿元参与设立创业投资基金
同花顺,2026-06-01 12:46:03,*ST荣控：撤销退市风险警示 股票简称变更为荣丰控股 日涨跌幅限制变更为10%
同花顺,2026-06-01 12:44:34,智洋创新：以3亿元认购灵明光子9.1463%股权，已签署增资协议
同花顺,2026-06-01 12:43:55,*ST交投：公司股票将于6月3日撤销退市风险警示和其他风险警示 日涨跌幅限制变更为10%
同花顺,2026-06-01 12:42:43,中文在线：张帆、谢广才、王京京减持计划实施完毕，合计减持0.0892%股份
同花顺,2026-06-01 12:41:35,ST葫芦娃：全资子公司获氯化钾口服溶液注册证书
同花顺,2026-06-01 12:32:42,美团王兴：AI服务AI Agent（To A）正变得越来越重要
同花顺,2026-06-01 12:31:40,润泽科技：股东大容明琛拟减持不超过0.9931%股份
同花顺,2026-06-01 12:31:04,东土科技：以4095万元参股持有高威科6.5%股权
同花顺,2026-06-01 12:28:50,弘信电子：控股子公司出资5000万元投资通用机器人企业
同花顺,2026-06-01 12:25:22,粤电力A：澄清克拉玛依项目算力收入占营收0.02%，与韶关算力集群无直接关联
同花顺,2026-06-01 12:24:43,ST洲际：控股股东广西正和未符合受理破产清算申请的法定条件
同花顺,2026-06-01 12:24:28,NYMEX天然气主力合约跌超1%
