来源,时间,标题
同花顺,2026-06-05 08:18:17,今年前5月上海口岸跨境电商海运出口已超去年全年
同花顺,2026-06-05 08:12:01,腾讯云与国星宇航签署“星算”计划战略合作协议 共推商用算力与AI云服务融合
同花顺,2026-06-05 08:11:42,迈威尔科技美股盘前跌超5%
同花顺,2026-06-05 08:11:29,中天科技：公司中标互联网企业数据中心耗材项目，中标金额约15.18亿元
同花顺,2026-06-05 08:10:30,港股收评：恒生指数跌1.15%，恒生科技指数跌1.75%
同花顺,2026-06-05 08:10:16,曙光股份：5月整车产量15辆 销量50辆
同花顺,2026-06-05 08:06:58,摩根士丹利：Vera Rubin是英伟达稳住高市占率的关键
同花顺,2026-06-05 08:04:35,美股中概股盘前多数下跌，百度跌4%
同花顺,2026-06-05 08:04:32,美股大型科技股盘前普跌，英伟达跌1%
同花顺,2026-06-05 08:04:18,阿斯麦美股盘前跌超4%
同花顺,2026-06-05 08:04:10,原力灵机并购物流机器人公司Atomix CEO唐文斌：模型与场景从来不是孤立存在的
同花顺,2026-06-05 08:03:54,Lululemon股价盘前跌超11%
同花顺,2026-06-05 08:02:27,国务院食安办成立工作组督导查处“望奎双汇猪肉抗生素超标问题”
同花顺,2026-06-05 07:56:52,汇源通信：2025年度定增获深交所终止审核
同花顺,2026-06-05 07:55:31,亚通股份：拟对全资子公司环岛混凝土增资1900万元
同花顺,2026-06-05 07:52:37,神农集团：5月商品猪销量30.84万头、同比增长37.13%
同花顺,2026-06-05 07:52:24,豆包误判蘑菇导致用户中毒？抖音集团副总裁回应
同花顺,2026-06-05 07:49:03,新晨科技：取得发明专利证书
同花顺,2026-06-05 07:48:57,2025年市场监管总局立案市场垄断案件20件
同花顺,2026-06-05 07:46:54,津药药业：拟以1.3亿元收购津药物流100%股权
同花顺,2026-06-05 06:53:33,沪深京三市成交额超3万亿元，较上日此时放量3107亿元
同花顺,2026-06-05 06:44:28,王毅同缅甸外长丁貌瑞会谈
同花顺,2026-06-05 06:42:51,上证指数跌幅扩大至1%
同花顺,2026-06-05 06:38:22,曝英伟达重启显卡计划
同花顺,2026-06-05 06:34:24,中际旭创成交额达500亿元
同花顺,2026-06-05 06:32:31,阿曼石油开发公司称其重要石油出口港运营正常
同花顺,2026-06-05 06:31:53,恒生电子发布6.0 AI生态架构
同花顺,2026-06-05 06:31:39,日韩股市集体收跌
同花顺,2026-06-05 06:30:21,光纤价格狂飙 高纯石英砂因供需偏紧而“身价”上涨
同花顺,2026-06-05 06:29:12,科创50指数跌幅扩大至4%
同花顺,2026-06-05 06:27:45,创业板指跌幅扩大至3%
同花顺,2026-06-05 06:27:25,首创期货：油价暴跌后小幅反弹
同花顺,2026-06-05 06:27:05,诚迈科技成立智慧科技公司 含AI及机器人业务
同花顺,2026-06-05 06:26:53,抖音高管回应豆包误判蘑菇导致中毒
同花顺,2026-06-05 06:23:38,沃兰特创始人：商用客运eVTOL现处早期酝酿阶段，下半年有望启动经济性验证工作
同花顺,2026-06-05 06:22:39,港股恒生科技指数跌幅达2%
同花顺,2026-06-05 06:21:58,电力板块跌幅扩大，豫能控股触及跌停
同花顺,2026-06-05 06:18:47,现货黄金失守4430美元/盎司
同花顺,2026-06-05 06:18:05,豆包已注册多个谐音商标
同花顺,2026-06-05 06:17:54,COMEX黄金期货跌超1% COMEX白银期货跌超3%
同花顺,2026-06-05 05:28:52,千问App发布业内首份AI健康助手指南
同花顺,2026-06-05 05:26:34,2026一季度全球扫地机榜单出炉，国产品牌霸榜全球
同花顺,2026-06-05 05:15:49,港股大模型概念股大幅下跌，智谱跌超10%
同花顺,2026-06-05 05:13:34,减速器板块持续拉升
同花顺,2026-06-05 05:12:39,胜利精密：复合铜箔项目仍处于工艺优化、样品测试和量产准备阶段
同花顺,2026-06-05 05:08:59,巴拿马副外长：希望巴中继续开展多层次对话
同花顺,2026-06-05 05:08:19,沪深京三市成交额超2万亿元，较上日此时放量1708亿元
同花顺,2026-06-05 05:07:14,印度Nifty 50指数抹去盘中涨幅
同花顺,2026-06-05 05:05:30,腾讯姚顺雨：多模态、具身智能等很多新事物正在或即将发生
同花顺,2026-06-05 05:01:14,机器人板块走高，绿的谐波涨超17%
同花顺,2026-06-05 04:56:59,上海电信联手淘宝闪购上线AI助餐服务，老人“动口不动手”即可点餐到家
同花顺,2026-06-05 04:51:28,英伟达CEO黄仁勋表示，计划与现代、三星和SK集团举行会晤
同花顺,2026-06-05 04:46:49,腾讯发布效率智能体工具集 助力AI提效
同花顺,2026-06-05 04:44:51,塞内加尔疟疾防控工作取得重要进展
同花顺,2026-06-05 04:44:16,卓创资讯：5月白银冲高回落，后市关注美联储利率决议与美伊谈判
同花顺,2026-06-05 04:39:44,上海开展“清朗·整治AI应用乱象”专项行动
同花顺,2026-06-05 04:20:40,海外618，速卖通欧洲本地订单占比过半
同花顺,2026-06-05 04:06:26,追觅科技创始人兼CEO俞浩微博被禁言
同花顺,2026-06-05 04:01:13,港股午评：恒生指数跌0.81%，恒生科技指数跌1.23%
同花顺,2026-06-05 03:56:49,我国轴向磁通电机研究取得新突破
同花顺,2026-06-05 03:44:30,上海集成电路产投基金入股此芯科技 后者为智能CPU芯片开发商
同花顺,2026-06-05 03:40:30,花旗：上调宁德时代AH股目标价，维持“买入”评级，续列为板块首选
同花顺,2026-06-05 03:31:33,ETF午评：卫星ETF领涨4.36%，中韩半导体ETF领跌4.13%
同花顺,2026-06-05 03:31:15,ETF两市成交额2146.90亿元
同花顺,2026-06-05 03:30:52,A股午评：沪指低开高走涨0.43%，通信设备、非金属材料、光纤概念板块表现强势
同花顺,2026-06-05 03:30:17,股指期货早盘收盘 主力合约多数上涨
同花顺,2026-06-05 03:30:04,华为云发布全球首个全流程具身智能开发平台CloudRobo
同花顺,2026-06-05 03:24:52,昭衍新药与中国科学院昆明动物研究所签署战略合作框架协议
同花顺,2026-06-05 03:23:21,我国自主研发的全球首款量产智能终端用硅基氮化镓射频芯片产品，近日已交付超五百万颗
同花顺,2026-06-05 03:11:24,阿根廷与美国签署协议加强军用无人机等合作
同花顺,2026-06-05 03:10:27,巴西外长：美国加征关税的理由“不成立”
同花顺,2026-06-05 03:09:10,光学光电子板块持续拉升，京东方A触及涨停
同花顺,2026-06-05 03:04:55,日本总务省公布调查结果：家庭消费持续承压
同花顺,2026-06-05 03:04:42,匈牙利同意开启乌克兰加入欧盟谈判
同花顺,2026-06-05 03:04:00,港股中兴通讯涨超11%
同花顺,2026-06-05 03:02:39,姚顺雨：需要建立长期AGI组织 ，腾讯AI下半场主攻三方向
同花顺,2026-06-05 02:57:32,刚果（金）埃博拉检测能力提升 24小时能出结果
同花顺,2026-06-05 02:56:53,千寻智能在杭州成立机器人公司 注册资本1000万
同花顺,2026-06-05 02:56:11,深圳：鼓励财险公司探索研究智能驾驶综合保险 为深圳无人驾驶出租车等提供充足保险保障
同花顺,2026-06-05 02:52:44,光伏加工设备板块短线拉升
同花顺,2026-06-05 02:27:57,中证协启动2026年券商并购重组能力专项评价
同花顺,2026-06-05 02:25:08,港股恒生科技指数跌幅达1%
同花顺,2026-06-05 02:23:00,全球最大的黄金ETF SPDR Gold Trust持仓较前日减少1.72吨
同花顺,2026-06-05 02:21:34,北证50指数涨幅扩大至3%
同花顺,2026-06-05 02:19:35,华为云发布AICS灵衢智算集群等Agentic AI新品
同花顺,2026-06-05 02:14:22,A股三大指数集体翻红
同花顺,2026-06-05 02:11:25,新易盛股价创历史新高
同花顺,2026-06-05 02:08:34,阿里千问支持NBA中国打造首个官方大模型
同花顺,2026-06-05 02:07:29,古巴国家主席：美国针对古巴的言行将加剧两国对抗
同花顺,2026-06-05 02:05:12,光刻胶板块拉升，百合花涨停
同花顺,2026-06-05 02:02:13,医保个人账户跨省共济来了 近亲属可用
同花顺,2026-06-05 02:02:08,沪深京三市成交额超1万亿元，较上日此时放量706亿元
同花顺,2026-06-05 02:00:59,习近平将对朝鲜民主主义人民共和国进行国事访问
同花顺,2026-06-05 01:58:38,小金属板块短线拉升
同花顺,2026-06-05 01:55:36,北证50指数涨幅扩大至2%
同花顺,2026-06-05 01:55:32,光学光电子板块短线拉升
同花顺,2026-06-05 01:54:35,泸州老窖集团等在成都新设企管合伙企业
同花顺,2026-06-05 01:48:29,保险板块走高，中国人寿涨超5%
同花顺,2026-06-05 01:43:29,光纤概念板块短线拉升，鼎通科技涨超13%
同花顺,2026-06-05 01:41:42,超级电容板块下挫，金时科技触及跌停
同花顺,2026-06-05 01:30:14,科创50指数跌幅扩大至1%
同花顺,2026-06-05 01:29:31,特朗普称代理国家情报总监不会被正式任命
同花顺,2026-06-05 01:29:11,股指期货早盘开盘 主力合约集体低开
同花顺,2026-06-05 01:28:02,中信期货：白银短线维持震荡，趋势性驱动不强
同花顺,2026-06-05 01:26:29,现货黄金失守4450美元/盎司
同花顺,2026-06-05 01:26:20,ETF开盘：创业板新能源ETF领涨3.43%，日经ETF领跌3.02%
同花顺,2026-06-05 01:25:32,A股开盘：三大指数集体低开
同花顺,2026-06-05 01:22:00,上一交易日ETF两市融资融券余额1103.95亿元
同花顺,2026-06-05 01:21:29,港股开盘：恒生指数低开0.27%，恒生科技指数低开0.31%
同花顺,2026-06-05 01:21:28,央行：6月5日开展了2150亿元7天期逆回购操作
同花顺,2026-06-05 01:19:14,上期所沪锡主力合约跌超4%
同花顺,2026-06-05 01:16:30,中金财富期货：目前的黄金受制于无法预判的油价因素
同花顺,2026-06-05 01:15:26,人民币兑美元中间价报6.8157，较上日调高46点
同花顺,2026-06-05 01:09:04,日经225指数跌幅扩大至2%
同花顺,2026-06-05 01:05:04,俄称控制一居民点 乌称打击俄巡逻舰
同花顺,2026-06-05 01:04:51,商务部：1-4月我国服务进出口总额24853.2亿元 同比增长4.9%
同花顺,2026-06-05 01:02:18,现货白银失守73美元/盎司
同花顺,2026-06-05 01:00:28,富时中国A50指数期货盘初涨0.16%
同花顺,2026-06-05 01:00:00,期市早盘开盘，国内期货主力合约多数下跌
同花顺,2026-06-05 00:59:24,6月4日545股获融资买入超亿元 兆易创新获买入52.57亿元居首
同花顺,2026-06-05 00:31:21,中信证券：科创板“1+6”改革成效显著 生态形成良性闭环
同花顺,2026-06-05 00:24:42,美股纳斯达克100指数期货跌超1%
同花顺,2026-06-05 00:23:12,全球最大的白银ETF iShares Silver Trust持仓量较前日减少0.02吨
同花顺,2026-06-05 00:23:01,开源证券：白酒底部布局，大众品把握三条主线
同花顺,2026-06-05 00:22:18,韩国综指跌幅扩大至6%
同花顺,2026-06-05 00:13:56,韩国综指跌幅扩大至5%
同花顺,2026-06-05 00:12:29,胡塞武装：准备应对局势升级 “抵抗阵线”保持协调
同花顺,2026-06-05 00:09:48,MSCI亚太指数下跌1%
同花顺,2026-06-05 00:09:19,韩国交易所因KOSPI 200期货下跌5%而启动KOSPI的熔断机制，程序化交易暂停5分钟
同花顺,2026-06-05 00:04:23,日经225指数跌幅扩大至1%
同花顺,2026-06-05 00:02:06,日韩股市集体低开
同花顺,2026-06-05 00:00:46,现货黄金失守4460美元/盎司
同花顺,2026-06-05 00:00:03,日本实际薪资连续四个月上涨
同花顺,2026-06-04 23:55:36,振华科技：公司目前整体钽电容产能10亿只
同花顺,2026-06-04 23:55:01,华泰证券：光模块设备或迎量升价增拐点
同花顺,2026-06-04 23:52:52,泽连斯基提议会晤 普京重申愿意和谈
同花顺,2026-06-04 23:50:57,印尼中苏拉威西省东北部海域发生5.6级地震
同花顺,2026-06-04 23:45:18,不拼网速侧重广覆盖 6G将带来三大产业机遇
同花顺,2026-06-04 23:42:57,伊朗说将同阿曼规范管理霍尔木兹海峡
同花顺,2026-06-04 23:39:37,纽约期金失守4490美元/盎司
同花顺,2026-06-04 23:39:28,中信建投：港股正式进入牛市中后段
同花顺,2026-06-04 23:33:28,广西南宁暴雨橙色预警信号提升为红色
同花顺,2026-06-04 23:24:15,聪明钱提前布局AI上游环节 部分基础材料成新宠
同花顺,2026-06-04 23:19:22,美联储到6月维持利率不变的概率为96.4%，累计降息25个基点的概率为3.6%
同花顺,2026-06-04 23:17:27,二手房挂牌量回落新房库存下降，楼市供需关系向好
同花顺,2026-06-04 23:12:26,古巴国家主席回应美国制裁：短视行径必遭坚定回击
同花顺,2026-06-04 23:09:45,资产划转税务处理口径存争议，业内建议出台可量化细则与指引
同花顺,2026-06-04 22:56:25,乌拉圭宣布对中国公民免签
同花顺,2026-06-04 22:46:54,古巴国家主席回应遭美制裁
同花顺,2026-06-04 22:28:20,机构前瞻下半年资本市场新趋势：改革强根基 资金增活力 工具提质效
同花顺,2026-06-04 22:28:15,ETF座次重新洗牌 资金“换挡”重塑市场生态
同花顺,2026-06-04 22:28:10,核心驱动力并未动摇 五大券商把脉A股下半年机遇
同花顺,2026-06-04 22:28:02,高温与算电协同助力 A股电力板块投资价值升温
同花顺,2026-06-04 22:27:40,透视年内债市信披监管措施：紧盯关键主体，全链条、穿透式深化
同花顺,2026-06-04 22:21:43,券商密集发布2026年度提质增效方案 锚定投行提质、控薪增效、分红回馈三条主线
同花顺,2026-06-04 22:21:35,前5个月基金新开户数近160万 基金经理对后市普遍持乐观态度
同花顺,2026-06-04 22:21:28,多路增量资金加码A股 主动权益类基金加仓科技成长
同花顺,2026-06-04 22:19:40,普京：需要说服乌方相信俄罗斯同意妥协
同花顺,2026-06-04 22:15:54,美元指数4日下跌
同花顺,2026-06-04 22:02:06,美联储6月维持利率不变的概率为96.4%
同花顺,2026-06-04 21:55:04,SpaceX告知投行其IPO发行价定为每股135美元，不会变动
同花顺,2026-06-04 21:50:49,以色列继续空袭黎巴嫩 真主党打死以军士兵
同花顺,2026-06-04 21:50:44,伊朗官员：若以色列向黎巴嫩达希耶方向推进将承受巨大代价
同花顺,2026-06-04 21:50:40,特朗普：乐见“普泽会” 俄乌会“妥协”
同花顺,2026-06-04 21:50:27,哈马斯高官与伊朗外长通话讨论地区局势
同花顺,2026-06-04 21:34:17,富时中国A50指数期货夜盘收涨0.16%，报15734点
同花顺,2026-06-04 21:34:12,美方将古巴国家主席列入制裁名单
同花顺,2026-06-04 21:33:57,国际油价4日显著下跌
同花顺,2026-06-04 20:56:12,特朗普称黎以和平谈判取得一定进展
同花顺,2026-06-04 20:55:28,特朗普称若达成协议 不排除与伊朗最高领袖会晤
同花顺,2026-06-04 20:21:47,美国总统特朗普：我们不需要与伊朗达成协议，也可以取得他们的浓缩铀
同花顺,2026-06-04 20:21:42,美国财政部网站显示，美国制裁古巴主席米格尔·迪亚斯
同花顺,2026-06-04 20:17:52,瑞士将在G7法国峰会期间向毗邻边境派兵四千
同花顺,2026-06-04 20:00:40,美股收评：美股三大指数收盘涨跌不一
同花顺,2026-06-04 19:57:15,德国落选安理会非常任理事国，德外长：或因支持乌克兰和以色列
同花顺,2026-06-04 19:57:06,俄总统新闻秘书：随时欢迎泽连斯基来莫斯科谈
同花顺,2026-06-04 19:26:55,伊朗外长：地区国家不应让美国利用其领土攻击伊朗
同花顺,2026-06-04 19:19:40,世界粮食计划署：中东危机外溢冲击全球粮食安全
同花顺,2026-06-04 19:06:12,在岸人民币兑美元夜盘收盘报6.7750，较上一交易日上涨43点
同花顺,2026-06-04 19:05:56,泽连斯基公开致信普京　提议举行会晤
同花顺,2026-06-04 19:05:32,普京愿在俄美会晤基础上与乌谈判
同花顺,2026-06-04 19:05:12,俄外长：俄已更新海湾地区安全构想并递交各方
同花顺,2026-06-04 18:21:41,美国天然气期货价格涨幅扩大至5%
同花顺,2026-06-04 18:20:44,胡塞武装称已做好准备应对任何局势发展
同花顺,2026-06-04 18:05:16,高盛预计SpaceX到2030年将“烧掉”3500亿美元现金，资本支出的80%将用于人工智能
同花顺,2026-06-04 18:04:42,普京：控制顿巴斯和与乌方达成和平协议不矛盾
同花顺,2026-06-04 18:04:35,LME金属期货收盘涨跌不一
同花顺,2026-06-04 18:03:19,普京：俄罗斯不拒绝与欧洲对话
同花顺,2026-06-04 17:43:55,普京：俄方愿在美国安克雷奇与乌方谈判
同花顺,2026-06-04 17:42:24,伊朗5月石油出口量降至每日30万桶以下，为至少六年来最低水平
同花顺,2026-06-04 17:04:56,伦敦股市4日上涨
同花顺,2026-06-04 17:04:12,俄外长：“拜登的战争”变成“特朗普的战争”
同花顺,2026-06-04 17:01:37,波士顿联储研究显示石油冲击对美国的影响弱于1970年代
同花顺,2026-06-04 16:59:11,世界最大海上换流站“海风之心”顺利完成海上安装
同花顺,2026-06-04 16:40:28,新疆伊犁州霍尔果斯市发生4.8级地震 震源深度17公里
同花顺,2026-06-04 16:38:12,公募机构对直销业务“做减法”
同花顺,2026-06-04 16:20:07,北京中科信半导体股份有限公司启动上市辅导
同花顺,2026-06-04 16:11:58,现货白银涨超1.50%
同花顺,2026-06-04 16:07:04,OpenAI：今天向美国的Plus和Pro用户提供更新，未来几周将向其他国家及免费和Go用户推出
同花顺,2026-06-04 16:05:21,Meta旗下Instagram推出Instagram Plus
同花顺,2026-06-04 16:05:11,Meta 股票价格上涨 3.1%，创盘中新高
同花顺,2026-06-04 16:00:49,美股减肥药板块走高，礼来、诺和诺德双双涨超5%
同花顺,2026-06-04 15:50:20,欧盟中国商会：中欧应加强互联互通与合作，共同促进创新发展
同花顺,2026-06-04 15:39:46,欧洲三大股指收盘全线上涨
同花顺,2026-06-04 15:35:44,罗马尼亚总统任命欧金·托马茨为总理
同花顺,2026-06-04 15:29:04,中国贸促会新闻发言人就美国贸易代表办公室发起强迫劳动301调查并拟加征关税发表谈话
同花顺,2026-06-04 15:28:38,为破解航运困局，阿联酋布局新输油管道
同花顺,2026-06-04 15:24:09,中国铁建：巩固完善公司市场化经营机制 推动科技创新与产业创新深度融合
同花顺,2026-06-04 15:22:51,法兰克福机场发生客机起落架坍塌事故致多人受伤
同花顺,2026-06-04 15:22:05,德法英酝酿推动俄乌展开直接谈判
同花顺,2026-06-04 15:21:38,联动科技：加速推进全品类客户导入与批量投产
同花顺,2026-06-04 15:20:44,广东：要大力推动批零住餐业实现量质齐升 加快培育金融业成为强大的支柱性产业
同花顺,2026-06-04 15:02:01,全国麦收高效有序推进 良种良法助力颗粒归仓
同花顺,2026-06-04 14:59:36,陕西麦科奥特医药科技股份有限公司 - B通过港交所上市聆讯
同花顺,2026-06-04 14:46:44,全球最大直驱型漂浮式海上风电机组示范工程建设正式启动
同花顺,2026-06-04 14:35:17,外资加速重仓中国硬科技
同花顺,2026-06-04 14:31:16,2026年度澜湄合作专项基金柬埔寨项目签署协议
同花顺,2026-06-04 14:28:59,美国国会众议院3日通过一项决议，旨在限制美国总统特朗普对伊朗采取军事行动的权力
同花顺,2026-06-04 14:28:19,标普500指数转涨
同花顺,2026-06-04 14:27:45,美国电池创业公司Solidion Technology暴涨超500%
同花顺,2026-06-04 14:24:15,世卫组织说不安全食品每年导致超8亿人患病
同花顺,2026-06-04 14:16:27,伊朗革命卫队：以色列须立即停止袭击黎巴嫩
同花顺,2026-06-04 14:15:30,QUANTINUUM股票预计开盘价为每股62.50美元，IPO价格为60美元
同花顺,2026-06-04 14:15:08,欧盟因西班牙未能实施新资本要求指令对其提出严厉批评
同花顺,2026-06-04 14:05:05,黎巴嫩真主党领导人：只要以色列的占领仍然存在，真主党的抵抗就将继续
同花顺,2026-06-04 14:02:22,NYMEX取暖油主力合约跌超4%
同花顺,2026-06-04 14:02:15,特朗普认为赞成限制其战争权力的众议员“不爱国”
同花顺,2026-06-04 14:02:04,美国5月全球供应链压力指数 1.77，前值1.82
同花顺,2026-06-04 14:01:20,乌克兰总理：欧盟成员国均已同意开启乌方入盟谈判
同花顺,2026-06-04 13:59:12,道指刷新纪录新高，盘中涨幅达1.5%
同花顺,2026-06-04 13:50:51,证监会同意泰诺麦博科创板IPO注册
同花顺,2026-06-04 13:40:47,美股光通信股盘初下跌
同花顺,2026-06-04 13:38:31,美股道琼斯指数期货涨超1%
同花顺,2026-06-04 13:34:49,李飞飞长文拆解世界模型实现路径
同花顺,2026-06-04 13:31:16,美股开盘：美股三大指数涨跌不一
同花顺,2026-06-04 13:29:43,我国成功发射千帆极轨11组卫星
同花顺,2026-06-04 13:28:24,礼来美股盘前涨超2%
同花顺,2026-06-04 13:26:14,格力电器：董明珠的一致行动人减持总股本的0.76%
同花顺,2026-06-04 13:18:53,阿布扎比公司旗下铜企再获赞比亚铜精矿出口豁免 却仍称不计划出口
同花顺,2026-06-04 13:18:39,谷歌宣布在德克萨斯州格雷和罗伯茨县新建一座数据中心并进行能源投资
同花顺,2026-06-04 13:18:29,上海市市场监管局召开第五期企业圆桌会 12家平台企业参与
同花顺,2026-06-04 13:04:27,摩根大通：4、5月全球股票回购金额创纪录 科技行业回购力度加大
同花顺,2026-06-04 13:02:17,剑桥科技：完成配售1560万股新H股 募资净额约19.67亿港元
同花顺,2026-06-04 13:00:12,期市夜盘开盘，国内期货主力合约多数下跌，燃油跌超2%
同花顺,2026-06-04 12:57:13,伊戈尔：5名股东已合计减持0.0833%股份
同花顺,2026-06-04 12:52:46,沪电股份独家回应海外订单传闻：若有大额订单会及时披露，目前没有需披露信息
同花顺,2026-06-04 12:52:24,伊朗“圣城旅”：以色列须撤退至冲突爆发前的位置
同花顺,2026-06-04 12:44:21,拓山重工：控股股东等3人拟合计减持不超2.81%股份
同花顺,2026-06-04 12:44:03,高端光纤预制棒价格涨幅近550% 业内人士：短期内光棒供给紧缺的情况仍会阶段性固化
同花顺,2026-06-04 12:43:23,空缺半月，交行普惠金融部总经理到岗
同花顺,2026-06-04 12:42:29,唯特偶：深交所向唯特偶下发关注函 要求说明公司目前主营产品分别应用在光模块生产三大环节的具体情况
同花顺,2026-06-04 12:39:10,韩国执政党赢得地方选举
同花顺,2026-06-04 12:38:46,合肥城建：股东工投控股和董事王庆生拟分别减持1%和0.0014%股份
同花顺,2026-06-04 12:23:49,日联科技：拟发行股份、可转债及支付现金收购菲莱测试100%股权，交易作价9.36亿元
同花顺,2026-06-04 12:22:30,美联新材：股东张盛业已减持1.99995%股份
同花顺,2026-06-04 12:21:03,金时科技：公司超级电容器业务目前暂无在手订单，公司不涉及液冷、光通信业务
同花顺,2026-06-04 12:16:09,博杰股份：拟定增募资不超15.03亿元用于服务器检测设备及散热模组零部件产能建设等项目
同花顺,2026-06-04 12:15:02,黎总统称黎以停火协议获批后24小时内可实施
同花顺,2026-06-04 12:14:48,6月4日周四《新闻联播》要闻22条
同花顺,2026-06-04 12:08:36,WTI原油期货跌幅扩大至4.20% 跌破每桶92美元
同花顺,2026-06-04 12:02:22,睿创微纳：拟将496.36万股回购股份用于注销并减少注册资本
同花顺,2026-06-04 11:58:47,韩国拟向加拿大提供的氢能项目估值为31亿加元
同花顺,2026-06-04 11:58:12,世贸组织小型部长会议在巴黎举行 李成钢出席会议并发言
同花顺,2026-06-04 11:57:47,现货黄金站上4510美元/盎司
同花顺,2026-06-04 11:54:58,万通发展：目前 PCIe 6.0 switch 芯片处于在研阶段，尚未投片
同花顺,2026-06-04 11:52:50,世纪天鸿：任伦及多名股东拟减持不超过0.69%股份
同花顺,2026-06-04 11:51:01,南京商旅：参与设立南京云枢文旅强链并购股权投资基金，出资2500万元
同花顺,2026-06-04 11:48:54,宁德时代林久标：今年推动实现钠电在储能领域开启GWh级交付应用
同花顺,2026-06-04 11:46:24,布伦特原油失守95美元/桶
同花顺,2026-06-04 11:46:22,戴尔科技美股盘前跌超5%
同花顺,2026-06-04 11:45:57,五洋自控：拟6.81亿元收购东莞市柯斯宇液冷技术有限公司51%股权
同花顺,2026-06-04 11:43:59,泰恩康：董事长郑汉杰提议以1亿元-2亿元回购公司股份
同花顺,2026-06-04 11:43:57,潍坊市动力装备产业链“AI赋能·智造升级”协同发展推进会议召开
同花顺,2026-06-04 11:17:40,日本调查机构：中东局势紧张对日企经营造成冲击
同花顺,2026-06-04 11:17:30,北京公布第五轮共4宗拟供宅地清单
同花顺,2026-06-04 11:15:39,克罗地亚一架小型飞机坠毁，造成多人死亡
同花顺,2026-06-04 11:15:28,陈吉宁调研上海电气集团
同花顺,2026-06-04 11:13:55,ST路通：股东萍乡减持计划期限已届满 实际减持0.40%股份
同花顺,2026-06-04 11:11:45,上峰水泥：公司全称及证券简称变更，6月5日启用上峰材料
同花顺,2026-06-04 11:09:35,*ST中迪：拟0元收购关联方北京天微49%股权
同花顺,2026-06-04 11:08:37,华源控股：2026年一季度半导体业务并表营收约1000万占比低，间接持有宇树科技比例约0.003%
同花顺,2026-06-04 11:08:35,SpaceX：高盛、摩根士丹利、美国银行证券、花旗集团、摩根大通、巴克莱及其他机构将担任本次发行的账簿管理人
同花顺,2026-06-04 11:07:12,SpaceX已启动首次公开募股（IPO）路演
