来源,时间,标题
同花顺,2026-01-06 01:32:11,电池产业链盘初冲高，滨海能源触及涨停
同花顺,2026-01-06 01:29:19,以旧换新政策“上新”啦 “国补”范围更大金额更高更实惠
同花顺,2026-01-06 01:27:31,脑机接口板块再度大涨，南京熊猫等多股涨停
同花顺,2026-01-06 01:27:16,ETF开盘：民企ETF领涨7.69%，银行AH优选ETF领跌2.02%
同花顺,2026-01-06 01:27:06,日本岛根县东部地区发生6.2级地震
同花顺,2026-01-06 01:26:17,航空人口超5亿 我国成为全球第一航空人口大国
同花顺,2026-01-06 01:25:24,A股开盘：三大指数涨跌不一
同花顺,2026-01-06 01:23:25,字节豆包AI眼镜第一代总规划数量约10万台，采用高通AR1芯片
同花顺,2026-01-06 01:21:58,央行开展162亿元7天期逆回购操作
同花顺,2026-01-06 01:21:41,委首都传出枪声目击者说为无人机飞越总统府引发 有媒体报道称，局势已受控制
同花顺,2026-01-06 01:20:47,港股开盘：恒生指数高开0.59%，恒生科技指数高开0.79%
同花顺,2026-01-06 01:19:58,2025年民航总体盈利65亿元
财联社,2026-01-06 01:18:04,马杜罗对美方所谓指控表示不认罪
同花顺,2026-01-06 01:16:59,上一交易日ETF两市融资融券余额1168.50亿元
财联社,2026-01-06 01:16:28,桥水创始人达利欧：AI热潮正处于泡沫初期阶段 美联储会进一步吹大泡沫
同花顺,2026-01-06 01:15:48,北京多区发布大风蓝色预警，局地风力8级以上
财联社,2026-01-06 01:06:01,马杜罗在美国法院首次出庭
同花顺,2026-01-06 01:02:34,广期所碳酸锂主力合约涨幅扩大至6%
同花顺,2026-01-06 01:00:16,富时中国A50指数期货盘初涨0.47%
同花顺,2026-01-06 01:00:11,期市早盘开盘，国内期货主力涨多跌少
财联社,2026-01-06 00:58:53,捷克新政府通过施政纲领 与欧盟存在诸多分歧
同花顺,2026-01-06 00:58:11,亿帆医药：获创新药ACT001在中国等东亚市场及东南亚市场独家商业化权益
同花顺,2026-01-06 00:55:49,智谱AI在厦门投资成立新公司
同花顺,2026-01-06 00:55:40,现代电气：签署980亿韩元美国供应协议
财联社,2026-01-06 00:51:45,现货钯金日内涨超6%
财联社,2026-01-06 00:50:54,纽约期银日内涨超9%
同花顺,2026-01-06 00:49:26,伊朗外交部：美国侵犯他国主权 严重违反国际法
财联社,2026-01-06 00:49:24,墨西哥总统回应特朗普：合作可以 干预不行
同花顺,2026-01-06 00:47:15,项兴初拜访华为公司创始人任正非等
同花顺,2026-01-06 00:47:10,两市融资余额较上一日增加190.95亿元
同花顺,2026-01-06 00:44:43,海信发布新一代RGB-Mini LED技术
同花顺,2026-01-06 00:44:29,经济日报金观平：绿电发得出更要用得好
同花顺,2026-01-06 00:41:43,黄仁勋新年第一场演讲提了DeepSeek
财联社,2026-01-06 00:41:15,欧洲主要股指集体收涨 德国DAX30指数涨1.46%
同花顺,2026-01-06 00:29:10,消息人士：空客2025年交付793架喷气式飞机，产量达标
同花顺,2026-01-06 00:21:51,华西证券：2026年是多个正面因素叠加的“大年”，牛市基础仍扎实
财联社,2026-01-06 00:19:51,面对美国威胁 哥伦比亚总统称将“拿起武器”
同花顺,2026-01-06 00:13:42,2025年大庆油田天然气产量连续15年稳定增长
财联社,2026-01-06 00:13:15,委内瑞拉下令警方搜捕参与或支持美国袭击人员
同花顺,2026-01-06 00:11:42,卡塔尔计划2026年夏季向埃及供应至多24船液化天然气
同花顺,2026-01-06 00:06:50,全球最大的白银ETF iShares Silver Trust持仓量较前日减少90.54吨
同花顺,2026-01-06 00:01:36,日韩股市涨跌互现 日本东证指数创纪录新高
同花顺,2026-01-05 23:55:57,爷爷的农场向港交所递交上市申请
财联社,2026-01-05 23:52:30,美企租用油轮运载委内瑞拉原油驶往美国
财联社,2026-01-05 23:49:46,文峰股份：被告徐翔、徐长江一审判决将向原告敖某某等23人赔偿损失合计329.36万元
同花顺,2026-01-05 23:44:46,券商测算今年约50万亿元存款到期 巨量资金流向备受关注
同花顺,2026-01-05 23:38:01,发改委：推动量子科技、脑机接口、具身智能、第六代移动通信等成为新的经济增长点
同花顺,2026-01-05 23:37:42,英伟达CEO黄仁勋：收购GROQ资产“不会影响我们的核心业务”，但可能会带来“新的事物”
同花顺,2026-01-05 23:37:30,英特尔将推出采用新芯片的掌上游戏平台
财联社,2026-01-05 23:36:23,美副总统万斯称有人试图闯入其家中
财联社,2026-01-05 23:32:15,美国纽约南区法院外抗议者聚集要求“释放马杜罗”
财联社,2026-01-05 23:29:58,道指首次站上49000点
同花顺,2026-01-05 23:27:22,郑栅洁：“十五五”时期发展新质生产力要重点做好八方面工作
财联社,2026-01-05 23:25:22,康斯卡特宣布数字媒体资产分拆工作完成
同花顺,2026-01-05 23:24:39,尼日利亚东北部船难死亡人数升至29人
同花顺,2026-01-05 23:23:09,超7万亿元年金基金迎来长周期考核机制
同花顺,2026-01-05 23:22:45,云南新型储能装机突破600万千瓦
财联社,2026-01-05 23:21:33,美国ISM制造业指数创一年最低点 工厂活动持续萎缩
同花顺,2026-01-05 23:19:49,A股“开门红” 三大利好因素将持续发力
同花顺,2026-01-05 23:19:38,Mobileye环绕式ADAS获美国车企900万套订单
财联社,2026-01-05 23:17:31,电广传媒：旗下达晨财智投资蓝箭航天、星河动力等航天企业
同花顺,2026-01-05 23:14:30,英伟达发布新一代Rubin平台，推理成本较Blackwell降10倍，拟下半年发货
财联社,2026-01-05 23:12:33,中持股份：芯长征将成为公司控股股东
财联社,2026-01-05 23:05:34,联合国安理会就委内瑞拉局势举行紧急会议
财联社,2026-01-05 23:01:48,国内商品期市夜盘收盘多数上涨 非金属建材涨幅居前
同花顺,2026-01-05 22:54:58,英伟达推出BlueField-4数据处理器 为英伟达推理上下文内存存储平台提供算力支持
财联社,2026-01-05 22:50:32,道指刷新盘中历史新高
财联社,2026-01-05 22:44:38,比特币上破9.3万美元 创三周新高
财联社,2026-01-05 22:38:33,土耳其总统与阿联酋总统通电话 讨论地区局势
财联社,2026-01-05 22:34:36,纳斯达克中国金龙指数跌1.16%
同花顺,2026-01-05 22:33:00,埃及一戒毒中心发生火灾 已致7死7伤
财联社,2026-01-05 22:32:51,加密货币概念股普涨
财联社,2026-01-05 22:30:44,纳指高开0.9% 能源、矿业板块领涨
财联社,2026-01-05 22:27:45,创力集团：与川九建设签订战略框架协议
财联社,2026-01-05 22:27:39,众安信科（深圳）股份有限公司递表港交所
同花顺,2026-01-05 22:19:33,国际油价上涨超1%，委内瑞拉局势扰动市场
财联社,2026-01-05 22:16:57,高通的IE-IoT扩展完成：边缘人工智能为开发者、企业和OEM释放
财联社,2026-01-05 22:15:42,智库预计英国今年将迈过人口拐点 人口结构发生永久性转变
财联社,2026-01-05 22:14:25,高通推出了完整的机器人技术套件 驱动从家用机器人到全尺寸类人生物的物理人工智能
财联社,2026-01-05 22:14:08,全球车企市值“大洗牌”：特斯拉、丰田、小米、比亚迪分列前四
同花顺,2026-01-05 22:08:07,英伟达CEO黄仁勋：推出NVIDIACosmos开放世界基础模型，该模型具备类人推理能力
财联社,2026-01-05 22:05:16,陕西华达：与航天五院、八院均有合作 公司长期为长征系列火箭配套产品
财联社,2026-01-05 22:04:35,金发科技：已成立机器人材料团队 部分材料产品已向客户批量供应
财联社,2026-01-05 22:02:13,中韩签署国家公园管理合作协议
财联社,2026-01-05 22:01:39,纽约拥堵费实施周年：曼哈顿车流量下降 公交与出租车行驶提速
财联社,2026-01-05 22:01:25,【公告全知道】脑机接口+机器人+低空经济+多模态AI+边缘计算+军工！公司引进脑机接口技术及设备作为智慧医疗辅助工具
财联社,2026-01-05 22:00:58,高通与谷歌扩大十年合作 推动汽车创新和人工智能驱动的移动出行
财联社,2026-01-05 21:57:50,国务院国资委成立国资监管信息化专家组
财联社,2026-01-05 21:57:36,【风口研报·洞察】伴随AI服务器算力升级，HVLP4铜箔有望在2026年正式放量，当前海外龙头扩产策略极为保守，二季度起或将出现供应短缺，为国内玩家提供导入契机；1月市场的两个潜在变化
财联社,2026-01-05 21:54:00,豪鹏科技：固液态电池已实现量产出货 全固态电池中试线正在积极准备中
财联社,2026-01-05 21:50:25,电广传媒：达晨财智旗下管理的基金投资了云深处科技
财联社,2026-01-05 21:50:12,狄耐克：公司脑电波交互技术产业研发运营中心建设项目预计2027年6月30日可使用
财联社,2026-01-05 21:49:49,财联社1月5日晚间新闻精选
同花顺,2026-01-05 21:46:31,英伟达为能够“思考”类交通工具推出Alpamayo模型
财联社,2026-01-05 21:43:06,贵州：到2027年服务进出口额达到120亿元以上
财联社,2026-01-05 21:41:23,北京发布人工智能创新高地建设行动计划
财联社,2026-01-05 21:40:36,首都在线：公司为智谱GLM系列模型提供稳定的训练与推理算力支撑
财联社,2026-01-05 21:40:28,博杰股份：液冷设备已小批量发货
财联社,2026-01-05 21:39:22,"Bitmine上周增持32,977枚以太坊 价值1.04亿美元"
财联社,2026-01-05 21:37:50,LME期铜首次升至13000美元
财联社,2026-01-05 21:37:40,爷爷的农场国际控股有限公司递表港交所
财联社,2026-01-05 21:37:16,昊志机电：谐波减速器等人形机器人部件正送样测试
财联社,2026-01-05 21:36:47,华尔街多头：连续三年大涨之后 预计2026年美股涨幅将趋于温和
同花顺,2026-01-05 21:35:17,初步计票结果显示中非共和国现总统图瓦德拉赢得连任
财联社,2026-01-05 21:33:43,汇丰策略师对美股接近最大程度超配
财联社,2026-01-05 21:28:08,柬埔寨再次提议举行柬泰联合边界委员会特别会议
同花顺,2026-01-05 21:24:35,Zeta Global与OpenAI组团，双方将交付由答案驱动的市场
财联社,2026-01-05 21:23:29,浙版传媒：通过基金持股3.07%投资柔灵科技 后者专注非侵入式脑机接口技术研究
财联社,2026-01-05 21:22:10,特朗普再对印度发出“加税”威胁
财联社,2026-01-05 21:21:56,雪人集团：子公司为华为数据中心项目提供制冷工程安装服务
财联社,2026-01-05 21:21:45,浙江：加大校园足球普及力度 每学年足球课时不少于体育总课时的三分之一
财联社,2026-01-05 21:19:59,浙江：支持各地积极引进、组建职业足球俱乐部 鼓励社会力量投资职业俱乐部
财联社,2026-01-05 21:14:30,东港股份：目前有研发、生产数字货币卡的相关技术储备 将完善技术方案推出相关产品
财联社,2026-01-05 21:13:49,松芝股份：液冷储能热管理系统产品已量产并供货宁德时代等客户
财联社,2026-01-05 21:11:43,【财联社早知道】突发！三星、海力士DRAM报价又涨70%，机构称国内DRAM全产业链有望实现加速成长，这家公司作为国内领先的独立DRAM内存芯片封测企业，具备精湛的多层堆叠封装工艺能力
财联社,2026-01-05 21:11:23,马杜罗进入纽约南区法院
财联社,2026-01-05 21:11:05,飞荣达：公司与优必选在人工智能领域有相关合作
财联社,2026-01-05 21:09:01,Strategy披露增持1287枚比特币 并将其美元储备增加6200万美元
财联社,2026-01-05 21:03:58,罗布斯塔咖啡价格下跌 越南出口激增提振供应前景
财联社,2026-01-05 20:57:25,本田中国回应“工厂推迟两周复工”：广汽本田1月生产节奏调整 不会影响产品交付
财联社,2026-01-05 20:56:21,上交所对天普股份及有关责任人予以监管警示
财联社,2026-01-05 20:51:34,美方公开马杜罗押送车辆行驶画面：车门敞开，士兵持枪，任人拍摄
财联社,2026-01-05 20:50:27,胜通能源：七腾机器人已将要约收购保证金1.12亿元存入指定账户
财联社,2026-01-05 20:49:34,高盛调整对兖矿能源、中煤能源等公司评级
财联社,2026-01-05 20:49:31,鹏辉能源：拟发行H股股票并在香港联交所主板上市
财联社,2026-01-05 20:46:47,冠石科技：28nm产线的相关设备于近日已全部到位
同花顺,2026-01-05 20:46:22,CFTC：截至12月30日当周 COMEX黄金投机者将净多头头寸减少10668手
财联社,2026-01-05 20:44:23,澜起科技通过港交所上市聆讯
财联社,2026-01-05 20:43:00,汉朔科技：与伍尔沃斯签订销售意向协议 公司智能购物车系统将实现批量出货
财联社,2026-01-05 20:38:05,胜通能源：相关核查工作已完成 股票复牌
财联社,2026-01-05 20:34:48,分析师警告：AI驱动的通胀是2026年最被忽视的风险
财联社,2026-01-05 20:34:39,证监会：进一步增强行政、刑事、民事协同 对财务造假和第三方配合造假一体打击
财联社,2026-01-05 20:34:03,ST葫芦娃：获得盐酸左沙丁胺醇雾化吸入溶液药品注册证书
同花顺,2026-01-05 20:28:03,多国在安理会声援委内瑞拉 谴责美国对委军事行动
财联社,2026-01-05 20:21:07,【风口研报·公司】横跨光伏+半导体+显示三大应用领域，公司刚刚赢得业内首条钙钛矿电池整线订单，且半导体新签订单远超2024年，有望打开新一轮增长周期；另有公司客户包括GE、东方电气等能源装备制造商
财联社,2026-01-05 20:19:38,加大供给 中证指数公司2025年发布超360只指数
财联社,2026-01-05 20:19:05,700亿元重点项目集中签约 上海浦东十大硬核产业集群目标出炉
财联社,2026-01-05 20:15:58,初创公司入局浏览器领域挑战谷歌 互联网入口之争全面升级
财联社,2026-01-05 20:15:30,郑州中原保时捷中心闭店续：被指授权协议已终止 部分车主因缺手续无法上牌
财联社,2026-01-05 20:15:06,欧普康视：取得《药品生产许可证》
财联社,2026-01-05 20:12:25,BMI维持铜价看涨预期 预计今年均价1.1万美元
财联社,2026-01-05 20:04:45,陕国投Ａ：拟参与长安银行增资 增资金额不超过8亿元
财联社,2026-01-05 20:03:47,福建电源装机容量突破1亿千瓦
财联社,2026-01-05 19:58:22,美国副总统万斯住所遭袭击 警方逮捕一人
财联社,2026-01-05 19:57:29,1月5日周一《新闻联播》要闻20条
财联社,2026-01-05 19:56:49,商米科技港股IPO及境内未上市股份“全流通”获中国证监会备案
财联社,2026-01-05 19:55:09,中上协：2025年上市公司平均市净率从年初3.3增长至4.4 市场整体估值稳步抬升
财联社,2026-01-05 19:54:08,多家A股车企公告披露2025年新能源汽车销量战报 比亚迪全年累计销量超460万辆 北汽蓝谷12月同比增长115%
财联社,2026-01-05 19:53:50,石头科技港股IPO获中国证监会备案
同花顺,2026-01-05 19:51:10,美国计划拦截一艘载有委内瑞拉石油的油轮
财联社,2026-01-05 19:50:38,德适生物港股IPO获中国证监会备案
财联社,2026-01-05 19:49:47,*ST东易：重整投资人受让转增股份支付14.12亿元 公司实际控制人拟变更
财联社,2026-01-05 19:48:09,驭势科技港股IPO获中国证监会备案
财联社,2026-01-05 19:44:30,海致科技港股IPO获中国证监会备案
财联社,2026-01-05 19:41:20,熵基科技：脑机合资公司仍在筹备工商注册阶段 脑机原型机按计划正常推进
财联社,2026-01-05 19:37:49,【机构调研】这家公司聚焦非侵入式康复全场景布局，脑机接口项目已进入500多家医疗机构
财联社,2026-01-05 19:36:38,豪鹏科技：拟定增募资不超8亿元
财联社,2026-01-05 19:36:32,广生堂：创新药子公司参与新发突发与重大传染病防控国家科技重大专项
财联社,2026-01-05 19:36:01,天赐材料：拟对龙山北基地年产15万吨液体六氟磷酸锂产线进行停产检修
财联社,2026-01-05 19:34:41,天赐材料：拟下调电解液改扩建项目产能至25万吨
财联社,2026-01-05 19:33:53,李强在广东调研时强调 厚植创新发展优势 勇立改革开放潮头 只争朝夕做好“十五五”开局之年工作
财联社,2026-01-05 19:33:32,《疯狂动物城2》成中国影史进口片票房冠军
财联社,2026-01-05 19:31:39,【电报解读】打响2026存储涨价第一枪！三星、海力士DRAM报价再涨70%，机构称海外原厂退出DDR4+AI需求提振下，DRAM市场景气将持续攀升，这家公司在DRAM等存储芯片的设计环节拥有核心技术
财联社,2026-01-05 19:29:33,飞沃科技：近日完成收购液体火箭发动机零部件公司新杉宇航60%的股权事项
财联社,2026-01-05 19:25:39,瑞士政府冻结马杜罗及其亲信在瑞士的资产
财联社,2026-01-05 19:25:39,瑞士冻结马杜罗在瑞资产
财联社,2026-01-05 19:25:04,万泽股份：控股股东万泽集团计划减持不超1.66%股份
财联社,2026-01-05 19:21:43,习近平同韩国总统李在明举行会谈
财联社,2026-01-05 19:18:54,再升科技：控股股东终止协议转让部分股份事项
财联社,2026-01-05 19:17:24,蓝箭航天IPO被抽中现场检查
财联社,2026-01-05 19:16:55,杰瑞股份：拟与关联方投资设立控股子公司 拓展小型模块化反应堆SMR业务
财联社,2026-01-05 19:14:29,TrendForce：2026年Q1各类存储器产品价格全面持续上涨
同花顺,2026-01-05 19:09:52,罗德里格斯就任委内瑞拉代总统
财联社,2026-01-05 19:09:10,威高血净：拟收购威高普瑞100%股权 交易价格为85.11亿元
财联社,2026-01-05 19:04:10,仟源医药：子公司获得药品注册证书及化学原料药上市申请批准通知书
财联社,2026-01-05 19:03:39,特斯拉上海超级工厂2025年贡献特斯拉全球超一半交付量
财联社,2026-01-05 19:02:03,ST新亚：申请撤销其他风险警示
财联社,2026-01-05 18:58:47,兴民智通：与青岛地铁集团签署战略合作协议 在无人机物流场景运营等方面展开合作
财联社,2026-01-05 18:53:24,浙矿股份：拟收购Alaigyr公司100%股权 标的公司拥有哈萨克斯坦卡拉干达州的铅银矿
财联社,2026-01-05 18:53:01,自然资源部：加强海洋开发利用保护
财联社,2026-01-05 18:52:33,联发科计划向人工智能芯片倾斜更多资源
财联社,2026-01-05 18:48:53,腾亚精工：控股股东拟以14.47元/股协议转让5.7%公司股份
财联社,2026-01-05 18:47:40,海南自由贸易港建设投资基金注册资本增至200亿元
财联社,2026-01-05 18:47:08,宜安科技：控股公司与福建福耀科技大学签署产学研战略合作协议
财联社,2026-01-05 18:45:32,荃银高科：52个杂交水稻新品种和5个杂交玉米新品种通过国家审定
财联社,2026-01-05 18:44:51,巨星科技：2025年净利同比预增5.00%-20.00%
财联社,2026-01-05 18:44:41,中天火箭：公司炭/炭热场材料业务受光伏行业竞争加剧影响出现亏损 对合并报表影响较大
财联社,2026-01-05 18:43:20,莱绅通灵：股东拓牌兴丰拟减持不超1.00%股份
财联社,2026-01-05 18:42:57,富特科技：湖北长江蔚来新能源产业发展基金合伙企业（有限合伙）减持股份至9.9999%
财联社,2026-01-05 18:42:48,立中集团：2025年净利同比预增17%-23%
财联社,2026-01-05 18:42:48,立中集团：2025年净利同比预增17%-23% 六氟磷酸锂业务实现扭亏为盈
财联社,2026-01-05 18:42:42,荃银高科：中种集团要约收购期限届满 股票停牌
财联社,2026-01-05 18:39:01,贵州轮胎：拟在摩洛哥投资建设年产600万条半钢子午线轮胎智能制造项目
财联社,2026-01-05 18:38:00,卡塔尔国民银行获批收购土耳其金融科技公司Oduyo
财联社,2026-01-05 18:37:16,独家｜广汽集团与华为终端签署全面合作框架协议
财联社,2026-01-05 18:36:46,合富中国：累计减持1%公司股份 控股股东提前终止减持计划
财联社,2026-01-05 18:35:57,贵州：到2027年全省培育打造10个具有较高知名度和影响力的县域旅居目的地
财联社,2026-01-05 18:35:20,【机构龙虎榜解读】脑机接口+功率半导体+人形机器人，第五代超级结MOSFET技术研发进展顺利，已小批量交付，中低压SGT器件已批量用于人形机器人关节电机控制并实现出货，这家公司获净买入超1亿
财联社,2026-01-05 18:33:21,盛洋科技：子公司FTA与全球头部卫星运营商的南美项目目前正按合同实施推进
财联社,2026-01-05 18:33:07,委内瑞拉成立马杜罗释放事宜委员会
财联社,2026-01-05 18:32:02,一拖股份：因股份转让协议先决条件无法成就 终止股权置换及相关协议
财联社,2026-01-05 18:31:30,侨银股份：中标约12.25亿元城乡环卫一体化项目特许经营项目
同花顺,2026-01-05 18:31:22,沪银主力合约夜盘收涨3.17%
同花顺,2026-01-05 18:31:03,中国代表：强烈谴责美方对委内瑞拉的单边、非法、霸凌行径
财联社,2026-01-05 18:29:45,第19届亚洲金融论坛将于1月26日在香港举行 首设“全球产业峰会”
财联社,2026-01-05 18:26:09,登云股份：涉嫌非法吸收公众存款罪 实控人杨涛被批准逮捕
财联社,2026-01-05 18:25:09,深赛格：出售华控赛格股票资产事项实施完毕
财联社,2026-01-05 18:23:51,航亚科技：股东拟合计减持不超2.76%股份
财联社,2026-01-05 18:22:48,和林微纳：拟投资不超过7.61亿元购买土地使用权并建设新项目
财联社,2026-01-05 18:22:40,东方锆业：投资3亿元建设年产1万吨新能源电池级高纯复合氧化锆项目
财联社,2026-01-05 18:22:33,能科科技：截至目前 公司累计服务航空航天客户200余家且订单金额超10亿元
财联社,2026-01-05 18:21:56,习近平同韩国总统李在明共同出席合作文件签字仪式
财联社,2026-01-05 18:19:17,招商轮船：签署17.9亿元动力定位穿梭油轮船舶订造协议
财联社,2026-01-05 18:16:35,大连重工：2025年净利同比预增11.97%-23.92%
财联社,2026-01-05 18:16:35,国务院国资委：聚焦生物育种、农机装备、农药化肥、粮食增产等领域 加强农业关键核心技术攻关和科技成果高效转化应用
财联社,2026-01-05 18:15:22,苏试试验：拟投资3亿元建设高端空间环境模拟试验设备研制与综合试验检测公共服务平台项目
财联社,2026-01-05 18:12:33,中材科技：2025年净利同比预增74%-119% 风电叶片产品销量同比增长
财联社,2026-01-05 18:11:00,鼎泰高科：预计2025年净利润4.1亿元-4.6亿元 同比增长81%-103%
财联社,2026-01-05 18:10:58,韩正会见加拿大前总理克雷蒂安
财联社,2026-01-05 18:07:33,德国外长：美国必须就其对委军事行动提供法律依据
财联社,2026-01-05 18:07:03,信科移动：国开制造业基金及一致行动人拟减持不超1%股份
财联社,2026-01-05 18:06:25,微芯生物：西格列他钠二甲双胍缓释片临床试验申请获受理
财联社,2026-01-05 18:06:05,墨西哥对华亚克力板启动反倾销调查
财联社,2026-01-05 18:05:29,墨西哥对涉华热轧钢板启动反倾销日落复审调查
财联社,2026-01-05 18:04:45,中红医疗：子公司参与集中带量采购项目拟中选
财联社,2026-01-05 18:00:38,日本央行行长：加息周期远未结束
财联社,2026-01-05 17:59:35,尚纬股份：股东李广元拟减持不超1%股份
财联社,2026-01-05 17:57:23,金风科技：子公司持有蓝箭航天4.1412%股份
同花顺,2026-01-05 17:54:45,俄罗斯代表：国际社会不应允许美国自诩为“最高法官”
财联社,2026-01-05 17:52:34,乌拉圭总统：反对任何形式的外来干涉
财联社,2026-01-05 17:50:03,周生生定价黄金饰品涨价 涨幅范围在200元至1500元之间
财联社,2026-01-05 17:49:39,先锋精科：股东优立佳合伙拟减持不超3.00%股份
财联社,2026-01-05 17:49:20,长高电新：已减持富特科技346.5万股 预计增加净利润8000多万元
财联社,2026-01-05 17:46:17,2025年赛力斯新能源汽车销量超47万辆 12月销量首次破6万
财联社,2026-01-05 17:45:49,亿帆医药：控股子公司1类新药F-652新增适应症移植物抗宿主病获得临床试验批准 国内外未有相同靶点产品获批上市
同花顺,2026-01-05 17:44:30,美国法官要求马杜罗3月17日再次出庭
财联社,2026-01-05 17:44:00,广西广电：证券简称变更为北投科技
财联社,2026-01-05 17:41:27,南向资金今日净买入超187亿港元 创近两个半月来单日流入新高
财联社,2026-01-05 17:41:00,亿帆医药：与尚德药缘签订独家协议
财联社,2026-01-05 17:39:13,苏大维格：与上海语荻光电签署战略合作框架协议
财联社,2026-01-05 17:37:58,鼎通科技：公司224G液冷散热器性能已得到客户认证 预计二季度增加一条液冷板产线
财联社,2026-01-05 17:36:48,知情人士：美的空调阶梯涨价系误读 全线产品价格体系并无变化
财联社,2026-01-05 17:34:25,三峡新材：拟0元收购临港新材料40%股权
同花顺,2026-01-05 17:33:44,“冷资源”破圈生长 万亿赛道迸发消费新动能
财联社,2026-01-05 17:32:55,景津装备：拟投资5.81亿元建设过滤成套装备产业化三期项目
财联社,2026-01-05 17:32:14,跨省转学办理效率提升约40% 全国中小学生学籍信息管理系统升级上线
财联社,2026-01-05 17:30:33,赛力斯：12月新能源汽车销量同比增长63.4% 2025年累计销量同比增长10.63%
财联社,2026-01-05 17:24:09,财政部拟发行2026年记账式贴现（二期）国债 招标面值总额300亿元
