来源,时间,标题
同花顺,2025-12-01 12:18:54.000,华润医药：拟发行30亿元中期票据
同花顺,2025-12-01 12:18:32.000,飞马国际：副总经理姚旭辞职
同花顺,2025-12-01 12:16:55.000,空客欧股跌超10%，市值或将蒸发逾180亿美元
同花顺,2025-12-01 12:14:22.000,中公教育：股东王振东拟减持不超2%股份
同花顺,2025-12-01 12:14:09.000,南极电商：拟以不超过5000万元认购宁波黑蚁四号股权投资合伙企业份额
财联社,2025-12-01 12:12:35.000,林清轩回应招股书失效：上市正在流程中 已获证监会备案通知书
同花顺,2025-12-01 12:10:49.000,*ST苏吴：收到股票终止上市决定 预计最后交易日期为12月29日
同花顺,2025-12-01 12:09:56.000,欣天科技：拟定增募资不超过2.91亿元，用于华南精密制造基地等项目
同花顺,2025-12-01 12:09:15.000,辰安科技：筹划向特定对象发行股票暨控制权变更继续停牌
同花顺,2025-12-01 12:09:02.000,华图山鼎：全资子公司拟购买房产交易总金额为1.3亿元（含税）
同花顺,2025-12-01 12:08:55.000,凯旺科技：拟设立控股子公司稳凯科技（东莞）有限公司
财联社,2025-12-01 12:08:46.000,财联社12月1日午间新闻精选
同花顺,2025-12-01 12:08:42.000,上海二手房市场现“翘尾行情”
同花顺,2025-12-01 12:03:52.000,诺德股份：孙公司参与投资设立产业基金
同花顺,2025-12-01 12:03:36.000,佰维存储：拟择机出售不超过374.47万股联芸科技股票
同花顺,2025-12-01 12:03:28.000,佰维存储：回购资金总额调整为不低于人民币8000万元（含），不超过人民币1.5亿元（含）
同花顺,2025-12-01 12:03:00.000,市场监管总局对为无证食品生产提供便利条件行为加大打击力度
财联社,2025-12-01 12:01:30.000,安妮股份：公司筹划控制权变更事项 股票停牌
同花顺,2025-12-01 12:01:21.000,佳禾智能：控股股东文富投资已减持333.8万股
同花顺,2025-12-01 12:01:09.000,中金辐照：拟定增募资不超过8亿元
同花顺,2025-12-01 12:00:25.000,鼎泰高科：向香港联交所递交H股发行上市申请
财联社,2025-12-01 12:00:21.000,港股午评：恒生指数涨0.81% 恒生科技指数涨0.99%
同花顺,2025-12-01 11:58:07.000,唐人神：大生行饲料完成减持0.6981%公司股份
同花顺,2025-12-01 11:57:57.000,京粮控股：股东王岳成拟减持不超过0.69%股份
同花顺,2025-12-01 11:56:53.000,20分钟“空中直达” 江苏太仓—浦东首条常态化低空航线开通
同花顺,2025-12-01 11:55:55.000,中粮科技：拟投资8.8亿元建设平凉25万吨/年淀粉糖及1万吨/年阿洛酮糖新建项目
同花顺,2025-12-01 11:55:48.000,星网锐捷：拟以8000万元出资设立产业基金
同花顺,2025-12-01 11:53:35.000,12月1日 周一《新闻联播》要闻12条
财联社,2025-12-01 11:51:03.000,12月1日午间涨停分析
财联社,2025-12-01 11:48:41.000,蚂蚁集团旗下云抒企业管理公司增资至39.4亿 增幅约9%
财联社,2025-12-01 11:46:06.000,中国疾控中心研究员彭质斌：当前仍建议还未接种流感疫苗的适宜人群尽快接种
财联社,2025-12-01 11:45:13.000,【电报解读】中兴通讯封涨停成交量超130亿，搭载豆包的努比亚M153少量发售，快速整理豆包手机相关上市公司（附表）
同花顺,2025-12-01 11:44:47.000,北化股份：拟每10股派发现金红利0.25元
同花顺,2025-12-01 11:44:39.000,岳阳兴长：股东长炼兴长拟减持不超过0.60%股份
财联社,2025-12-01 11:42:29.000,中国疾病预防控制中心：当前我国已进入呼吸道传染病高发季节 疫情总体呈上升趋势
财联社,2025-12-01 11:37:06.000,苏州市重大产业发展私募投资基金成立
同花顺,2025-12-01 11:36:44.000,威奥股份：股东锐泽投资持股比例降至7.59%
同花顺,2025-12-01 11:36:34.000,白云山：拟将节余募集资金4.19亿元永久补充流动资金
同花顺,2025-12-01 11:34:32.000,京东互联网医院上线儿童流感问诊专区
财联社,2025-12-01 11:33:31.000,深圳地铁集团法定代表人变更 黄力平接替辛杰
财联社,2025-12-01 11:31:30.000,午评：深成指、创业板指均涨近1%  消费电子板块爆发
财联社,2025-12-01 11:30:33.000,瑞银证券：2026年全部A股盈利增速有望升至8%
同花顺,2025-12-01 11:28:40.000,汇通控股：拟与芜湖经济技术开发区管理委员会签署《项目投资协议》
同花顺,2025-12-01 11:28:35.000,滴滴自动驾驶在广州试运行全天候、全无人Robotaxi服务
同花顺,2025-12-01 11:26:52.000,兴证全球基金旗下首只ETF结束募集
财联社,2025-12-01 11:25:13.000,深成指涨逾1% AI端侧领涨市场
同花顺,2025-12-01 11:24:26.000,长城汽车：11月销量13.32万台，同比增4.57%
同花顺,2025-12-01 11:24:17.000,赛力斯：11月新能源汽车销量55203辆，同比增幅为49.84%
同花顺,2025-12-01 11:19:35.000,华海诚科：完成回购0.70%公司股份
同花顺,2025-12-01 11:19:34.000,渤西油气处理厂今年向天津供应天然气超4亿立方米
同花顺,2025-12-01 11:17:35.000,珠海中富：全资子公司拟购买资产，预计交易总价约为人民币3279万元
同花顺,2025-12-01 11:17:28.000,世卫组织：国际援助减少影响全球艾滋病防控
财联社,2025-12-01 11:15:53.000,我国首次出口泰国的整套铁路大型养路施工车组在昆明下线验收
财联社,2025-12-01 11:15:07.000,我国推动ISO立项首个工业废水毒性削减国际标准
同花顺,2025-12-01 11:11:31.000,龚正会见智利卢克希奇集团董事会顾问，期待更好助力上海智利友好合作
同花顺,2025-12-01 11:11:06.000,城建设计：捐赠300万港元以驰援香港大埔灾后救援
同花顺,2025-12-01 11:10:18.000,速腾聚创诉灵明光子“侵害技术秘密” 后者回应称未收到相关函件
同花顺,2025-12-01 11:05:12.000,源飞宠物：股东平阳晟飞持股比例下降至5%
财联社,2025-12-01 11:04:50.000,商务部：鄢东副部长会见韩国驻华大使卢载宪
同花顺,2025-12-01 11:04:39.000,热景生物：公司与关联方拟共同投资尧景基因 公司出资2400万元
财联社,2025-12-01 11:03:33.000,机构：11月深圳一二手房网签总量7116套 环比涨3.9%、同比降57.3%
同花顺,2025-12-01 11:02:03.000,永泰能源：拟以3亿元-5亿元回购公司股份
同花顺,2025-12-01 11:01:08.000,国家药监局注销4家企业共9个医疗器械注册证书
财联社,2025-12-01 11:00:30.000,FF：在必要融资到位等条件下 未来五年产销目标40万-50万台
财联社,2025-12-01 10:59:39.000,中兴通讯封涨停 成交金额超131亿元
同花顺,2025-12-01 10:58:58.000,广东鼎泰高科技术股份有限公司向港交所提交上市申请书
同花顺,2025-12-01 10:58:27.000,比亚迪：11月新能源汽车产量47.42万辆，销量48.02万辆
财联社,2025-12-01 10:57:17.000,主力资金监控：中兴通讯净买入超23亿
同花顺,2025-12-01 10:56:57.000,广东鼎泰高科向港交所提交上市申请书
财联社,2025-12-01 10:52:53.000,广州：11月二手住宅网签套数突破9000宗 环比增长逾20%
财联社,2025-12-01 10:52:19.000,工信部：1-10月份规模以上互联网企业实现利润总额1237亿元 同比下降10.9%
财联社,2025-12-01 10:50:41.000,【风口研报·公司】这家公司为国内领先的体育运营赛事IP运营商，受益政策支持+高尔夫赛事运营成第二成长曲线，赛事影响力提升及商业化落地有望带来可观收益
财联社,2025-12-01 10:49:50.000,上海闵行金融投资发展公司增资至50亿 增幅400%
同花顺,2025-12-01 10:48:45.000,宁德时代：参与投资博裕新智新产（宁波）股权投资合伙企业（有限合伙）
财联社,2025-12-01 10:46:51.000,北京已进入流感高峰期 流行株为甲型H3N2
财联社,2025-12-01 10:46:43.000,中国聚变能源公司：与同方股份探讨“人工智能赋能聚变研发”等议题
财联社,2025-12-01 10:44:50.000,沪深两市成交额突破1万亿 较上一日此时放量超2100亿
财联社,2025-12-01 10:44:33.000,内存芯片价格快速上涨 业内预计手机产品将迎涨价潮
同花顺,2025-12-01 10:43:14.000,纽威股份：股东席超拟减持不超过1%
同花顺,2025-12-01 10:34:12.000,电影《疯狂动物城2》上映6天票房破20亿
同花顺,2025-12-01 10:34:05.000,沃尔德：多名股东拟减持股份
同花顺,2025-12-01 10:32:58.000,卧龙新能：拟对外投资8.04亿元建设储能电站
同花顺,2025-12-01 10:31:08.000,德众汽车：成立全资孙公司凯里宝利
财联社,2025-12-01 10:30:36.000,【盘中宝】这类战略性关键金属下游需求多点开花，行业供需格局改善或支撑价格高位运行，这家公司相关资源储量和生产能力均居行业前列
财联社,2025-12-01 10:30:08.000,上海智算领航私募基金登记成立 出资额50.4亿
同花顺,2025-12-01 10:29:47.000,瑞松科技：中标3.31亿元项目
财联社,2025-12-01 10:24:23.000,银行板块震荡走强 张家港行涨超5%
财新网,2025-12-01 10:23:21.683,半导体和汽车业比较争气，韩国出口额保持了增长
财新网,2025-12-01 10:23:21.683,韩国11月出口额保持增长
同花顺,2025-12-01 10:20:13.000,雄帝科技：高晶、郑嵩合计持股比例减少至35.00%
同花顺,2025-12-01 10:20:08.000,探路者：拟以3.21亿元收购贝特莱51%股权
同花顺,2025-12-01 10:20:01.000,新铝时代：年产10万吨车用铝板带项目获备案证
财联社,2025-12-01 10:19:47.000,消费电子板块持续拉升 贝隆精密等多股涨停
同花顺,2025-12-01 10:19:40.000,龙高股份与吉安金晟矿业签署项目合作协议
同花顺,2025-12-01 10:19:30.000,携程集团与柬埔寨国家旅游局签约营销合作
财联社,2025-12-01 10:18:29.000,豆包手机助手发布技术预览版 可在工程样机nubia M153上体验
同花顺,2025-12-01 10:17:09.000,上海电信与阿里云签署战略合作协议
同花顺,2025-12-01 10:16:24.000,中国生物制药：TRD208「非阿片类多靶点多模式镇痛」完成I期临床试验首例患者入组
财联社,2025-12-01 10:15:41.000,11月百城新建住宅均价为17036元/平方米 环比上涨0.37%同比上涨2.68%
同花顺,2025-12-01 10:15:12.000,中国社会福利基金会向五家香港慈善组织捐款7500万元
同花顺,2025-12-01 10:14:25.000,特锐德：公司预中标铁路项目 总金额约9487.92万元
同花顺,2025-12-01 10:14:09.000,海力风电：公司为全资子公司海力海上温州履行合同提供担保
财联社,2025-12-01 10:14:04.000,辽宁“十五五”规划建议：举全省之力发展人工智能核心产业 加快工业软件创新突破
财联社,2025-12-01 10:13:37.000,万科被冻结5.7亿股权
财联社,2025-12-01 10:12:35.000,中信银行成立金融资产投资公司 注册资本100亿
同花顺,2025-12-01 10:12:11.000,清水源：一审判决子公司原股东返还股票及现金
同花顺,2025-12-01 10:11:07.000,奥迪威：签订1.17亿元施工总承包合同
同花顺,2025-12-01 10:10:16.000,佩斯科夫：里海管道集团公司设施遭袭系乌无人机所为
同花顺,2025-12-01 10:09:09.000,英国广播公司苏格兰总部发生火灾
财联社,2025-12-01 10:07:26.000,上海：培育一批以专业化为基础、通过创新运营和操作模式扩展服务项目的新型国际货代企业
同花顺,2025-12-01 10:06:05.000,现货黄金站上4260美元/盎司
同花顺,2025-12-01 10:06:04.000,常友科技：核心技术人员万慧荣先生离职
同花顺,2025-12-01 10:05:25.000,欧派家居：拟向全体股东每股派发现金红利1.24元（含税）
同花顺,2025-12-01 10:03:25.000,芯原股份：兴橙投资方和国开基金拟减持1%和0.15%股份
财联社,2025-12-01 10:02:23.000,【异动解析】华为AI玩具开售即秒罄，该类产品有望深度受益AI玩具渗透率增长，这家公司在桌面机器人、AI陪伴领域产品率先落地
同花顺,2025-12-01 10:01:41.000,中电环保：签订1.26亿元陕煤煤化工水处理项目合同
同花顺,2025-12-01 09:59:55.000,我国单机容量最大、效率最高燃机投产
同花顺,2025-12-01 09:58:51.000,国博电子今日大宗交易折价成交118.7万股，成交额7306万元
财联社,2025-12-01 09:56:29.000,金属铜概念表现活跃 江西铜业涨停
财联社,2025-12-01 09:52:12.000,沪深两市成交额突破5000亿 预计全天成交超2万亿
同花顺,2025-12-01 09:51:59.000,苹果正加速推进其首款可折叠iPhone的研发 预计将于2026年秋季正式发布
同花顺,2025-12-01 09:51:41.000,北汽蓝谷：11月新能源汽车产量31935辆，同比增180.57%
同花顺,2025-12-01 09:50:06.000,艾华集团：拟以2035.6万元收购艾华新动力电容(苏州)有限公司100%股权
财联社,2025-12-01 09:46:51.000,铂期货主力合约日内涨幅扩大至5%
同花顺,2025-12-01 09:45:53.000,和达科技：股东上海建元拟减持不超过0.0954%
同花顺,2025-12-01 09:45:09.000,东安动力：11月发动机销量同比增21.83%
财联社,2025-12-01 09:44:29.000,锂矿概念延续强势 天华新能涨超10%
同花顺,2025-12-01 09:44:18.000,梅雁吉祥：全资子公司矿产资源储量备案申请获受理事项尚存在评审结果不确定及审批环节不确定性风险
财联社,2025-12-01 09:43:09.000,智己汽车11月销量环比增长3%
同花顺,2025-12-01 09:42:34.000,金龙汽车：副总裁吴文彬辞任
同花顺,2025-12-01 09:41:14.000,永贵电器：公司控股子公司近期收到1789.9万元中标通知书
同花顺,2025-12-01 09:40:50.000,韩国首尔市长被起诉
同花顺,2025-12-01 09:40:15.000,和誉药业：口服小分子KRAS G12D抑制剂ABSK141的IND申请获FDA批准
同花顺,2025-12-01 09:39:42.000,莱尔科技：对控股子公司增资4000万元
同花顺,2025-12-01 09:37:45.000,福然德：控股股东、实际控制人的一致行动人拟减持不超3%
同花顺,2025-12-01 09:36:19.000,太龙药业：控股股东筹划重大事项停牌
同花顺,2025-12-01 09:34:23.000,ST先河：申请撤销其他风险警示
同花顺,2025-12-01 09:31:36.000,蔚来：11月交付36275辆汽车，同比增长76.3%
同花顺,2025-12-01 09:31:16.000,"小鹏汽车：11月交付智能电动汽车36,728辆"
财联社,2025-12-01 09:30:30.000,赛力斯涨超4% 获调入港股通
同花顺,2025-12-01 09:30:25.000,恒逸石化：恒逸集团与恒逸投资拟增持15亿-25亿元 增持价格区间为不超过10元/股
财联社,2025-12-01 09:30:19.000,影视板块大幅高开 中国电影一字涨停
财联社,2025-12-01 09:28:16.000,三大指数集体高开
同花顺,2025-12-01 09:24:52.000,潮宏基：公司控股子公司终止股权激励暨关联交易
财联社,2025-12-01 09:22:15.000,金饰克价涨到1336元 有品牌金饰价六连涨
财联社,2025-12-01 09:21:05.000,央行公开市场今日净回笼2311亿元
同花顺,2025-12-01 09:20:03.000,阳光乳业：公司无应披露而未披露事项 不存在处于筹划阶段的重大事项
财联社,2025-12-01 09:18:30.000,辽宁“十五五”规划建议：积极拓展低空+作业、低空+治理、低空+物流、低空+旅游等产业应用场景
同花顺,2025-12-01 09:18:10.000,美媒：美移民执法行动将在南部两州逮捕5000人
同花顺,2025-12-01 09:16:48.000,"万胜智能：收到国家电网中标通知书 中标金额约4,298.66万元"
财联社,2025-12-01 09:14:49.000,哈马斯官员称以军阻碍停火协议执行
财联社,2025-12-01 09:13:31.000,工信部：1—10月规模以上电子信息制造业增加值同比增长10.6%
同花顺,2025-12-01 09:12:58.000,莱克电气：拟以2000万元认购基金份额
财联社,2025-12-01 09:12:58.000,辽宁“十五五”规划建议：面向未来制造等发展方向 重点培育具身智能、第六代移动通信等未来产业
财联社,2025-12-01 09:12:30.000,【盘中宝】AI浪潮下该行业渗透率有望快速提升，机构称相关产业链目前处在0-1阶段，未来市场规模或超1000亿，这家企业已切入头部企业供应链，开展相关关键环节业务
同花顺,2025-12-01 09:10:39.000,普冉股份：公司及有关各方正在积极推进购买资产事项 公司股票将继续停牌
财联社,2025-12-01 09:09:44.000,预告
财联社,2025-12-01 09:08:41.000,植田和男：如果经济前景实现 将提高利率
同花顺,2025-12-01 09:08:38.000,香港火灾遇难人数升至151人
财联社,2025-12-01 09:07:43.000,上海市长宁区印发《长宁区房屋协议置换实施办法》
财联社,2025-12-01 09:06:02.000,零跑汽车：11月零跑全系交付再创新高达70327台 同比增长超75%
同花顺,2025-12-01 09:04:53.000,花旗集团对中国平安的多头持仓比例降至6.07%
同花顺,2025-12-01 09:04:43.000,摩根大通（JPMorgan）对小鹏汽车-W的多头持仓比例增至5.33%
同花顺,2025-12-01 09:04:30.000,摩根大通（JPMorgan）对宁德时代的多头持仓比例增至8.09%
同花顺,2025-12-01 09:03:18.000,星云股份：股东江美珠近期累计减持0.50%
财联社,2025-12-01 09:01:57.000,日本北海道附近海域发生4.5级地震
同花顺,2025-12-01 09:01:18.000,美股中概股盘前涨跌互现，小马智行涨3%
同花顺,2025-12-01 09:01:08.000,美股大型科技股盘前普跌，Meta跌1%
同花顺,2025-12-01 08:59:52.000,北京人工智能产投基金等入股人形机器人公司星动纪元
同花顺,2025-12-01 08:58:46.000,连城数控：股东兆恒拟减持不超过2%股份
同花顺,2025-12-01 08:57:36.000,蓝思科技：独立董事谢志明逝世
同花顺,2025-12-01 08:54:52.000,远东股份：子公司中标23.83亿元合同订单
同花顺,2025-12-01 08:54:35.000,三星医疗：奥克斯智能科技预中标1.24亿元项目
同花顺,2025-12-01 08:54:14.000,三星医疗：子公司签订1.6亿元人民币海外合同
同花顺,2025-12-01 08:52:34.000,华润双鹤：控股子公司双鹤天安药业盐酸吡格列酮分散片获得药品补充申请批准通知书
同花顺,2025-12-01 08:48:44.000,英国拟对国际留学生征收6%附加费
同花顺,2025-12-01 08:48:39.000,宁波富达：控股子公司拟公开挂牌出售河口瀛洲水泥有限公司100%股权
同花顺,2025-12-01 08:48:18.000,山子高科：收到甘肃证监局警示函
财联社,2025-12-01 08:47:00.000,两市融资余额增加14.45亿元
同花顺,2025-12-01 08:46:06.000,普洛药业：全资子公司获阿莫西林克拉维酸钾片药品注册证书
同花顺,2025-12-01 08:46:02.000,蓝思科技独供豆包手机关键精密结构件等，已获上亿订单
同花顺,2025-12-01 08:44:34.000,航天软件：公司近期收到政府补助款人民币910万元
同花顺,2025-12-01 08:43:51.000,俄罗斯对华免签，飞猪平台上赴俄机票预订量应声大涨近5倍
同花顺,2025-12-01 08:43:39.000,英可瑞：放弃控股子公司增资扩股优先认购权
同花顺,2025-12-01 08:42:15.000,福光股份：拟将持有的小屯派25%股权转让给福光科技集团，交易价格为6726.36万元
财联社,2025-12-01 08:42:05.000,深交所：安妮股份拟筹划控制权变更事项 今起临时停牌
财联社,2025-12-01 08:39:22.000,中信建投：白酒板块估值处于历史低位 具备较强底部配置价值
同花顺,2025-12-01 08:39:17.000,银河微电：竞得国有建设用地使用权
同花顺,2025-12-01 08:37:46.000,中超控股：公司中标金额13.18亿元
同花顺,2025-12-01 08:37:23.000,广弘控股：子公司与中山市坦洲镇人民政府签订投资框架协议书
财联社,2025-12-01 08:36:36.000,深交所：赛力斯调入港股通标的证券名单 自12月1日起生效
同花顺,2025-12-01 08:36:10.000,吉利汽车：11月汽车销量31.04万辆，同比增长24%
财联社,2025-12-01 08:34:35.000,中信建投12月策略：择机布局 备战跨年行情
同花顺,2025-12-01 08:34:06.000,惠柏新材：公司已收到100万元政府补助
财联社,2025-12-01 08:34:02.000,现货钯金日内涨幅扩大至2%
财联社,2025-12-01 08:32:37.000,贵州“十五五”规划建议：推动数字经济做强做优引领支撑“数智贵州”建设
同花顺,2025-12-01 08:31:47.000,理想汽车：11月交付新车33181辆
同花顺,2025-12-01 08:30:23.000,宝泰隆：收购双鸭山投资公司2.8258%股权
同花顺,2025-12-01 08:30:20.000,中国航材集团董事长任宇会见中国农业发展银行行长张小东
财联社,2025-12-01 08:28:33.000,贵州“十五五”规划建议：推动商品消费扩容升级 稳定汽车、白酒等重点商品消费
同花顺,2025-12-01 08:28:25.000,杰瑞股份今日涨停，多家机构交投活跃
财联社,2025-12-01 08:28:20.000,贵州“十五五”规划建议：优化调整白酒产品结构和营销策略 更好适应市场需求
同花顺,2025-12-01 08:27:54.000,津滨发展：公司全资子公司竞得4.74亿元地块
同花顺,2025-12-01 08:27:14.000,空客：中国民航机队所涉A320系列飞机已采取预防性措施，航班运行平稳正常
同花顺,2025-12-01 08:26:43.000,北京君正今日20cm涨停，2家机构专用席位净买入2.51亿元
同花顺,2025-12-01 08:25:35.000,海辰药业：公司VC项目正在进行投产前准备工作
同花顺,2025-12-01 08:25:10.000,德国总统访问西班牙小镇反思纳粹罪行
同花顺,2025-12-01 08:24:41.000,富奥股份：公开挂牌转让富奥万安股权交割完成
同花顺,2025-12-01 08:24:31.000,中兴通讯今日涨停，国泰海通上海中山东路大额买入
财联社,2025-12-01 08:21:48.000,华泰证券：预计12月锂电产业链景气度持续向好
同花顺,2025-12-01 08:20:30.000,正泰电器：全资子公司拟不超2.01亿元参与设立产业基金
财联社,2025-12-01 08:20:12.000,天风证券：锑冶炼市场或仍有一波探涨机会
财联社,2025-12-01 08:19:32.000,冬季风暴致芝加哥数百架次航班延误或取消
同花顺,2025-12-01 08:19:27.000,软银CEO：抛售英伟达股票是为筹集资金投入OpenAI及新机遇
同花顺,2025-12-01 08:18:52.000,香港宏福苑4栋起火大厦多处区域未达阻燃标准
同花顺,2025-12-01 08:18:41.000,金种子酒：副总经理何武勇辞职
财联社,2025-12-01 08:18:37.000,财联社12月1日早间新闻精选
财联社,2025-12-01 08:17:24.000,中信证券：科技巨头争相布局 太空算力逐渐成为共识
同花顺,2025-12-01 08:16:09.000,信邦智能：发行股份及支付现金购买资产并募集配套资金申请文件获深交所受理
同花顺,2025-12-01 08:16:00.000,粤桂股份：目前无生产电池级高纯度硫磺计划
同花顺,2025-12-01 08:14:09.000,千味央厨：开展股东回馈活动
同花顺,2025-12-01 08:12:51.000,新赛股份：副总经理张成年因工作调整辞职
财联社,2025-12-01 08:12:39.000,日经225指数向下跌破50000点
同花顺,2025-12-01 08:10:27.000,港股收评：恒生指数涨0.67%，恒生科技指数涨0.82%
同花顺,2025-12-01 08:10:00.000,接连有日本歌手演唱会被中断或取消，外交部：建议向中方主办方了解
同花顺,2025-12-01 08:08:57.000,共创草坪：创享投资及王强众合计减持0.42%
财联社,2025-12-01 08:07:40.000,中金：当前时点AI板块拥挤风险相对较低 长期依旧存在机会
同花顺,2025-12-01 08:06:50.000,中文传媒：副总经理陈佳羚因工作调整辞职
同花顺,2025-12-01 08:06:30.000,友发集团：终止向特定对象发行A股股票事项
同花顺,2025-12-01 08:05:33.000,交大思诺：董事长李伟解除留置
财联社,2025-12-01 08:02:19.000,日本福岛县附近海域发生4.2级地震
财联社,2025-12-01 08:01:26.000,日经225指数开盘涨0.09%
同花顺,2025-12-01 07:59:37.000,长华集团：公司收到客户项目定点通知书，预计生命周期总销售额约7.32亿元
财联社,2025-12-01 07:59:28.000,投资日历：周一资本市场大事提醒
同花顺,2025-12-01 07:58:24.000,国家能源集团浙江安吉梅溪2×9H级燃机新建工程1号机组正式并网发电
同花顺,2025-12-01 07:56:40.000,震安科技成立现代电子科技公司，含AI业务
同花顺,2025-12-01 07:53:36.000,顺丰控股10亿元成立顺英控股公司
同花顺,2025-12-01 07:51:10.000,福安药业：子公司庆余堂获头孢托仑匹酯颗粒药品注册证书
同花顺,2025-12-01 07:50:51.000,立中集团：签署《人形机器人零部件委托加工技术协议》
同花顺,2025-12-01 07:48:06.000,本钢板材：预计触发本钢转债转股价格向下修正条件
同花顺,2025-12-01 07:45:03.000,重庆港：拟投资2.99亿元建设江津港现代化多式联运集疏运能力提升项目（二期改扩建工程）
财联社,2025-12-01 07:45:01.000,【点金互动易】锂电材料+EVA，锂电碳酸酯溶剂全产全销，受益于近期EC等溶剂供需偏紧，产品价格快速上涨，这家公司稳居EVA高端阵营
财联社,2025-12-01 07:44:56.000,殷勇会见越南农业与环境部部长
财联社,2025-12-01 07:44:18.000,日本一钢铁厂发生爆炸并引发火灾 大火仍未扑灭
同花顺,2025-12-01 07:44:03.000,华策影视发表声明 公开谴责短剧跟风拍摄
财联社,2025-12-01 07:44:00.000,我国粮食主产区秋冬种基本结束 田管有序展开
财联社,2025-12-01 07:42:18.000,中国通号卡斯柯接连中标三大信号系统集成项目
同花顺,2025-12-01 07:41:08.000,外交部：中方观察团给予吉尔吉斯斯坦提前举行议会选举高度评价
财联社,2025-12-01 07:40:48.000,商业不动产REITs试点启动 高质量扩容可期
同花顺,2025-12-01 07:40:42.000,汉马科技：11月货车产量1947辆、销量2002辆，同比大增
财联社,2025-12-01 07:37:56.000,A股限售股解禁一览：361.87亿元市值限售股今日解禁
同花顺,2025-12-01 07:36:10.000,交易所债券市场收盘，万科债普遍继续下滑
