来源,时间,标题
财联社,2026-03-05 07:39:48,【点金互动易】光模块+PCB，400G/800G高速光模块已送样国内头部客户，一启动PCB生产线投建，这家公司光芯片采用磷化铟材料
财联社,2026-03-05 07:39:09,金正恩访问“崔贤”号驱逐舰
财联社,2026-03-05 07:32:44,A股限售股解禁一览：24.15亿元市值限售股今日解禁
财联社,2026-03-05 07:29:10,银行理财入局IPO打新潮 “固收+打新”策略渐成主流
财联社,2026-03-05 07:26:53,“固收+”基金正成为居民资产配置新宠 个人投资者成申购新晋主力
财联社,2026-03-05 07:25:25,今年以来41家公募管理人斥资8.9亿元自购
财联社,2026-03-05 07:17:23,OpenAI与美军签约 ChatGPT卸载率激增
财联社,2026-03-05 06:54:27,【研选】算电协同的政策推出为AIDC发展筑牢核心支撑，对行业发展形成直接且关键的利好；国内半导体存储解决方案龙头，AI驱动与需求复苏共振，存储进入超级周期
财联社,2026-03-05 06:54:08,两会日程预告丨3月5日：十四届全国人大四次会议上午9时开幕
财联社,2026-03-05 06:34:45,特立尼达和多巴哥总统宣布该国进入紧急状态
财联社,2026-03-05 06:21:51,从拼利率到控成本 部分中小银行调降存款利率
财联社,2026-03-05 06:19:47,私募基金规模连续四个月刷新历史纪录
财联社,2026-03-05 06:18:51,南向资金年内净流入超1600亿元
财联社,2026-03-05 06:16:12,美参议院未能阻止继续对伊朗动武
财联社,2026-03-05 06:14:03,以军称打击黎巴嫩境内数十个真主党目标
财联社,2026-03-05 06:11:47,美联储3月维持利率不变的概率为97.3%
财联社,2026-03-05 06:07:40,离岸人民币兑美元较周二纽约尾盘涨243点
财联社,2026-03-05 06:00:12,周四（3月5日）重点关注财经事件和经济数据
财联社,2026-03-05 06:00:00,周四你需要知道的隔夜全球要闻：白宫向参议院提名凯文·沃什担任美联储主席，西班牙否认同意与美国军事合作，伊朗否认其情报部门联络中情局讨论结束冲突
财联社,2026-03-05 05:19:18,博通第一财季调整后净营收193.1亿美元 公司计划实施至多100亿美元新版股票回购计划
财联社,2026-03-05 05:08:57,普京说考虑主动给欧洲“断气”
财联社,2026-03-05 05:03:53,伊军袭击以国防部大楼与本·古里安国际机场 摧毁7套雷达系统
财联社,2026-03-05 05:01:15,伊朗外长与伊拉克总理通电话 讨论地区局势发展
财联社,2026-03-05 05:00:37,利弗莫尔中概股龙头指数收涨0.22%
财联社,2026-03-05 05:00:23,美股三大指数集体收涨 英特尔涨超5%
财联社,2026-03-05 03:57:54,以军对伊朗德黑兰发动新一轮空袭
财联社,2026-03-05 03:39:12,伊朗军方在冲突中首次使用“哈迪德110”高速无人机
财联社,2026-03-05 03:33:03,西班牙否认同意与美国军事合作
财联社,2026-03-05 03:31:39,国际原油期货结算价几乎平收
财联社,2026-03-05 03:17:32,城堡证券的Rubner不再看空美股预计3月将出现反弹
财联社,2026-03-05 03:12:20,在岸人民币兑美元较周二夜盘收盘涨242点
财联社,2026-03-05 03:01:16,美联储褐皮书：多数地区预计未来几个月经济将呈现小幅至温和增长
财联社,2026-03-05 02:57:41,白宫称美军已打击逾2000个伊朗目标 暂无派遣地面部队计划
财联社,2026-03-05 02:52:00,普京：俄罗斯依然是所有伙伴可靠的能源供应国
财联社,2026-03-05 02:42:53,英媒：英国官员表示未来不排除参与打击伊朗导弹设施
财联社,2026-03-05 02:36:25,英伟达CEO黄仁勋：将投资300亿美元于OpenAI 1000亿美元不在考虑之中
财联社,2026-03-05 02:36:25,英伟达CEO黄仁勋：投资300亿美元于OpenAI 1000亿美元不在考虑之中
财联社,2026-03-05 02:36:25,英伟达CEO黄仁勋：公司近期对OpenAI的300亿美元投资
财联社,2026-03-05 02:35:26,美国阿拉斯加州附近海域发生6.4级地震
财联社,2026-03-05 02:31:21,德防长：德国军队不会参与针对伊朗的战争
财联社,2026-03-05 02:01:46,伊朗总统强调尊重邻国主权
财联社,2026-03-05 01:57:41,伊朗外长与俄罗斯外长通电话 讨论地区冲突
财联社,2026-03-05 01:55:28,伊朗发起第18轮对美以打击
财联社,2026-03-05 01:48:57,伊朗卫生部：目前药品、婴儿奶粉和医疗设备不存在短缺
财联社,2026-03-05 01:25:27,德黑兰市区传出密集爆炸声
财联社,2026-03-05 01:19:31,伊朗击毁6架入侵无人机并对美军基地及以境内目标实施打击
财联社,2026-03-05 00:58:09,美防长：北约拦截伊朗导弹不会触发集体防御条款
财联社,2026-03-05 00:46:27,伊拉克电力部：伊国家电网全境断电
财联社,2026-03-05 00:44:41,普京会见匈牙利外长 双方讨论能源安全等问题
财联社,2026-03-05 00:43:59,英特尔CFO：服务器CPU市场将在2026年显著增长
财联社,2026-03-05 00:39:47,美军部分精确制导武器弹药可能在“数日内”面临短缺
财联社,2026-03-05 00:37:14,欧洲主要股指集体收涨 德国DAX30指数涨1.82%
财联社,2026-03-05 00:25:37,美防长称一周内控制伊朗领空 承认美军击沉伊朗军舰
财联社,2026-03-05 00:08:54,以军称对伊朗德黑兰东部一处军事设施实施大规模空袭
财联社,2026-03-05 00:08:10,俄罗斯3月2日当周CPI周环比上升0.08%
财联社,2026-03-05 00:03:40,美中央司令部：首次实战使用远程精确打击导弹
财联社,2026-03-04 23:59:01,隆基绿能董事长钟宝申：建议参考地产“三道红线” 对不达标的光伏企业实施融资约束
财联社,2026-03-04 23:55:27,伊朗否认其情报部门联络中情局讨论结束冲突
财联社,2026-03-04 23:53:46,美军称已打击或击沉伊朗方面超过20艘舰船
财联社,2026-03-04 23:49:51,伊朗军方称对阿联酋境内目标打击造成至少100美军死亡
财联社,2026-03-04 23:46:59,马士基：暂停接受进出阿联酋、阿曼、伊拉克、科威特、卡塔尔、巴林及沙特的货物订舱
财联社,2026-03-04 23:45:52,斯洛伐克将停止向乌克兰提供应急电力
财联社,2026-03-04 23:40:29,国际原子能机构：伊朗核设施目前无放射性物质泄漏风险
同花顺,2026-03-04 23:38:35,OpenAI下一款AI模型或将具备“极端的”推理能力
财联社,2026-03-04 23:37:23,泰国确认国会下议院选举正式计票结果
财联社,2026-03-04 23:35:13,储油能力迅速耗尽 中东产油国面临减产倒计时
财联社,2026-03-04 23:35:10,拉里贾尼称已有超过500名美国军人丧生
财联社,2026-03-04 23:32:37,欧盟提出《工业加速器法案》拟推动“欧盟制造”
同花顺,2026-03-04 23:32:23,全球最大的白银ETF iShares Silver Trust持仓量较前日减少33.81吨
财联社,2026-03-04 23:31:49,比特币持续拉升 升至7.3万美元上方
财联社,2026-03-04 23:30:30,美国上周EIA原油库存增加348万桶
财联社,2026-03-04 23:25:56,美国服务业以2022年来最快步伐扩张 需求回升推动
同花顺,2026-03-04 23:23:45,开年以来多只基金产品单次派现超10亿元
同花顺,2026-03-04 23:21:35,摩根士丹利将裁员3%
同花顺,2026-03-04 23:21:20,英伟达CEO黄仁勋：300亿投资OpenAI“可能是最后一次”
同花顺,2026-03-04 23:18:48,美国一移民拘留中心暴发麻疹疫情
同花顺,2026-03-04 23:11:43,市场消息：韩国与美国讨论驻韩美军资产向中东调动
财联社,2026-03-04 23:10:48,以军称已在对伊朗的空袭中投下超过5000枚炸弹
财联社,2026-03-04 23:10:34,富时意大利MIB指数涨超2%
同花顺,2026-03-04 23:09:49,通胀担忧重起 美联储降息预期生变
同花顺,2026-03-04 23:07:00,全球最大的黄金ETF SPDR Gold Trust持仓较前日减少18.00吨
财联社,2026-03-04 23:01:43,国内商品期市夜盘多数下跌 低硫燃料油跌3.70%
财联社,2026-03-04 22:49:51,中国国航：利雅得航线航班恢复运行
财联社,2026-03-04 22:49:23,"【电报解读】Seedance2.0生成视频价格公布！机构称Seedance2.0标志着AI视频生成实现了从""技术可行""向""商业可用""的关键跨越，这家公司与红果短剧进行了批量化的合作"
财联社,2026-03-04 22:48:32,国民技术通过港交所上市聆讯
财联社,2026-03-04 22:47:23,霍尔木兹海峡附近货船遭导弹袭击 24名船员获救
财联社,2026-03-04 22:39:05,南非总统呼吁加强非洲能源安全
财联社,2026-03-04 22:35:03,美股加密货币概念股集体大涨 Coinbase涨超11%
财联社,2026-03-04 22:33:15,加密货币持续走高 比特币过去24小时内涨8%
财联社,2026-03-04 22:30:49,美股三大指数集体高开 纳指涨0.5%
财联社,2026-03-04 22:30:48,【金牌纪要库】AI的尽头是电力！AI为电力强度带来指数级增长，算力与电力的深度融合（算电协同）将重塑能源行业的利润分配格局
财联社,2026-03-04 22:26:27,伊拉克埃尔比勒被指设有摩萨德和中情局地区总部
财联社,2026-03-04 22:24:52,美防长称美伊冲突可能持续8周甚至更长
财联社,2026-03-04 22:21:43,王毅同阿联酋副总理兼外长阿卜杜拉通电话
财联社,2026-03-04 22:21:12,王毅同沙特外交大臣费萨尔通电话
财联社,2026-03-04 22:20:27,苏丹宣布该国本轮霍乱疫情结束
财联社,2026-03-04 22:15:55,两会日程预告｜3月5日：十四届全国人大四次会议上午9时开幕
同花顺,2026-03-04 22:14:32,博通CEO：预计Anthropic将在2027（财务）年度带来3 GW算力需求。预计OpenAI将在2027年批量部署芯片。Meta的定制芯片路线图“正在推进之中，进展不错”
财联社,2026-03-04 22:13:25,【公告全知道】智能电网+特高压+军工+海工装备+数据中心！公司具备高性能中压高频变压器自主设计及生产能力
财联社,2026-03-04 22:13:07,由迪拜国际机场飞往广州白云国际机场航班平安落地
财联社,2026-03-04 22:05:01,【风口研报·洞察】欧洲产能或受阻+上游成本支撑+价格处于历史极端底部，这个行业主流厂商相继上调报价，供给高度集中背景下，提价逻辑已得到初步验证；当前A股市场波动的“正负手”
同花顺,2026-03-04 21:58:10,COMEX黄金期货涨0.5%，报5149.2美元/盎司；COMEX白银期货涨0.15%，报83.6美元/盎司
财联社,2026-03-04 21:55:41,俄坚决谴责美以袭击伊朗致中东局势升级的危险行径
财联社,2026-03-04 21:51:31,马克龙声援西班牙以回应美国贸易威胁
财联社,2026-03-04 21:50:58,美防长称美军无法完全拦截所有来自伊朗的无人机
财联社,2026-03-04 21:48:42,湖北27个高速公路建设项目全面复工复产
财联社,2026-03-04 21:48:36,欧盟力挺西班牙表示将充分保护成员国利益
财联社,2026-03-04 21:46:14,财联社3月4日晚间新闻精选
财联社,2026-03-04 21:40:01,美联储米兰：倾向于以25个基点的幅度降息 直至达到中性状态
财联社,2026-03-04 21:36:16,美国驻卡塔尔大使馆敦促本国公民“立即离境”
财联社,2026-03-04 21:36:04,美联储理事米兰：油价传导至核心通胀的证据相当有限
财联社,2026-03-04 21:34:25,伊朗海军船只遇险 斯里兰卡已打捞出部分遗体
财联社,2026-03-04 21:33:00,伊朗退役军人申请出战
财联社,2026-03-04 21:32:50,涉嫌网络诈骗 13名日本人在印尼被捕
财联社,2026-03-04 21:30:51,三星电子Q1 DRAM价格涨幅从70%上调至100%
财联社,2026-03-04 21:26:25,以色列进入黎巴嫩南部城镇希亚姆部署兵力
财联社,2026-03-04 21:25:40,美防长称美以要一周内“完全控制”伊朗天空
财联社,2026-03-04 21:21:47,伊拉克宣布将关闭领空延长72小时
财联社,2026-03-04 21:20:48,【财联社早知道】“6G机器人”亮相，有望在2029商业化落地，人形机器人整机厂加速推进量产节奏，这家公司针对具身智能推出了基于Nvidia Jetson等核心芯片平台的大小脑控制器产品线
财联社,2026-03-04 21:20:43,中控技术：预计2026年1-2月净利润亏损6200万元-7400万元
财联社,2026-03-04 21:16:04,外交部部长助理刘彬会见法国驻华大使白玉堂
财联社,2026-03-04 21:15:15,美国2月ADP就业人数增加6.3万人 高于市场预期
财联社,2026-03-04 21:13:06,土耳其外长致电伊朗外长 就伊朗导弹进入土领空表示抗议
财联社,2026-03-04 21:11:52,土耳其国防部：北约拦截一枚来自伊朗的导弹
财联社,2026-03-04 21:11:03,以伊冲突可能给以色列经济造成每周超29亿美元损失
财联社,2026-03-04 21:09:47,扎哈罗娃：不认为中东局势将影响西方向乌提供武器
财联社,2026-03-04 21:08:36,美股盘前要闻一览：美国15%“全球进口关税”或将本周生效；沙特阿美原油出口改走红海；字节Seedance2.0生成视频价格公布
财联社,2026-03-04 21:05:04,每日互动：将第一时间测评DeepSeek相关新版本并赋能产品
财联社,2026-03-04 21:04:25,广州珠江新城一项目1.87亿元售出一套房源 成交单价达28万元/平
财联社,2026-03-04 21:00:29,伊拉克外长：全球能源市场恐受严重影响
财联社,2026-03-04 20:55:57,江苏出台政府投资基金新政：出资比例最高可至70%
财联社,2026-03-04 20:54:39,刚果（金）东部矿区发生滑坡 数百人被埋
财联社,2026-03-04 20:54:08,高盛：若中东局势快速降级 美联储年内有降息两次的空间
财联社,2026-03-04 20:47:51,5.3秒飙到时速800公里 我国再创短距离磁悬浮加速全球纪录
财联社,2026-03-04 20:43:15,通过“友谊”管道向斯洛伐克供油仍处于暂停状态
财联社,2026-03-04 20:36:33,消息称特斯拉计划就大幅提升AI6芯片产能规模与三星电子磋商
财联社,2026-03-04 20:35:27,【风口研报·行业】20%的LNG供给缺口对全球能源供给冲击大，这个行业需求直接挂钩欧洲电价，当前库存位于低位，有望迎来新一轮爆发；菲律宾3.3GW海风建设计划启动，这家公司受益于亚太市场海风项目放量
财联社,2026-03-04 20:34:54,满100减20 河南新一轮消费券来了
财联社,2026-03-04 20:33:20,旺能环境：投资12.44亿元建设印尼勿加泗垃圾焚烧发电项目
财联社,2026-03-04 20:32:12,东方财富：近期高管程磊减持260万股公司股份 本次减持计划已实施完毕
财联社,2026-03-04 20:27:50,伊朗和黎巴嫩真主党协同攻击以色列中部
财联社,2026-03-04 20:26:34,英国海事贸易组织说一艘集装箱船在霍尔木兹海峡被击中
财联社,2026-03-04 20:26:20,卡塔尔国防部：拦截10架无人机和2枚巡航导弹
财联社,2026-03-04 20:23:12,美国财长贝森特：Anthropic将在几天内退出财政部系统
财联社,2026-03-04 20:21:37,卡塔尔能源公司向受影响买家宣布不可抗力
财联社,2026-03-04 20:14:05,财政部等三部门发布中国国际服务贸易交易会展期内销售的进口展品税收优惠政策
财联社,2026-03-04 20:11:45,我国新型信息基础设施已形成 5G基站总量达全球60%以上
财联社,2026-03-04 20:06:03,【电报解读】英伟达GB300、AMD MI300等新一代AI服务器平台大规模部署催生需求，国巨9个月内第三次上调聚合物钽电容价格，这家业内巨头已于去年末正式发布相关产品的涨价函
财联社,2026-03-04 20:05:36,财政部等三部门发布“十五五”期间中西部地区国际性展会展期内销售的进口展品税收优惠政策
财联社,2026-03-04 20:03:29,3月4日周三《新闻联播》要闻11条
财联社,2026-03-04 20:02:52,双欣环保：拟投资5.42亿元建设年产10万吨电子级DMC配套年产3万吨EMC/DEC项目
财联社,2026-03-04 20:01:17,中国海油：实际控制人已累计增持公司股份4.03亿元
财联社,2026-03-04 19:59:51,阿联酋航空：往返迪拜航班将持续停飞至3月7日
财联社,2026-03-04 19:58:48,以军透露军事行动期间与美军分工合作细节
财联社,2026-03-04 19:52:45,伊朗称又一所学校遭美以袭击
财联社,2026-03-04 19:52:31,LME铝价在ALBA遭遇不可抗力事件后创下自2022年以来的最高记录
财联社,2026-03-04 19:48:51,默茨：不接受没有欧洲参与达成的俄乌协议
财联社,2026-03-04 19:48:43,美以袭击致伊朗1045人死亡
财联社,2026-03-04 19:47:39,加州州长批评美以政府对伊朗发动袭击：“一场非法、危险的战争”
财联社,2026-03-04 19:47:14,瑞银将2026年第一季度布伦特石油价格预测上调至每桶71美元 长期预测保持不变
财联社,2026-03-04 19:44:18,仪表板和后视摄像头显示屏故障 本田在美召回65135辆汽车
财联社,2026-03-04 19:41:36,欧洲天然气价格本周已飙升60% 创三年多来新高
财联社,2026-03-04 19:41:23,机构人士：燃料油期货三连板后继续交易 有利于维持市场流动性
财联社,2026-03-04 19:40:22,【机构调研】这家逆变器供应商户储系统3月底开始正式发货，储能系统成为今年核心战略增量
财联社,2026-03-04 19:38:42,Seedance2.0生成视频价格公布 生成视频一秒1块钱
财联社,2026-03-04 19:34:31,巴方称巴阿冲突已致阿富汗方481人死亡
财联社,2026-03-04 19:30:15,澜起科技：核心技术人员山岗因病逝世
财联社,2026-03-04 19:25:53,联想下发涨价函 部分电脑涨幅超千元
财联社,2026-03-04 19:25:38,沐曦股份：预计一季度净亏损9076万元-1.82亿元 同比亏损收窄
财联社,2026-03-04 19:20:06,德邦股份：上交所受理公司股票主动终止上市申请
同花顺,2026-03-04 19:15:39,据Crane Data，美国货币基金资产管理规模达到8.27万亿美元，创历史新高
财联社,2026-03-04 19:13:45,【机构龙虎榜解读】电网设备+商业航天+光纤光缆，系航天科技集团、航天科工集团和中国电子科技集团的主要合格供应商，耐高温电缆产品用于航天领域，已完成小批量机器人控制电缆相关销售，这家公司获净买入
财联社,2026-03-04 19:11:58,2月中国大宗商品价格指数同比上涨10.9%
财联社,2026-03-04 19:07:57,佩斯科夫：欧盟国家并未向俄提出增加能源供应的请求
财联社,2026-03-04 18:59:42,第十四届全国人民代表大会第四次会议议程
财联社,2026-03-04 18:56:10,英国海事机构：阿联酋富查伊拉附近海域一船只发生爆炸
财联社,2026-03-04 18:56:01,凯盛新材：股东凯盛投资拟减持不超2.49%股份
财联社,2026-03-04 18:54:13,伊朗发射的导弹和无人机共造成阿联酋78人受伤
同花顺,2026-03-04 18:51:07,白宫：五角大楼和能源部正在制定确保霍尔木兹海峡航运安全的计划
同花顺,2026-03-04 18:50:14,白宫：目前地面部队不在对伊朗的行动计划范围内
财联社,2026-03-04 18:49:37,宋平同志逝世
财联社,2026-03-04 18:45:14,汇隆新材：终止筹划公司控制权变更事项 明起复牌
财联社,2026-03-04 18:40:54,中无人机：实控人一致行动人2月13日～3月4日减持675万股
财联社,2026-03-04 18:37:34,十四届全国人大常委会举行第六十四次委员长会议
财联社,2026-03-04 18:36:44,康辰药业：KC1036联合PD-1/PD-L1治疗晚期实体肿瘤获得临床试验通知书
财联社,2026-03-04 18:35:54,欧盟委员会：已准备好采取行动捍卫利益
财联社,2026-03-04 18:35:44,8天6板法尔胜：不涉及“特种光纤”、“光纤传感”等业务 如未来股票价格进一步上涨可能申请停牌核查
财联社,2026-03-04 18:35:01,沙特阿美：出于安全考虑 原油出口改走红海延布港
财联社,2026-03-04 18:34:58,中国公民东京遇滋扰 我驻日本大使馆再次提醒近期避免赴日
财联社,2026-03-04 18:29:52,佳缘科技：公司股东王进计划询价转让3.00%股份
财联社,2026-03-04 18:28:13,4连板亚盛集团：公司未取得相关采矿资质 也未开展矿产相关业务
财联社,2026-03-04 18:26:55,7天5板洲际油气：近期国际原油市场受地缘局势等多重因素影响 短期油价波动存在较大不确定性
财联社,2026-03-04 18:26:12,厦钨新能：预计1-2月营业收入27.02亿元至35.46亿元 同比增长60%至110%
财联社,2026-03-04 18:24:57,4连板水发燃气：目前生产经营情况正常 市场环境、行业政策没有发生重大变化
财联社,2026-03-04 18:19:58,全球部分风险资产反弹：欧美股市涨 比特币拉升 富时A50中国指数期货涨近1%
财联社,2026-03-04 18:17:56,强一股份：1-2月合并营业收入同比增长157.90% 高端MEMS探针卡业务增长迅猛
财联社,2026-03-04 18:17:56,强一股份：1-2月合并营业收入同比增长158% AI算力需求爆发高端MEMS探针卡业务增长迅猛
财联社,2026-03-04 18:10:50,美以空袭德黑兰东北部一处住宅区
财联社,2026-03-04 18:08:14,华宝油气LOF：暂停申购及定期定额投资业务
财联社,2026-03-04 18:06:33,欧盟或将重新讨论俄罗斯天然气进口禁令
财联社,2026-03-04 17:58:44,特斯拉巨鲸廖凯原买入100万股英伟达 将再买100万股以支持紧张的市场
同花顺,2026-03-04 17:56:13,《堡垒之夜》将重返全球 Google Play
同花顺,2026-03-04 17:55:53,LME金属期货收盘普涨
同花顺,2026-03-04 17:55:15,伊朗伊斯兰革命卫队对以色列发动新一轮导弹和无人机袭击
财联社,2026-03-04 17:51:06,纳斯达克100指数期货转涨 盘中一度下跌1%
财联社,2026-03-04 17:46:58,上海电力：江苏滨海南区H5#、东台H7#海上风电项目获得核准
财联社,2026-03-04 17:41:28,南向资金今日净卖出逾4亿港元 阿里巴巴遭卖出超34亿港元
财联社,2026-03-04 17:41:10,以军称对伊朗伊斯法罕和设拉子的军事目标发动空袭
财联社,2026-03-04 17:40:56,伊朗确定最高领袖候选人
财联社,2026-03-04 17:40:16,俄外交部发言人：杀害哈梅内伊等人的行为是卑鄙行径
同花顺,2026-03-04 17:39:51,伊朗开始转向为长期战争做治理准备
财联社,2026-03-04 17:36:57,【风口研报·公司】北美LNG终端建设正在加速，这家公司高端产品有望受益，且其他造船、电力领域订单增长前景强劲；大炼化供需格局有望率先展现弹性的或是这个产业链，公司卡位供需格局更佳的环节
财联社,2026-03-04 17:33:29,花旗经济学家：中国头部AI模型实力比肩美国
财联社,2026-03-04 17:32:34,多家券商试水7×24小时银证转账
同花顺,2026-03-04 17:32:01,惠誉评级称，霍尔木兹海峡关闭很可能是暂时性，对油价的影响有限
同花顺,2026-03-04 17:31:50,伊朗首都德黑兰市区4日晚传出密集爆炸声
财联社,2026-03-04 17:28:53,机构：DDR4和DDR5部分颗粒小幅下跌
财联社,2026-03-04 17:26:54,哈梅内伊高级助理：伊朗无意与美国谈判
财联社,2026-03-04 17:26:54,哈梅内伊高级助理：伊朗无意与美国谈判 战争“想打多久就打多久”
财联社,2026-03-04 17:26:18,美股黄金、白银股盘前普涨
财联社,2026-03-04 17:23:23,中国驻韩大使戴兵会见韩国外交部经济外交调整官 就中方今年主办深圳APEC会议等问题交换意见
同花顺,2026-03-04 17:22:53,特斯拉2月英国电动车新车销量同比下降45.21%至2208辆
财联社,2026-03-04 17:21:43,国巨第三次上调聚合物钽电容价格 4月1日起生效
财联社,2026-03-04 17:20:58,伊朗外交部：全力以赴打赢“存亡之战”
财联社,2026-03-04 17:16:36,加拿大总理称 美国和以色列对伊朗的袭击“不符合国际法”
财联社,2026-03-04 17:15:27,李世石时隔10年再度对决AI
财联社,2026-03-04 17:15:01,加密货币集体上行 比特币涨6%升破7.1万美元
财联社,2026-03-04 17:13:43,首场“代表通道”集中采访活动明早8时举行
财联社,2026-03-04 17:11:36,俄称乌克兰无人艇在地中海袭击俄天然气运输船
财联社,2026-03-04 17:09:16,以色列防长：伊朗任何新的最高领袖都将成“清除目标”
财联社,2026-03-04 17:06:56,卡塔尔外交部称能源设施受损可控
财联社,2026-03-04 17:06:06,欢乐家：股东李兴询价转让初步确定转让价格为17.34元/股
财联社,2026-03-04 17:05:51,美股加密货币概念股盘前普涨
财联社,2026-03-04 17:05:25,原油LOF易方达：将于3月5日开市起至当日10:30停牌
财联社,2026-03-04 17:03:28,国投白银LOF：将于3月5日开市起至当日10:30停牌
同花顺,2026-03-04 17:00:06,白宫表示已向参议院提交凯文·沃什担任美联储主席的提名
财联社,2026-03-04 16:58:04,富时中国A50指数纳入中国船舶、天孚通信、万华化学
财联社,2026-03-04 16:56:34,乘联分会：1月轿车市场成交价13.76万 环比提高3.91%
财联社,2026-03-04 16:53:52,1月全国新增建档立卡新能源发电项目共5690个
财联社,2026-03-04 16:52:31,北京量子院量子接口器件与系统团队在多模量子声学器件研究中取得重要进展
财联社,2026-03-04 16:52:24,以军称在德黑兰上空击落伊朗战机
同花顺,2026-03-04 16:48:03,伊拉克电力部称，全国各省电网已全面瘫痪，事故原因正在调查中
财联社,2026-03-04 16:47:56,用友网络：拟使用不超过21亿元自有资金进行委托理财
财联社,2026-03-04 16:46:09,长江证券：维持比亚迪“买入”评级 盈利能力有望继续提升
财联社,2026-03-04 16:45:57,最新报告预测：2036年全球人形机器人市场规模将达295亿美元
同花顺,2026-03-04 16:43:15,航运和贸易消息人士称，伊拉克基尔库克原油对土耳其杰伊汉港的输送于3月4日恢复，此前曾中断一天
财联社,2026-03-04 16:42:55,十四届全国人大四次会议记者会等集中采访活动安排发布
同花顺,2026-03-04 16:41:29,"福特汽车2月美国销量为149,962辆，同比下降5.5%"
