来源,时间,标题
同花顺,2026-03-03 11:06:47,路维光电：向特定对象发行A股股票申请获受理
同花顺,2026-03-03 11:03:54,欧洲央行管委Stournaras：不应因伊朗局势仓促调整利率
同花顺,2026-03-03 11:01:31,二六三：董事许立东已减持0.011%股份
同花顺,2026-03-03 11:01:13,海油工程：3月2日、3月3日连续两个交易日内收盘价格涨幅偏离值累计达到20%
财联社,2026-03-03 11:00:52,【风口研报·公司】这家公司把握CCL高端材料国产化机遇，产品已可匹配M6-M9等级，当前产能由中试向释放阶段过渡，有望持续享受算力基建红利
财联社,2026-03-03 11:00:32,主力资金监控：电子板块净流出超189亿
同花顺,2026-03-03 11:00:14,海创药业：治疗代谢相关脂肪性肝炎（MASH）药物HP515临床IIa期试验完成全部参与者入组
同花顺,2026-03-03 11:00:08,先锋精科：拟发行可转换公司债券总额不超过7.5亿元
同花顺,2026-03-03 10:59:56,中国海油：短期油价波动存在较大不确定性
同花顺,2026-03-03 10:57:12,荷兰国际：若能源价格居高不下，欧元或将继续承压
财联社,2026-03-03 10:56:06,民调显示近六成美国民众不赞成对伊朗动武
同花顺,2026-03-03 10:55:39,NYMEX汽油主力合约大涨6% LME铝主力合约涨超2%
同花顺,2026-03-03 10:55:36,上期能源调整原油等期货相关合约交易限额
财联社,2026-03-03 10:53:11,工业和信息化部等六部门：推动光伏组件有价组分高效提纯 采用湿法、火法等工艺提升硅料纯度
同花顺,2026-03-03 10:52:12,银河通用25亿元融资 成都国资入局具身智能
同花顺,2026-03-03 10:51:57,香港开始对超级豪宅加税
同花顺,2026-03-03 10:48:51,伊朗开展“真实承诺-4”行动第15轮攻击 称重创美军基地
同花顺,2026-03-03 10:43:47,以军称空袭伊朗总统府等目标
同花顺,2026-03-03 10:43:30,中润光学：无人机镜头主要应用于工业无人机等领域，部分产品尚处于研发或小批量试制阶段
同花顺,2026-03-03 10:43:08,欧洲天然气价格涨幅进一步扩大至40%，报62.5欧元/兆瓦时
同花顺,2026-03-03 10:42:06,海默科技：公司为油气田高端装备与数字化技术服务提供商，国际原油价格后续走势存在不确定性
同花顺,2026-03-03 10:36:35,阿里巴巴美股盘前跌超5%
同花顺,2026-03-03 10:36:09,英特尔美股盘前跌超5%
同花顺,2026-03-03 10:35:53,科兴制药：GB19注射液皮肤型红斑狼疮适应症获临床试验批准
同花顺,2026-03-03 10:32:50,欧洲股指持续下跌
同花顺,2026-03-03 10:32:44,我国为干细胞制定国际“通用语言”
同花顺,2026-03-03 10:31:31,东华能源：LPG价格在短期内出现较强波动
同花顺,2026-03-03 10:31:17,保加利亚首都举行游行 反对美以打击伊朗
同花顺,2026-03-03 10:30:35,永冠新材：拟增加回购股份金额，回购股份价格上限由人民币20.35元/股调整为人民币31.1元/股
同花顺,2026-03-03 10:30:08,中曼石油：国际原油价格短期涨幅较大，未来油价波动存在较大不确定性
同花顺,2026-03-03 10:29:13,招商南油：航运市场受多种因素综合影响，运价走势存在诸多不确定性
同花顺,2026-03-03 10:24:41,特朗普称美英关系“与过去截然不同了”
同花顺,2026-03-03 10:24:19,中国银行：聘任黄学玲女士为本行副行长
同花顺,2026-03-03 10:23:58,交易员们认为欧洲央行今年有50%的概率会提高利率
同花顺,2026-03-03 10:23:28,以军对伊朗和黎巴嫩发起新一轮大规模空袭
同花顺,2026-03-03 10:23:24,东华能源：全资子公司增资3亿元，公司放弃优先认购权
同花顺,2026-03-03 10:23:00,广聚能源：近期中东地缘政治冲突升级，对国际原油市场产生重大影响
同花顺,2026-03-03 10:22:12,洲际油气：公司股价可能存在市场情绪过热，非理性炒作情形
同花顺,2026-03-03 10:21:03,兆易创新：拟出资4亿元认购上海石溪兆易智芯创业投资合伙企业（有限合伙）约25.87%的基金份额
同花顺,2026-03-03 10:19:36,全国人大代表、上海国投公司袁国华：加快构建统一科学数据库 赋能AI4S创新发展
同花顺,2026-03-03 10:19:27,天邑股份：公司为智能家庭网关产品紧急集中采购项目中选候选人之一
同花顺,2026-03-03 10:19:06,珠海冠宇：预计2026年1-2月实现营业收入22.06亿元至23.47亿元，同比增长45%至54%
同花顺,2026-03-03 10:17:38,Applovin美股盘前跌超5%
同花顺,2026-03-03 10:17:35,巴阿边境冲突升级 各方伤亡惨重
同花顺,2026-03-03 10:13:01,韩国电力美股盘前跌超12%
同花顺,2026-03-03 10:11:15,国投白银LOF：基金将于2026年3月3日开市起至当日10:30停牌，自2026年3月3日10:30复牌
同花顺,2026-03-03 10:10:10,贵州茅台：已累计回购股份57.25万股，占公司总股本的比例为0.0457%
同花顺,2026-03-03 10:09:27,西班牙IBEX35指数日内大跌4%，现报17160.12点
同花顺,2026-03-03 10:07:48,Cheniere Energy美股盘前涨超10%
同花顺,2026-03-03 10:06:32,俄外长：美以伊冲突后果已波及整个中东
同花顺,2026-03-03 10:05:48,昂跑美股盘前跌超10%
同花顺,2026-03-03 10:04:38,标普将软银评级展望调至负面，称向OpenAI投资300亿美元或有损信用质量
同花顺,2026-03-03 10:04:27,央行发布2026年1月金融市场运行情况
同花顺,2026-03-03 10:03:57,伊朗多地传出爆炸声 死亡人数升至787人
同花顺,2026-03-03 10:01:50,标普将软银评级展望调至负面 称向OpenAI投资300亿美元或有损信用质量
同花顺,2026-03-03 09:59:49,海正药业：国贸集团拟公开征集转让6.06%股份
同花顺,2026-03-03 09:58:20,伊朗关闭霍尔木兹海峡影响几何？专家分析
同花顺,2026-03-03 09:49:57,我驻卡塔尔使馆提醒在卡中国公民就地安置避险
同花顺,2026-03-03 09:48:14,伊朗外交部发言人：伊方行动是行使合法自卫权
同花顺,2026-03-03 09:47:51,以军称空袭伊朗总统府等“领导层建筑群”
同花顺,2026-03-03 09:47:17,中牧股份：拟以7.27亿元收购圣雪大成51%股权及内蒙古圣雪大成72.7272%股权
同花顺,2026-03-03 09:46:47,新天然气：公司股票连续两个交易日收盘价格涨幅偏离值累计超过20%
同花顺,2026-03-03 09:44:58,孚能科技：上杭兴源减持计划未实施，持股比例保持1.6816%
同花顺,2026-03-03 09:42:32,准油股份：公司股票存在被实施退市风险警示（*ST）的风险
同花顺,2026-03-03 09:41:28,亨通股份：放弃圣雪大成51%股权优先购买权
同花顺,2026-03-03 09:41:22,中国巨石：振石控股集团增持1.2808%
同花顺,2026-03-03 09:37:55,受中东局势影响，欧洲天然气价格大幅上涨
同花顺,2026-03-03 09:36:33,华宝油气LOF：A类单日单个基金账户累计申购金额上限调整为10元
同花顺,2026-03-03 09:34:28,国际原子能机构：伊朗纳坦兹核设施近日遭破坏
同花顺,2026-03-03 09:34:03,南向资金今日净买入60.81亿港元 腾讯控股获净买入居前
同花顺,2026-03-03 09:33:49,宁波方正：兴工控股已减持2.97%股份
同花顺,2026-03-03 09:33:07,联瑞新材：核心技术人员张建平离职
同花顺,2026-03-03 09:32:54,中国外长与多国外长通话 外交部：阐明中方立场 积极劝和阻战
同花顺,2026-03-03 09:31:34,现货黄金白银短线跳水，现货黄金跌1.70%，现货白银跌7%
财联社,2026-03-03 09:30:36,特朗普：没有必要对伊朗采取地面军事行动
财联社,2026-03-03 09:30:23,沪指再度刷新阶段高点
同花顺,2026-03-03 09:30:22,日本有识之士呼吁日本正视历史 避免重蹈战争覆辙
财联社,2026-03-03 09:30:04,港口航运概念延续强势 招商南油2连板
同花顺,2026-03-03 09:29:42,亚盛集团：公司目前尚未取得相关采矿资质，也未开展矿产相关业务
同花顺,2026-03-03 09:28:23,现货黄金失守5230美元/盎司
财联社,2026-03-03 09:27:42,港股AI应用股反弹 MINIMAX涨近10%
同花顺,2026-03-03 09:27:29,现货黄金失守5240美元/盎司
同花顺,2026-03-03 09:27:21,现货黄金失守5250美元/盎司
财联社,2026-03-03 09:26:36,油气板块继续大面积高开 洲际油气等多股封涨停
财联社,2026-03-03 09:26:32,三大指数集体高开
同花顺,2026-03-03 09:26:27,2025年天然气对外依存度40% 处于“十四五”最低水平
同花顺,2026-03-03 09:25:53,现货黄金失守5260美元/盎司
同花顺,2026-03-03 09:24:33,艾力斯：预计2026年第一季度净利润同比增长43.73%
同花顺,2026-03-03 09:24:32,纽约期金失守5300美元/盎司
财联社,2026-03-03 09:23:01,港股油气设备股延续涨势 山东墨龙涨近15%
同花顺,2026-03-03 09:22:43,春运第30天 全社会跨区域人员流动量预计18199.0万人次
同花顺,2026-03-03 09:21:57,以军说正在拦截伊朗导弹
财联社,2026-03-03 09:20:31,央行公开市场今日净回笼4917亿元
同花顺,2026-03-03 09:19:26,ST金鸿：公开招募重整投资人
财联社,2026-03-03 09:19:04,阿富汗首都喀布尔再遭空袭 当地传出爆炸声
财联社,2026-03-03 09:18:50,特朗普称将很快宣布报复措施
财联社,2026-03-03 09:17:44,【盘中宝】下游广泛用于光通信、军事、半导体等领域，该品种是AI细分领域刚需材料，我国储量占全球比重近70%，这家企业产能世界第一
财联社,2026-03-03 09:16:35,2026年全国消费促进月启动
同花顺,2026-03-03 09:16:19,央行：2月中期借贷便利净投放3000亿元
同花顺,2026-03-03 09:15:11,巴比食品：董事李俊、苏爽完成增持428.27万元
财联社,2026-03-03 09:15:00,科兴制药引进产品碳酸司维拉姆片获秘鲁上市批准
财联社,2026-03-03 09:14:24,国家数据局局长刘烈宏：加快建设一批数据领域重点实验室等创新平台 大力推进数据领域关键技术、设备攻关与应用创新
同花顺,2026-03-03 09:08:52,美股油气股盘前延续涨势
同花顺,2026-03-03 09:08:27,美以袭击已致伊朗787人死亡
同花顺,2026-03-03 09:08:15,通化金马：董事长张玉富拟增持1000万至2000万元
同花顺,2026-03-03 09:08:12,林洋能源：累计回购0.54%公司股份，已支付7037.1万元
同花顺,2026-03-03 09:01:37,美股大型科技股盘前普跌，英伟达跌2%
同花顺,2026-03-03 09:01:26,阿斯麦美股盘前跌超4%
同花顺,2026-03-03 09:01:09,美股中概股盘前多数下跌，小鹏汽车跌3%
同花顺,2026-03-03 09:01:03,索尼美股盘前跌超7%
同花顺,2026-03-03 08:58:36,先河环保：董事赵顺因个人原因辞职
同花顺,2026-03-03 08:57:42,艾迪药业：公司获得日本专利证书
同花顺,2026-03-03 08:56:29,比特币跌破67000美元，日内跌2.67%
财联社,2026-03-03 08:51:41,清华团队在手性反铁磁的电学操控上取得新突破
同花顺,2026-03-03 08:51:03,欢乐家：李兴拟通过询价转让2.50%公司股份
同花顺,2026-03-03 08:47:51,当升科技：管理层与骨干股权增持0.22%计划完成
同花顺,2026-03-03 08:47:46,泰祥股份：王世斌一致行动人减持1%
同花顺,2026-03-03 08:47:40,美股恐慌指数VIX上涨18%，最新报25.36点
财联社,2026-03-03 08:47:15,两市融资余额增加45.78亿元
同花顺,2026-03-03 08:43:48,伊朗外长：领袖虽遇难 但伊朗不会倒下
财联社,2026-03-03 08:43:04,【电报解读】英伟达投资40亿美元，美股两大光通信龙头股价均涨超10%，这家公司表示两大龙头均为公司客户
财联社,2026-03-03 08:42:35,华为李鹏：“智能体互联网时代”有望孕育出十万亿美元级产业空间
同花顺,2026-03-03 08:40:54,欧洲主要股指持续下行
同花顺,2026-03-03 08:39:53,去哪儿旅行：“免票效应”拉动多个景区周边酒店预订激增2倍以上
同花顺,2026-03-03 08:39:14,美元指数升破99
同花顺,2026-03-03 08:38:35,香港金管局与澳门金管局签署修订谅解备忘录以进一步加强合作
同花顺,2026-03-03 08:35:38,浩淼科技：多名股东拟减持股份
财联社,2026-03-03 08:34:38,美驻沙特使馆建议美公民就地避难
同花顺,2026-03-03 08:34:29,信科移动：核心技术人员王俊离职
财联社,2026-03-03 08:33:43,美称对伊行动最初24小时内 已有18名美军人员重伤
财联社,2026-03-03 08:31:40,阿联酋称维持着强大的战略弹药储备
同花顺,2026-03-03 08:28:51,澳大利亚学者：美以挑起对伊战事违反国际法
同花顺,2026-03-03 08:28:06,北陆药业：获得碘普罗胺注射液《药品注册证书》
同花顺,2026-03-03 08:27:14,新锦动力今日20cm涨停，有4家机构专用席位净卖出1.08亿元
同花顺,2026-03-03 08:26:32,雷科防务今日跌1.41%，有3家机构专用席位净卖出1.49亿元
财联社,2026-03-03 08:26:21,美驻沙特使馆起火
同花顺,2026-03-03 08:26:14,通源石油今日20cm涨停，4家机构专用席位净买入1.05亿元
同花顺,2026-03-03 08:24:21,首华燃气今日20cm涨停，有3家机构专用席位净卖出2.16亿元
同花顺,2026-03-03 08:23:27,晓程科技今日涨2.73%，有3家机构专用席位净卖出2.53亿元
同花顺,2026-03-03 08:23:09,三菱瓦斯化学CCL等产品4月1日起涨价30%
同花顺,2026-03-03 08:22:49,以军称空袭黎巴嫩 打死一名真主党兵力建设关键人物
财联社,2026-03-03 08:21:06,【九点特供】OpenAI“牵手”五角大楼，且并未禁止将人工智能工具用于完全自主武器系统；卡塔尔能源暂停生产，欧洲天然气价格创2022年3月以来最大涨幅，分析师看好天然气是价格弹性明显的能化品种
同花顺,2026-03-03 08:18:37,安旭生物：股东马华祥已减持0.94%
同花顺,2026-03-03 08:17:00,美国多个城市的民众举行游行集会，抗议美国对伊朗发动军事打击
同花顺,2026-03-03 08:16:04,外交部：如何解决台湾问题是中国人自己的事
同花顺,2026-03-03 08:13:52,数据显示，2月特斯拉在瑞典的新车注册量同比下降9.8%
同花顺,2026-03-03 08:12:00,中国驻巴基斯坦大使姜再冬会见巴基斯坦副总理兼外长达尔
财联社,2026-03-03 08:10:32,银河证券：纸浆价格上涨 看好纸企提价带来业绩弹性
同花顺,2026-03-03 08:10:12,港股收评：恒生指数跌1.12%，恒生科技指数跌2.26%
同花顺,2026-03-03 08:08:57,财政部副部长廖岷与德国财政部国务秘书施万贝格举行视频通话
同花顺,2026-03-03 08:06:49,威贸电子：取得发明专利证书
财联社,2026-03-03 08:06:41,华领医药：多格列艾汀在中国香港特别行政区获批上市
同花顺,2026-03-03 08:05:38,港澳金融管理局签署修订谅解备忘录，以进一步加强合作
同花顺,2026-03-03 08:04:10,荣耀推出智能体基础模型MagicAgent 面向全球开源
同花顺,2026-03-03 08:03:52,大会新闻发言人刘结：春节假期海南离岛免税购物增长明显 中国开放的大门只会越开越大
同花顺,2026-03-03 08:02:50,舍得酒业：副总裁王勇因工作原因辞职
同花顺,2026-03-03 08:01:22,欧洲主要股指开盘集体下跌
财联社,2026-03-03 08:00:54,投资日历：周二资本市场大事提醒
同花顺,2026-03-03 08:00:45,阿曼港口一燃料储罐遭无人机袭击
同花顺,2026-03-03 07:59:09,布伦特原油站上81美元/桶
同花顺,2026-03-03 07:57:50,正元智慧：截至3月2日已减持1%股份
财联社,2026-03-03 07:57:44,以军空袭黎巴嫩真主党媒体大楼
同花顺,2026-03-03 07:57:08,德国国债跌幅扩大，2年期国债收益率上行7个基点至2.16%
同花顺,2026-03-03 07:56:56,中国脱贫攻坚成果经受住了实践和历史检验
同花顺,2026-03-03 07:54:46,智元机器人海外独立站正式上线
同花顺,2026-03-03 07:51:50,全国政协委员李丹：建议“五位一体”推进专业服务业智能化发展
同花顺,2026-03-03 07:50:16,WTI原油突破74美元/桶，日内涨3.92%
财联社,2026-03-03 07:48:44,江西铜业股份：全资子公司收购SolGold plc全部股份方案获批
同花顺,2026-03-03 07:46:56,南共体国家期待加强对华合作推动绿色转型
同花顺,2026-03-03 07:46:10,长源电力：2月发电量同比降低9.78%
财联社,2026-03-03 07:45:37,以色列国防军：局势评估后 已允许民众离开受保护区域
同花顺,2026-03-03 07:44:44,旺能环境：公司中标印尼1500吨/日垃圾焚烧发电项目
财联社,2026-03-03 07:44:32,【点金互动易】固态变压器+AI数据中心，浸式变压器出口美国，合作研发的固态变压器即将完成样机，这家公司直接受益于全球AI算力爆发带来的电力设备紧缺
同花顺,2026-03-03 07:44:20,英镑跌幅扩大，最新报1.3337美元，下跌0.51%
财联社,2026-03-03 07:41:11,以军称正袭击黎真主党指挥中心和武器库
同花顺,2026-03-03 07:40:50,国际原子能机构称未看到伊朗核武器制造计划，外交部回应
同花顺,2026-03-03 07:40:36,布伦特原油期货上涨3美元至每桶80.74美元
同花顺,2026-03-03 07:39:57,NYMEX取暖油主力合约大涨8%
同花顺,2026-03-03 07:38:34,全国政协委员刘永好：建议下调首付比例和贷款利率
同花顺,2026-03-03 07:36:28,伊朗多地传出爆炸声
同花顺,2026-03-03 07:34:20,我驻伊周边国家使领馆派工作组赴口岸接应 协助中国公民撤离
同花顺,2026-03-03 07:33:53,全国政协委员谭岳衡：建议支持香港参与乃至引领全球金融规则制定
同花顺,2026-03-03 07:32:35,挪威推迟对非配额化工业务的天然气、液化石油气气候税
财联社,2026-03-03 07:32:19,A股限售股解禁一览：58.1亿元市值限售股今日解禁
同花顺,2026-03-03 07:30:53,中国经济顶压前行，展现强大韧性和活力
同花顺,2026-03-03 07:30:31,南苏丹北部发生武装袭击至少169人死亡
财联社,2026-03-03 07:30:25,伊朗称纳坦兹核设施遭美以两次袭击
同花顺,2026-03-03 07:30:18,全国政协委员、重庆市政协副主席丁时勇：提高农民收入首先要壮大产业基础
财联社,2026-03-03 07:24:07,苹果商讨由谷歌托管新版Siri
财联社,2026-03-03 07:17:57,春节后公募发行快速回暖 本周43只“新基”将亮相
同花顺,2026-03-03 07:16:00,俄央行要求欧盟法院宣告欧盟理事会冻结俄资产条例无效
财联社,2026-03-03 07:14:33,阿布扎比再遭袭击 阿联酋发布全国紧急警报
财联社,2026-03-03 07:12:07,韩国将密切关注市场动态 必要时将采取措施
财联社,2026-03-03 07:10:55,卡塔尔首都多哈再次传出爆炸声
同花顺,2026-03-03 07:10:46,NYMEX取暖油主力合约大涨7%
同花顺,2026-03-03 07:10:41,沙特股市指数走势逆转，现上涨0.5%
同花顺,2026-03-03 07:07:47,大会新闻发言人刘结一通报本次政协大会主要议程
同花顺,2026-03-03 07:05:04,全国政协十四届四次会议新闻发布会开始
同花顺,2026-03-03 07:04:05,伊朗代表呼吁联合国针对美以军事打击采取行动
同花顺,2026-03-03 07:02:43,期货收评：涨停还是跌停？期货市场分化加剧
同花顺,2026-03-03 07:02:02,ETF收评：油气ETF银华领涨10.02%，卫星ETF领跌8.69%
同花顺,2026-03-03 07:01:54,股指期货午盘收盘 主力合约集体收跌
同花顺,2026-03-03 07:00:59,A股收评：深成指高开低走跌3.07%，全市场超4800只个股下跌
同花顺,2026-03-03 06:59:50,美国驻以色列大使建议希望离开以色列的人不要经约旦离境
同花顺,2026-03-03 06:59:24,上期所沪锡主力合约触及跌停
财联社,2026-03-03 06:58:36,华为首次在海外展出全液冷AI超节点
同花顺,2026-03-03 06:58:23,以色列国防军：以色列国防军部队对北部定居点发起前沿防御演习
财联社,2026-03-03 06:58:02,【研选】全球资源供应安全饱受威胁，缅甸掸邦北部局势再度紧张，引发市场对缅甸锡矿供应链的担忧；公司同时具备PCB、光芯片和光模块能力，约占AI服务器BOM成本的9%-14%
同花顺,2026-03-03 06:57:35,Omdia：华为夺2025中国手机销量第一
同花顺,2026-03-03 06:56:08,德黑兰东部地区据称遭到空袭
同花顺,2026-03-03 06:55:19,全国人大代表胡成中：加快推进车用固态电池系列国家标准制定与落地
同花顺,2026-03-03 06:54:44,四川南充出台六条措施稳定新出生人口规模，生育二孩三孩最高可累计领15万购房补贴
财联社,2026-03-03 06:54:09,人体血液中CO2水平随大气指标上升
财联社,2026-03-03 06:53:14,以色列全境发布防空警报
财联社,2026-03-03 06:52:46,动物实验表明：升级版CAR-T疗法清除多种实体瘤
同花顺,2026-03-03 06:51:37,广期所钯主力合约大跌6% NYMEX铂金主力合约大跌5%
同花顺,2026-03-03 06:51:16,3月3日“农产品批发价格200指数”比昨天上升0.23个点
财联社,2026-03-03 06:50:51,塞浦路斯传出爆炸声
同花顺,2026-03-03 06:50:17,华为李鹏：5G-A x AI，携手加速迈入智能体互联网时代
同花顺,2026-03-03 06:48:32,沪深京三市成交额超3万亿元，较上日此时放量998亿元
同花顺,2026-03-03 06:47:42,澳大利亚告知消费者，由于库存充足，无需因伊朗战事而抢购汽油
同花顺,2026-03-03 06:46:43,在沪全国政协委员赴京参会
同花顺,2026-03-03 06:41:46,深证成指盘中跌3%
同花顺,2026-03-03 06:39:49,专家警告：海湾国家拦截弹或难以持续一周
同花顺,2026-03-03 06:38:58,原材料成本持续攀升，2026开年多家LED企业集体涨价
同花顺,2026-03-03 06:38:45,现货白银失守83美元/盎司 上期所沪银主力合约暴跌11%
同花顺,2026-03-03 06:37:19,现货白银失守84美元/盎司
同花顺,2026-03-03 06:37:14,伊朗学者：美以真实野心是控制整个西亚资源
同花顺,2026-03-03 06:36:49,上期所沪银主力合约暴跌10%
同花顺,2026-03-03 06:36:21,现货白银失守85美元/盎司
同花顺,2026-03-03 06:35:51,人大代表田轩：建议延长A股交易时间 延至下午4点闭市
同花顺,2026-03-03 06:32:34,蚂蚁数科发布具身智能真实数据采集框架
同花顺,2026-03-03 06:30:27,日韩股市大幅收跌
同花顺,2026-03-03 06:29:56,全球首台百T级智算互联设备样机发布
财联社,2026-03-03 06:29:41,3家理财公司披露2025年成绩单 规模全部正增长
财联社,2026-03-03 06:26:49,伊朗国家电视台附近区域遭袭 现场浓烟滚滚
同花顺,2026-03-03 06:26:24,马斯克确认SpaceX的IPO目标估值超1.75万亿美元
同花顺,2026-03-03 06:25:09,俄罗斯国际航空宣布，首班从迪拜飞往莫斯科的撤离航班已起飞
财联社,2026-03-03 06:24:15,上市银行密集聘任首席合规官
同花顺,2026-03-03 06:24:12,消息人士称，伊朗冲突增加了日本央行3月放弃加息的可能性
同花顺,2026-03-03 06:22:57,稀土永磁板块持续下挫，北方稀土跌停
同花顺,2026-03-03 06:22:12,富时中国A50指数期货转跌，此前一度涨1.7%
同花顺,2026-03-03 06:20:25,沪深京三市成交额超2.7万亿元，较上日此时放量323亿元
同花顺,2026-03-03 06:20:20,科创50指数跌幅扩大至5%，芯原股份跌超10%
同花顺,2026-03-03 06:18:57,真主党称使用无人机和导弹袭击了以色列地区
同花顺,2026-03-03 06:17:53,LME锡主力合约大跌5%
同花顺,2026-03-03 06:17:06,小米汽车公布车牌定制专利
财联社,2026-03-03 06:16:58,AI需求驱动 半导体上市公司2025年营收增长
同花顺,2026-03-03 06:16:00,创业板指跌超2%，全市场近4700只个股下跌
财联社,2026-03-03 06:15:54,AI推理芯片打开市场空间 PCB产业链涨价或持续
同花顺,2026-03-03 06:15:25,广期所铂主力合约暴跌9%
同花顺,2026-03-03 06:15:20,现货黄金失守5290美元/盎司 纽约期金失守5310美元/盎司
财联社,2026-03-03 06:10:20,伊拉克民兵武装称对科威特境内美军基地遭袭事件负责
同花顺,2026-03-03 06:01:03,郑商所苹果主力合约大涨6%
财联社,2026-03-03 06:00:04,周二（3月3日）重点关注财经事件和经济数据
财联社,2026-03-03 06:00:00,周二你需要知道的隔夜全球要闻：特朗普称对伊朗军事行动可能持续4至5周，伊朗称霍尔木兹海峡已关闭，美政府违法征收关税或需加速退还
同花顺,2026-03-03 05:59:20,韩国综合股价指数（KOSPI）下跌7%
财联社,2026-03-03 05:58:34,美国敦促美公民立即离开中东国家
同花顺,2026-03-03 05:58:26,沪深京三市成交额超2.5万亿元，较上日此时缩量184亿元
同花顺,2026-03-03 05:57:32,伊朗伊斯兰革命卫队发布反击最初两天美军战损情况
同花顺,2026-03-03 05:56:52,淮河进入春季禁渔期
同花顺,2026-03-03 05:55:54,上期所沪银主力合约暴跌9%
同花顺,2026-03-03 05:54:57,上期所沪银主力合约大跌8% 现货白银跌超4%
同花顺,2026-03-03 05:54:37,广期所铂主力合约大跌7% 钯主力合约大跌5%
同花顺,2026-03-03 05:53:34,现货白银失守87美元/盎司
同花顺,2026-03-03 05:52:37,港股持续走低，恒生科技指数跌超2%
同花顺,2026-03-03 05:52:08,上期所沪银主力合约大跌7% 现货白银跌超3%
同花顺,2026-03-03 05:51:55,中证1000股指期货(IM)主力合约日内跌超3%
同花顺,2026-03-03 05:51:45,北京银行积存金乌龙事件引发市场关注
同花顺,2026-03-03 05:51:16,COMEX白银期货跌超1%
同花顺,2026-03-03 05:50:41,南向资金净买入超20亿港元
同花顺,2026-03-03 05:49:47,现货白银失守88美元/盎司
同花顺,2026-03-03 05:49:38,上期所沪锡主力合约暴跌10%
同花顺,2026-03-03 05:46:55,中关村科金发布OpenClaw企业级解决方案PowerClaw
同花顺,2026-03-03 05:45:23,沙特航空公司将部分航班取消期限延长至3月4日
同花顺,2026-03-03 05:44:31,美国国务院：美国下令非紧急政府人员及其家属撤离伊拉克
