来源,时间,标题
同花顺,2026-03-02 11:56:37,法兰泰克：金红萍、陶峰华合计持股14.64%股份拟协议转让给新投启航
同花顺,2026-03-02 11:56:15,受卡塔尔液化天然气项目暂停影响，欧洲基准天然气价格涨幅扩大至30%以上
同花顺,2026-03-02 11:56:13,凌云光：完成回购0.2730%公司股份
财联社,2026-03-02 11:52:47,伊朗前总统内贾德亲信称其平安
同花顺,2026-03-02 11:52:14,小米卢伟冰：有勇气在更高价位冲击苹果
同花顺,2026-03-02 11:49:53,中远海运称密切关注中东局势发展 正在评估所有在船货物后续处置方案
同花顺,2026-03-02 11:47:22,中科曙光：历军、任京旸、翁启南拟分别减持0.43%、0.02%、0.02%
同花顺,2026-03-02 11:46:22,龙星科技：股东渤海信托拟减持不超过1%
财联社,2026-03-02 11:45:58,3月2日午间涨停分析
同花顺,2026-03-02 11:44:49,中国方案引领全球！我国积极推进完善新能源汽车领域国际标准体系
财联社,2026-03-02 11:41:28,希荻微3月1日起部分产品涨价
同花顺,2026-03-02 11:38:45,智元彭志辉：行业已进入工程化、场景化竞争的下半场
同花顺,2026-03-02 11:38:44,天合光能：初步确定的本次询价转让价格为17.31元/股
同花顺,2026-03-02 11:36:21,美以打击伊朗致局势升级，中东多国关闭领空
同花顺,2026-03-02 11:35:42,浙农股份：拟以不高于6498万元收购金诚汽车19%股权
同花顺,2026-03-02 11:35:37,沃尔德：拟发行股票募集资金不超过3亿元用于金刚石微钻产业化项目
财联社,2026-03-02 11:33:52,伊拉克民众在美国大使馆附近举行抗议
同花顺,2026-03-02 11:33:25,两架飞往英国皇家空军驻塞浦路斯基地的无人机被拦截
财联社,2026-03-02 11:33:17,午评：沪指率先翻红 两市成交额半日突破2万亿
财联社,2026-03-02 11:31:35,国内期货主力合约多数上涨 集运欧线涨超14%
财联社,2026-03-02 11:30:11,英首相表示同意美国使用英军事基地
同花顺,2026-03-02 11:29:00,兰剑智能：多名高管拟增持A股375万元至750万元
财联社,2026-03-02 11:28:40,阿里巴巴大模型品牌统一为千问
同花顺,2026-03-02 11:28:22,华测导航：高管高占武拟减持不超0.0089%
同花顺,2026-03-02 11:24:43,南京化纤：南京工艺变更为南京化纤全资子公司
同花顺,2026-03-02 11:24:36,丽尚国潮：元明控股已增持0.88%，计划再增持
财联社,2026-03-02 11:22:55,惠誉旗下BMI：油价飙升或使几个主要经济体的通胀上升1%-2.5%
同花顺,2026-03-02 11:20:03,德尔未来：董事史旭东等三人合计减持0.0701%
同花顺,2026-03-02 11:19:39,中国天楹：股票已连续2个交易日收盘价格涨幅偏离值累计超过20%
同花顺,2026-03-02 11:19:34,名臣健康：董事陈东松减持0.11%股份
财联社,2026-03-02 11:19:12,沪深两市成交额连续第5个交易日突破2万亿 较上一日此时放量超4800亿
同花顺,2026-03-02 11:18:44,千里科技：2月产量3335辆增12.40%，销量4017辆降24.85%
财联社,2026-03-02 11:18:41,【盘中宝】行业正迎来技术突破提速期，多个细分领域精准发力，产业链进入规模化时代，这家公司为相关领域提供多种产品
同花顺,2026-03-02 11:18:06,华是科技：多名股东拟减持股份
同花顺,2026-03-02 11:17:54,菲菱科思：股东陈曦拟减持不超过0.3750%
同花顺,2026-03-02 11:17:30,科威特上空传出巨大爆炸声，原因尚不明
同花顺,2026-03-02 11:15:50,赛微微电：聚核投资完成增持0.1781%
同花顺,2026-03-02 11:14:57,向日葵：收到《行政处罚事先告知书》
财联社,2026-03-02 11:14:07,伊拉克民兵组织称袭击巴格达机场内美军目标
同花顺,2026-03-02 11:13:47,美中央司令部证实：3架美军战机在科威特坠毁
财联社,2026-03-02 11:12:40,北证50跌超4%
同花顺,2026-03-02 11:12:25,央行：有序推进金融高水平对外开放
财联社,2026-03-02 11:11:37,美国中央司令部称正持续空袭伊朗
财联社,2026-03-02 11:11:36,广发证券：维持百度集团买入评级 目标价173港元
同花顺,2026-03-02 11:11:32,央行：2025年，科技、绿色、普惠、养老产业、数字经济产业等重点领域贷款都保持了两位数增长
同花顺,2026-03-02 11:11:32,大中矿业：股东梁宝东拟减持不超过0.07%
同花顺,2026-03-02 11:11:21,金时科技：拟在广东省投资200MW/400MWh电化学独立储能电站项目
同花顺,2026-03-02 11:10:14,琉球群岛发生5.6级地震，震源深度10千米
同花顺,2026-03-02 11:10:11,亨通光电：当前全球光纤光缆行业市场环境正常
财联社,2026-03-02 11:09:14,魅族StarV AR系统团队全部入职雷鸟
同花顺,2026-03-02 11:08:53,赛力斯：2月新能源汽车产量11028辆，同比下降35.06%
财联社,2026-03-02 11:08:03,油气板块持续走高 科力股份等近20股涨停
同花顺,2026-03-02 11:07:19,晶澳科技：首次回购0.47%公司股份，成交总金额为2.17亿元
财联社,2026-03-02 11:06:15,工信部：春节9天刷出878.3万TB 5G流量超七成
同花顺,2026-03-02 11:05:17,伊朗总统任命代理国防部长
同花顺,2026-03-02 11:04:31,鼎捷数智：股东工业富联已减持2.36%
同花顺,2026-03-02 11:04:11,洁美科技：筹划发行股份及支付现金购买资产并募集配套资金事项 公司股票自2026年3月3日（星期二）开市时起开始停牌
同花顺,2026-03-02 11:03:57,全国政协十四届常委会第十五次会议闭幕王沪宁主持并讲话
财联社,2026-03-02 11:03:47,PCB概念震荡回升 民爆光电20cm涨停
同花顺,2026-03-02 11:03:27,道明光学：以3000万元增资合肥首镜科技，持股11%
财联社,2026-03-02 11:02:23,长三角铁路今日预计发送旅客245万人次 计划增开列车179列
同花顺,2026-03-02 11:02:05,香港将举办国际人才盛事“全球人才高峰会周”
财联社,2026-03-02 11:00:28,国债期货涨幅扩大 30年期主力合约涨0.48%
同花顺,2026-03-02 11:00:22,伊朗：用导弹袭击内塔尼亚胡办公室
同花顺,2026-03-02 10:59:22,弘景光电：2025年净利润1.93亿元，同比增长16.72%
财联社,2026-03-02 10:59:16,美团：必要时中东特定区域将暂时限制或停止服务 以确保社区安全
同花顺,2026-03-02 10:58:54,永太科技：拟签订《年产20万吨锂电池电解液项目投资协议书》
同花顺,2026-03-02 10:58:47,华明装备：完成回购1382.08万股
同花顺,2026-03-02 10:50:29,乌克兰据悉袭击俄罗斯Sheskharis石油终端
同花顺,2026-03-02 10:45:32,中巨芯：股东衢州恒芯拟增持金额不低于5000万元
同花顺,2026-03-02 10:44:16,小米集团：3月2日回购302.28万股，支付总价9999.9万港元
同花顺,2026-03-02 10:43:01,欧洲天然气价格涨超20%
同花顺,2026-03-02 10:38:24,德国政府发言人表示，我们保留在中东部署的德国军队在遭受攻击时进行自卫的权利
同花顺,2026-03-02 10:36:43,伊朗对以色列打击力度逐渐增强
同花顺,2026-03-02 10:36:05,亚盛集团：公司目前未开展矿产相关业务
财联社,2026-03-02 10:35:41,伊朗首都德黑兰再次传出爆炸声
同花顺,2026-03-02 10:32:50,泰晶科技：公司主营业务为石英晶体谐振器、振荡器 可应用于人形机器人、光模块 但业务收入占比极少
财联社,2026-03-02 10:32:32,CPO概念逆势拉升 德科立涨超10%
同花顺,2026-03-02 10:31:32,维科精密：2025年净利润5293.82万元，同比增长16.85%
同花顺,2026-03-02 10:31:29,东宏股份：全资子公司拟0元收购东宏管道智能终端100%股权
财联社,2026-03-02 10:29:22,以军将空袭黎巴嫩50个城镇
同花顺,2026-03-02 10:29:21,长安汽车：拟以10亿元-20亿元回购公司股份
同花顺,2026-03-02 10:27:58,万事利：拟在澳门设立全资孙公司
财联社,2026-03-02 10:27:27,美国防部将就针对伊朗的军事行动召开新闻发布会
财联社,2026-03-02 10:25:32,均胜电子：首个L3级智驾域控将于2027年上车
同花顺,2026-03-02 10:24:00,松原安全：控股股东南京明凯创业减持0.9236%计划完成
同花顺,2026-03-02 10:23:56,唯特偶：利乐缘已减持1%股份
同花顺,2026-03-02 10:23:52,电声股份：曾俊与风上国际拟减持不超过2%
同花顺,2026-03-02 10:23:33,电声股份：股东张黎、赏睿集团分别减持0.99%和0.66%
同花顺,2026-03-02 10:22:56,中稀有色：公司股票连续两个交易日内日收盘价格涨幅偏离值累计超过20%
财联社,2026-03-02 10:22:41,航运、港口板块再度拉升 南京港直线涨停
财联社,2026-03-02 10:22:18,开盘50分钟沪深两市成交额突破1.5万亿 较上一日此时放量超4400亿
同花顺,2026-03-02 10:22:03,丝路视觉：董事王军平已减持0.047%
同花顺,2026-03-02 10:21:58,凯格精机：股票连续三个交易日内收盘价格涨幅偏离值累计超过30%
同花顺,2026-03-02 10:21:39,欧盟主席冯德莱恩：必须叫停伊朗的核计划与弹道导弹计划
财联社,2026-03-02 10:17:06,千问AI眼镜今日上线 3月8日在中国市场现货发售
同花顺,2026-03-02 10:16:35,千问将发布AI眼镜、耳机、指环，巨头抢占AI新入口
同花顺,2026-03-02 10:15:31,海南高速：海南儋州东坡雅居置业有限公司六宗地块招商合作成功，挂牌价格6.09亿元
同花顺,2026-03-02 10:15:23,中信特钢：中信集团将向中信泰富转让所持长越投资等三家子公司100%股权
财联社,2026-03-02 10:14:22,十四届全国人大四次会议新闻发布会3月4日举行
同花顺,2026-03-02 10:13:42,*ST金泰：副总裁何俊龙因个人原因辞职
同花顺,2026-03-02 10:13:39,美能能源：2025年净利润1.01亿元，同比增长16.10%
同花顺,2026-03-02 10:13:34,四川美丰：股票连续两个交易日收盘价格涨幅偏离值累计超过20%
同花顺,2026-03-02 10:13:30,*ST立方：公司股票可能被终止上市
同花顺,2026-03-02 10:12:58,雅迪越南智能制造工厂一期项目竣工，投资额超1亿美元
财联社,2026-03-02 10:07:53,全国铁路今天预计发送旅客1315万人次
财联社,2026-03-02 10:05:44,伊朗首都一广场遭美以空袭20人死亡
财联社,2026-03-02 10:05:02,国家税务总局发布服务全国统一大市场建设六项举措成果
财联社,2026-03-02 10:03:56,山东省济南市政府党组成员、副市长谢堃接受纪律审查和监察调查
财联社,2026-03-02 10:03:45,河南省医疗保障局原党组成员、副局长孙晓灿被开除党籍
同花顺,2026-03-02 10:02:07,上期所贵金属及有色金属仓单日报：铅、国际铜仓单减少，白银、铝和锡等增加
同花顺,2026-03-02 10:01:37,安恒信息：注销28.11万股已回购股份
同花顺,2026-03-02 10:00:11,国邦医药：首次回购1.39%公司股份，已全部用于员工持股计划
同花顺,2026-03-02 09:56:01,盛和资源：股东王全根拟减持不超过1%
同花顺,2026-03-02 09:50:54,MiniMax：截至2025年12月31日止年度净亏损18.72亿美元，上年同期净亏损4.65亿美元
同花顺,2026-03-02 09:46:34,永鼎股份：控股股东永鼎集团拟减持不超过1%
同花顺,2026-03-02 09:45:48,光大期货：伊朗局势升温，原油开盘即涨停
同花顺,2026-03-02 09:45:14,衢州发展：出售衢发瑞100%股权 交易价格7009.62万元
同花顺,2026-03-02 09:42:16,烽火通信：低轨星载路由及星间激光通信业务的营业收入比例不到1%
同花顺,2026-03-02 09:36:56,伊朗外交部发言人：美以继续无差别打击伊居民区
同花顺,2026-03-02 09:32:39,美的集团：截至2026年2月28日，以集中竞价交易方式累计回购2694.37万股
财联社,2026-03-02 09:31:50,贵金属概念快速走强 晓程科技涨超14%
同花顺,2026-03-02 09:31:36,南向资金今日净买入162.14亿港元 南方恒生科技获净买入居前
同花顺,2026-03-02 09:30:59,华东医药：注射用DR30206临床试验获批
同花顺,2026-03-02 09:30:56,中欧航线票价暴涨，上海飞巴黎飙升5倍
同花顺,2026-03-02 09:30:29,以军称打击黎真主党一名高级成员
财联社,2026-03-02 09:30:15,航运概念集体走强 中远海能、招商南油双双涨停
同花顺,2026-03-02 09:30:13,奥赛康：子公司创新药麦芽酚铁胶囊获得药品注册上市许可申请受理通知书
同花顺,2026-03-02 09:29:56,上交所：截至3月1日，各板块在审企业共309家
同花顺,2026-03-02 09:29:44,黄河凌汛进入风险集中暴发期，水利部专题部署黄河防凌工作
财联社,2026-03-02 09:28:53,以色列特拉维夫传出爆炸声 以称黎巴嫩发射炮弹
财联社,2026-03-02 09:28:24,港股AI应用股走低 MINIMAX跌近8%
财联社,2026-03-02 09:27:06,油气板块开盘大涨 中国海油等多股涨停
财联社,2026-03-02 09:25:53,港股黄金股走强 赤峰黄金涨近5%
同花顺,2026-03-02 09:24:55,至正股份：2025年净利润亏损4583.97万元
财联社,2026-03-02 09:23:59,澳大利亚政府建议澳公民避免前往卡塔尔和阿联酋
财联社,2026-03-02 09:22:19,港股油气股走强 中石化油服涨15%
财联社,2026-03-02 09:21:36,香港恒生指数开盘跌1.22% 油气股大涨、科技股下挫
同花顺,2026-03-02 09:21:10,机构：预估2026年全球新能源车销量年增14%
同花顺,2026-03-02 09:20:45,包头稀交所：今日稀土主流产品价格出现回落
同花顺,2026-03-02 09:20:22,圣晖集成：2025年净利润1.54亿元，同比增长34.91%
同花顺,2026-03-02 09:18:34,伊朗驻国际原子能机构大使表示，美国及以色列昨日袭击了伊朗核设施
财联社,2026-03-02 09:15:49,【盘中宝】地缘冲突进一步打乱复产预期，叠加霍尔木兹海峡航运风险上升，或驱动该类品种价格上行，这家企业参股公司相关产品年产能60万吨
财联社,2026-03-02 09:14:51,美股石油股夜盘飙升 埃克森美孚涨超8%
同花顺,2026-03-02 09:09:19,美股航空股盘前走低
同花顺,2026-03-02 09:08:41,阿里巴巴持有的澜起科技H股股份降至6.91%
同花顺,2026-03-02 09:07:39,摩根大通（JPMorgan）对中国石油股份的多头持仓比例增至5.11%
同花顺,2026-03-02 09:01:30,美股大型科技股盘前普跌，特斯拉跌2%
同花顺,2026-03-02 09:01:24,康芝药业：全资子公司布洛芬颗粒产品中选国家集采
同花顺,2026-03-02 09:01:00,康菲石油美股盘前涨超7%
同花顺,2026-03-02 09:00:26,埃克森美孚美股盘前涨超5%
同花顺,2026-03-02 08:55:27,泰国暂停石油出口
同花顺,2026-03-02 08:54:15,新宝股份：2025年净利润10.02亿元，同比下降4.85%
同花顺,2026-03-02 08:53:35,新疆：受风吹雪及低能见度影响 对多路段实行双向交通管制
同花顺,2026-03-02 08:52:48,方盛制药：公司依折麦布片等中选本次接续采购
同花顺,2026-03-02 08:51:55,武汉控股：收到上交所同意恢复审核的通知
同花顺,2026-03-02 08:50:38,中油资本：伊朗局势对业务影响不大，下属公司昆仑银行“目前基本不受影响”
财联社,2026-03-02 08:50:09,机构：短期内IT机架电源系统在数据中心资本支出中的占比或提高
同花顺,2026-03-02 08:50:02,*ST太和：股东何文辉所持4.56%公司股份司法拍卖流拍
财联社,2026-03-02 08:48:32,以军大规模空袭伊朗首都
同花顺,2026-03-02 08:47:56,华宏科技：副总裁胡品龙已减持0.33%股份
同花顺,2026-03-02 08:47:48,首开股份：刘安因退休辞去副总经理职务
财联社,2026-03-02 08:47:42,两市融资余额增加18.59亿元
同花顺,2026-03-02 08:47:36,美年健康：深交所同意恢复审核本次交易事项
同花顺,2026-03-02 08:41:54,泰国股市盘中最多下跌3.2% 创4月8日以来最大盘中百分比跌幅
同花顺,2026-03-02 08:41:42,泰恩康：全资子公司部分药品中选国家集采药品接续采购
同花顺,2026-03-02 08:41:38,达利凯普：股东磐茂投资累计减持4.0991%
同花顺,2026-03-02 08:41:32,金卡智能：全资子公司受让林芝鼎孚所持基金份额6.7171%
财联社,2026-03-02 08:40:07,伊朗称美军在中东遭受重大伤亡 美中央司令部否认
财联社,2026-03-02 08:38:44,东吴证券：拟收购东海证券 今日开市起停牌
财联社,2026-03-02 08:37:14,美国驻巴林使馆宣布关闭 直至另行通知
同花顺,2026-03-02 08:36:54,亚马逊在巴林和阿联酋的云服务中断
财联社,2026-03-02 08:36:21,银河证券：中长期来看市场有望长期稳健运行
财联社,2026-03-02 08:34:57,银河通用完成25亿元新一轮融资
财联社,2026-03-02 08:33:50,本周央行公开市场共15250亿元逆回购到期
同花顺,2026-03-02 08:31:21,以美对伊朗东阿塞拜疆省的袭击已致27人死亡
同花顺,2026-03-02 08:31:11,比特币回升，因伊朗冲突导致通胀担忧加剧
同花顺,2026-03-02 08:30:42,汉马科技：2月货车销量1201辆，同比增减48.27%
同花顺,2026-03-02 08:29:22,则成电子：股东海汇聚成已减持2%
同花顺,2026-03-02 08:27:36,英力股份：发行股份购买资产事项中止审核
同花顺,2026-03-02 08:27:29,通源石油今日20cm涨停，有2家机构专用席位净卖出4556.69万元
同花顺,2026-03-02 08:27:24,立方制药：公司中选国家组织集采药品协议期满品种接续采购
同花顺,2026-03-02 08:26:52,沙特国家石油公司一炼油厂遭无人机袭击
同花顺,2026-03-02 08:26:34,美以对伊朗发动袭击已造成555人死亡
同花顺,2026-03-02 08:26:20,翔鹭钨业今日涨停，4家机构专用席位净买入1.42亿元
同花顺,2026-03-02 08:25:40,潍柴重机今日跌9.63%，有5家机构专用席位净卖出3.52亿元
同花顺,2026-03-02 08:25:28,锡业股份今日涨停，有2家机构专用席位净卖出1.18亿元
财联社,2026-03-02 08:24:35,财联社3月2日早间新闻精选
财联社,2026-03-02 08:23:25,美以对伊朗发动军事打击后 美多个城市加强安保
财联社,2026-03-02 08:16:41,中金：看好在三重催化共振下锂电板块的春季攻势
同花顺,2026-03-02 08:16:14,蒙草生态：控股子公司提前终止锡林浩特PPP项目
同花顺,2026-03-02 08:14:22,新产业：拟使用不超过1亿元回购公司股份
同花顺,2026-03-02 08:14:12,美股期货继续下挫，道指期货跌超700点
同花顺,2026-03-02 08:11:23,新泉股份：在开封投资设立全资子公司 开封新泉汽车零部件有限公司完成注册登记
同花顺,2026-03-02 08:10:16,港股收评：恒生指数跌2.14%，恒生科技指数跌2.89%
同花顺,2026-03-02 08:10:07,奥泰生物：首次回购0.15%公司股份，支付的资金总额为人民币787.68万元
同花顺,2026-03-02 08:09:12,2025年全国统一大市场建设提速 省际贸易额增长明显
同花顺,2026-03-02 08:05:54,中方是否就伊朗局势呼吁再次召开联合国安理会会议或进行其他形式的多边努力？外交部回应
同花顺,2026-03-02 08:05:26,春运第29天 全社会跨区域人员流动量预计2亿人次
同花顺,2026-03-02 08:04:08,印度版“美团”CEO再创业 押注脑机接口可穿戴设备
同花顺,2026-03-02 08:03:52,小马智行恢复多哈Robotaxi道路测试，迪拜仍暂停
同花顺,2026-03-02 08:03:37,商务部：关于延长征求对中国—澳大利亚自由贸易协定审议意见截止时间的通知
财联社,2026-03-02 08:01:55,投资日历：周一资本市场大事提醒
同花顺,2026-03-02 08:01:20,伊朗动用“霍拉姆沙赫尔-4”导弹发动“真实承诺4”第十轮打击
同花顺,2026-03-02 07:58:47,美以袭击致伊朗法尔斯省35人死亡
财联社,2026-03-02 07:55:49,伊朗方面称6名中情局官员在阿联酋身亡
同花顺,2026-03-02 07:55:23,玻利维亚一军机坠毁造成人员伤亡 外交部：对遇难者表示深切哀悼
同花顺,2026-03-02 07:54:58,南向资金净买入超150亿港元
同花顺,2026-03-02 07:53:48,中国和俄罗斯已推动联合国安理会举行紧急会议
同花顺,2026-03-02 07:51:01,影石创始人回应337胜诉：将开放Ace系列运动相机专利供同行善意使用
财联社,2026-03-02 07:45:55,【点金互动易】交换机+AI数据中心，800G交换机持续高速增长，这家公司推出AI智算中心网络解决方案，实现了万卡级AI-GPU集群网络
财联社,2026-03-02 07:44:46,A股限售股解禁一览：178.43亿元市值限售股今日解禁
同花顺,2026-03-02 07:44:24,外交部：中方支持地区国家从睦邻友好出发 共同致力于地区和平稳定
财联社,2026-03-02 07:37:41,黎巴嫩向以色列发射6枚火箭弹 以称将强烈回应
同花顺,2026-03-02 07:35:09,中方下阶段对于保护在伊朗中国公民有什么措施？外交部回应
同花顺,2026-03-02 07:34:35,特朗普3月访华能否成行？外交部：中美就元首互动保持着沟通
同花顺,2026-03-02 07:34:21,外媒称中伊接近达成导弹采购协议不实
同花顺,2026-03-02 07:34:00,外交部回应特朗普称打击或持续4周
同花顺,2026-03-02 07:33:26,霍尔木兹海峡被关闭对中国的进口和能源安全有何影响？外交部回应
同花顺,2026-03-02 07:33:03,南向资金净买入超120亿港元
财联社,2026-03-02 07:30:32,霍尔木兹海峡禁航 运价或进一步上涨
同花顺,2026-03-02 07:25:14,英国同意美国使用英军事基地 英国已派战机在海湾地区执行任务
同花顺,2026-03-02 07:23:45,分析师：欧佩克+4月增产反映出管理有限闲置产能的需要
同花顺,2026-03-02 07:22:44,塞浦路斯：英空军基地遭无人机袭击造成“有限损失”
同花顺,2026-03-02 07:20:27,南向资金净买入超110亿港元
同花顺,2026-03-02 07:19:39,龙湖完成两笔公司债本息兑付 合计1.7亿元
同花顺,2026-03-02 07:17:29,现货黄金站上5410美元/盎司
财联社,2026-03-02 07:16:54,英国驻塞浦路斯空军基地传出强烈爆炸声
同花顺,2026-03-02 07:15:44,伊朗向以色列发动新一波袭击，耶路撒冷及以色列中部城市特拉维夫等地防空警报响起
同花顺,2026-03-02 07:15:28,小鹏汽车何小鹏：将在全国两会上提出《关于加快推动自动驾驶技术从L2跨越到L4完善法规与管理政策的建议
同花顺,2026-03-02 07:11:38,何小鹏：小鹏第二代VLA开启自动驾驶DeepSeek时刻
同花顺,2026-03-02 07:11:30,现货黄金站上5400美元/盎司，日内涨超2%
同花顺,2026-03-02 07:08:06,涨停！中油工程回应涉中东业务进展：伊拉克、沙特等项目正常，回款暂无风险
同花顺,2026-03-02 07:06:12,三艘英美油轮在波斯湾和霍尔木兹海峡遭到袭击
同花顺,2026-03-02 07:03:48,期货收评：美伊冲突引爆市场！商品涨停潮来袭！
同花顺,2026-03-02 07:03:27,伊朗外长：任何人都不能说伊朗无权自卫
同花顺,2026-03-02 07:03:01,NYMEX取暖油主力合约暴涨12%
同花顺,2026-03-02 07:02:16,ETF收评：标普油气ETF领涨10.03%，港股通互联网ETF领跌4.38%
同花顺,2026-03-02 07:01:51,ETF两市成交额5029.41亿元
同花顺,2026-03-02 07:01:24,A股收评：沪指低开高收涨0.47%，市场成交额突破3万亿元，“三桶油”集体涨停
同花顺,2026-03-02 07:01:22,股指期货午盘收盘 主力合约涨跌不一
财联社,2026-03-02 07:00:58,美国和以色列袭击伊朗后 国际油价跳涨 美股期货下跌
同花顺,2026-03-02 07:00:51,福建省交融科技创新股权投资基金成立 出资额3亿
同花顺,2026-03-02 07:00:43,百亿私募再扩容至125家，8家突破百亿用时不足1年
同花顺,2026-03-02 07:00:39,南向资金净买入超90亿港元
同花顺,2026-03-02 06:59:50,伊朗东阿塞拜疆省遭空袭，已造成27人死亡
同花顺,2026-03-02 06:58:44,尾盘中国石化涨停，“三桶油”集体涨停
同花顺,2026-03-02 06:57:03,土耳其主要股指BIST-100指数早盘下跌5.32%，主要银行指数早盘下跌5.81%
同花顺,2026-03-02 06:56:30,四川去年转移输出农民工数量减少55万人
同花顺,2026-03-02 06:56:20,沪深京三市成交额超3万亿元，较上日此时放量5570亿元
同花顺,2026-03-02 06:55:38,郑商所对二甲苯主力合约触及涨停
财联社,2026-03-02 06:51:15,白宫下令暂缓推进对台军售
财联社,2026-03-02 06:50:14,【研选】AI带动巨量电力需求，美国现场发电需求旺盛，分析师看好发电板块上下游均有望受益；国内领先的大数据与AI基础软件厂商，其GPU原生认知数据库性能跃升20倍，实现营收增速回升与亏损收窄的双重拐点
财联社,2026-03-02 06:47:59,俄称打击乌能源设施 乌称打击俄军集结区
财联社,2026-03-02 06:47:19,淡季不淡 3月TV面板价格继续看涨
财联社,2026-03-02 06:42:42,我国建成全球最大的可再生能源体系 每用10度电就有近4度是绿电
财联社,2026-03-02 06:32:53,机构：A股基本面受地缘政治扰动有限 顺周期主线有望强化
同花顺,2026-03-02 06:32:47,国投白银LOF午后触达涨停
同花顺,2026-03-02 06:30:59,南向资金净买入超60亿港元
同花顺,2026-03-02 06:28:39,伊朗打击中东区域内美军基地 多国传出爆炸声
同花顺,2026-03-02 06:27:10,郑商所短纤主力合约大涨5%
同花顺,2026-03-02 06:26:14,沪深京三市成交额超2.7万亿元，较上日此时放量5305亿元
同花顺,2026-03-02 06:25:00,以色列关闭边境口岸导致加沙民众恐慌性抢购
同花顺,2026-03-02 06:24:02,中东最大港口暂停运营
同花顺,2026-03-02 06:23:45,上期所沪银主力合约暴涨9%
同花顺,2026-03-02 06:20:37,南向资金净买入超50亿港元
同花顺,2026-03-02 06:20:07,大商所塑料主力合约大涨5%
同花顺,2026-03-02 06:19:23,郑商所PTA主力合约大涨6% 瓶片主力合约大涨5%
同花顺,2026-03-02 06:19:08,万联易达集团推出物流撮合交易平台“易达宝”
同花顺,2026-03-02 06:17:04,黄金股持续大涨，晓程科技20cm涨停
