来源,时间,标题
同花顺,2026-03-04 09:53:26,消息人士：哈梅内伊之子可能成为下一任伊朗最高领袖
同花顺,2026-03-04 09:52:50,阿里AI团队面临重大变动，负责人林俊旸离职引发关注
同花顺,2026-03-04 09:50:40,金不换代表建言：严禁未满16周岁未成年人注册主播
同花顺,2026-03-04 09:47:08,荣耀李健阐释AHI理念：AI不仅有IQ 还有EQ
同花顺,2026-03-04 09:46:12,京运通：京运通达兴及冯焕培拟协议转让公司5.9637%股份
同花顺,2026-03-04 09:45:36,上海电力：海上风电项目获得核准
同花顺,2026-03-04 09:41:35,现货白银突破86美元/盎司，日内涨4.91%
同花顺,2026-03-04 09:39:49,伊朗东部传出数次爆炸声 总台记者听到战机从德黑兰上空飞过
同花顺,2026-03-04 09:39:31,现货白银站上86美元/盎司
同花顺,2026-03-04 09:36:06,福田汽车：2月汽车销量41150辆，产量46291辆
同花顺,2026-03-04 09:33:21,TCL李东生：加强资本市场对先进制造企业融资支持
财联社,2026-03-04 09:31:15,存储芯片概念反弹 佰维存储触及20cm涨停
财联社,2026-03-04 09:28:45,贵金属概念集体走弱 四川黄金跌停
财联社,2026-03-04 09:28:08,竞价看龙头
财联社,2026-03-04 09:27:23,港股黄金股走低 赤峰黄金跌超5%
财联社,2026-03-04 09:26:28,油气板块延续强势 洲际油气等多股3连板
同花顺,2026-03-04 09:26:20,亚太药业：全资子公司拟出资600万元设立合资公司
财联社,2026-03-04 09:26:07,三大指数集体低开
同花顺,2026-03-04 09:25:07,IF椰子水回应添加外源糖质疑：不实信息
同花顺,2026-03-04 09:24:22,阳光诺和：BTP4327临床试验申请获批
财联社,2026-03-04 09:23:35,部分港股油气设备股走强 山东墨龙涨超14%
同花顺,2026-03-04 09:23:04,今年华交会意向订单近22亿美元，东南亚采购商激增24%
财联社,2026-03-04 09:22:18,央行公开市场今日实现净回笼3690亿元
财联社,2026-03-04 09:21:47,【盘中宝】资源禀赋特点+下游产品需求旺盛推动产业快速发展，能源结构决定行业战略重要性，机构称重视该板块投资机会，这家企业多个相关项目有序推进
财联社,2026-03-04 09:21:22,香港恒生指数开盘跌1.16% 热门科技股普遍下跌
同花顺,2026-03-04 09:20:09,俄罗斯卢布下跌逾1%
财联社,2026-03-04 09:20:00,阿联酋经济与旅游部：阿联酋已与海湾国家协调开通空中走廊
财联社,2026-03-04 09:19:39,杰富瑞下调小米目标价
同花顺,2026-03-04 09:19:15,大钲资本收购蓝瓶咖啡，后者尚在亏损中
财联社,2026-03-04 09:17:56,美以对伊朗采取军事行动 乌克兰担忧美国减少武器供应
同花顺,2026-03-04 09:17:30,西班牙称有能力应对美国贸易威胁
同花顺,2026-03-04 09:16:47,韩国电力美股盘前跌超10%
同花顺,2026-03-04 09:16:32,汇得科技：控股股东及其一致行动人持股比例被动稀释10.52%
同花顺,2026-03-04 09:14:06,COMEX白银期货涨超3%
同花顺,2026-03-04 09:08:11,欢乐家：股东李兴询价转让每股17.34元
同花顺,2026-03-04 09:05:01,全国政协委员、上海新联会会长张毅：让“幸福经济”成为经济增长新引领点
同花顺,2026-03-04 09:04:55,恒瑞医药：子公司HRS-1780片获临床试验批准
同花顺,2026-03-04 09:04:54,贝莱德（BlackRock）对联想集团的多头持仓比例增至6.04%
同花顺,2026-03-04 09:04:37,宇通客车：2月销售量1806辆，同比变动14.96%
同花顺,2026-03-04 09:04:02,联合国阿富汗援助团：阿巴冲突不断造成阿平民伤亡
同花顺,2026-03-04 09:03:05,包头稀交所：今日稀土主流产品价格走势分化
同花顺,2026-03-04 09:02:00,美股中概股盘前涨跌互现，京东跌2%
同花顺,2026-03-04 09:01:57,美股大型科技股盘前普跌，亚马逊跌0.9%
同花顺,2026-03-04 09:01:28,石化油服今日涨停，3家机构专用席位净买入2.14亿元
同花顺,2026-03-04 09:00:43,中曼石油今日涨6.96%，有4家机构专用席位净卖出9.59亿元
同花顺,2026-03-04 08:54:47,伊拉克武装组织称打击约旦境内一“关键目标”
同花顺,2026-03-04 08:53:58,美国政府未出台帮助公民撤离中东举措遭批无能
同花顺,2026-03-04 08:50:34,刘海星会见智利共和党干部考察团
同花顺,2026-03-04 08:48:47,西班牙首相说西班牙拒绝战争
同花顺,2026-03-04 08:47:57,特斯拉“铁粉”斥资上亿美金加仓英伟达 称AI浪潮非泡沫
财联社,2026-03-04 08:47:13,两市融资余额减少224.78亿元
同花顺,2026-03-04 08:47:01,比特币升破70000美元，日内涨3.13%
同花顺,2026-03-04 08:44:40,政协委员彭静：建议推进高中阶段教育免费
同花顺,2026-03-04 08:44:14,现货白银涨超3%
财联社,2026-03-04 08:42:19,阿里千问大模型技术负责人自宣卸任
财联社,2026-03-04 08:41:28,国金证券：原油市场当前由地缘政治风险驱动 预计高波动率将持续
同花顺,2026-03-04 08:40:38,WTI原油站上77美元/桶
同花顺,2026-03-04 08:39:29,WTI原油突破77美元/桶，日内涨3.31%
财联社,2026-03-04 08:39:04,【九点特供】超150艘货船在波斯湾被迫抛锚停航，欧洲天然气价格涨幅进一步扩大，这一产品经济性曾在俄乌冲突下迎来大幅提升，这家公司是对欧出口链核心标的
同花顺,2026-03-04 08:36:44,深圳楼市升温：中介门店二手房成交均价连续3个月回稳，买家入市节奏加快
财联社,2026-03-04 08:34:16,中情局在美驻沙特使馆站点据报遭袭
同花顺,2026-03-04 08:33:52,洪汇新材：完成回购0.58%公司股份
同花顺,2026-03-04 08:33:46,德明利今日涨停，长江证券成都东大街证券营业部净买入2.8亿元
同花顺,2026-03-04 08:32:56,准油股份今日涨停，有3家机构专用席位净卖出5371.75万元
同花顺,2026-03-04 08:32:46,DBRS晨星：今年大型航运企业的盈利将出现下滑
同花顺,2026-03-04 08:32:28,通鼎互联今日涨3.43%，4家机构专用席位净买入2.03亿元
同花顺,2026-03-04 08:31:52,航天彩虹今日涨停，有1家机构专用席位净卖出3.31亿元
同花顺,2026-03-04 08:31:52,统一企业中国：2025年末期股东应占盈利20.5亿元，同比增长10.9%
同花顺,2026-03-04 08:30:39,首药控股：正大天晴将向公司支付一次性收益分成人民币8000万元
财联社,2026-03-04 08:29:44,SK海力士推进全新HBM封装技术 或缩小DRAM层间距
同花顺,2026-03-04 08:25:44,知情人士：“华为系”更多车型将搭载896线激光雷达
财联社,2026-03-04 08:24:39,中信证券：AIDC供电系统升级迭代催生全新机遇 海外电网升级趋势明确
同花顺,2026-03-04 08:24:13,方盛制药：比索洛尔氨氯地平片获药品注册证书
同花顺,2026-03-04 08:21:13,高盛预计英国央行将在2026年4月、7月和11月各降息25个基点
财联社,2026-03-04 08:20:39,中国生物制药：与赛诺菲就罗伐昔替尼订立独家授权协议
财联社,2026-03-04 08:20:31,动武以来美总统特使未与伊朗进行外交接触
财联社,2026-03-04 08:20:13,美军称击毁17艘伊朗舰船
同花顺,2026-03-04 08:16:54,预计今天全社会跨区域人员流动量2.19亿人次
同花顺,2026-03-04 08:14:26,宇邦新材：宇邦转债预计触发赎回条件
同花顺,2026-03-04 08:11:32,安科生物：PA3-17注射液新增适应症获临床试验批准
同花顺,2026-03-04 08:10:33,港股收评：恒生指数跌2.01%，恒生科技指数跌0.96%
同花顺,2026-03-04 08:10:14,纽威股份：控股股东席超已减持1%
同花顺,2026-03-04 08:07:37,中远海运：鉴于中东地区冲突持续升级 即日起暂停相关航线新订舱业务
财联社,2026-03-04 08:06:47,全国政协委员周鸿祎：建立“全国统筹+区域细化” 的推理算力布局体系
同花顺,2026-03-04 08:05:35,理工导航：签订4614万元销售合同
同花顺,2026-03-04 08:02:15,东亚药业：富马酸伏诺拉生片获得药品注册证书
财联社,2026-03-04 08:01:39,财联社3月4日早间新闻精选
财联社,2026-03-04 07:55:04,伊朗称完全控制霍尔木兹海峡 十多艘油轮被炮弹击中
同花顺,2026-03-04 07:52:38,首架回国航班从阿联酋迪拜起飞
财联社,2026-03-04 07:52:04,今日申购指南及新股定位分析
财联社,2026-03-04 07:51:34,投资日历：周三资本市场大事提醒
财联社,2026-03-04 07:50:59,【点金互动易】AI电力+英伟达，深度切入英伟达生态，全栈布局高压到核心芯片低压供电，前瞻研发新代际电源产品，这家公司持续匹配AI服务器电源升级节奏
同花顺,2026-03-04 07:50:40,新诺威：控股子公司艾美赛珠单抗注射液（SYS6053）获得药物临床试验批准通知书
财联社,2026-03-04 07:50:37,英特尔任命Barratt为下一任董事长 接替Frank Yeary
财联社,2026-03-04 07:48:21,贵金属市场波动加大 多家银行提示投资风险
财联社,2026-03-04 07:47:11,假谈判真备战 知情人士称美以早已密谋对伊动武
同花顺,2026-03-04 07:39:27,OpenAI与美国国防部达成合作后，ChatGPT卸载量飙升
同花顺,2026-03-04 07:38:17,外交部：“全球治理之友小组”先后在两地成立 充分证明全球治理倡议契合世界所需
同花顺,2026-03-04 07:36:20,伊朗：摧毁三套美军“萨德”反导系统，美军：同样重挫伊朗防空能力
同花顺,2026-03-04 07:34:15,黄三文委员：粮食产量达1.43万亿斤，丰收密码是农业科技
财联社,2026-03-04 07:32:26,A股限售股解禁一览：90.56亿元市值限售股今日解禁
同花顺,2026-03-04 07:31:06,全国政协经济委员会副主任、中央财经委员会办公室原副主任尹艳林：今年经济增速预计保持平稳 要以更加有力措施促进投资止跌回稳
同花顺,2026-03-04 07:30:37,郑商所：自2026年3月4日结算时起，甲醇期货2604及2605合约的交易保证金标准调整为16%
财联社,2026-03-04 07:28:57,北交所公司2025年业绩分化中显韧性 化工新材料板块“双增长”领跑
同花顺,2026-03-04 07:27:23,国泰海通路颖：内需提振迎有力转折 成A股“转型牛”关键动力
同花顺,2026-03-04 07:24:08,以军称已对黎巴嫩境内超250个目标进行军事打击
财联社,2026-03-04 07:24:01,新材料首次将储能与释氢合二为一
同花顺,2026-03-04 07:22:38,特朗普因西班牙不配合打击伊朗对其发出威胁，外交部：贸易不应被武器化
同花顺,2026-03-04 07:21:12,美元指数回吐涨幅
财联社,2026-03-04 07:21:09,伊朗称袭击位于印度洋的美军驱逐舰和补给舰
同花顺,2026-03-04 07:20:23,外交部：中国公民持护照可免签入境阿塞拜疆、亚美尼亚和土耳其
同花顺,2026-03-04 07:20:10,法国外交部长：法国“阵风”战斗机已击落瞄准阿拉伯联合酋长国的伊朗无人机
财联社,2026-03-04 07:19:56,伊朗称对美以同时展开三项行动 共发射230架无人机
同花顺,2026-03-04 07:19:04,盛视科技成立投资新公司，注册资本2亿元
财联社,2026-03-04 07:16:47,新方法训练AI模型更具“人类智慧”
财联社,2026-03-04 07:15:09,以军称监测到伊朗方向发射的导弹 多地响起防空警报
同花顺,2026-03-04 07:13:48,中国移动集团公司原董事长杨杰：我国已形成“网络+算力+数据”的新型信息基础设施
财联社,2026-03-04 07:11:02,超薄二维材料中观测到两种罕见磁性状态
同花顺,2026-03-04 07:10:00,全国政协十四届三次会议以来99.9%的提案已办复
财联社,2026-03-04 07:08:54,微针贴片实现人体关键免疫细胞无创采样
同花顺,2026-03-04 07:08:02,全国政协十四届四次会议开幕会审议通过了政协第十四届全国委员会第四次会议议程
同花顺,2026-03-04 07:05:49,华为乾崑发布图像级896线激光雷达
同花顺,2026-03-04 07:04:32,德商银行：债券投资者或从能源价格动态中寻找线索
同花顺,2026-03-04 07:02:28,ETF收评：电网设备ETF领涨3.33%，巴西ETF易方达领跌7.87%
同花顺,2026-03-04 07:02:21,ETF两市成交额5792.45亿元
同花顺,2026-03-04 07:01:03,股指期货午盘收盘 主力合约全线收跌
同花顺,2026-03-04 07:01:00,A股收评：沪指低开低收跌近1%，市场成交额缩量近7700亿元
财联社,2026-03-04 06:59:50,三峡南线船闸启动2026年计划性停航检修
财联社,2026-03-04 06:58:15,伊朗选举最高领袖的机构大楼遭袭
财联社,2026-03-04 06:55:15,【研选】GTC大会前瞻，分析师看好LPU对PCB设备和钻针带来的增量需求；中国调味品行业绝对龙头，领先构建“餐饮解决方案”商业模式，新一轮提价潮渐行渐近
同花顺,2026-03-04 06:50:52,海外农化巨头停产百草枯？红太阳午后直线涨停，公司回应
同花顺,2026-03-04 06:50:06,问界M9累计交付量超28万台
同花顺,2026-03-04 06:48:37,上海三大先导产业母基金常态化遴选子基金
同花顺,2026-03-04 06:47:34,伊朗宣布将为哈梅内伊举行告别仪式
同花顺,2026-03-04 06:42:36,ETF两市成交额超5500亿元
同花顺,2026-03-04 06:39:40,鸿蒙智行总销量达128万辆
同花顺,2026-03-04 06:39:24,曾毓群：会把中国的产品卖到全世界
同花顺,2026-03-04 06:38:18,沪深京三市成交额超2.2万亿元，较上日此时缩量6913亿元
财联社,2026-03-04 06:38:05,并购再起 券商板块估值修复窗口开启
财联社,2026-03-04 06:37:12,今年以来南向资金持续净流入 机构看好港股三大配置主线
同花顺,2026-03-04 06:34:42,英国2026年经济增长预期下调至1.1%
同花顺,2026-03-04 06:33:20,3月4日“农产品批发价格200指数”比昨天下降0.98个点
同花顺,2026-03-04 06:30:46,日韩股市双双大幅收跌 韩国综指跌超12%
同花顺,2026-03-04 06:30:09,韩国政府表示，正密切关注股市，如有需要，韩国将积极启动100万亿韩元的市场计划
同花顺,2026-03-04 06:26:56,昨日芝商所黄金、白银、铜期货成交量和未平仓合约均增加
同花顺,2026-03-04 06:26:36,全国政协十四届四次会议即将开幕
同花顺,2026-03-04 06:26:19,国晟科技等成立新公司，含AI软件开发业务
同花顺,2026-03-04 06:25:43,油气资源股再度拉升，准油股份涨停
同花顺,2026-03-04 06:23:41,上期所燃油主力合约再度触及涨停
同花顺,2026-03-04 06:22:19,沪深京三市成交额超2.1万亿元，较上日此时缩量6228亿元
财联社,2026-03-04 06:17:47,百亿级私募数量已达125家
财联社,2026-03-04 06:16:32,逾千家A股公司发布2025年业绩快报 近七成营收增长
同花顺,2026-03-04 06:15:01,中国信通院与全球电信管理论坛达成战略合作 全面开展自智网络分级评估活动
财联社,2026-03-04 06:14:19,美联储3月维持利率不变的概率为97.4%
同花顺,2026-03-04 06:13:10,全国人大代表张强：建议农村彩礼不超过2万
财联社,2026-03-04 06:09:22,离岸人民币兑美元较周一纽约尾盘跌184点
同花顺,2026-03-04 06:06:56,紫金矿业成交额达100亿元
财联社,2026-03-04 06:04:25,伊朗称打击以色列中部及北部多处军事目标
同花顺,2026-03-04 06:03:21,华峰超纤：3月9日起对超纤基布统一上调1元/米-4元/米
财联社,2026-03-04 06:02:09,以军称已完成对约60个黎巴嫩真主党目标的打击行动
同花顺,2026-03-04 06:02:00,冯远征：AI抢不了好演员的饭碗
同花顺,2026-03-04 06:01:44,ETF两市成交额超5000亿元
同花顺,2026-03-04 06:00:57,中东动荡持续，迪拜主要股指早盘下跌4.7%
财联社,2026-03-04 06:00:07,周三（3月4日）重点关注财经事件和经济数据
财联社,2026-03-04 06:00:00,周三你需要知道的隔夜全球要闻：中东冲突持续，法国“戴高乐”号航母将部署在地中海，COMEX白银期货大跌超7%
同花顺,2026-03-04 05:49:01,上期所原油主力合约日内再度触及涨停
同花顺,2026-03-04 05:45:57,电网设备板块午后再度拉升，汇金通等近10股涨停
同花顺,2026-03-04 05:35:21,中国必将是外商理想投资目的地 未来10多年中国中等收入群体可能超8亿
同花顺,2026-03-04 05:34:07,人大监督工作针对性实效性有效提升
同花顺,2026-03-04 05:33:44,泰国期货交易所（TFEX）宣布暂停股指期货、股指期权及个股期货的交易
同花顺,2026-03-04 05:32:54,ETF两市成交额超4500亿元
同花顺,2026-03-04 05:31:13,高盛将2026年第二季度布伦特原油平均价格预测上调10美元至76美元/桶
同花顺,2026-03-04 05:28:53,巴格达国际机场附近美国设施遭无人机袭击
同花顺,2026-03-04 05:24:46,大会发言人娄勤俭：中方高度关注伊朗局势
同花顺,2026-03-04 05:22:02,大会发言人：任何国家不能在世界上我行我素
同花顺,2026-03-04 05:20:49,泰国SET指数暴跌8%，触发停牌
财联社,2026-03-04 05:19:44,美联储卡什卡利：如果通胀降温 今年晚些时候再降息一到两次可能是合适的
同花顺,2026-03-04 05:17:14,ETF两市成交额超4000亿元
同花顺,2026-03-04 05:15:19,瑞华泰等成立前沿介电高分子材料创新中心公司
同花顺,2026-03-04 05:15:01,全国人大代表姚劲波：建议新购房贷利息纳入个税扣除
同花顺,2026-03-04 05:14:45,中央将出台更多惠港政策措施
财联社,2026-03-04 05:11:38,美国务卿称一架伊朗无人机击中美驻迪拜领事馆外停车场
同花顺,2026-03-04 05:11:32,澳新银行将第一季度末布伦特原油价格预测上调至每桶90美元
财联社,2026-03-04 05:11:00,伊拉克总理与黎巴嫩总统通话 谴责以军屡次袭击黎巴嫩
同花顺,2026-03-04 05:05:19,沪深京三市成交额超1.7万亿元，较上日此时缩量4025亿元
同花顺,2026-03-04 05:04:29,大会发言人谈中日关系：决不允许任何外部势力干涉中国内政
同花顺,2026-03-04 05:03:49,农化制品板块短线拉升，红太阳涨停
同花顺,2026-03-04 05:03:26,制定民族团结进步促进法 保证党对民族工作的全面领导
财联社,2026-03-04 05:00:47,利弗莫尔中概股龙头指数收跌3.67%
财联社,2026-03-04 05:00:27,美股三大指数集体收跌 费城半体指数跌4.58%
同花顺,2026-03-04 04:57:15,大会发言人：以国家立法保证党对民族工作的全面领导
同花顺,2026-03-04 04:46:06,中矿资源回应津巴布韦锂矿出口禁令：影响有限，正积极推进本地化加工
同花顺,2026-03-04 04:41:53,2025年是国产人形机器人技术突破关键一年
财联社,2026-03-04 04:36:01,以军称已摧毁300个伊朗导弹发射装置
同花顺,2026-03-04 04:35:28,伊朗称又击落6架美以军方无人机
财联社,2026-03-04 04:35:25,以军称已向伊朗投掷超4000枚炸弹
财联社,2026-03-04 04:34:43,伊拉克库区苏莱曼尼亚省传出爆炸声
同花顺,2026-03-04 04:30:31,大会发言人回应中美关系发展趋势：中美应相互尊重和平共处合作共赢
同花顺,2026-03-04 04:26:14,九丰能源成立能源发展公司，含石油天然气技术服务业务
同花顺,2026-03-04 04:20:43,我国今年将坚持扩大内需这个战略基点
同花顺,2026-03-04 04:15:37,“十五五”规划纲要草案将提请大会审查批准并公布实施
同花顺,2026-03-04 04:14:49,韩国KOSPI指数跌幅现收窄至约7%
同花顺,2026-03-04 04:14:17,知情人士：相关部门召开会议强化生猪产能综合调控
同花顺,2026-03-04 04:13:42,3月4日午间公告一览：今日为“赛龙转债”最后一个转股日 收市后未转股将强制赎回
财联社,2026-03-04 04:13:09,马克龙：美以对伊朗发起军事行动不符合国际法
财联社,2026-03-04 04:07:04,从伊朗撤离的25名中国公民经土库曼斯坦启程回国
同花顺,2026-03-04 04:02:48,泰国股市盘中跌7.7%
同花顺,2026-03-04 04:01:19,港股午评：恒生指数跌2.73%，恒生科技指数跌2.02%
财联社,2026-03-04 03:59:27,马克龙：法国“戴高乐”号航母将部署在地中海
同花顺,2026-03-04 03:54:10,大叶股份：地缘冲突事件对公司业务未产生重大影响
同花顺,2026-03-04 03:43:11,印度Sensex指数开盘下跌2.1%，报78528.82点
同花顺,2026-03-04 03:42:00,韩国KOSDAQ指数下跌13%
同花顺,2026-03-04 03:40:49,以色列袭击黎巴嫩造成至少10人死亡
同花顺,2026-03-04 03:39:52,金风科技在浙江成立风电国创科技公司
财联社,2026-03-04 03:35:44,国际原油期货结算价大幅收涨4.7%
同花顺,2026-03-04 03:35:25,港股恒生指数跌幅达3%
财联社,2026-03-04 03:34:21,美国驻阿联酋大使馆附近区域燃起大火并升起浓烟
同花顺,2026-03-04 03:32:17,印度卢比兑美元跌至纪录新低
同花顺,2026-03-04 03:31:49,ETF午评：标普油气ETF领涨4.11%，石油ETF领跌7.43%
同花顺,2026-03-04 03:31:43,ETF两市成交额3691.70亿元
同花顺,2026-03-04 03:31:18,A股午评：沪指半日跌1.43% 港口航运、燃气板块集体回调
同花顺,2026-03-04 03:30:55,日经225指数失守54000点，日内跌幅4.21%
同花顺,2026-03-04 03:30:43,中东跨境物流价格已翻2倍 货发不过去 中东跨境物流海外仓快断货
同花顺,2026-03-04 03:30:41,股指期货早盘收盘 主力合约全线下跌
同花顺,2026-03-04 03:29:22,伊朗媒体：最高领袖选举可能推迟到下周
同花顺,2026-03-04 03:28:35,上证50股指期货(IH)主力合约日内跌超2%
财联社,2026-03-04 03:25:05,特朗普称将切断贸易往来 西班牙回应：美国须尊重双边协定
同花顺,2026-03-04 03:20:22,报告：外卖价格战波及餐饮产业链，近7成餐饮店已集体要求上游供应链降价
财联社,2026-03-04 03:17:51,以军称打死负责黎巴嫩事务的伊朗革命卫队高级指挥官
同花顺,2026-03-04 03:17:42,首创期货：伊拉克或被动减产，油价继续暴涨
财联社,2026-03-04 03:16:47,在岸人民币兑美元较周一夜盘收盘跌135点
同花顺,2026-03-04 03:14:35,国台办：决不允许破坏两岸关系的人一边在大陆赚钱、一边干“吃饭砸锅”的事
财联社,2026-03-04 03:13:59,以军警告驻黎巴嫩的伊朗官员24小时内离开
同花顺,2026-03-04 03:13:57,蚂蚁集团联合清华大学发布开源强化学习训练框架AReaL v1.0稳定版
同花顺,2026-03-04 03:13:28,黎真主党武装对多处以军事基地发动袭击
财联社,2026-03-04 03:11:15,伊朗称开展“真实承诺-4”行动第16轮攻击
同花顺,2026-03-04 03:10:57,国台办：台湾问题是中国内政 完全是中国人自己的事
同花顺,2026-03-04 03:10:38,保险板块集体下挫，新华保险、中国人寿跌超5%
同花顺,2026-03-04 03:09:55,韩国执政党议会党团领袖：将于3月12日通过有关美国投资的法案
同花顺,2026-03-04 03:08:41,俄外交部副部长：拉夫罗夫已确定访华计划，相关工作正在落实
财联社,2026-03-04 03:06:40,已故伊朗最高领袖哈梅内伊的遗体将被安葬于马什哈德
财联社,2026-03-04 03:01:40,伊朗伊斯兰革命卫队：针对美以的行动将在更深层次和更广维度展开
财联社,2026-03-04 02:53:07,消息人士称伊朗新任最高领袖选举进入最后阶段
财联社,2026-03-04 02:44:48,特朗普称伊朗军事能力遭重创 否认被以色列“拖入战争”
同花顺,2026-03-04 02:34:48,石油主题LOF集体回调，全球油气能源LOF跌超8%
同花顺,2026-03-04 02:34:46,浙江印发指导意见 推进食品产业高质量发展
同花顺,2026-03-04 02:30:00,沪深京三市成交额超1.2万亿元，较上日此时缩量3727亿元
同花顺,2026-03-04 02:29:55,军工装备板块震荡冲高，航天彩虹涨停
同花顺,2026-03-04 02:26:31,中国移动发布全球首台超百T智算互联路由器样机
同花顺,2026-03-04 02:24:47,以军说摧毁伊朗约300个导弹发射器
同花顺,2026-03-04 02:24:24,国台办：希望广大台湾同胞共同推动两岸关系和平发展
同花顺,2026-03-04 02:23:35,国台办：只要民进党当局认同“九二共识” 两岸关系就能和平发展
同花顺,2026-03-04 02:19:03,国台办：春节期间两岸“小三通”航线持续平稳运行
同花顺,2026-03-04 02:18:36,华泰期货：白银短期偏中性看待 需追踪地缘影响以及流动性信号
同花顺,2026-03-04 02:18:10,韩国创业板指数KOSDAQ暴跌8%后，触发熔断机制
同花顺,2026-03-04 02:15:03,港股石油天然气板块持续下挫，中港石油跌超37%
同花顺,2026-03-04 02:13:48,现货黄金涨超2%
财联社,2026-03-04 02:13:29,伊朗称击落并控制一架以军“赫尔墨斯”无人机
同花顺,2026-03-04 02:13:06,中证500股指期货(IC)主力合约日内涨超1%
财联社,2026-03-04 02:10:49,OpenAI推出GPT‑5.3即时网站
同花顺,2026-03-04 02:10:46,沪深京三市成交额超1万亿元，较上日此时缩量2778亿元
同花顺,2026-03-04 02:09:52,现货黄金站上5180美元/盎司 纽约期金站上5190美元/盎司
同花顺,2026-03-04 02:09:17,韩国首尔综合指数（KOSPI）跌幅扩大至7%，报5385.79点
同花顺,2026-03-04 02:08:59,现货白银站上85美元/盎司
同花顺,2026-03-04 02:07:39,ETF两市成交额超1500亿元
财联社,2026-03-04 01:35:58,特朗普：将切断美国和西班牙之间的贸易往来
同花顺,2026-03-04 01:31:59,广期所多晶硅主力合约大跌5%
同花顺,2026-03-04 01:31:56,港股恒生指数跌幅达2%
同花顺,2026-03-04 01:30:30,2月我国制造业新动能呈现整体稳中有增态势
同花顺,2026-03-04 01:30:05,光纤概念股多数低开，通鼎互联跌停
同花顺,2026-03-04 01:29:58,国债期货开盘多数持平
财联社,2026-03-04 01:29:36,西班牙外交大臣：不担心拒绝美国使用军事基地会带来任何后果
同花顺,2026-03-04 01:29:05,港口航运板块多数回调，国航远洋跌超10%
同花顺,2026-03-04 01:28:19,上期所欧线集运、原油主力合约打开涨停板
