来源,时间,标题
财联社,2026-01-08 12:13:54,京东据悉考虑首次发行点心债券募集100亿元人民币
财联社,2026-01-08 12:08:56,2025年私募证券产品备案数量同比翻倍
财联社,2026-01-08 12:07:10,财联社1月8日午间新闻精选
财联社,2026-01-08 12:03:52,港股午评：恒生指数跌1.22% 恒生科技指数跌1.13%
财联社,2026-01-08 12:02:22,我国公开发布2025年度《中国空间站科学研究与应用进展报告》
财联社,2026-01-08 11:58:56,财联社C50风向指数调查：MLF与买断式逆回购或延续小额净投放 财政重心从总量加码向结构增效转型 
财联社,2026-01-08 11:51:07,也门南方过渡委员会领导人祖贝迪“逃往”阿联酋
财联社,2026-01-08 11:42:22,1月8日午间涨停分析
财联社,2026-01-08 11:41:40,摩根士丹利：全球基金12月增持中国股票 受被动型流入支撑
财联社,2026-01-08 11:35:14,吉利汽车获L3级自动驾驶道路测试牌照
财联社,2026-01-08 11:35:14,吉利汽车集团获杭州市全域L3级自动驾驶道路测试牌照
财联社,2026-01-08 11:33:57,【大佬持仓跟踪】数据中心+液冷+储能，布局涵盖HVDC、液冷CDU等智算中心产品，细分电源产品全球份额第五，这家公司储能产品在全球多个国家和地区交付落地
财联社,2026-01-08 11:33:27,阿里云发布多模态交互开发套件 可应用于AI眼镜、机器人等
财联社,2026-01-08 11:32:00,午评：沪指半日涨0.09% 商业航天、AI应用端全线走强
财联社,2026-01-08 11:31:53,国内期货主力合约多数下跌 焦煤涨超5%
财联社,2026-01-08 11:27:30,“钱塘号”火箭来了 国内首个海上回收复用火箭基地在钱塘开工
财联社,2026-01-08 11:13:15,AI应用端持续走高 汉得信息20cm涨停
财联社,2026-01-08 11:04:52,四川明确脑机接口医疗服务价格 置入费最高6583元/次
财联社,2026-01-08 11:01:31,蚂蚁阿福月活用户已达3000万
财联社,2026-01-08 11:00:32,国内金饰价格小幅回落
财联社,2026-01-08 11:00:27,财政部拟发行2026年记账式贴现（四期）国债
财联社,2026-01-08 10:57:08,沪深两市成交额突破1.5万亿 较上一日此时缩量超1000亿
财联社,2026-01-08 10:56:58,公安部：2025年立案侦办破坏环境资源犯罪案件3.7万起
财联社,2026-01-08 10:56:45,【风口研报·公司】考公赛道景气度高，这家行业公考龙头打造独特模式战略加速市占率提升，且AI技术全场景赋能，持续重塑行业格局
财联社,2026-01-08 10:55:42,主力资金监控：立讯精密净卖出超14亿
财联社,2026-01-08 10:53:19,智谱首席科学家唐杰：很快将推出新一代模型GLM-5
财联社,2026-01-08 10:50:13,2025年全国铁路旅客发送量超45亿人次
财联社,2026-01-08 10:47:12,进出口银行2025年新发放外贸领域贷款超1.2万亿元
财联社,2026-01-08 10:46:54,【盘中宝】高性能计算需求不断提升，带动该重要市场规模逐年增长，这家公司产品技术国内领先，多次打破海外垄断
财联社,2026-01-08 10:42:06,特朗普旗下加密企业World Liberty申请银行牌照 拟拓展30亿美元稳定币业务
财联社,2026-01-08 10:40:18,美国宣布停止对索马里政府所有支援
财联社,2026-01-08 10:38:23,中国半导体行业协会魏少军谈英伟达H200芯片：绝不动摇国产化道路信心与决心
财联社,2026-01-08 10:36:19,量子科技概念异动拉升 神州信息直线涨停
财联社,2026-01-08 10:26:32,国家“人工智能应用中试基地”签约共建 聚焦AI赋能高端装备制造体系
财联社,2026-01-08 10:26:10,《2025上海市“Al+制造”发展白皮书》正式发布
财联社,2026-01-08 10:25:41,陈茂波：香港今年经济应稳步前进 IPO集资额非常可能超越去年
财联社,2026-01-08 10:25:19,证券板块持续调整 华林证券触及跌停
财联社,2026-01-08 10:18:45,伊利股份：公司奶粉产品中ARA（花生四烯酸）目前没有问题
财联社,2026-01-08 10:15:49,委内瑞拉政府推进以经济发展和主权保护为核心的立法议程
财联社,2026-01-08 10:14:49,2025年全国共侦破电信网络诈骗案件25.8万起
财联社,2026-01-08 10:11:44,2025年全国公安机关共立刑事案件数同比下降12.8%
财联社,2026-01-08 10:10:19,沪深两市成交额突破1万亿 较上一日此时缩量超800亿
财联社,2026-01-08 10:04:50,脑机接口概念震荡回升 南京熊猫4连板
财联社,2026-01-08 10:04:45,国家体育总局体育器材装备中心原副主任王明晏接受纪律审查和监察调查
财联社,2026-01-08 10:02:34,工业和信息化部等部门联合召开动力和储能电池行业座谈会 部署规范产业竞争秩序工作
财联社,2026-01-08 10:01:25,苹果或2028年发布2亿像素iPhone 此前已维持主摄4800万像素数年
财联社,2026-01-08 10:00:01,“全球大模型第一股”智谱盘中一度转跌破发
财联社,2026-01-08 09:59:45,美国副总统万斯：符合美国的国家利益 委内瑞拉才能卖石油
财联社,2026-01-08 09:51:38,委内政部长：美国对委袭击已致100人死亡 包括平民
财联社,2026-01-08 09:51:10,AI应用端再度拉升 宝信软件涨停
财联社,2026-01-08 09:46:10,商业航天概念反复走强 银河电子4连板
财联社,2026-01-08 09:43:31,复星国际旗下智能科技集团翌耀科技启动上市辅导
财联社,2026-01-08 09:37:54,创新药概念延续强势 必贝特2连板
财联社,2026-01-08 09:36:38,部分港股新股大涨 精锋医疗涨超30%
财联社,2026-01-08 09:36:30,算力芯片概念盘初走强 海光信息涨近10%
财联社,2026-01-08 09:32:55,创业板指跌逾1% 下跌个股近3200只
财联社,2026-01-08 09:32:48,可控核聚变概念延续强势 弘讯科技2连板
财联社,2026-01-08 09:27:17,竞价看龙头
财联社,2026-01-08 09:27:11,电子气体概念大幅高开 三孚股份、和远气体封涨停
财联社,2026-01-08 09:26:08,三大指数集体低开
财联社,2026-01-08 09:25:37,【盘中宝】AI需求下有望迎来放量元年，谷歌、英伟达纷纷采用，该行业需求增量有望达百亿美元，这家企业在手订单充裕，客户包括字节、腾讯等
财联社,2026-01-08 09:25:35,合肥“十五五”规划建议：加快巨型星座组网建设 布局可回收复用液体火箭、差异化小火箭等整机产品和卫星服务网络
财联社,2026-01-08 09:25:12,合肥“十五五”规划建议：加快突破量子科技、人工智能、集成电路、先进材料、核心种源等重点领域关键核心技术
财联社,2026-01-08 09:23:03,合肥“十五五”规划建议：推进氢能、氨能等技术迭代应用 布局小型堆等先进核能技术
财联社,2026-01-08 09:22:14,合肥“十五五”规划建议：围绕“芯屏汽合”等重点方向 聚力推动主导产业壮大规模、增强优势
财联社,2026-01-08 09:04:49,三星：内存成本上涨 压力或将传导至消费电子产品售价
财联社,2026-01-08 09:01:52,高盛：美国2030年将面临电力危机
财联社,2026-01-08 09:00:53,国内期货主力合约涨跌不一 焦煤涨超6%
财联社,2026-01-08 08:53:07,【电报解读】ARM将扩大机器人芯片技术布局，机构称算力将成为人形机器人发展关键支撑点，这家公司加速推出面向具身智能机器人大小脑的SoC芯片
财联社,2026-01-08 08:47:57,两市融资余额增加249.65亿元
财联社,2026-01-08 08:44:40,中信证券：网下打新收益将继续维持稳态区间 2亿元规模的A类账户打新收益预计在3%~4%左右
财联社,2026-01-08 08:37:07,港股通标的即将调整 多只新经济与科技股有望被纳入
财联社,2026-01-08 08:21:07,【九点特供】120秒稳态运行，中国核聚变再突破！分析师预计未来3~5年将是核聚变项目投招标的高峰，这家公司产品应用于“人造太阳”EAST大科学工程装置；商务部决定对原产于日本的二氯二氢硅发起反倾销调查
财联社,2026-01-08 08:14:21,美国政府更新经济数据发布时间 2025全年GDP将在2月中旬出炉
财联社,2026-01-08 08:08:28,财联社1月8日早间新闻精选
财联社,2026-01-08 08:05:55,特朗普：与哥伦比亚总统讨论毒品问题 未来将在白宫会晤
财联社,2026-01-08 08:01:07,科学家实现城市大气微纳塑料量化研究
财联社,2026-01-08 07:59:33,中信建投：2026年炼油、页岩油、天然气领域凸显红利
财联社,2026-01-08 07:55:14,美国司法部起诉加州两座禁止使用天然气的城市
财联社,2026-01-08 07:43:28,【点金互动易】服务器液冷+脑机接口，拟并购企业服务英伟达、英特尔等算力巨头，产品包括UQD、光模块冷板等服务器液冷核心硬件，这家公司与脑机接口独角兽战略合作
财联社,2026-01-08 07:39:39,投资日历：周四资本市场大事提醒
财联社,2026-01-08 07:35:53,医保便捷支付体系力争3年左右建成
财联社,2026-01-08 07:34:54,加拿大前副总理克里斯蒂娅·弗里兰宣布辞去国会议员
财联社,2026-01-08 07:32:25,A股限售股解禁一览：98.03亿元市值限售股今日解禁
财联社,2026-01-08 07:23:57,哥伦比亚总统与美国总统通电话
财联社,2026-01-08 07:17:58,卡特彼勒与英伟达扩大合作
财联社,2026-01-08 07:02:03,【研选】Starlink在全球7大洲连接超过900万活跃用户，手机直连卫星业务初具规模，即将进入高速发展阶段；心血管器械龙头，短期医美板块开拓新增长曲线，产品布局覆盖童颜针、水光针等
财联社,2026-01-08 07:01:24,2026年港股IPO募资规模有望突破3000亿港元
财联社,2026-01-08 06:39:12,三星电子录得创纪录利润 AI需求猛增推动内存芯片价格大涨
财联社,2026-01-08 06:37:35,机构称2026年铜市上行趋势明朗
财联社,2026-01-08 06:36:30,看好中国经济 外资机构释放积极信号
财联社,2026-01-08 06:35:08,全力以赴稳增长 央企下好“先手棋”
财联社,2026-01-08 06:34:31,FOF供求两旺 基金发行“开门红”
财联社,2026-01-08 06:32:20,耐心资本布局硬科技 社保科创基金多地落子
财联社,2026-01-08 06:30:43,股基提前结募 债基屡现赎回 机构：后续增量资金入市可期
财联社,2026-01-08 06:29:11,促消费扩投资“双引擎”发力 各地瞄准扩大内需激活经济
财联社,2026-01-08 06:28:22,早部署、快投放、重质量 银行开年信贷“加速跑”
财联社,2026-01-08 06:27:33,央行今日开展1.1万亿元买断式逆回购
财联社,2026-01-08 06:22:37,美联储1月维持利率不变的概率为88.4%
财联社,2026-01-08 06:14:13,伊朗外交部就美干涉主义立场发表声明
财联社,2026-01-08 06:07:11,特朗普指示美国退出“不符合该国利益”的66个国际组织
财联社,2026-01-08 06:02:54,委代理总统召开工作会议 强调营救马杜罗夫妇等
财联社,2026-01-08 06:00:20,周四（1月8日）重点关注财经事件和经济数据
财联社,2026-01-08 06:00:00,周四你需要知道的隔夜全球要闻：美国务卿称下周将就格陵兰岛议题与丹麦举行会谈，泽连斯基称有望在2026年上半年结束俄乌冲突，欧美股市多数下跌
财联社,2026-01-08 05:32:08,白宫：被扣油轮上船员可能被带到美国接受审判
财联社,2026-01-08 05:20:08,特朗普称2027年美军事预算应是1.5万亿美元
财联社,2026-01-08 05:14:24,AZZ第三季度销售额4.257亿美元 高于市场预期
财联社,2026-01-08 05:11:43,委内瑞拉民众举行大规模游行 要求释放马杜罗
财联社,2026-01-08 05:07:30,科特迪瓦总统瓦塔拉批准总理和政府辞职
财联社,2026-01-08 05:07:03,以总理：特朗普已为以方对黎真主党发动新一轮军事行动“开绿灯”
财联社,2026-01-08 05:00:31,热门中概股多数下跌 纳斯达克中国金龙指数跌1.58%
财联社,2026-01-08 05:00:18,美股三大指数收盘涨跌不一 谷歌2019年以来首次市值超苹果公司
财联社,2026-01-08 05:00:18,美股三大指数收盘涨跌不一 英特尔涨超6%
财联社,2026-01-08 04:26:59,美能源部长宣称将“无限期”控制委内瑞拉石油销售
同花顺,2026-01-08 04:11:53,淘宝闪购非餐订单已稳定在日均1000万单
同花顺,2026-01-08 04:01:42,LumiMind于CES发布实时调控脑电睡眠仪，计划今年上半年上市
同花顺,2026-01-08 04:01:24,应用成果持续涌现！中国空间站2025年“工作总结”出炉
同花顺,2026-01-08 03:56:24,沙特主导联军：也门南方过渡委员会领导人经索马里前往阿联酋
同花顺,2026-01-08 03:54:31,全运会澳门赛区筹备办总结：最大收获是推动粤港澳三地协作
同花顺,2026-01-08 03:45:29,一图看懂中信证券出现大额压单后的指数走势
同花顺,2026-01-08 03:38:17,日经225指数日内跌幅扩大至1%
同花顺,2026-01-08 03:37:40,南向资金净买入超30亿港元
同花顺,2026-01-08 03:33:52,“收到钱了”，帮扶祥源控股集团工作组开启资金预清退，比例为投资本金5%
同花顺,2026-01-08 03:32:30,期货午评：冰火两重天！欧线集运闪崩vs焦煤涨停 地缘风险发酵
同花顺,2026-01-08 03:31:43,股指期货早盘收盘
同花顺,2026-01-08 03:31:19,A股午评：沪指半日微涨0.09%，脑机接口、商业航天板块再度爆发
同花顺,2026-01-08 03:30:51,ETF午评：军工龙头ETF领涨4.57%，证券ETF龙头领跌2.48%
同花顺,2026-01-08 03:30:26,ETF两市成交额3236.73亿元
同花顺,2026-01-08 03:26:58,国内多家金店金饰价格多数持稳，最高报1398元/克
财联社,2026-01-08 03:26:06,泽连斯基称有望在2026年上半年结束俄乌冲突
同花顺,2026-01-08 03:22:48,元旦过后机票价格大跳水 广州出发机票低至两百多
同花顺,2026-01-08 03:18:11,上期所纸浆主力合约跌超2%
同花顺,2026-01-08 03:17:45,奇瑞汽车在上海成立纵横无界汽车公司
同花顺,2026-01-08 03:17:29,上期所沪镍主力合约跌超3%
同花顺,2026-01-08 03:17:29,上期所沪镍主力合约跌超3%，沪锡主力合约跌超2%
同花顺,2026-01-08 03:17:28,沪深京三市成交额超1.7万亿元，较上日此时缩量747亿元
同花顺,2026-01-08 03:17:16,上期所沪锡主力合约跌超2%
同花顺,2026-01-08 03:17:10,菲仕兰回应雀巢奶粉召回：未从涉事供应商采购原料、未使用涉事问题ARA
同花顺,2026-01-08 03:16:56,工业硅期货主力合约跌超2%，一看跌期权合约暴涨407.14%
同花顺,2026-01-08 03:16:52,协鑫能科与印尼国家石油电力公司签署谅解备忘录
同花顺,2026-01-08 03:16:50,沪铅期货主力合约跌超2%，一看跌期权合约暴涨139.29%
同花顺,2026-01-08 03:16:49,中国卫星成交额达100亿元
同花顺,2026-01-08 03:16:45,广期所工业硅主力合约跌超2%
同花顺,2026-01-08 03:16:40,上期所沪铅主力合约跌超2%
同花顺,2026-01-08 03:14:41,氧化铝期货主力合约跌超2%，一看跌期权合约大涨89.47%
同花顺,2026-01-08 03:14:36,上期所氧化铝主力合约跌超2%
财联社,2026-01-08 03:10:40,特朗普向国防承包商回购股票的做法发出威胁
同花顺,2026-01-08 03:09:41,影视传媒、AI智能体等AI应用方向持续走强，汉得信息20cm涨停
同花顺,2026-01-08 03:09:17,印尼股市首次突破9000点，涨幅达0.65%
同花顺,2026-01-08 03:07:07,沪深京三市成交额超1.6万亿元，较上日此时缩量990亿元
同花顺,2026-01-08 03:06:55,万斯称符合美利益委内瑞拉才能卖油
同花顺,2026-01-08 03:06:17,宜家中国回应关店
同花顺,2026-01-08 03:05:58,沪铝期货主力合约跌超2%，一看跌期权合约暴涨300.0%
财联社,2026-01-08 02:34:18,特朗普质疑北约在美国需要时会否给予支持
同花顺,2026-01-08 02:33:05,培育钻石、超硬材料板块盘中拉升，黄河旋风涨停
同花顺,2026-01-08 02:32:18,上期所原油主力合约日内跌幅达2%
同花顺,2026-01-08 02:31:15,甲醇期货主力合约跌超2%，一看跌期权合约暴涨133.33%
同花顺,2026-01-08 02:31:11,马棕油早盘开盘行情
同花顺,2026-01-08 02:30:33,现货黄金失守4440美元/盎司
财联社,2026-01-08 02:28:41,古特雷斯与委常驻联合国代表举行会晤
同花顺,2026-01-08 02:26:48,ETF两市成交额超2000亿元
同花顺,2026-01-08 02:25:55,证券板块震荡走低，华林证券触及跌停
同花顺,2026-01-08 02:24:19,沪深京三市成交额超1.2万亿元，较上日此时缩量1155亿元
同花顺,2026-01-08 02:23:59,脑机接口板块持续走强，爱朋医疗20cm涨停创新高
同花顺,2026-01-08 02:09:06,沪深京三市成交额超1万亿元，较上日此时缩量840亿元
同花顺,2026-01-08 02:08:59,郑商所玻璃主力合约涨超3%
同花顺,2026-01-08 02:06:42,南向资金净买入超20亿港元
同花顺,2026-01-08 02:05:44,ETF两市成交额超1000亿元
同花顺,2026-01-08 02:02:20,沪指盘中转涨
同花顺,2026-01-08 02:01:53,工业和信息化部等部门联合召开动力和储能电池行业座谈会，部署规范产业竞争秩序工作
同花顺,2026-01-08 02:01:25,开盘半小时 沪深京三市成交额达8713亿元
同花顺,2026-01-08 02:00:53,港股半导体板块走高，华虹半导体涨超5%
同花顺,2026-01-08 01:59:01,科创50指数涨幅扩大至2%，半导体、国产算力产业链持续走强
同花顺,2026-01-08 01:52:08,“全球大模型第一股”智谱盘中转跌破发
同花顺,2026-01-08 01:50:53,沪深京三市成交额超7000亿元，较上日此时缩量682亿元
同花顺,2026-01-08 01:48:51,短剧游戏、传媒等AI应用方向延续活跃，东方明珠2连板
同花顺,2026-01-08 01:47:33,玻璃期货主力合约涨超2%，一看涨期权合约涨29.63%
同花顺,2026-01-08 01:47:13,ETF两市成交额超500亿元
同花顺,2026-01-08 01:43:43,港股大金融板块盘初下挫，华泰证券等股跌超3%
同花顺,2026-01-08 01:43:39,棕榈油期货主力合约涨超2%，一看涨期权合约暴涨200.0%
同花顺,2026-01-08 01:43:31,大商所棕榈油主力合约涨超2%
同花顺,2026-01-08 01:42:23,港股恒生指数跌幅达1%
同花顺,2026-01-08 01:41:57,沪深京三市成交额超5000亿元，较上日此时缩量688亿元
同花顺,2026-01-08 01:39:57,COMEX铜期货涨超1%
同花顺,2026-01-08 01:39:50,LME铜主力合约涨超1%
同花顺,2026-01-08 01:38:06,半导体板块盘初走强，中科蓝讯、海光信息大涨超10%
同花顺,2026-01-08 01:37:03,科创50ETF涨超1%，一看涨期权合约涨17.20%
同花顺,2026-01-08 01:37:02,创新药板块表现活跃，必贝特盘中创新高
同花顺,2026-01-08 01:35:38,可控核聚变板块盘初拉升，华菱线缆等股创新高
同花顺,2026-01-08 01:34:04,证券板块短线走低，华林证券跌超7%
同花顺,2026-01-08 01:33:11,工业母机板块盘初走强，弘讯科技、中国一重2连板
同花顺,2026-01-08 01:32:02,创业板指跌1%
同花顺,2026-01-08 01:31:15,股指期货早盘开盘
财联社,2026-01-08 01:21:10,美国会众议长：白宫正通过外交渠道处理格陵兰岛问题
财联社,2026-01-08 01:12:09,WTI原油期货跌幅扩大至2%
同花顺,2026-01-08 01:09:18,国防部：爱好和平的国家和人民应共同捍卫战后国际秩序
同花顺,2026-01-08 01:09:13,碳酸锂期货主力合约涨超2%，一看涨期权合约大涨69.64%
同花顺,2026-01-08 01:08:14,广期所碳酸锂主力合约涨超2%
同花顺,2026-01-08 01:07:00,LME镍主力合约涨超1%
同花顺,2026-01-08 01:06:45,国防部：中方与地区国家共同将南海打造成和平、友谊、合作之海
同花顺,2026-01-08 01:03:35,合成橡胶期货主力合约涨超4%，一看涨期权合约暴涨445.0%
同花顺,2026-01-08 01:03:22,沪镍期货主力合约跌超2%，一看跌期权合约大涨63.29%
同花顺,2026-01-08 01:01:12,多晶硅期货主力合约跌超3%，一看跌期权合约暴涨380.0%
财联社,2026-01-08 01:00:55,英国证实参与美国北大西洋扣押油轮行动
同花顺,2026-01-08 01:00:45,沪银期货主力合约跌超4%，一看跌期权合约涨22.41%
同花顺,2026-01-08 01:00:41,沪铜期货主力合约跌超2%，一看跌期权合约涨32.72%
同花顺,2026-01-08 01:00:28,广期所钯主力合约跌超2%
同花顺,2026-01-08 01:00:22,富时中国A50指数期货盘初跌0.50%
同花顺,2026-01-08 01:00:05,期市早盘开盘，国内期货主力合约多数下跌
同花顺,2026-01-08 00:57:16,云从科技签约可信交易项目
同花顺,2026-01-08 00:57:02,韩国KOSPI指数涨幅扩大至1%
同花顺,2026-01-08 00:54:53,俄谴责美扣押油轮 称其无权在公海动武
财联社,2026-01-08 00:47:31,美国务卿：下周将就格陵兰岛议题与丹麦举行会谈
同花顺,2026-01-08 00:47:31,两市融资余额较上日增加249.65亿元
财联社,2026-01-08 00:43:37,欧洲主要股指多数收跌 英国富时100指数跌0.74%
同花顺,2026-01-08 00:30:35,美联储1月议息预测：维持不变的概率92%
同花顺,2026-01-08 00:30:13,福特拟2028年推出L3级驾驶辅助系统
同花顺,2026-01-08 00:30:03,中金：看好保险、固收+、私募基金的资金流向增量
同花顺,2026-01-08 00:23:51,5年期日本国债收益率下跌3.0个基点，至1.550%
同花顺,2026-01-08 00:23:31,驻琼央企资产总额破万亿元
财联社,2026-01-08 00:20:39,乌美代表团在巴黎举行新一轮磋商
同花顺,2026-01-08 00:07:52,OpenAI设立500亿美元员工股票奖励池
同花顺,2026-01-08 00:03:59,中国科学家开发半自动显微分析方法 首次实现对环境样品中小至200纳米塑料颗粒的有效定量
同花顺,2026-01-08 00:03:51,日韩股市集体低开
财联社,2026-01-08 00:02:48,委外长称该国重要科研中心在美军袭击中彻底损毁
财联社,2026-01-08 00:00:13,俄罗斯要求美方尊重“水手”号油轮上的俄公民权益
同花顺,2026-01-07 23:45:41,委内瑞拉加拉加斯机场恢复运营 袭击影响仍未消散
财联社,2026-01-07 23:39:45,精锋医疗香港IPO公开发售部分获1091.94倍认购
同花顺,2026-01-07 23:39:41,美总统特朗普与哥伦比亚总统佩特罗通电话 通话持续15分钟
同花顺,2026-01-07 23:39:36,陈茂波称香港今年IPO融资规模很可能超越2025年
同花顺,2026-01-07 23:35:32,加拿大前副总理弗里兰宣布辞去国会议员
同花顺,2026-01-07 23:34:57,看病缴费不用等！医保便捷支付体系力争3年左右建成
同花顺,2026-01-07 23:33:22,渣打银行：超配中国股票、黄金
财联社,2026-01-07 23:32:33,广联航空：天津跃峰作为天兵科技天龙三号核心供应商 为其承担整箭贮箱及部分结构件的制造任务
同花顺,2026-01-07 23:31:46,小摩据悉切断与所有代理顾问合作，启用自有AI平台决策
同花顺,2026-01-07 23:31:12,美州长就移民及海关执法局所涉枪击事件举行新闻发布会
财联社,2026-01-07 23:30:33,美国上周EIA原油库存减少383万桶
同花顺,2026-01-07 23:28:56,华泰证券：多重需求共振下阀门国产替代加速
财联社,2026-01-07 23:28:40,美股炼油商和油轮股上涨
同花顺,2026-01-07 23:25:36,北京气温骤降 周末或达冰点
同花顺,2026-01-07 23:20:27,美能源部长称将无限期控制委石油销售
同花顺,2026-01-07 23:17:19,CME“美联储观察”：美联储1月降息25个基点的概率为11.6%，维持利率不变的概率为88.4%
同花顺,2026-01-07 23:15:24,具身机器人也有自己的保单 险企竞逐机器人保险业务
同花顺,2026-01-07 23:13:51,长单溢价飙升 供需博弈加剧 机构称2026年铜市上行趋势明朗
财联社,2026-01-07 23:13:27,超捷股份：可回收趋势可能通过“高频发射+维护更新”双轮驱动为公司创造新的业务增长点
财联社,2026-01-07 23:12:53,弘阳地产：2025年累计合约销售金额为43.3亿元
财联社,2026-01-07 23:10:24,俄交通部确认美军登船 称与“马里涅拉号”失去联系
同花顺,2026-01-07 23:05:53,全球最大的黄金ETF SPDR Gold Trust持仓较前日持平
同花顺,2026-01-07 23:05:50,全球最大的白银ETF iShares Silver Trust持仓量较前日减少18.33吨
同花顺,2026-01-07 23:05:41,人民日报再发钟才平文章：向新向优发展，中国经济向好
财联社,2026-01-07 23:04:59,上交所：对亚辉龙及有关责任人予以监管警示
财联社,2026-01-07 23:02:27,国内商品期市夜盘收盘多数上涨 黑色系涨幅居前
财联社,2026-01-07 23:01:13,美国11月职位空缺降至一年多以来最低水平
财联社,2026-01-07 23:00:54,美国10月工厂订单环比下降1.3% 预估为下降1.2%
财联社,2026-01-07 23:00:23,美国12月服务业扩张速度为一年多来最快 新订单大幅增长
同花顺,2026-01-07 23:00:15,赎回新规“靴子落地”，公募债基或顺势重构生态圈
财联社,2026-01-07 22:58:40,上交所：对英集芯及时任董秘吴任超予以监管警示
财联社,2026-01-07 22:58:40,上交所：对英集芯及有关责任人予以监管警示
财联社,2026-01-07 22:47:17,老挝公布最新国家社会经济发展五年计划
同花顺,2026-01-07 22:46:52,推进国际化打造一流投行 广发证券“双轮”募资超60亿港元
同花顺,2026-01-07 22:46:47,银行取消手机盾业务将成趋势
同花顺,2026-01-07 22:46:40,港股通标的即将调整，多只新经济与科技股有望被纳入
同花顺,2026-01-07 22:46:30,文华东方完成资产出售 将私有化退市
财联社,2026-01-07 22:46:10,美国欧洲司令部：扣押俄罗斯油轮行动系执行美国总统令
同花顺,2026-01-07 22:40:07,三星电子第四季度营业利润20万亿韩元，预估17.84万亿韩元
财联社,2026-01-07 22:39:02,亚辉龙：与脑机星链合作产品尚未取得注册证 预计最早产生收益时间不早于2026年11月
财联社,2026-01-07 22:32:23,纳斯达克中国金龙指数跌0.51%
