来源,时间,标题
财联社,2026-01-07 06:00:00,周三你需要知道的隔夜全球要闻：道指、标普500指数均创历史收盘新高，特朗普称若输中期选举可能被弹劾，特朗普考虑动用美军等“一系列选项”获取格陵兰岛
同花顺,2026-01-07 05:57:55,山东聚力打造具有国际竞争力的航空维修产业集群
财联社,2026-01-07 05:57:09,委内瑞拉代总统：委未受外部势力统治
同花顺,2026-01-07 05:55:19,TikTok Shop 2025年GMV近千亿美元
同花顺,2026-01-07 05:53:52,微信员工辟谣封号新规：从未发布，黑灰产团伙编造借口
同花顺,2026-01-07 05:49:52,港股券商股午后下探，国泰君安国际跌超5%
同花顺,2026-01-07 05:47:08,现货白银大跌逾5%
同花顺,2026-01-07 05:46:42,富时中国A50指数期货跌1%
同花顺,2026-01-07 05:45:44,互联网金融板块持续走低，国源科技跌超10%
同花顺,2026-01-07 05:34:56,蔚来创始人：建议大家早买车 2025年最大的成本压力不是原材料，而是内存
同花顺,2026-01-07 05:34:33,沪深京三市成交额超2.2万亿元，较上日此时放量864亿元
同花顺,2026-01-07 05:27:01,A股三大指数午后全线翻绿
同花顺,2026-01-07 05:26:28,脑机接口板块午后跳水，诚益通等股跌超10%
同花顺,2026-01-07 05:24:07,港股煤炭股持续走强，飞尚无烟煤大涨38%
同花顺,2026-01-07 05:23:37,ETF两市成交额超3000亿元
同花顺,2026-01-07 05:18:51,算力租赁板块震荡攀升，大位科技、润建股份双双涨停
同花顺,2026-01-07 05:14:07,沪深京三市成交额超2万亿元，较上日此时放量571亿元
同花顺,2026-01-07 05:12:54,食品饮料板块午后冲高，养元饮品涨停
财联社,2026-01-07 05:11:25,英法将在俄乌和平协议达成后向乌克兰部署部队
同花顺,2026-01-07 05:10:31,港股科网股多数下挫，阿里巴巴跌超4%
财联社,2026-01-07 05:07:33,特朗普政府正在讨论获取格陵兰岛的方案 包括军事选项
同花顺,2026-01-07 05:06:42,南向资金净买入超40亿港元
同花顺,2026-01-07 05:06:36,港股恒生科技指数跌幅达2%
同花顺,2026-01-07 05:06:28,福建本地股午后拉升，厦门港务触及涨停
财联社,2026-01-07 05:00:34,热门中概股涨跌不一 纳斯达克中国金龙指数跌0.78%
财联社,2026-01-07 05:00:23,美股三大指数集体收涨 道指、标普500指数均创历史收盘新高
同花顺,2026-01-07 04:56:55,今年我国适度宽松货币政策将聚焦这些领域
同花顺,2026-01-07 04:53:36,国内碳酸锂、沪镍期货远期合约齐破15万元关口
财联社,2026-01-07 04:51:22,以军称在黎巴嫩南部打死两名真主党成员
同花顺,2026-01-07 04:48:16,布伦特原油失守60美元/桶
同花顺,2026-01-07 04:46:18,隆基绿能在鄂尔多斯成立新公司 含太阳能发电相关业务
同花顺,2026-01-07 04:45:56,印尼东爪哇省塞梅鲁火山喷发 火山灰柱高约900米
财联社,2026-01-07 04:36:34,“意愿联盟”达成共识 敲定对乌战后安全保障方案
同花顺,2026-01-07 04:35:51,武汉GDP预计增长6%左右 创近四年最高增速
同花顺,2026-01-07 04:33:32,日经225指数下跌1%
同花顺,2026-01-07 04:18:59,川航、五粮液持股公司成立智慧飞行航空服务公司
同花顺,2026-01-07 04:10:34,韩国KOSPI指数回吐涨幅
同花顺,2026-01-07 04:09:55,已完成300例脑机接口手术？三博脑科：假的
同花顺,2026-01-07 04:06:54,2025年全国居民健康素养水平达到33.69%
同花顺,2026-01-07 04:06:33,深圳推进电动自行车“全链条”监管闭环
同花顺,2026-01-07 04:02:56,雀巢回应在多国召回奶粉
财联社,2026-01-07 04:02:08,XAI称在E轮融资筹集200亿美元
财联社,2026-01-07 04:01:41,美以叙三方就巴黎会谈发表联合声明
同花顺,2026-01-07 04:01:23,港股午评：恒生科技指数跌1.65%，恒生指数跌1.01%
同花顺,2026-01-07 04:00:00,1月7日午间公告一览：潜能恒信QK18-9-7井1月7日正式启航出海开展钻井作业
同花顺,2026-01-07 03:59:51,华天酒店：副董事长、副总裁邓永平因个人原因辞职
财联社,2026-01-07 03:56:33,布伦特原油期货跌幅扩大至2%
同花顺,2026-01-07 03:55:18,大为股份：公司积极推进LPDDR5认证与试产工作
财联社,2026-01-07 03:51:40,法英乌签署意向声明 拟于俄乌停火后向乌派驻多国部队
同花顺,2026-01-07 03:46:27,国内首条二维半导体工程化示范工艺线在沪点亮，计划今年6月正式通线
财联社,2026-01-07 03:43:31,北欧五国外长就格陵兰岛问题发表联合声明
同花顺,2026-01-07 03:43:28,李在明在上海出席“中韩创新创业论坛”：期待两国创新人才常来常往
财联社,2026-01-07 03:40:17,特朗普：若输中期选举 我可能被弹劾
同花顺,2026-01-07 03:37:09,沙特宣布向外国投资者全面开放资本市场
财联社,2026-01-07 03:32:31,新疆喀什地区塔什库尔干县附近发生5.1级左右地震
财联社,2026-01-07 03:32:14,国际原油期货结算价收跌
同花顺,2026-01-07 03:31:30,国内多家金店金饰价格集体上涨，最高报1402元/克
同花顺,2026-01-07 03:30:58,A股午评：沪指半日涨0.29%逼近4100点，稀土、半导体设备板块涨幅居前
同花顺,2026-01-07 03:24:20,煤炭板块短线拉升，安泰集团直线涨停
同花顺,2026-01-07 03:22:45,ETF两市成交额超2500亿元
同花顺,2026-01-07 03:22:10,沪深京三市成交额超1.8万亿元，较上日此时放量499亿元
同花顺,2026-01-07 03:18:30,大商所焦煤主力合约触及涨停
同花顺,2026-01-07 03:17:04,动力型磷酸铁锂价格较上一工作日上涨250元
同花顺,2026-01-07 03:10:30,以色列称与叙利亚恢复外交对话
财联社,2026-01-07 03:10:23,委内瑞拉国民警卫队称已在全国范围内部署兵力
同花顺,2026-01-07 03:09:58,国台办：和平是两岸同胞的共同追求 统一是台湾前途的唯一方向
同花顺,2026-01-07 03:08:36,旅游及酒店板块震荡走高，君亭酒店涨超10%
同花顺,2026-01-07 03:06:37,沪深京三市成交额超1.7万亿元，较上日此时放量455亿元
同花顺,2026-01-07 03:01:22,光刻胶板块持续走高，雅克科技涨停
同花顺,2026-01-07 02:54:26,全球DRAM市场经历“史上最强”涨价周期
同花顺,2026-01-07 02:53:50,黄仁勋回应H200何时售往中国：正加快生产，等待许可的最终细节敲定
同花顺,2026-01-07 02:53:13,高德扫街榜首度引入世界模型，用户规模突破6.6亿
同花顺,2026-01-07 02:41:13,沪深京三市成交额超1.5万亿元，较上日此时放量638亿元
同花顺,2026-01-07 02:35:44,杨元庆：新一轮算力浪潮将源于AI推理的爆发
同花顺,2026-01-07 02:33:18,稀土永磁概念震荡拉升，中稀有色涨停
同花顺,2026-01-07 02:31:54,30年期国债期货一度跌至110.47元 创调整以来新低
同花顺,2026-01-07 02:30:53,国投白银LOF（161226）开盘快速上涨超3%
同花顺,2026-01-07 02:25:34,和府捞面回应被指预制：中央厨房统一制作，不属于预制菜
同花顺,2026-01-07 02:21:50,2026年适度宽松的货币政策将着力服务经济高质量发展
财联社,2026-01-07 02:19:40,现货黄金日内涨幅扩大至1%
同花顺,2026-01-07 02:19:18,韩国股市升至纪录高位，芯片、汽车板块领涨
同花顺,2026-01-07 02:19:01,两部门推进水上解纷“一站式”服务，提出六项具体任务
同花顺,2026-01-07 02:17:29,沪深京三市成交额超1.2万亿元，较上日此时放量419亿元
同花顺,2026-01-07 02:13:29,医疗研发外包板块走高，益诺思涨停
财联社,2026-01-07 02:08:58,南非总统：“完全反对”美对委军事行动
同花顺,2026-01-07 02:07:39,深圳多方面发力推动外贸产品出海
财联社,2026-01-07 02:03:20,巴西12月铁矿石出口量为4024万吨 高于2024年同期的3057万吨
同花顺,2026-01-07 02:02:08,铜缆高速连接概念股持续上扬，通宇通讯盘中创新高
同花顺,2026-01-07 02:01:00,小米新一代SU7 22.99万元起售
同花顺,2026-01-07 02:00:10,开盘半小时 沪深京三市成交额达9409亿元
同花顺,2026-01-07 01:56:49,半导体设备板块延续涨势，北方华创等股创出历史新高
同花顺,2026-01-07 01:55:24,意大利总理：支持乌克兰但不会向乌派兵
财联社,2026-01-07 01:54:36,现货白银日内涨超6%
同花顺,2026-01-07 01:49:40,欧盟呼吁以色列允许国际援助组织在加沙活动
同花顺,2026-01-07 01:48:22,可控核聚变板块持续上扬，远东股份、弘讯科技涨停
同花顺,2026-01-07 01:45:06,证券板块局部走高，华林证券涨停
财联社,2026-01-07 01:44:48,委内瑞拉总检察长强调马杜罗享有绝对豁免权
同花顺,2026-01-07 01:43:31,沪深京三市成交额超6000亿元，较上日此时放量683亿元
同花顺,2026-01-07 01:43:09,港股创新药概念股盘初走强，昭衍新药涨超6%
同花顺,2026-01-07 01:41:13,存储行情持续强劲，南方两倍做多海力士盘初大涨近10%
同花顺,2026-01-07 01:40:37,电网设备板块盘初走强，和顺电气、中国西电涨停
同花顺,2026-01-07 01:38:49,游戏、传媒等AI应用方向盘初走高，引力传媒、东方明珠双双涨停
同花顺,2026-01-07 01:38:20,黄仁勋、杨元庆官宣合作：推出“人工智能云超级工厂”
同花顺,2026-01-07 01:37:25,蓝箭航天在无锡成立分公司
同花顺,2026-01-07 01:37:03,房地产板块短线拉升，盈新发展涨停
同花顺,2026-01-07 01:36:19,NYMEX钯金主力合约跌幅扩大至3%
同花顺,2026-01-07 01:33:09,港股恒生科技指数跌幅达1%
同花顺,2026-01-07 01:32:17,金属镍板块盘初冲高，中伟股份涨超10%
同花顺,2026-01-07 01:30:18,科创50指数涨幅扩大至1%
同花顺,2026-01-07 01:29:27,港股镍金属概念股走强，力勤资源涨超8%
同花顺,2026-01-07 01:29:23,国债期货集体低开
同花顺,2026-01-07 01:28:58,脑机接口板块再度高开，美好医疗等股创新高
同花顺,2026-01-07 01:27:07,存储芯片板块高开，普冉股份20cm涨停
财联社,2026-01-07 01:21:37,纽约期银站上81美元/盎司
财联社,2026-01-07 01:14:57,现货铂金涨逾7%
财联社,2026-01-07 01:14:06,也门亚丁市传出激烈枪声
同花顺,2026-01-07 01:09:58,英伟达 CEO 黄仁勋回应游戏显卡太贵，不排除重启旧架构 GPU 以缓解市场压力
同花顺,2026-01-07 01:09:18,现货白银失守81美元/盎司
同花顺,2026-01-07 01:08:42,碳酸锂主力合约日内涨幅收窄至4%
同花顺,2026-01-07 01:06:42,上期所欧线集运主力合约涨幅扩大至7%
同花顺,2026-01-07 01:03:06,联想与英伟达合作开展“千兆瓦级人工智能工厂”项目
同花顺,2026-01-07 01:02:17,期市早盘开盘，国内期货主力合约多数上涨  沪镍涨停
同花顺,2026-01-07 01:02:01,上期所沪镍主力合约触及涨停
同花顺,2026-01-07 01:00:19,富时中国A50指数期货盘初跌0.02%
财联社,2026-01-07 01:00:04,古巴与委内瑞拉：美对委军事行动致约55名军人死亡
同花顺,2026-01-07 00:58:49,聚焦具身智能 汉威科技与征和工业签署战略合作协议
同花顺,2026-01-07 00:56:54,供需紧平衡预期提升碳酸锂“期现”价格开年大涨
同花顺,2026-01-07 00:47:43,两市融资余额较上日增加187.36亿元
同花顺,2026-01-07 00:47:11,铠侠股价在东京上涨15%
财联社,2026-01-07 00:45:24,王毅同芬兰外长瓦尔托宁通电话
财联社,2026-01-07 00:41:54,欧洲主要股指多数收涨 德国DAX30指数涨0.19%
同花顺,2026-01-07 00:39:34,旋极信息：网传公司持有深圳安创6.77%股权不属实
财联社,2026-01-07 00:35:46,沪镍主力合约触及涨停
财联社,2026-01-07 00:32:17,英伟达CFO：营收预期变得更加乐观
同花顺,2026-01-07 00:26:21,韩国综合股价指数连续第四天上涨 再创纪录新高
同花顺,2026-01-07 00:21:36,WTI原油失守56美元/桶
同花顺,2026-01-07 00:19:20,中国地震局对新疆喀什地区塔什库尔干县地震启动四级应急服务响应
同花顺,2026-01-07 00:11:25,黄仁勋回应能源问题：效率才是关键
同花顺,2026-01-07 00:08:13,雷军：新一代SU7豪华高性能纯电轿车预计4月份上市
同花顺,2026-01-07 00:03:44,小米汽车宣布，新一代SU7，预计2026年4月上市
同花顺,2026-01-07 00:01:40,日韩股市涨跌互现
同花顺,2026-01-07 00:00:18,委临时总统：委内瑞拉没有“外国代理人”
同花顺,2026-01-07 00:00:03,无人机飞越也门亚丁引发防空火力
财联社,2026-01-06 23:58:01,锦华新材：公司已向终端芯片客户交付电子级羟胺水溶液订单
同花顺,2026-01-06 23:57:05,特朗普据悉拟会晤石油高管，力促委内瑞拉产量复苏
同花顺,2026-01-06 23:44:48,委内瑞拉将为在美袭击中死亡军人举行7天哀悼
财联社,2026-01-06 23:43:36,美最高法院定于9日就关税问题作出裁决
同花顺,2026-01-06 23:37:09,苏州上舜科技股份有限公司、苏州长城精工科技股份有限公司、北京天圣华信息技术股份有限公司、江苏永康智能防务科技股份有限公司启动上市辅导
同花顺,2026-01-06 23:35:44,全球最大的白银ETF iShares Silver Trust持仓量较前日减少235.44吨
财联社,2026-01-06 23:33:48,俄罗斯就委内瑞拉局势发表声明
同花顺,2026-01-06 23:33:35,人民币汇率“涨声”不断 三类资产配置价值升温
同花顺,2026-01-06 23:33:10,新加坡交易所日经指数期货开盘报52120点，下跌520点
同花顺,2026-01-06 23:29:24,成为任期最长科技CEO，黄仁勋的秘诀是什么？
同花顺,2026-01-06 23:29:01,现货黄金站上4500美元/盎司
同花顺,2026-01-06 23:27:26,现货白银大涨超8%
同花顺,2026-01-06 23:25:56,商业航天主题指数实现八连阳 可回收技术的概念股获融资客青睐
同花顺,2026-01-06 23:19:32,聊天平台DISCORD据称秘密提交IPO申请
同花顺,2026-01-06 23:15:23,钯金期货日内涨1%，现报1904.50美元/盎司
同花顺,2026-01-06 23:14:32,人民日报和音：共同珍惜中韩关系向好发展态势
同花顺,2026-01-06 23:14:25,CME“美联储观察”：美联储1月降息概率18.3% 维持利率不变概率81.7%
同花顺,2026-01-06 23:11:54,股份制银行AIC多元投资项目密集落地
同花顺,2026-01-06 23:11:09,全球最大的黄金ETF SPDR Gold Trust持仓较前日增加2.00吨
同花顺,2026-01-06 23:10:40,芬兰总统：格陵兰岛问题“没有任何讨论空间”
同花顺,2026-01-06 23:02:40,2025年中国空间站在轨实施科学与应用项目新增31个
财联社,2026-01-06 23:01:32,国内商品期市夜盘多数上涨 黑色系领涨焦煤涨5.6%
财联社,2026-01-06 22:59:42,现货白银盘中涨幅扩大至5% 开年以来大涨12%
财联社,2026-01-06 22:59:40,美股稀土股集体走高
财联社,2026-01-06 22:53:27,杭州德适生物科技股份有限公司-B递表港交所
财联社,2026-01-06 22:49:40,数据中心冷却股集体下挫 受黄仁勋言论影响
财联社,2026-01-06 22:49:13,现货白银再次站上80美元/盎司
同花顺,2026-01-06 22:46:07,捷克总理：永远不会向乌克兰派遣士兵
财联社,2026-01-06 22:34:14,纳斯达克中国金龙指数涨0.35%
财联社,2026-01-06 22:30:53,纳指高开0.3%
财联社,2026-01-06 22:26:05,科大讯飞：讯飞星火对标A100的训练效率优化后达到85%-95%以上
财联社,2026-01-06 22:21:56,【金牌纪要库】太空光伏犹如电力之于地面AI算力，卫星电池片市场有望实现从百亿级向万亿级别跨越，为相关头部企业提供一个高附加值、高壁垒的“蓝海”市场
财联社,2026-01-06 22:20:07,科大讯飞：讯飞机器人超脑平台实现多项技术突破 与宇树、智元等形成广泛合作
财联社,2026-01-06 22:16:07,我国情绪消费市场规模超2万亿元
财联社,2026-01-06 22:15:54,比特币涨至9.4万美元上方 过去24小时内涨1.5%
同花顺,2026-01-06 22:14:57,“志愿联盟”承诺向乌克兰提供安全保障
财联社,2026-01-06 22:10:44,数据中心冷却股盘前下跌 受黄仁勋言论影响
财联社,2026-01-06 22:08:25,国内商品期货夜盘普涨 焦煤、沪镍大涨超5%
财联社,2026-01-06 22:05:25,德赛西威：目前已与多家知名机器人企业达成战略合作
财联社,2026-01-06 22:03:07,拓邦股份：公司与优必选在相关业务领域有较深的合作
财联社,2026-01-06 22:02:29,浙江世宝：目前无并购同行业企业计划
财联社,2026-01-06 22:00:35,脑机接口龙头三博脑科、爱朋医疗20CM2连板 10余家上市公司在互动易等平台回应相关业务
财联社,2026-01-06 21:58:05,东华软件：已和沐曦集成建立合作
财联社,2026-01-06 21:53:57,【公告全知道】商业航天+人形机器人+低空经济+军工+新能源车！公司商业航天火箭结构件业务已形成正式的合同订单
财联社,2026-01-06 21:50:58,【风口研报·洞察】英伟达推出自动驾驶开源模型，分析师看好这个环节天然适配L4+高级别自动驾驶，或是智能底盘制动技术的最终解决方案，2026有望迎来量产元年；定位当下AI产业链投资阶段
财联社,2026-01-06 21:50:43,河南：拟依托胖东来、蜜雪冰城等商业品牌打造20个商文旅融合消费新场景
同花顺,2026-01-06 21:50:42,美国众议院委员会将于1月13日就加速自动驾驶汽车部署的立法举行听证会
财联社,2026-01-06 21:46:31,消息人士：中方正研究收紧对日稀土出口许可审查
财联社,2026-01-06 21:43:13,财联社1月6日晚间新闻精选
财联社,2026-01-06 21:39:32,美联储理事米兰：美联储今年应降息超过100个基点
财联社,2026-01-06 21:35:07,蜂助手：高度重视商业航天与航空互联网发展机遇 明确将其作为第四条业务增长曲线进行布局
财联社,2026-01-06 21:33:01,亚辉龙：脑机星链成立时间短规模较小 技术路线与马斯克脑机接口公司Neuralink在技术路线上存在本质区别
财联社,2026-01-06 21:30:20,湖南鸣鸣很忙商业连锁股份有限公司通过港交所上市聆讯
同花顺,2026-01-06 21:30:06,埃塞俄比亚东北部发生车祸致22人死亡
财联社,2026-01-06 21:26:56,上交所对亚辉龙下发问询函 要求补充披露与脑机星链合作细节
财联社,2026-01-06 21:26:56,上交所对亚辉龙下发问询函
财联社,2026-01-06 21:24:49,沙特向各类外国投资者开放资本市场
财联社,2026-01-06 21:17:43,【财联社早知道】脑机接口“独角兽”强脑科技完成20亿元融资；全球首款无折痕面板来了！三星发布全新折叠屏OLED面板，这家公司已攻克折叠屏用OCA光学胶技术瓶颈并实现量产，且与三星、苹果有合作关系
财联社,2026-01-06 21:14:16,恒宝股份：控股股东钱京拟减持不超3%公司股份
财联社,2026-01-06 21:12:05,比亚迪去年在欧洲两大电动车市场销量超越特斯拉
同花顺,2026-01-06 21:10:51,特朗普政府正在讨论获取格陵兰岛的方案，包括军事选项
财联社,2026-01-06 21:07:28,今年6月起实施 国家疾控局发布8项疾控领域新标准
财联社,2026-01-06 20:59:13,高盛：看好欧股年内表现 低估值或引美国资金流入
财联社,2026-01-06 20:59:06,光启技术：已协助某商业航天卫星天线核心供应商开展大量研制验证测试工作
财联社,2026-01-06 20:58:09,ST福能：已向部分客户交付固态电池设备
同花顺,2026-01-06 20:39:37,欧洲理事会、欧盟委员会发布声明称，当天在法国巴黎举行的“意愿联盟”会议就为乌克兰提供强有力的战后安全保障达成共识
同花顺,2026-01-06 20:38:37,以色列耶路撒冷发生公交车冲撞行人事件，造成1死3伤
财联社,2026-01-06 20:36:14,新西兰医疗平台遭黑客入侵 超10万用户信息被盗
财联社,2026-01-06 20:35:02,特朗普说马斯克八成是超级天才
财联社,2026-01-06 20:34:46,法兴银行：荷兰养老金系统改革或使欧元区10s30s曲线陡化至75个基点
财联社,2026-01-06 20:32:46,NASA在2026财年的预算将达到244.4亿美元
财联社,2026-01-06 20:31:59,天赐材料：百吨级硫化锂及固态电解质中试线预计2026年下半年建成
财联社,2026-01-06 20:31:54,越秀资本：中科宇航是公司控股子公司越秀产业基金管理基金的投资企业之一
财联社,2026-01-06 20:30:44,福事特：与江西铜业签订战略合作协议
财联社,2026-01-06 20:28:23,联合国机构：美国干涉委内瑞拉“让每个国家变得更加不安全”
财联社,2026-01-06 20:25:51,中国汽车流通协会：预计1月汽车市场将呈现“开门红”的局面
财联社,2026-01-06 20:25:43,东方中科：股东大连金投拟减持不超3.00%股份
财联社,2026-01-06 20:20:48,1月6日周二《新闻联播》要闻19条
同花顺,2026-01-06 20:19:59,拉美多国声援委内瑞拉 谴责美国对委军事行动
财联社,2026-01-06 20:17:30,摩根士丹利申请推出比特币和索拉纳ETF
财联社,2026-01-06 20:16:37,【风口研报·公司】公司新游表现亮眼且新一轮产品周期开启，叠加在脑机接口+AI引用等领域的投资布局，分析师上调未来三年业绩预测和目标估值；这个行业2026年价格弹性增强，龙头公司规模优势下的价格向上弹性
财联社,2026-01-06 20:12:59,2025年证券从业者跌破33万大关
财联社,2026-01-06 20:11:01,香港：暂停进口波兰、美国和法国部分地区禽肉及禽类产品
财联社,2026-01-06 20:10:34,李强同爱尔兰总理马丁会谈
财联社,2026-01-06 20:02:43,监管问计理财公司 聚焦A股投资障碍与政策期待
财联社,2026-01-06 20:02:43,为打通中长期资金入市卡点堵点 监管问计理财公司并希望理财公司提高投资A股的积极性和规模
同花顺,2026-01-06 20:02:39,XAI完成200亿美元的E轮融资
财联社,2026-01-06 20:01:32,盛科通信：第二大股东大基金拟减持不超3%股份
财联社,2026-01-06 20:01:32,盛科通信：股东国家集成电路产业投资基金拟减持不超3.00%股份
财联社,2026-01-06 20:01:23,摩根大通发布欧元区成员国评级动向展望 料法国遭降级的概率约五成
财联社,2026-01-06 19:57:25,燕东微：国家集成电路基金1月6日减持109.02万股公司股份
财联社,2026-01-06 19:57:25,燕东微：第四大股东大基金1月6日减持109.02万股公司股份
财联社,2026-01-06 19:55:55,券商文化建设落实缺位遭监管警示 2025年评估将予以扣分
财联社,2026-01-06 19:52:16,天能重工：股东郑旭拟减持不超1.86%股份
财联社,2026-01-06 19:45:07,美媒爆料：特朗普对委动手前曾向油企高管暗示
同花顺,2026-01-06 19:43:31,古巴外长：古巴人民将抵御侵略捍卫祖国
财联社,2026-01-06 19:42:13,芯原股份：收购逐点半导体交割完成
财联社,2026-01-06 19:41:07,【机构调研】这家光伏电池供应商海外业务占比超50%，拟入股国内稀缺卫星电池生产商
财联社,2026-01-06 19:37:58,伯恩斯坦下调Coinbase等加密货币概念股目标价
财联社,2026-01-06 19:37:50,*ST长药：公司股票可能被终止上市
财联社,2026-01-06 19:33:05,巴基斯坦去年在反恐行动中打死超5千名恐怖分子
财联社,2026-01-06 19:31:59,欧洲领导人发布联合声明：称北极安全仍是关键要务 必须以集体方式实现
财联社,2026-01-06 19:31:45,明阳电路：通过全资子公司向全资孙公司增资1500万美元
财联社,2026-01-06 19:31:07,西部材料：西安航天1月5日减持479.91万股
财联社,2026-01-06 19:31:07,西部材料第二大股东西安航天1月5日减持479.91万股
财联社,2026-01-06 19:29:55,【电报解读】融资规模仅次于马斯克旗下Neuralink！脑机接口“独角兽”强脑科技完成约20亿元融资，快速梳理强脑科技相关标的（附表）
财联社,2026-01-06 19:27:46,奇瑞集团发布2026年销量目标：集团目标320万辆 较2025年增长14%
财联社,2026-01-06 19:24:58,全国网信办主任会议在京召开 强调着力推进信息基础设施建设、信息化应用等工作
财联社,2026-01-06 19:23:11,海正药业：参股子公司博锐生物递交H股上市申请
财联社,2026-01-06 19:22:50,水利部：2026年要加快建设现代化水网 夯实农业农村现代化水利基础
财联社,2026-01-06 19:21:21,瑞士公布酒吧火灾最新调查情况：政府官员遭刑事控告
财联社,2026-01-06 19:18:35,3连板索菱股份：控股股东一致行动人汤和控股竞买成功3750万股公司股份
财联社,2026-01-06 19:16:26,国家数据局：2026年我国将在智能体、具身智能等前沿方向布局一批数据标准
财联社,2026-01-06 19:15:54,16天12板嘉美包装：2025年12月17日至1月6日期间累计涨幅230% 1月7日起停牌核查
财联社,2026-01-06 19:15:54,16天12板嘉美包装：公司股票短期内价格涨幅较大 1月7日起停牌核查
财联社,2026-01-06 19:14:14,赛诺菲降甘油三酯新药在华获批
财联社,2026-01-06 19:14:04,罗博特科：子公司ficonTEC与瑞士客户签订第二条全自动OCS（光交换机）封装整线订单
财联社,2026-01-06 19:11:45,先锋电子：控股股东石政民拟减持不超1%股份
财联社,2026-01-06 19:09:21,和而泰：控股股东刘建伟拟减持不超2%股份
财联社,2026-01-06 19:07:32,智能自控：股东李耀武、吴畏等拟合计减持不超2.42%股份
财联社,2026-01-06 19:05:19,超讯通信：控股股东协议转让部分股权
财联社,2026-01-06 19:04:59,东田微：目前已初步完成光隔离器产品线的搭建 并实现了对部分客户的批量交付
财联社,2026-01-06 19:04:24,机构：受春节减产影响 预估2026年一季度LCD电视面板供需转紧
财联社,2026-01-06 19:02:42,银邦股份：股东淮北公用拟减持不超3%股份
