来源,时间,标题
财联社,2025-12-02 19:31:04.000,【机构调研】这家公司构建MEMS传感器芯片全周期能力，具备全谱系压力传感芯片解决方案
财联社,2025-12-02 19:30:44.000,四连板睿能科技：不从事机器人整机制造业务 前三季度应用到机器人领域的营收占比约1.02%
财联社,2025-12-02 19:29:46.000,中核科技：目前公司在手核电订单总计超30亿元
财联社,2025-12-02 19:29:19.000,工信部高东升：全链条推动船舶海洋工程装备创新发展 持续提升产业科技创新能力
财联社,2025-12-02 19:24:34.000,科技部：要加大力度做好“十五五”安全生产科技支撑
财联社,2025-12-02 19:17:03.000,国家发展改革委副主任周海兵会见乌兹别克斯坦投资、工业和贸易部副部长卡西莫夫
财联社,2025-12-02 19:15:53.000,信测标准：股东李生平拟减持不超2.77%股份
财联社,2025-12-02 19:15:11.000,西藏那曲市比如县发生4.9级地震 震源深度10公里
财联社,2025-12-02 19:14:58.000,天普股份：核查工作已完成 股票明起复牌
财联社,2025-12-02 19:14:58.000,天普股份：停牌核查工作已完成 股票明起复牌
财联社,2025-12-02 19:10:45.000,宁德时代：截至11月30日累计回购公司A股1599.08万股 成交总金额为43.86亿元
财联社,2025-12-02 19:10:40.000,西安奕材：拟投建10亿元“智造创新中心”项目
财联社,2025-12-02 19:10:38.000,舜宇光学独家供应豆包手机助手工程样机镜头以及主摄长焦模组
财联社,2025-12-02 19:09:04.000,中国银行间市场交易商协会：增强资金使用灵活性 优先支持重点领域并购
财联社,2025-12-02 19:06:54.000,绿联科技：股东珠海锡恒投资合伙企业拟减持不超2.00%股份
财联社,2025-12-02 19:05:47.000,沐曦股份：网上路演时间为12月4日9:00-12:00
财联社,2025-12-02 19:05:10.000,天孚通信：副总经理等高管拟合计减持不超47.5万股
财联社,2025-12-02 19:02:13.000,西藏那曲市比如县附近发生4.8级左右地震
财联社,2025-12-02 19:01:46.000,西安奕材：拟投建武汉硅材料基地项目 项目总投资约125亿元
财联社,2025-12-02 19:01:46.000,西安奕材：拟投资125亿元建设武汉硅材料基地项目
财联社,2025-12-02 19:01:03.000,【机构龙虎榜解读】端侧AI+AI玩具+AI眼镜+机器人，推出基于高通高算力芯片的端侧AI解决方案及具身智能机器人开发平台Fibot，并与行业头部AR眼镜企业XREAL达成战略合作，这家公司获净买入
财联社,2025-12-02 18:59:30.000,年薪涨至435万元仍不满意 艾比森董事长丁彦辉对董事长选举议案投反对票
财联社,2025-12-02 18:59:26.000,寒潮+大风双预警 江苏安徽浙江等地降温将超10℃
财联社,2025-12-02 18:56:25.000,乌军否认俄控制红军城
财联社,2025-12-02 18:53:19.000,澜起科技：截至11月30日已累计回购公司A股股份150.5万股 支付金额约2.02亿元
财联社,2025-12-02 18:52:19.000,大摩将谷歌2027年TPU产量预测从约300万块上调至500万块
财联社,2025-12-02 18:50:19.000,年末存储厂商延续惜售策略 本周存储成品整体维持涨价势头
财联社,2025-12-02 18:49:50.000,日本加息前景搅动美国市场
财联社,2025-12-02 18:45:10.000,人福医药：子公司撤回重组质粒-肝细胞生长因子注射液药品注册申请
财联社,2025-12-02 18:41:58.000,*ST正平：停牌核查工作已完成 股票明起复牌
财联社,2025-12-02 18:37:30.000,捷佳伟创：半导体清洗设备、碳化硅高温热处理工艺设备都已出货给客户
财联社,2025-12-02 18:34:38.000,派能科技：股东融科创投拟减持不超3%股份
财联社,2025-12-02 18:33:23.000,珍宝岛：全资子公司获得盐酸莫西沙星片药品注册证书
财联社,2025-12-02 18:30:28.000,日本北海道根室半岛附近海域发生5.2级地震
财联社,2025-12-02 18:29:58.000,财信发展：投资人拟收购公司20%至29.99%的股份 控制权可能发生变更
财联社,2025-12-02 18:29:58.000,财信发展：投资人江西中久拟收购公司20%至29.99%的股份 控制权可能发生变更
财联社,2025-12-02 18:28:33.000,大洋电机：拟3000万元参与投资产业基金 完善在机器人产业链的战略布局
财联社,2025-12-02 18:28:33.000,大洋电机：拟3000万元参与投资产业基金 投资标的主营人形机器人等的智能模组、整机产品
财联社,2025-12-02 18:26:21.000,磷酸铁锂涨价潮来袭？龙蟠科技：正与客户沟通涨价事由
财联社,2025-12-02 18:26:11.000,南华期货股份有限公司通过港交所上市聆讯
财联社,2025-12-02 18:24:38.000,碧兴物联：碧水源12月1日至12月2日减持17.77万股
财联社,2025-12-02 18:21:05.000,佐力药业：拟募资不超过15.56亿元 用于智能化中药大健康工厂等
财联社,2025-12-02 18:17:30.000,2连板福蓉科技：公司产品本身不具有AI功能
财联社,2025-12-02 18:15:04.000,亨通光电：奖励基金通过信托已耗资4998万元购买公司股票 剩余资金计划在2026年5月前继续购买
财联社,2025-12-02 18:14:32.000,欧元区11月通胀率升至2.2%
财联社,2025-12-02 18:13:07.000,5连板海欣食品：公司产品已成功入驻山姆超市 目前仍处于销售考核期
财联社,2025-12-02 18:11:46.000,OECD预估2025年美国经济增长2%
财联社,2025-12-02 18:10:54.000,WSTS：2026年全球半导体市场规模将逼近1万亿美元大关
财联社,2025-12-02 18:08:52.000,经合组织上调2025年中国经济增长至5%
财联社,2025-12-02 18:07:32.000,浙江宁波：放宽经营主体住所（经营场所）登记条件
财联社,2025-12-02 18:06:49.000,经合组织维持今明两年全球经济增速预期
财联社,2025-12-02 18:05:25.000,经合组织：美关税对自身影响尤为明显
财联社,2025-12-02 18:00:02.000,*ST万方：股东双阳农商行拟减持不超3%股份
财联社,2025-12-02 17:58:47.000,长沙市低空产业发展公司成立
财联社,2025-12-02 17:57:29.000,中国电影：参与《得闲谨制》出品
财联社,2025-12-02 17:52:22.000,印尼洪灾和山体滑坡灾害已致702人死亡
财联社,2025-12-02 17:49:39.000,3连板顺灏股份：轨道辰光的主要业务是通过将算力卫星发射至晨昏轨道组建太空数据中心
财联社,2025-12-02 17:49:39.000,顺灏股份：轨道辰光的主要业务是通过将算力卫星发射至晨昏轨道组建太空数据中心
财联社,2025-12-02 17:49:34.000,豪威集团：控股股东虞仁荣拟向大学基金会捐赠2.48%公司股份
财联社,2025-12-02 17:48:31.000,联合国警告：AI可能加剧全球贫富差距
财联社,2025-12-02 17:47:45.000,重庆出台10条措施支持“好房子”建设 将推进智能建造升级
财联社,2025-12-02 17:45:28.000,起亚美国11月的总销量为72002辆 同比增长3%
财联社,2025-12-02 17:43:22.000,财政部拟第二次续发行2025年记账式附息（十九期）国债 招标面值总额960亿元
财联社,2025-12-02 17:37:16.000,南向资金今日净买入约41亿港元 美团获净买入居前
财联社,2025-12-02 17:32:43.000,高盛：料阿里健康2026财年业绩指引仍存上行空间 升目标价至5.2港元
财联社,2025-12-02 17:31:14.000,吉林工业职业技术学院党委书记朱永忠接受纪律审查和监察调查
财联社,2025-12-02 17:25:50.000,印度股市创新高之际 野村预计未来一年还将有12%的涨幅空间
财联社,2025-12-02 17:25:20.000,4连板道明光学：公司目前不存在AI手机相关业务
财联社,2025-12-02 17:25:02.000,奥尔特曼计划全力强化ChatGPT竞争力 或推迟OpenAI广告业务
财联社,2025-12-02 17:23:58.000,远东股份：已获全球领先AI芯片公司直供商代码
财联社,2025-12-02 17:20:38.000,杰美特：终止筹划收购思腾合力控制权事项
财联社,2025-12-02 17:19:11.000,上海发布寒潮蓝色预警 预计未来48小时内全市最低气温将下降8-10度
财联社,2025-12-02 17:18:30.000,重庆绿电、绿证交易量创新高
财联社,2025-12-02 17:17:20.000,【风口研报·公司】通过航天技术转化发力智能制造，分析师强call公司“技术壁垒+政策红利”双轮驱动增长，近期还新获取军工批产任务，长期成长性存在预期差；另有公司具备较强的单位游客价值转化能力
财联社,2025-12-02 17:15:09.000,全志科技：与谷歌围绕安卓生态开展广泛合作
财联社,2025-12-02 17:14:42.000,华建集团：下属子公司签署1.6亿元设计合同
财联社,2025-12-02 17:13:47.000,臻镭科技：未发布或收到商业航天司调研相关信息
财联社,2025-12-02 17:12:15.000,万凯新材：与Carbios合作投资约9.22亿元建设生物酶解聚PET再生项目
财联社,2025-12-02 17:11:45.000,马斯克批评美国关税：会扭曲市场 曾试图劝阻特朗普但未果
财联社,2025-12-02 17:09:38.000,万凯新材：投资3.5亿建设年产10万吨乙二酸技改项目
财联社,2025-12-02 17:09:06.000,龙虎榜|招商轮船今日跌9.94% 有2家机构专用席位净卖出1.36亿元
财联社,2025-12-02 17:06:42.000,【电报解读】发改委要求全链条推动重点领域关键核心技术攻关取得决定性突破，机构称政策监管、技术突破与生态协同正合力推动中国商业航天进入高质量发展拐点，这家公司已实现批量交付多种火箭箭体结构件
财联社,2025-12-02 17:06:31.000,香港大埔宏福苑火灾已造成156人遇难
财联社,2025-12-02 17:06:03.000,特变电工：应收账款2期资产支持专项计划成立
财联社,2025-12-02 17:05:52.000,北注协报告显示超七成受访上市公司管理层已将ESG纳入战略决策
财联社,2025-12-02 17:05:42.000,首部地方性冰雪产业法规出台 ：七台河鼓励“AI+冰雪”
财联社,2025-12-02 17:04:15.000,雪天盐业：拟2.61亿元购买美特新材41%股权
财联社,2025-12-02 17:03:46.000,富信科技：股东拟询价转让公司总股本2.02%
财联社,2025-12-02 17:01:28.000,广西壮族自治区政协原常委韦均林接受审查调查
财联社,2025-12-02 16:58:22.000,英国首相承认脱欧重创英国经济
财联社,2025-12-02 16:56:17.000,华康洁净：中标1.76亿元柯桥未来医学中心净化系统项目
财联社,2025-12-02 16:51:15.000,专家称巴西阿拉比卡咖啡收成可能逊于预期 因天气异常及品种偏好改变
财联社,2025-12-02 16:48:08.000,2025约旦中国电影节在安曼举行
财联社,2025-12-02 16:48:07.000,佳能回应中山打印机工厂停止经营
财联社,2025-12-02 16:46:30.000,国家能源局：10月全国新增建档立卡新能源发电项目共5358个
财联社,2025-12-02 16:45:30.000,恒瑞医药：注射用甲苯磺酸瑞马唑仑上市许可申请获受理
财联社,2025-12-02 16:44:34.000,法德：俄乌“和平计划” 欧洲必须“坐到谈判桌前”
财联社,2025-12-02 16:43:59.000,中汽协：10月汽车商品进出口总额为253.1亿美元 环比增长1.7%
财联社,2025-12-02 16:42:29.000,延江股份：公司实际控制人之一、董事、副总经理谢影秋逝世
财联社,2025-12-02 16:38:18.000,澳大利亚发布国家人工智能计划 吸引对澳大利亚数字与实体基础设施的投资
财联社,2025-12-02 16:38:18.000,澳大利亚发布国家人工智能计划
财联社,2025-12-02 16:35:11.000,平潭发展：公司经营情况正常 不存在应披露而未披露的重大事项
财联社,2025-12-02 16:25:32.000,郑栅洁：统筹推进房地产、地方政府债务、中小金融机构等风险有序化解 加强网络、数据、人工智能等新兴领域国家安全能力建设
财联社,2025-12-02 16:25:29.000,郑栅洁：做强国内大循环 畅通国内国际双循环
财联社,2025-12-02 16:22:46.000,郑栅洁：提高居民收入在国民收入分配中的比重 提高劳动报酬在初次分配中的比重
财联社,2025-12-02 16:22:39.000,港股新股乐摩科技(02539.HK)暗盘盘初上涨50% 每手赚2000港元
财联社,2025-12-02 16:22:32.000,郑栅洁：采取超常规措施 全链条推动重点领域关键核心技术攻关取得决定性突破
财联社,2025-12-02 16:14:44.000,12月2日连板股分析：连板股晋级率超六成 “炒地图”行情火热
财联社,2025-12-02 16:09:56.000,香港恒生指数收涨0.24% 恒生科技指数跌0.37%
财联社,2025-12-02 16:08:58.000,10天7板梦天家居：如股价进一步异常上涨 公司可能申请停牌核查
财联社,2025-12-02 16:08:29.000,普莱柯：拟认购中信农业所持中普生物股权以获得控制权
财联社,2025-12-02 16:08:21.000,悦康药业：子公司YKYY018雾化吸入剂获得国家药品监督管理局临床试验批准
财联社,2025-12-02 16:04:36.000,担心权益受损 美国民众反对兴建AI数据中心
财联社,2025-12-02 16:02:28.000,森马服饰：已推出疯狂动物城IP联名产品
财联社,2025-12-02 16:02:11.000,中国国航换帅完成工商变更 注册资本增至174.48亿
财联社,2025-12-02 16:01:29.000,江西：加快推进脑机接口技术在神经与精神类疾病诊疗、养老康复等领域的临床研究
财联社,2025-12-02 16:00:56.000,欧洲主要股指开盘多数上涨
财联社,2025-12-02 16:00:03.000,引力传媒：目前在业务开展过程中已应用谷歌Veo3及Nano Banana模型
财联社,2025-12-02 15:57:03.000,英国央行称七大贷款机构在最新压力测试中展现韧性
财联社,2025-12-02 15:56:46.000,卓易信息：子公司为中国大陆唯一获得英特尔授权的独立BIOS供应商
财联社,2025-12-02 15:55:20.000,天津育儿补贴方案发布
财联社,2025-12-02 15:54:33.000,岱美股份：子公司收到火灾事故部分保险赔偿款1470万美元
财联社,2025-12-02 15:53:50.000,三友医疗：与韩国细基生物签署战略合作和经销协议
财联社,2025-12-02 15:53:46.000,蒙古工矿部紧急部署能源资源领域重点工作 将持续发布勘探招标
财联社,2025-12-02 15:52:56.000,特朗普警告以色列勿干涉叙利亚
财联社,2025-12-02 15:52:07.000,11月A股新开户数238万户 今年已累计新开2484万户
财联社,2025-12-02 15:51:45.000,珠海冠宇：有为中兴客户供应手机类电池
财联社,2025-12-02 15:51:45.000,今日投资舆情热点
财联社,2025-12-02 15:50:50.000,航天电器：CPO光模块系列产品处于市场推广阶段 CPC相关产品在研制中
财联社,2025-12-02 15:49:03.000,尼日利亚国防部长辞职
财联社,2025-12-02 15:49:01.000,塞浦路斯总统：任欧盟轮值主席国期间将致力于加强欧盟战略自主
财联社,2025-12-02 15:45:18.000,外交部：洪都拉斯大选是其内部事务 中方奉行不干涉原则
财联社,2025-12-02 15:44:42.000,厦门钨业：拟投资9.42亿元购置电机产业园二期首批用地并建设产业园A、B区项目
财联社,2025-12-02 15:38:37.000,外交部：任何外部势力胆敢介入台海事务 我们必将迎头痛击
财联社,2025-12-02 15:37:27.000,外交部：中方坚决反对日本挑战战后国际秩序、为军国主义招魂
财联社,2025-12-02 15:33:59.000,万科债普遍延续下滑态势 “21万科06”跌超31%
财联社,2025-12-02 15:33:40.000,李在明提议恢复韩朝间联络渠道
财联社,2025-12-02 15:32:29.000,外交部：中俄实现互免签证是两国政府和人民又一次双向奔赴
财联社,2025-12-02 15:30:09.000,日团体表达访华意愿 外交部：望在日本国内多发挥积极作用
财联社,2025-12-02 15:30:09.000,外交部：希望日本相关团体在日本国内多发挥积极作用
财联社,2025-12-02 15:28:08.000,以军连续在约旦河西岸多地开展行动 关闭道路且突袭医院
财联社,2025-12-02 15:26:28.000,五部门：支持有条件的学位授予单位建设数据科学与工程、数字经济与管理等数据要素相关学科专业
财联社,2025-12-02 15:26:19.000,五部门：鼓励地方利用算力券、模型券、数据券等方式 在算力、算法、数据等方面提供便利和优惠
财联社,2025-12-02 15:19:29.000,12月2日涨停分析
财联社,2025-12-02 15:18:03.000,六大行全面停售5年期大额存单
财联社,2025-12-02 15:16:13.000,国债期货收盘全线下跌 30年期主力合约跌0.51%
财联社,2025-12-02 15:13:47.000,【风口专家会议】AI手机2026年出货挑战6亿台，特邀行业专家全面解读各类AI终端未来市场潜力
财联社,2025-12-02 15:07:26.000,卓创资讯：屠宰量逐步恢复 11月份生猪屠宰毛利回暖
财联社,2025-12-02 15:05:43.000,蓝佛安出席中亚经济合作天山论坛开幕式并致辞
财联社,2025-12-02 15:02:21.000,收评：创业板指低开低走跌0.69% 福建板块逆势爆发
财联社,2025-12-02 15:02:03.000,美政府将入股芯片制造工艺初创公司xLight
财联社,2025-12-02 15:00:35.000,国内商品期货收盘 BR橡胶涨约4%
财联社,2025-12-02 14:51:27.000,墨西哥大毒枭之子相继获罪
财联社,2025-12-02 14:48:47.000,沪深两市成交额突破1.5万亿 较昨日此时缩量超2600亿
财联社,2025-12-02 14:43:08.000,中国药品价格登记系统正式上线 9家药企首批登记
财联社,2025-12-02 14:41:18.000,机构：三季度中国PC市场出货量同比增长2% 达到1130万台
财联社,2025-12-02 14:39:24.000,古特雷斯正式提交联合国削减预算和裁员方案
财联社,2025-12-02 14:38:53.000,12月组件排产预计大降 终端需求将回归冷淡时期
财联社,2025-12-02 14:38:02.000,俄罗斯将开始接受对人民币计价主权债的认购
财联社,2025-12-02 14:32:25.000,12月2日全国农产品批发市场猪肉平均价格为17.59元/公斤 比昨天下降1.2%
财联社,2025-12-02 14:32:16.000,尾盘算力硬件股再度异动 菲菱科思20cm涨停
财联社,2025-12-02 14:29:25.000,【盘中宝】政策支持+技术突破+应用拓展多重驱动下，该新技术领域有望快速增长，未来行业市场规模或超120亿美元，这家企业已有多款产品落地并销售
财联社,2025-12-02 14:29:22.000,普京将访印度 苏-57战斗机成热点话题
财联社,2025-12-02 14:22:55.000,韩国一陆军训练场发生爆炸 造成4人受伤
财联社,2025-12-02 14:21:51.000,主力资金监控：电子板块净流出超61亿
财联社,2025-12-02 14:21:23.000,中国汽车动力电池联盟赴北京人形机器人创新中心调研交流
财联社,2025-12-02 14:18:24.000,国内首个作物“AI基因科学家”问世 明年面向全球上线
财联社,2025-12-02 14:10:57.000,嘉环科技与中移上研院达成产业供需签约
财联社,2025-12-02 14:07:10.000,华伍股份：公司已将商业航天作为未来重点发展方向之一 正积极推进相关战略布局与业务洽谈
财联社,2025-12-02 13:59:31.000,Burry据报道已做空特斯拉 “荒谬”的估值和马斯克的薪酬计划乃原因所在
财联社,2025-12-02 13:54:44.000,【盘中宝】供电保障体系的理想方案，AIDC建设有望提振该市场增长，这家公司相关细分领域已有产品技术布局
财联社,2025-12-02 13:51:17.000,2025脑机接口大会将于12月4日至5日在上海举行
财联社,2025-12-02 13:37:50.000,深交所：“23万科01”盘中临时停牌
财联社,2025-12-02 13:34:55.000,南宁：新婚购房按每套2万元给予补贴 三孩购房补贴6万元
财联社,2025-12-02 13:28:58.000,福建规划建设金门供水第二通道、马祖供水、泉金高速等一批重大项目
财联社,2025-12-02 13:28:11.000,消息称台积电董事长魏哲家将出席OIP论坛南京场
财联社,2025-12-02 13:27:38.000,福建本地股持续走高 东百集团等近十股涨停
财联社,2025-12-02 13:25:36.000,美连锁超市就“对等关税”起诉特朗普政府
财联社,2025-12-02 13:09:31.000,【风口研报·公司】公司围绕商业航天全产业链进行深度布局，覆盖制造、运营、测控、应用等多个环节，且联手中科曙光布局太空算力
财联社,2025-12-02 13:08:25.000,西班牙部署军队参与防控非洲猪瘟
财联社,2025-12-02 13:03:46.000,创业板指跌逾1% 下跌个股近3900只
财联社,2025-12-02 13:01:54.000,食品板块异动 安记、惠发午后直线拉升涨停
财联社,2025-12-02 12:59:13.000,日本游退潮 11月后两周韩国酒店预订热度同比增长超240%
财联社,2025-12-02 12:51:29.000,上海：2026年8月1日起 所有新建或更新的公共充（换）电设施均须采用通过充电桩产品强制性认证的产品
财联社,2025-12-02 12:51:29.000,上海：所有新建或更新的公共充（换）电设施均须采用通过充电桩产品强制性认证（CCC认证）的产品
财联社,2025-12-02 12:49:52.000,【机构调研】这家公司打造宇航级产品生产线，为航天领域客户提供安全载荷、计算载荷等
财联社,2025-12-02 12:45:25.000,以代表团赴德交付“箭-3”导弹防御系统
财联社,2025-12-02 12:43:42.000,国际电信联盟宣布：2027年世界无线电通信大会将在中国上海举办
财联社,2025-12-02 12:39:02.000,药明生物：与卡塔尔自由区管理局签署战略合作备忘录 将全球服务网络与专业业务能力拓展至中东地区
财联社,2025-12-02 12:36:00.000,宁德时代：1000座换电站将于春节前正式运营
财联社,2025-12-02 12:29:01.000,支持台胞开设沙县小吃门店等 福建发布12条惠台政策措施
财联社,2025-12-02 12:21:08.000,中国驻英国使馆发言人就英国首相斯塔默外交政策演讲涉华内容答记者问
财联社,2025-12-02 12:17:20.000,白鸽在线港股IPO及境内未上市股份“全流通”获中国证监会备案
财联社,2025-12-02 12:15:06.000,集邦咨询：存储器价格飙升冲击游戏主机毛利 2026年出货量预估将下调至年减4.4%
财联社,2025-12-02 12:06:49.000,滨江集团13.61亿元底价斩获杭州一宅地
财联社,2025-12-02 12:06:29.000,财联社12月2日午间新闻精选
财联社,2025-12-02 12:01:14.000,山东海运与中船动力达成X82DF-E多燃料主机订单合作意向
财联社,2025-12-02 12:00:20.000,港股午评：恒生指数涨0.11% 恒生科技指数跌0.53%
财联社,2025-12-02 11:58:26.000,优必选科技与卓世科技达成战略合作 计划未来5年联合部署1万台机器人
财联社,2025-12-02 11:53:50.000,12月2日午间涨停分析
财联社,2025-12-02 11:51:10.000,全国医疗卫生机构总诊疗人次超101亿
财联社,2025-12-02 11:47:28.000,国民技术港股IPO获中国证监会备案
财联社,2025-12-02 11:46:17.000,瑞银巩旻：预计2026年中国乘用车批发增速将从2025年11%放缓至3%
财联社,2025-12-02 11:41:26.000,优地机器人在港交所发行上市计划获证监会备案
财联社,2025-12-02 11:41:08.000,福建产投启航股权投资合伙企业登记成立 出资额15亿
同花顺,2025-12-02 11:34:05.000,江波龙：拟定增募资不超37亿元
同花顺,2025-12-02 11:33:09.000,赛微电子：近期公司经营情况及内外部经营环境未发生重大变化
财联社,2025-12-02 11:32:39.000,午评：创业板指半日跌近1% 福建板块逆势走强
财联社,2025-12-02 11:32:20.000,【大佬持仓跟踪】AI算力+消费电子+机器人，产品应用于多个AI客户的TPU的电源解决方案，推出了448G的高速互联产品，这家公司人形机器人今年预计出货数千台
同花顺,2025-12-02 11:31:22.000,北京“无事不扰”企业超55万户 放管结合持续优化营商环境
同花顺,2025-12-02 11:29:31.000,四连板睿能科技：不从事机器人整机制造业务
同花顺,2025-12-02 11:29:18.000,京东外卖为全职骑手免费配置加热餐箱
同花顺,2025-12-02 11:28:13.000,世联行：公司控股股东及实控人在本公司股票交易异常波动期间未买卖本公司股票
同花顺,2025-12-02 11:27:01.000,比利时警方突袭欧盟外交机构 以涉嫌欺诈逮捕3人
财联社,2025-12-02 11:25:00.000,上海：普惠性民办幼儿园保育教育费收费标准为不高于700元/生·月
财联社,2025-12-02 11:17:22.000,沪深两市成交额突破1万亿 较昨日此时缩量超1600亿
财联社,2025-12-02 11:15:48.000,海南自贸概念回升 海马汽车涨停
财联社,2025-12-02 11:13:58.000,知情人士称美国政府解雇纽约8名移民法官
同花顺,2025-12-02 11:13:50.000,美力科技：股东王光明拟减持不超过1.1138%公司股份
财联社,2025-12-02 11:12:43.000,阿里发布Qwen-Image模型新版本 千问APP首发接入
同花顺,2025-12-02 11:12:10.000,信测标准：股东李生平拟减持不超过2.77%股份
财联社,2025-12-02 11:11:35.000,欧盟撤销对华诉讼
同花顺,2025-12-02 11:10:02.000,联合国难民署：莫桑比克北部暴力冲突加速蔓延
财联社,2025-12-02 11:08:46.000,全国“以竹代塑”工作推进现场会在福建南平召开
财联社,2025-12-02 11:07:17.000,云南省大理州副州长、州公安局局长雷楚英接受纪律审查和监察调查
财联社,2025-12-02 11:06:02.000,中国药品价格登记系统上线
同花顺,2025-12-02 11:05:32.000,12月21日起，深圳24小时通关口岸暂停跨境货运车辆通关服务
同花顺,2025-12-02 11:04:02.000,新莱应材：厉善君等多名董事拟减持公司股份
同花顺,2025-12-02 11:03:40.000,天孚通信：董事及高管拟合计减持不超0.0611%股份
同花顺,2025-12-02 11:03:21.000,同有科技：股东佟易虹、杨永松各拟减持不超过1%股份
财联社,2025-12-02 11:00:23.000,【盘中宝】AI赋能万物通过应用端实现，大模型厂商正加速AI应用形态革新与场景渗透，这家公司相关细分领域业务已实现收入过亿元
同花顺,2025-12-02 11:00:11.000,美特使已抵达莫斯科，为今年第6次访俄
同花顺,2025-12-02 11:00:07.000,西安奕材：与关联方共同投资10亿元设立项目公司
财联社,2025-12-02 10:59:21.000,马来西亚总理：英特尔承诺在马投资2.08亿美元用于芯片产业
