来源,时间,标题
财联社,2026-04-02 02:19:44,伊朗237名学生死于美以袭击
同花顺,2026-04-02 02:19:08,共封装光学(CPO)板块短线走低
财联社,2026-04-02 01:58:08,山西一煤业公司发生冒顶事故 4人被困
财联社,2026-04-02 01:41:40,伊朗媒体：伊朗总统将发表致美国人民公开信
财联社,2026-04-02 01:40:17,特朗普称伊朗目前“已无能力”发展核武器
财联社,2026-04-02 01:37:55,伊朗军方高官：抵抗阵线在对美以战斗中展现力量
同花顺,2026-04-02 01:35:04,日经225指数向下跌破53000点
财联社,2026-04-02 01:34:35,三国际机构决定成立协调小组应对中东战争的经济影响
同花顺,2026-04-02 01:33:54,机场航运板块开盘走弱 中国东航跌超4%
同花顺,2026-04-02 01:33:52,布伦特原油站上106美元/桶
同花顺,2026-04-02 01:32:43,现货黄金失守4650美元/盎司 纽约期金失守4680美元/盎司
同花顺,2026-04-02 01:31:38,美股纳斯达克100指数期货跌超1%
同花顺,2026-04-02 01:31:29,现货黄金失守4680美元/盎司
同花顺,2026-04-02 01:31:17,特朗普：若无法达成协议，将猛烈打击伊朗所有发电厂
同花顺,2026-04-02 01:30:33,贵金属板块集体低开 晓程科技低开近4%
同花顺,2026-04-02 01:30:21,股指期货早盘开盘 主力合约集体低开
同花顺,2026-04-02 01:28:12,油气开采板块再度高开 贝肯能源高开近6%
同花顺,2026-04-02 01:27:35,韩元兑美元跌破1500关口
同花顺,2026-04-02 01:26:31,ETF开盘：上证580ETF领涨7.56%，巴西ETF领跌2.34%
同花顺,2026-04-02 01:26:22,现货白银失守73美元/盎司
同花顺,2026-04-02 01:25:55,现货黄金失守4700美元/盎司
同花顺,2026-04-02 01:25:36,A股开盘：三大指数集体低开
同花顺,2026-04-02 01:25:20,特朗普称有望“非常短时间内”完成所有军事目标
同花顺,2026-04-02 01:24:15,NYMEX取暖油主力合约大涨5% NYMEX汽油主力合约涨超3%
财联社,2026-04-02 01:14:02,伊朗称600多处教育设施遭美以蓄意袭击
财联社,2026-04-02 01:08:38,消息人士称特朗普开出停火条件：需满足美方“特定要求”
财联社,2026-04-02 00:52:54,LME期铜收涨99美元
财联社,2026-04-02 00:49:33,伊朗总统强调捍卫国家独立与安全
同花顺,2026-04-02 00:48:54,SpaceX投资人：史上最大IPO即将开启，太空经济进入真正拐点
同花顺,2026-04-02 00:48:20,国家烟草专卖局：对电子烟相关生产企业进行总量管理，依法依规核定产能和生产规模
同花顺,2026-04-02 00:47:18,两市融资余额较上日增加7.06亿元
同花顺,2026-04-02 00:47:15,脑动极光：成为北京前沿脑机接口研究院战略合作单位 携手推进脑机接口关键技术临床转化
财联社,2026-04-02 00:46:54,伊朗军方称打击以色列军工企业
财联社,2026-04-02 00:45:48,伊朗强调不理会美以的“幻想与谎言”
同花顺,2026-04-02 00:45:29,国家烟草专卖局就修改电子烟监管政策文件征求意见
同花顺,2026-04-02 00:44:37,深企造全球最轻植入式人工心脏 已累计植入超1200例
同花顺,2026-04-02 00:42:07,美晨科技子公司再次中标某头部客户新能源热管理储能产品项目
同花顺,2026-04-02 00:34:59,巴西总统批评美国发动“虚伪的”战争
同花顺,2026-04-02 00:34:52,伊朗称大量民用设施遭袭受损 将作出对等回应
同花顺,2026-04-02 00:30:45,Anthropic 紧急控制 Claude AI 代理底层代码泄露事件
同花顺,2026-04-02 00:27:59,中信证券：AI颠覆美股互联网叙事短期过度演绎
同花顺,2026-04-02 00:25:38,摩尔线程AIBOOK升级实现开箱即用“龙虾”功能
同花顺,2026-04-02 00:24:45,中信证券：海外降息+国内融资改善 持续看好药品产业链需求全面复苏
同花顺,2026-04-02 00:23:49,美前高级军官警告称如果登陆伊朗 美军部队将“很快被吞没”
财联社,2026-04-02 00:23:11,美官员称美军已损失16架MQ-9型“死神”无人机
同花顺,2026-04-02 00:22:45,韩国央行：将密切监控通胀形势和中东局势对油价的影响
同花顺,2026-04-02 00:19:17,中信证券：预计保险板块调整结束，建议积极把握重大机遇期
同花顺,2026-04-02 00:19:00,印尼北马鲁古省附近海域发生7.6级地震已发布海啸预警
同花顺,2026-04-02 00:12:45,美媒：美军方已制定夺取伊朗浓缩铀的计划
同花顺,2026-04-02 00:10:47,WTI原油失守98美元/桶
财联社,2026-04-02 00:06:44,俄外长：若被视为伊朗问题调解方 俄方愿提供协助
同花顺,2026-04-02 00:04:06,布伦特原油失守100美元/桶
同花顺,2026-04-01 23:57:01,穆杰塔巴号召民众植树缅怀死难者
财联社,2026-04-01 23:55:21,美股三大指数涨幅继续扩大 标普500指数触及6600点
财联社,2026-04-01 23:55:21,美股三大指数涨幅继续扩大 标普500指数重新触及6600点
同花顺,2026-04-01 23:55:00,华西证券：当下AI应用发展迅速，叠加文娱消费回暖
同花顺,2026-04-01 23:53:58,今麦郎董事长回应手打是商标
财联社,2026-04-01 23:50:32,伊朗革命卫队称“完全掌控”霍尔木兹海峡局势
财联社,2026-04-01 23:48:59,美股存储板块全线爆发 美光、西部数据、闪迪均涨超10%
财联社,2026-04-01 23:45:27,特朗普成首位出席美最高法庭审总统
同花顺,2026-04-01 23:45:15,马斯克与美国SEC就有关推特持股争议一案或将进入庭审
同花顺,2026-04-01 23:44:00,伊朗外交部发言人：美方要求“过分且不合理”
财联社,2026-04-01 23:41:04,欧洲各国股市均大幅收涨 多国股指涨超3%
同花顺,2026-04-01 23:35:40,美机构发布预警：印尼附近海域地震或引发海啸
财联社,2026-04-01 23:33:03,美官员称美伊讨论以重开霍尔木兹海峡为条件的停火协议
同花顺,2026-04-01 23:31:51,现货黄金站上4800美元/盎司
财联社,2026-04-01 23:30:53,伊朗重申将封锁霍尔木兹海峡作为反制手段
财联社,2026-04-01 23:26:48,以色列遭开战以来最大规模导弹袭击
财联社,2026-04-01 23:26:48,刚刚过去的一个小时 以色列遭开战以来最大规模导弹袭击
财联社,2026-04-01 23:21:37,美股石油股普跌 西方石油跌逾4%
同花顺,2026-04-01 23:20:42,苹果库克再回应退休传闻
同花顺,2026-04-01 23:19:07,订单旺 扩产忙 A股公司一季度经营势头火热
财联社,2026-04-01 23:17:32,亿万富翁马斯克旗下的SpaceX公司已秘密提交IPO文件
同花顺,2026-04-01 23:14:34,正式测定：印尼马鲁古海峡发生7.4级地震，震源深度30千米
同花顺,2026-04-01 23:14:05,自然资源部：印尼马鲁古海北部海域地震不会对我国沿岸造成影响
财联社,2026-04-01 23:13:36,富临运业：实际控制人将变更为东阳市国资办 明起复牌
同花顺,2026-04-01 23:05:19,全球最大的白银ETF iShares Silver Trust持仓量较前日减少2.82吨
同花顺,2026-04-01 23:03:24,印尼发生7.6级地震
财联社,2026-04-01 23:01:20,部分期货品种夜盘收盘 几乎全线下跌
财联社,2026-04-01 23:00:37,【季报高增长】半导体+IGBT，一季度净利润同比增长超20%，这家公司聚焦适配AI领域需求的功率半导体产品研发，受益于全球半导体行业的涨价潮从存储芯片迅速蔓延至功率芯片等领域的趋势
财联社,2026-04-01 23:00:23,中东最大铝生产商阿联酋环球铝业的冶炼厂停运 袭击严重破坏运营
同花顺,2026-04-01 23:00:14,WTI原油失守99美元/桶
财联社,2026-04-01 22:57:15,伊朗以色列同时大规模互袭
同花顺,2026-04-01 22:56:49,印尼马鲁古海峡附近发生7.5级左右地震
财联社,2026-04-01 22:55:20,港股IPO：宜美智科递表港交所
财联社,2026-04-01 22:52:06,美国制造业扩张速度创2022年来最高 伊朗战争推动投入成本跃升
财联社,2026-04-01 22:48:58,港股IPO：AR眼镜公司XREAL Ltd.递表港交所
财联社,2026-04-01 22:45:22,伊朗外交部：伊朗最高领袖身体健康但因战争推迟公开露面
同花顺,2026-04-01 22:42:24,新投资额度火速“上架”，QDII产品集体开门迎客
财联社,2026-04-01 22:40:03,马克龙说法国不参与对伊军事打击
同花顺,2026-04-01 22:39:05,首季熊猫债发行规模大增
财联社,2026-04-01 22:38:48,伊朗称特朗普社媒声明纯属子虚乌有
财联社,2026-04-01 22:36:28,港股IPO：圣邦微电子再次递表港交所
财联社,2026-04-01 22:34:40,【金牌纪要库】中国创新药出海一季度超600亿美元，已接近去年全年近一半，四五月密集数据催化下板块有望迎来估值重估
财联社,2026-04-01 22:34:35,手机回收价出现下跌  旧手机回收价一周跌百元
财联社,2026-04-01 22:30:39,美国能源信息署：美国上周原油库存增加545.1万桶 远高于市场预期
财联社,2026-04-01 22:29:14,伊朗革命卫队：若美以实施“恐怖行动”将对等回应
同花顺,2026-04-01 22:26:55,现货白银失守74美元/盎司
同花顺,2026-04-01 22:18:36,5亿元逆回购创10年新低，分析称4月流动性料维持偏松
财联社,2026-04-01 22:18:32,【公告全知道】算力+商业航天+智能电网+储能+绿色电力！公司成功打造全国首个算电协同项目并持股蓝箭航天
财联社,2026-04-01 22:14:29,伊朗外长：只有伊朗和阿曼才能决定霍尔木兹海峡的未来
财联社,2026-04-01 22:14:12,克罗地亚决定释放储备柴油
财联社,2026-04-01 22:13:40,俄罗斯表示将继续推进火箭核发动机研究
财联社,2026-04-01 22:10:21,德国回应特朗普“退约”威胁 称将继续支持北约
同花顺,2026-04-01 22:08:37,全球最大的黄金ETF SPDR Gold Trust持仓较前日增加3.71吨
同花顺,2026-04-01 22:04:42,现货白银跌超1%
同花顺,2026-04-01 22:01:16,COMEX白银期货跌超1%
财联社,2026-04-01 21:59:15,财联社4月1日晚间新闻精选
财联社,2026-04-01 21:56:38,伊朗回应特朗普停火言论 称霍尔木兹海峡不对敌开放
财联社,2026-04-01 21:54:55,美股存储概念股延续强势上涨
财联社,2026-04-01 21:53:28,【风口研报·洞察】游戏行业将4月迎来新品上线潮，多个重磅作品陆续面世，分析师指出当前游戏板块估值中枢处于14-15倍PE，仅高于18年及22年版号停发期间，后续有望迎来修复；反攻之路配置科技制造与内需
财联社,2026-04-01 21:48:37,伊朗首都德黑兰发生爆炸
财联社,2026-04-01 21:37:20,扎哈罗娃：日本加速背离战后和平宪法 对东北亚安全构成威胁
财联社,2026-04-01 21:34:42,伊朗称已击落150架美以无人机
财联社,2026-04-01 21:33:53,伊朗称超11.5万处民用设施在冲突中受损
财联社,2026-04-01 21:32:32,特朗普称将很快撤出伊朗战事
财联社,2026-04-01 21:30:37,美股三大指数集体高开 耐克跌超12%
财联社,2026-04-01 21:28:49,多家银行4月1日起下调部分存款挂牌利率 短期产品成重点
财联社,2026-04-01 21:23:46,瑞安航空：欧洲5月可能出现航空燃油短缺
财联社,2026-04-01 21:23:05,史上最严充电宝新规2027年4月实施 多电芯企业通过摸底测试
财联社,2026-04-01 21:22:19,云南2.25GW风、光项目竞配启动
财联社,2026-04-01 21:21:38,【财联社早知道】高盛预计到2026Q4全球AI相关硬件营收将突破7000亿美元，机构称2026年或迎来AI第三次算力需求高增，这家公司已建立了全面的产品系列，能够为客户提供一站式的配套光纤器件解决方案
同花顺,2026-04-01 21:17:19,富时中国A50指数期货夜盘收涨0.03%
财联社,2026-04-01 21:02:57,韩国进一步上调资源安全危机预警级别
财联社,2026-04-01 20:58:00,国家继续开展中央冻猪肉储备收储
财联社,2026-04-01 20:56:58,【电报解读】腾讯云发布企业智能体门户ADP Agent Portal！机构称在确定的Agent“淘金热”中，云厂商作为“卖铲人”有望迎来三重价值重估，这家公司的设备已在腾讯长三角AI超算中心的机房就位
财联社,2026-04-01 20:56:49,国药一致：2025年度净利润同比增长76.80%
财联社,2026-04-01 20:52:52,特朗普称伊朗新政权总统请求停火
财联社,2026-04-01 20:52:22,加强重点场所火灾隐患排查 两部门部署清明假期安全防范工作
财联社,2026-04-01 20:51:25,约旦河西岸多地民众抗议以色列通过“巴勒斯坦人死刑法案”
财联社,2026-04-01 20:49:06,拓邦股份：2025年度净利润同比下降45.81%
财联社,2026-04-01 20:47:40,美股盘前要闻一览：美财政部预计油价将在一段时间内维持在100美元上方；美国载人绕月火箭明早发射；特朗普正“认真考虑”让美国退出北约
财联社,2026-04-01 20:46:52,“小电驴”4月起集体涨价？深圳已有门店直接涨400元
财联社,2026-04-01 20:44:57,印度时隔15年再做人口普查 收集种姓信息引争议
财联社,2026-04-01 20:42:07,德国新规：加油站一天只准涨价一次
财联社,2026-04-01 20:40:18,欧菲光2025年营收221.50亿元 经营韧性呈现、创新动能不减
财联社,2026-04-01 20:38:30,现代汽车和起亚3月销量同比一降一升
财联社,2026-04-01 20:35:10,2025年上海离境退税销售额同比增长80.5%
财联社,2026-04-01 20:30:34,江顺科技：公司未向海外公司寄送数据中心液冷板样品
财联社,2026-04-01 20:29:54,花旗：上调中银香港目标价至49.7港元 维持“买入”评级
同花顺,2026-04-01 20:28:25,印度政府公告：自4月2日起至6月30日止，对部分化学品的进口关税降至零
财联社,2026-04-01 20:28:23,美以空袭美原驻伊朗使馆区域
财联社,2026-04-01 20:27:19,英国央行行长贝利：市场对加息预期的定价有些操之过急
财联社,2026-04-01 20:22:16,充电桩涨价潮来袭 行业竞争有望告别“低价内卷”
财联社,2026-04-01 20:17:47,气象局最新预测：今年将有7至9个台风登陆或影响我国沿海
财联社,2026-04-01 20:14:16,美国法官裁定白宫“断供”公共媒体违宪
财联社,2026-04-01 20:13:11,【风口研报·公司】3D视觉与英伟达Jetson Thor平台适配，这家公司细分产品市占率超70%，与优必选、普渡等超100家机器人企业达成合作；公司最新季度业绩增长提速，海外市场爆发的新兴赛道布局领先
财联社,2026-04-01 20:11:02,阿联酋已拦截超2000架无人机
同花顺,2026-04-01 20:00:32,美股收评：美股三大指数集体收涨
财联社,2026-04-01 19:58:48,美联储巴尔金：预期通胀进展缓慢 不会迅速回到目标
财联社,2026-04-01 19:58:42,4月1日周三《新闻联播》要闻19条
同花顺,2026-04-01 19:55:45,伊朗媒体：伊朗前外长在空袭中受伤
财联社,2026-04-01 19:55:04,交易员称美股本轮劲扬主要由空头回补所致 并非伊朗和平前景
财联社,2026-04-01 19:51:39,美股黄金股盘前续涨
财联社,2026-04-01 19:49:02,小鹏副总裁魏斌已于近期离职
财联社,2026-04-01 19:48:33,胜蓝股份：控股股东及部分董事拟合计减持不超3.19%公司股份
同花顺,2026-04-01 19:46:16,伊朗：600多所学校和教育中心遭蓄意袭击
财联社,2026-04-01 19:45:10,奥来德：控股股东、实际控制人及一致行动人、部分高管拟合计减持不超过3%
财联社,2026-04-01 19:44:48,美官员称美军意图扩大在格陵兰岛军事存在
财联社,2026-04-01 19:44:09,伊朗称打击美预警机加油机部署地
财联社,2026-04-01 19:42:14,光伏大规模退役潮来了 企业扎堆入局光伏回收赛道
财联社,2026-04-01 19:41:10,美军弹药现缺口 美军欲调用反导系统被波兰拒绝
财联社,2026-04-01 19:40:38,航发动力：2025年净利润同比减少26.27% 拟10派0.72元
财联社,2026-04-01 19:38:00,湖北能源：副董事长、总经理涂山峰因到退休年龄辞职
财联社,2026-04-01 19:37:22,李强在四川调研时强调 着力推进新型电网建设 加快能源结构调整优化 为经济社会高质量发展提供有力支撑
财联社,2026-04-01 19:36:55,超捷股份：员工持股平台拟合计减持不超过1.33%
财联社,2026-04-01 19:36:25,中国人民银行等四部门：进一步深化金融供给侧结构性改革 完善多元金融服务体系
财联社,2026-04-01 19:34:31,俄罗斯要求乌克兰尽快决定从顿巴斯地区撤军
财联社,2026-04-01 19:34:27,扬杰科技：一季度净利同比预增20%-40%
财联社,2026-04-01 19:32:37,中国人民银行等四部门联合召开科技金融工作交流推进会
财联社,2026-04-01 19:31:17,霍尔木兹海峡航运受阻 沙特3月原油出口腰斩
财联社,2026-04-01 19:30:14,【机构调研】这家硅零部件供应商已进入中国主流存储芯片及等离子刻蚀设备制造厂供应链
财联社,2026-04-01 19:30:00,沧州明珠：孙公司拟设立合资公司实施年产12亿平米湿法锂电隔膜项目二期
财联社,2026-04-01 19:29:52,韩国超常规施策稳定国内油价
同花顺,2026-04-01 19:27:09,山西一煤业公司发生冒顶事故4人被困 救援进行中
财联社,2026-04-01 19:19:12,能特科技：因涉嫌信息披露违法违规被中国证监会立案
财联社,2026-04-01 19:17:46,【机构龙虎榜解读】CPO设备+半导体设备+数据中心，在光通信CPO半导体领域推出了多款设备，可应用于AI服务器和数据中心等功能模块及器件制造环节，相关设备已实现销售并保持稳步增长，这家公司获净买入
财联社,2026-04-01 19:16:31,由于缺少燃料 日本海洋研究开发机构被迫中止4月海洋调查计划
同花顺,2026-04-01 19:13:40,穆杰塔巴号召伊朗民众“以烈士的名义”种树
财联社,2026-04-01 19:09:00,埃尔多安谴责美以袭击伊朗 称将坚决避免该国受波及
财联社,2026-04-01 19:08:23,城投控股：股东弘毅基金拟减持不超3%股份
财联社,2026-04-01 19:05:56,国芯科技：股东拟合计减持不超1.5%股份
财联社,2026-04-01 19:05:38,英国将举办国际会议讨论恢复霍尔木兹海峡通航
财联社,2026-04-01 19:05:30,尿素市场交投按需 价格窄幅波动
财联社,2026-04-01 19:04:37,高盛：预计到2026年第四季度 AI相关硬件营收将突破7000亿美元
财联社,2026-04-01 19:02:14,重庆市政府原参事赵江平接受纪律审查和监察调查
同花顺,2026-04-01 19:01:31,在岸人民币兑美元夜盘收盘报6.8750，较上一交易日上涨131点
财联社,2026-04-01 19:00:44,东鹏饮料：拟10亿至20亿元回购股份 不低于90%将用于注销并减少注册资本
财联社,2026-04-01 18:59:42,《2025年中国专利调查报告》发布 企业发明专利产业化率达54.0%
财联社,2026-04-01 18:58:56,行云科技：公司及子公司预计不超过70亿元用于服务器设备及零部件采购
同花顺,2026-04-01 18:58:20,伊朗总统致美国人民公开信
财联社,2026-04-01 18:58:11,不点名抨击特朗普？马克龙：有些国家可能会在不通知你的情况下伤害你
财联社,2026-04-01 18:54:41,博汇股份：预计一季度净利润同比增长184%-205%
财联社,2026-04-01 18:51:28,DRAM价格3月涨势稍歇 但预计Q2继续上涨
财联社,2026-04-01 18:47:05,局势左右摇摆 硫磺高位震荡
财联社,2026-04-01 18:45:42,喜临门：实控人陈阿裕因涉嫌信披违规被立案
财联社,2026-04-01 18:44:51,喜临门：因涉嫌信披违规被证监会立案
财联社,2026-04-01 18:44:45,海南新能源汽车充电量一季度同比增长近四成
财联社,2026-04-01 18:42:16,力诺药包：询价转让初步定价为15.69元/股
同花顺,2026-04-01 18:42:04,德国索林根持刀伤人事件致两人受伤
财联社,2026-04-01 18:41:29,赛力斯：3月新能源汽车销量22706辆 同比增长20.74%
财联社,2026-04-01 18:39:30,信达地产：2025年净亏损78.75亿元
财联社,2026-04-01 18:33:14,嘉友国际：拟参与投资坦赞铁路激活项目
财联社,2026-04-01 18:31:10,云赛智联：拟收购智能汽车平台12%股权
同花顺,2026-04-01 18:30:49,五角大楼将中东地区的A-10攻击机数量增加一倍
财联社,2026-04-01 18:28:15,单季度首破100万辆次 “北上”港澳单牌车创历史同期新高
财联社,2026-04-01 18:28:10,德昌股份：终止筹划重大事项 股票复牌
财联社,2026-04-01 18:26:18,甘肃能化：筹划收购金昌化工100%股权 股票停牌
同花顺,2026-04-01 18:23:14,纳斯达克100指数涨幅收窄至1.0%，此前一度上涨1.8%
财联社,2026-04-01 18:20:25,澳总理：伊朗战事对澳经济的冲击将持续数月
财联社,2026-04-01 18:19:06,【风口研报·记者传真】“一天一个价”！这个化工品种进入3月飙涨90%，产品供不应求，上市公司获益几何？
财联社,2026-04-01 18:18:20,中东战争推高燃油价格 亚太地区消费者加速“弃油转电”
财联社,2026-04-01 18:16:14,三江购物：股东阿里泽泰拟减持不超2%公司股份
财联社,2026-04-01 18:12:25,珠海中富：筹划控制权变更 股票明起停牌
财联社,2026-04-01 18:11:20,光华科技：董事蔡雯因涉嫌内幕交易被立案
财联社,2026-04-01 18:11:01,以军称黎巴嫩真主党南方阵线指挥官身亡
财联社,2026-04-01 18:07:44,云南对一起交通事故查处实行挂牌督办
财联社,2026-04-01 18:07:08,云南白药：INB301注射液获准开展肿瘤恶病质临床试验
财联社,2026-04-01 18:06:28,欧洲央行管委马赫鲁夫：已准备好在数据明确战争影响时采取行动
财联社,2026-04-01 18:04:59,上汽集团：2025年度净利润101.06亿元 同比增长506.45%
财联社,2026-04-01 18:04:53,沪电股份：同意投资约68亿元建设印制电路板生产项目
财联社,2026-04-01 18:04:08,宁波港：2025年度净利润51.68亿元 同比增长5.63%
同花顺,2026-04-01 18:04:08,现货黄金涨超1%
财联社,2026-04-01 18:03:02,百利天恒：iza-bren联合用药获2个II/III期临床试验批准
财联社,2026-04-01 18:02:09,韩国强化车辆限行措施 公共机关车辆单双号限行
财联社,2026-04-01 18:02:03,国务院食安办、市场监管总局、海关总署部署核查跨境电商进口“优思益”保健品违规营销行为
同花顺,2026-04-01 17:56:50,山西一煤业公司发生冒顶事故，4人被困
同花顺,2026-04-01 17:50:41,LME金属期货收盘集体上涨
财联社,2026-04-01 17:48:18,英国首相回应特朗普退出北约言论
同花顺,2026-04-01 17:45:29,礼来首席执行官：礼来公司反对将特朗普时期的药品定价协议写入法律
财联社,2026-04-01 17:44:47,南向资金今日净卖出近127亿港元 中国海洋石油遭卖出居前
财联社,2026-04-01 17:44:40,电煤运输有保障 大秦铁路开启30天集中检修
财联社,2026-04-01 17:43:12,国际能源署署长：目前已有超过1200万桶/日的石油供应量损失
财联社,2026-04-01 17:43:06,旭升集团：控股股东及实际控制人变更完成
财联社,2026-04-01 17:41:09,李云泽会见澳门金管局行政管理委员会主席黄善文
财联社,2026-04-01 17:36:38,上海国际能源交易中心对部分客户采取限制开仓监管措施
财联社,2026-04-01 17:35:46,大连重工：2026年第一季度净利同比预增12.57%-27.06%
财联社,2026-04-01 17:35:45,3月148只新基金发行 规模达高1132亿元
财联社,2026-04-01 17:35:09,杰瑞股份：签署约20.8亿元燃气轮机发电机组销售合同 将应用于数据中心供电领域
财联社,2026-04-01 17:34:38,长江流域今起正式进入汛期
同花顺,2026-04-01 17:26:22,现货白银站上76美元/盎司
同花顺,2026-04-01 17:26:07,币安正式推出石油和天然气期货交易
财联社,2026-04-01 17:23:35,俄军称控制卢甘斯克全境
财联社,2026-04-01 17:22:21,均胜电子：车载光模块技术将带来系统性变革 未来5年有望实现大规模上车
财联社,2026-04-01 17:20:26,宇树科技被抽中首发企业现场检查
财联社,2026-04-01 17:17:15,分析师对特朗普TACO心存疑虑 若放弃海峡将引发油价更猛烈上涨
财联社,2026-04-01 17:17:04,宏发股份：2025年度净利润同比增长7.76%
财联社,2026-04-01 17:16:11,横店影视：以0元受让影视科技49%股权 聚焦影视AI、区块链等技术业务
财联社,2026-04-01 17:14:09,特斯拉正式停产Model S和Model X两款车型
财联社,2026-04-01 17:11:40,俄副外长：俄方未向伊朗提供用于打击民用设施的情报
财联社,2026-04-01 17:10:47,特朗普威胁退出北约 欧洲航空航天与防务类股票上涨4.2%
财联社,2026-04-01 17:09:33,机构：2025年全球前十大IC设计厂营收年增44%
同花顺,2026-04-01 17:09:17,WTI原油跌超2%
财联社,2026-04-01 17:08:00,海翔药业：参股公司华益泰康北交所上市申请获受理
同花顺,2026-04-01 17:03:30,COMEX黄金期货涨超3%
同花顺,2026-04-01 17:02:37,美国天然气期货跌超3.00%
财联社,2026-04-01 16:49:21,3月上海全市二手房成交量达3.1万套
财联社,2026-04-01 16:49:00,国家税务总局：2025年个税汇算已超7000万人申请退税
财联社,2026-04-01 16:48:06,小摩：维持毛戈平“增持”评级 视为中国美妆板块首选股
财联社,2026-04-01 16:47:33,三诺生物：欧洲法院维持临时禁令 禁止销售GlucoMen iCan产品
财联社,2026-04-01 16:45:48,复星医药：控股子公司HLX319获临床试验批准
财联社,2026-04-01 16:43:06,美湖股份：终止投资建设北美生产基地项目
财联社,2026-04-01 16:41:35,中金：降中国中免至95港元 维持“跑赢行业”评级
财联社,2026-04-01 16:40:49,中策橡胶：拟10.41亿元投建越南轮胎生产基地项目
同花顺,2026-04-01 16:39:32,德国索林根发生持刀袭击事件，已致多人受伤
财联社,2026-04-01 16:39:11,HBM之父：看好高带宽闪存技术 未来AI产业或从GPU转向内存主导
财联社,2026-04-01 16:38:38,荣昌生物：双抗ADC药物RC288获临床试验批准
