来源,时间,标题
同花顺,2025-12-02 05:51:13.000,美国对印度和韩国锻钢配件发起第一次双反日落复审调查
同花顺,2025-12-02 05:49:39.000,宇树科技双足机器人外观专利获授权
同花顺,2025-12-02 05:49:12.000,ETF两市成交额超3000亿元
同花顺,2025-12-02 05:46:37.000,尼尔森IQ：对2026年中国经济和消费市场的发展充满信心
同花顺,2025-12-02 05:37:42.000,福建本地股持续走强，福建高速等超10股涨停
同花顺,2025-12-02 05:37:24.000,"台湾证交所加权股价指数收高0.8%报27,564.27"
同花顺,2025-12-02 05:34:24.000,南宁：新婚购房按每套2万元给予补贴，三孩购房补贴6万元
同花顺,2025-12-02 05:31:48.000,沪深京三市成交额超1.2万亿元，较上日此时缩量2041亿元
同花顺,2025-12-02 05:29:02.000,韩国总统：必须彻底揭开隐匿于各处的内乱黑恶势力
同花顺,2025-12-02 05:27:09.000,深成指、创业板指午后双双跌超1%
同花顺,2025-12-02 05:24:48.000,ETF两市成交额超2500亿元
财联社,2025-12-02 05:20:25.000,美元指数1日下跌
同花顺,2025-12-02 05:17:56.000,美银：重申百度“买入”评级 预计AI相关业务将保持高速增长
财联社,2025-12-02 05:15:48.000,土耳其总统谴责黑海油轮遭袭事件
同花顺,2025-12-02 05:15:28.000,英国首相涉华言论，中方回应
同花顺,2025-12-02 05:10:22.000,海南全岛封关在即，黄奇帆建议发展服务贸易，不能“西装料做衬衫”
同花顺,2025-12-02 05:09:31.000,工业富联成交额达100亿元
同花顺,2025-12-02 05:05:47.000,上海：2026年8月1日起所有新建或更新的公共充（换）电设施均须采用通过充电桩产品强制性认证的产品
同花顺,2025-12-02 05:04:11.000,宁德时代在湖州投资成立新能源科技公司
同花顺,2025-12-02 05:04:03.000,2027年世界无线电通信大会将在中国上海举办
同花顺,2025-12-02 05:01:56.000,创业板指跌1%
同花顺,2025-12-02 05:01:40.000,食品股午后再度拉升，安记食品、惠发食品直线涨停
财联社,2025-12-02 05:00:42.000,美股三大指数集体收跌 加密货币概念股跌幅居前
财联社,2025-12-02 05:00:42.000,美股三大指数集体收跌
同花顺,2025-12-02 04:59:09.000,清华成立具身智能与机器人研究院
同花顺,2025-12-02 04:52:56.000,前10月福建泉州纺织机械出口同比增长超四成
同花顺,2025-12-02 04:50:02.000,全国首票进口印尼冷冻榴莲运抵福州
同花顺,2025-12-02 04:37:09.000,机构：受存储芯片涨价影响 游戏主机明年出货量预估将下降4.4%
同花顺,2025-12-02 04:33:03.000,法国前总理：中法应在全球重要领域携手合作
同花顺,2025-12-02 04:31:24.000,华宸未来基金回应旗下债基净值回撤：个别债券受市场环境影响发生了较大幅度的调整
同花顺,2025-12-02 04:18:40.000,OpenAI计划推迟广告业务等其他举措
同花顺,2025-12-02 04:14:06.000,众擎发布T800全尺寸极致高效能通用人形机器人
同花顺,2025-12-02 04:13:18.000,机器人的“ChatGPT时刻”何时到来？英伟达高管：需满足2个条件
财新网,2025-12-02 04:13:11.793,人民币将创五年来最佳年度表现
财联社,2025-12-02 04:13:07.000,俄称已控制红军城和沃尔昌斯克
同花顺,2025-12-02 04:12:55.000,攀钢计划投资五十亿元 全面推进钒钛磁铁矿绿色智能地下开采
同花顺,2025-12-02 04:12:20.000,12月2日午间公告一览：巨子生物拟回购不超过1.04亿股股份
同花顺,2025-12-02 04:01:05.000,港股午评：恒生指数涨0.11%，恒生科技指数跌0.53%
同花顺,2025-12-02 03:52:26.000,支持台胞开设沙县小吃门店等，福建发布12条惠台政策措施
同花顺,2025-12-02 03:44:52.000,加拿大宣布完成加入“欧洲安全行动”谈判
同花顺,2025-12-02 03:42:35.000,海浪蓝色警报，辽宁、山东、福建近岸海域将有中到大浪
同花顺,2025-12-02 03:31:40.000,上海：普惠性民办幼儿园保育教育费收费标准为不高于700元/生每月
财新网,2025-12-02 03:31:03.102,市场对万科的流动性担忧从“预期”走向“现实”
同花顺,2025-12-02 03:31:01.000,ETF午评：标普消费ETF领涨1.59%，标普生物科技ETF领跌2.2%
同花顺,2025-12-02 03:30:46.000,A股午评：沪指半日跌0.55%，多只福建本地股逆势走高
同花顺,2025-12-02 03:30:41.000,ETF两市成交额2164.03亿元
同花顺,2025-12-02 03:28:07.000,南向资金净买入超20亿港元
同花顺,2025-12-02 03:26:05.000,清微智能完成超20亿元C轮融资，已启动上市筹备工作
同花顺,2025-12-02 03:22:58.000,低空物流城市乡村“两端发力” 解决传统物流难题
同花顺,2025-12-02 03:22:54.000,马杜罗：委内瑞拉拒绝“奴隶式和平”
同花顺,2025-12-02 03:17:26.000,ETF两市成交额超2000亿元
同花顺,2025-12-02 03:15:54.000,海南自贸区板块短线拉升，海马汽车涨停
同花顺,2025-12-02 03:15:23.000,沪深京三市成交额超1万亿元，较上日此时缩量1674亿元
同花顺,2025-12-02 03:13:45.000,京东数字人直播免费向所有商家开放
财新网,2025-12-02 03:12:17.273,AI能力从客服走向全链条
同花顺,2025-12-02 03:09:22.000,阿里巴巴宣布图片生成及编辑模型Qwen-Image更新
同花顺,2025-12-02 03:04:05.000,福建：再推12条惠台利民政策措施 推进对台商贸文旅交流合作
同花顺,2025-12-02 03:02:53.000,大连海事局发布航行警告，渤海部分海域进行实弹射击
同花顺,2025-12-02 03:02:43.000,推进婚姻家庭纠纷预防化解 最高法与全国妇联联合印发通知
同花顺,2025-12-02 02:55:08.000,福建：推进存算网核心设施国产化升级改造
同花顺,2025-12-02 02:50:09.000,伊朗称美国成为国际安全“最大威胁”
同花顺,2025-12-02 02:48:02.000,五粮液物产公司增资至11.34亿，增幅约29%
同花顺,2025-12-02 02:40:32.000,白宫开会讨论对委内瑞拉行动，致命打击“贩毒船”合法性遭两党质疑
同花顺,2025-12-02 02:40:13.000,秘鲁山体滑坡致客船沉没 至少12人死亡
同花顺,2025-12-02 02:39:11.000,TCL科技据悉考虑五年来的首次境外债券发行
财联社,2025-12-02 02:37:54.000,以美领导人通话 特朗普邀请内塔尼亚胡访美
同花顺,2025-12-02 02:37:05.000,ETF两市成交额超1500亿元
同花顺,2025-12-02 02:36:43.000,国债期货走弱 30年期主力合约跌超0.4%
同花顺,2025-12-02 02:31:50.000,富时中国A50指数期货盘中转跌
同花顺,2025-12-02 02:31:37.000,沪深京三市成交额超8000亿元，较上日此时缩量1279亿元
同花顺,2025-12-02 02:30:02.000,商业航天板块再度拉升，招标股份20cm涨停
同花顺,2025-12-02 02:28:58.000,北京亦庄加快打造世界级XR产业集群
同花顺,2025-12-02 02:27:55.000,台湾宜兰县发生3.4级地震 震源深度10千米
同花顺,2025-12-02 02:27:02.000,冰雪产业板块短线拉升，冰山冷热直线涨停
同花顺,2025-12-02 02:23:51.000,“21万科06”盘中二次临时停牌
财联社,2025-12-02 02:20:41.000,Jane Street和城堡证券全年交易业务收入迈向历史新高
同花顺,2025-12-02 02:18:57.000,西藏：完善国有企业公司治理 强化国有企业招商功能
同花顺,2025-12-02 02:16:18.000,ETF两市成交额超1000亿元
同花顺,2025-12-02 02:15:00.000,煤炭开采加工板块震荡拉升，安泰集团涨停
同花顺,2025-12-02 02:12:08.000,李家超：香港特区立法会选举将如期举行
同花顺,2025-12-02 02:11:54.000,戴盟机器人完成新一轮战略融资
同花顺,2025-12-02 02:11:44.000,医药商业板块持续拉升，人民同泰涨停
同花顺,2025-12-02 02:11:17.000,蚂蚁灵光用户已创建330万个AI应用
同花顺,2025-12-02 02:09:46.000,坤泰股份与烟台智能制造技术与装备创新中心达成战略合作
同花顺,2025-12-02 02:08:02.000,斯里兰卡极端天气致390人死亡
同花顺,2025-12-02 02:07:23.000,中老铁路开通运营四年累计发送旅客超6250万人次
财联社,2025-12-02 02:04:20.000,美联储关注地区性银行商业地产敞口 示警相关潜在风险
财联社,2025-12-02 01:54:30.000,LME金属期货收盘普遍上涨
同花顺,2025-12-02 01:51:48.000,深圳证券交易所：21万科06盘中临时停牌
同花顺,2025-12-02 01:50:29.000,福建本地股局部走高，平潭发展、榕基软件双双涨停
同花顺,2025-12-02 01:49:40.000,四川局积极支持辖区机构开展北交所做市业务
同花顺,2025-12-02 01:45:09.000,商业航天板块局部延续活跃，通宇通讯4连板
同花顺,2025-12-02 01:43:12.000,国债期货走弱 30年期主力合约跌超0.2%
同花顺,2025-12-02 01:42:36.000,零售板块异动拉升，合百集团、茂业商业双双涨停
同花顺,2025-12-02 01:41:54.000,德国将为二战波兰受害者建纪念碑并归还侵占文物
同花顺,2025-12-02 01:41:12.000,广汽集团港股涨幅扩大至10%
财联社,2025-12-02 01:39:16.000,泽连斯基与欧洲多方讨论乌美佛州会谈
同花顺,2025-12-02 01:38:25.000,港股保险板块盘初上扬，中国太保、友邦保险涨超2%
财联社,2025-12-02 01:38:10.000,泽连斯基：乌美就领土问题讨论长达6.5小时
同花顺,2025-12-02 01:36:29.000,“21万科02”“21万科04”盘中临时停牌
同花顺,2025-12-02 01:36:03.000,宁波舟山港年集装箱吞吐量首次突破4000万标准箱
同花顺,2025-12-02 01:35:45.000,海南自贸区板块盘初走低，康芝药业跌超7%
同花顺,2025-12-02 01:34:42.000,有色金属板块盘初回调，华锡有色跌超5%
同花顺,2025-12-02 01:34:34.000,北约称美在德测试反无人机技术
同花顺,2025-12-02 01:34:26.000,国家移民局提醒认准官方渠道 填报入境卡不收费
同花顺,2025-12-02 01:33:47.000,港股TATA健康盘初涨超20%
同花顺,2025-12-02 01:29:45.000,以总理内塔尼亚胡出席贪腐案听证会 民众抗议其赦免请求
同花顺,2025-12-02 01:29:41.000,国债期货多数低开
同花顺,2025-12-02 01:28:50.000,特朗普政府将入股芯片初创公司XLIGHT
财联社,2025-12-02 01:24:16.000,秘鲁东部一港口发生河上事故 已致12人死亡
同花顺,2025-12-02 01:08:46.000,苏丹快速支援部队宣布控制苏丹西部重要城市巴巴努萨
同花顺,2025-12-02 01:07:55.000,深圳机场正式迈入“三跑道时代”
同花顺,2025-12-02 01:05:47.000,贵州黔能一号私募基金成立
同花顺,2025-12-02 01:05:36.000,上期所欧线集运主力合约涨超2%
同花顺,2025-12-02 01:05:29.000,海南离岛免税新政实施首月购物金额23.8亿元
同花顺,2025-12-02 01:04:32.000,中国疾控中心：全国流感阳性率近45%
财联社,2025-12-02 01:01:19.000,苏丹领导人：冲突解决方案须包括解散快速支援部队
同花顺,2025-12-02 01:01:10.000,中国台湾加权指数高开0.76%
同花顺,2025-12-02 01:00:28.000,期市早盘开盘，国内期货主力多数上涨
同花顺,2025-12-02 01:00:07.000,富时中国A50指数期货开盘涨0.07%
同花顺,2025-12-02 00:56:29.000,日媒：日本经团联、议员团接连请求访华
同花顺,2025-12-02 00:56:08.000,华丰股份入股极篇人工智能科技公司
同花顺,2025-12-02 00:49:18.000,OpenAI准备在ChatGPT中植入广告
同花顺,2025-12-02 00:48:14.000,两市融资余额5连升 较上一日增加101.66亿元
同花顺,2025-12-02 00:47:34.000,西班牙政府召开紧急会议 严防非洲猪瘟病毒进入商业养猪场
财联社,2025-12-02 00:47:03.000,欧洲主要股指多数收跌
同花顺,2025-12-02 00:46:36.000,俄美及乌欧就“和平计划”密集互动
同花顺,2025-12-02 00:46:03.000,长安汽车11月销量28.3万辆
同花顺,2025-12-02 00:42:23.000,健友股份子公司健进制药自主研发注射用达巴万星获美国FDA批准上市
同花顺,2025-12-02 00:41:45.000,40年期日本国债收益率上涨1.5个基点
同花顺,2025-12-02 00:40:10.000,可灵AI正式发布“可灵O1”
同花顺,2025-12-02 00:37:09.000,国安部：警惕境外组织利用恶意SDK嵌入应用软件，收集敏感信息
同花顺,2025-12-02 00:31:59.000,湖南11项举措提振扩大消费
同花顺,2025-12-02 00:30:26.000,美国财长卢特尼克证实美国关税削减计划后，现代汽车股价上涨4%
财联社,2025-12-02 00:28:30.000,法乌领导人举行新闻发布会 强调对乌安全保障
同花顺,2025-12-02 00:26:34.000,中东部多地气温将创下半年来新低 南方干燥暂时缓和
同花顺,2025-12-02 00:25:15.000,日本民众要求调查美军基地污染问题
同花顺,2025-12-02 00:22:48.000,日本防卫费13连增 专家：警惕其“扩武”野心
同花顺,2025-12-02 00:17:35.000,全国首支AI领域孵化培育型创新基金发布
同花顺,2025-12-02 00:09:00.000,日股发那科股价上涨5%
同花顺,2025-12-02 00:08:04.000,澳新银行不再预计澳洲联储在2026年上半年进行一次最终降息
同花顺,2025-12-02 00:07:30.000,国金证券：机器人产业将迎来奇点时刻
同花顺,2025-12-02 00:07:04.000,开源证券：人形机器人板块持续反弹，布局窗口开启
同花顺,2025-12-02 00:06:23.000,谷歌进一步加码具身机器人，重视工程机械出海大趋势和国内非挖拐点
同花顺,2025-12-02 00:04:35.000,现货黄金失守4230美元/盎司
同花顺,2025-12-02 00:03:51.000,“大空头”Michael Burry披露做空特斯拉
财联社,2025-12-02 00:03:46.000,俄官员：若美持积极态度 愿恢复网络安全领域合作
同花顺,2025-12-02 00:03:28.000,速腾聚创起诉灵明光子，后者称“未收到任何法律函件”
同花顺,2025-12-02 00:02:58.000,日韩股市高开
财联社,2025-12-01 23:44:05.000,比特币跌破84000美元
财联社,2025-12-01 23:42:26.000,联合光电：拟购买长益光电100%股份 交易价格2.6亿元
财联社,2025-12-01 23:41:50.000,乌代表团团长称乌美佛州会谈“取得显著进展”
同花顺,2025-12-01 23:40:25.000,Adobe：预计消费者在网络星期一的支出将介于139亿美元至142亿美元之间
同花顺,2025-12-01 23:38:57.000,美国启动“创世纪计划”推动人工智能发展
同花顺,2025-12-01 23:30:21.000,资本关注企业加码 冰雪经济持续升温
同花顺,2025-12-01 23:30:02.000,纽约期金突破4270美元/盎司，日内跌0.13%
财联社,2025-12-01 23:28:29.000,以军称打死2名越过“黄线”的武装人员
同花顺,2025-12-01 23:24:45.000,汇聚多方合力 筑牢稳市制度根基
同花顺,2025-12-01 23:24:33.000,环球时报社评：人民币受青睐是现实选择，不是对抗游戏
同花顺,2025-12-01 23:24:21.000,用户报告OpenAI服务出现“宕机”
财联社,2025-12-01 23:24:03.000,美国工厂活动以四个月来最快速度萎缩 原材料支付价格回升
财联社,2025-12-01 23:20:56.000,我国科学家全面模拟火星沙尘循环
同花顺,2025-12-01 23:18:26.000,美国政府宣布美英就药品定价达成原则性协议
同花顺,2025-12-01 23:13:10.000,蓝佛安：将不新增隐性债务作为“铁的纪律” 推动建立统一的地方政府债务长效监管制度
同花顺,2025-12-01 23:12:06.000,蓝佛安：完善人口发展支持政策体系 优化养老、托育服务供给
同花顺,2025-12-01 23:09:33.000,蓝佛安：全方位扩大国内需求，支持建设强大国内市场
同花顺,2025-12-01 23:09:25.000,苹果宣布AI主管卸任
财联社,2025-12-01 23:01:34.000,国内商品期市夜盘多数上涨 化工品涨幅居前甲醇涨1.89%
财联社,2025-12-01 22:50:58.000,刚果（金）宣布第16轮埃博拉疫情结束
财联社,2025-12-01 22:50:19.000,云南金浔资源股份有限公司递表港交所
同花顺,2025-12-01 22:49:19.000,寒潮+大风双预警 东北、江南中东部等地将出现大风降温天气
财联社,2025-12-01 22:35:16.000,英唐智控：公司车载显示芯片部分已实现量产
财联社,2025-12-01 22:34:29.000,纳斯达克中国金龙指数盘初涨约0.5%
财联社,2025-12-01 22:31:42.000,纳指低开0.85% 科技、加密货币板块领跌
财联社,2025-12-01 22:23:28.000,Strategy宣布建立股息和利息准备金 以缓解市场对其可能出售比特币的担忧
财联社,2025-12-01 22:20:58.000,航旅纵横大面积误发通知？最新回应：提供专项补偿
财联社,2025-12-01 22:17:52.000,泽连斯基与马克龙会谈 聚焦和平谈判与安全保障
财联社,2025-12-01 22:13:52.000,国泰海通：中国资本市场处于大发展的周期 股指向上还有很大空间
财联社,2025-12-01 22:13:27.000,俄外交部：北约对俄“先发制人打击”言论“极不负责任”
财联社,2025-12-01 22:11:38.000,空客证实“机身面板存在质量问题”报道 称问题根源已查明并得到控制
财联社,2025-12-01 22:03:38.000,【公告全知道】6G+商业航天+芯片+军工+华为！公司拥有6G低轨卫星互联网系统等关键技术
财联社,2025-12-01 21:56:18.000,园林股份：拟购买华澜微6.5%股份 交易总金额合计1.12亿元
财联社,2025-12-01 21:53:00.000,【风口研报·洞察】字节发布豆包手机助手，抢占手机AI入口，分析师认为12月18日至19日举办的“Force字节原动力大会”或为产业链注入全新驱动力；如何布局春季躁动行情
财联社,2025-12-01 21:52:38.000,万科20亿元境内债展期初步方案：本金及利息兑付拟展期一年 票面利率维持不变
财联社,2025-12-01 21:51:38.000,崔东树：2025年10月中国占世界汽车份额38%
财联社,2025-12-01 21:50:35.000,芯海科技：在机器人领域围绕电子皮肤等关键应用 正与相关客户进行探索与合作
财联社,2025-12-01 21:46:21.000,财联社12月1日晚间新闻精选
财联社,2025-12-01 21:40:57.000,"BitMine上周增持96,798枚以太坊 总持仓量增至3,726,499枚"
财联社,2025-12-01 21:40:39.000,北京深演智能科技股份有限公司递表港交所
财联社,2025-12-01 21:34:27.000,工信部部长李乐成会见挪威渔业和海洋政策大臣玛丽安·奈斯
财联社,2025-12-01 21:33:06.000,农业农村部：统筹推进南疆现代设施农业高质量发展
同花顺,2025-12-01 21:29:25.000,马克龙：只有乌欧参与才能达成俄乌“和平计划”
同花顺,2025-12-01 21:29:14.000,富时A50期指连续夜盘收涨0.13%
财联社,2025-12-01 21:25:27.000,摩根士丹利策略师：韩元最糟糕时期可能已经过去
财联社,2025-12-01 21:21:05.000,TCL中环：张长旭辞去CFO职务 聘任杨帆为新任CFO
财联社,2025-12-01 21:19:11.000,美股盘前要闻一览
财联社,2025-12-01 21:17:31.000,上海闵行区330公里自动驾驶测试道路即将开放
财联社,2025-12-01 21:15:54.000,卓翼科技：认定和山未来为公司控股股东 陈雍为实际控制人
财联社,2025-12-01 21:15:08.000,博亚精工：股东李文喜计划询价转让450万股 占总股本3.83%
财联社,2025-12-01 21:12:35.000,高乐股份：实控人将变更为王帆 股票明起复牌
财联社,2025-12-01 21:12:16.000,Strategy上周斥资1170万美元增持130枚比特币
同花顺,2025-12-01 21:11:49.000,亚马逊计划推出新的美国超快速配送服务
财联社,2025-12-01 21:08:51.000,乌克兰第聂伯市遭导弹袭击致4人死亡
财联社,2025-12-01 21:08:37.000,【财联社早知道】DeepSeek发布两款新模型，机构称国产大模型迭代推动AI算力投资持续高景气，这家公司参股了国内掌握TPU架构AI芯片核心研发技术并实现TPU芯片量产的公司
财联社,2025-12-01 21:06:47.000,威领股份：山南锑金将成为第一大股东 股票将于明日复牌
财联社,2025-12-01 21:04:42.000,沃尔核材：高速通信线448G样品已送客户验证
同花顺,2025-12-01 21:03:34.000,纳斯达克中国金龙指数收涨0.87%，热门中概股多数收涨
财联社,2025-12-01 21:03:10.000,英伟达以每股414.79美元的价格投资20亿美元入股新思科技
财联社,2025-12-01 21:03:07.000,金字火腿：中晟微专注于400G/800G/1.6T高速光模块芯片
财联社,2025-12-01 20:56:31.000,海航控股：拟向海航货运增资7.5亿元
财联社,2025-12-01 20:55:10.000,【风口研报·公司】聚焦锂电材料，且具备大股东集团原材料优势+自供绿电降本，分析师看好这家公司受益本轮储能锂电需求爆发；纸类价格底部反弹，这家公司在原料采购及供应链上具备显著优势，提价后盈利空间有望打开
财联社,2025-12-01 20:52:56.000,深圳华强：前三季度公司存储产品线出货总额同比大幅增长
财联社,2025-12-01 20:51:28.000,香港暂停进口加拿大、波兰和英国部分地区禽肉及禽类产品
财联社,2025-12-01 20:49:33.000,兴业银锡：全资子公司拟以3.08亿元收购威领股份7.76%股权
财联社,2025-12-01 20:48:49.000,立昂微：今年以来硅片出货量持续创新高
财联社,2025-12-01 20:48:12.000,迎丰股份：第三事业部将成新利润增长点 各工厂平均月产能利用率超70%
财联社,2025-12-01 20:47:47.000,高盛宣布同意收购创新者资本管理公司
财联社,2025-12-01 20:45:20.000,蜀道装备：拟与关联方共同投资20亿元设立产业投资基金
财联社,2025-12-01 20:41:25.000,翱捷科技：阿里巴巴网络技术有限公司11月24日至12月1日减持1.3%公司股份
财联社,2025-12-01 20:41:25.000,翱捷科技第一大股东阿里网络11月24日至12月1日减持1.3%股份
财联社,2025-12-01 20:38:01.000,天华新能：控股股东协议转让12.95%公司股份完成过户登记
财联社,2025-12-01 20:34:17.000,三人行：控股股东及其一致行动人拟协议转让公司8%股份
财联社,2025-12-01 20:27:47.000,以色列总统回应内塔尼亚胡赦免请求
财联社,2025-12-01 20:21:21.000,中金辐照：拟定增募资不超8亿元 控股股东参与认购
财联社,2025-12-01 20:20:36.000,合力泰：拟投资5000万元参与设立产业基金 主要投资半导体、人工智能等行业
财联社,2025-12-01 20:19:07.000,12月1日周一《新闻联播》要闻25条
财联社,2025-12-01 20:18:47.000,中公教育：股东王振东计划减持不超2%股份
财联社,2025-12-01 20:14:35.000,住建部：各地住建部门要全面排查欠薪隐患 切实做好欠薪化解稳控工作
财联社,2025-12-01 20:14:20.000,胜宏科技：应用于机器人领域的PCB产品已进入生产销售阶段
财联社,2025-12-01 20:11:59.000,五连板*ST苏吴：收到股票终止上市决定 预计最后交易日期为12月29日
财联社,2025-12-01 20:10:43.000,浙江：抢抓人工智能发展浪潮，发挥数字经济、平台经济优势作用
财联社,2025-12-01 20:08:51.000,美迪凯：拟定增募资不超过7亿元 用于MEMS器件光学系统制造项目等
同花顺,2025-12-01 20:08:25.000,谷歌将Gemini 3人工智能模式引入谷歌搜索，覆盖近120个国家和地区
财联社,2025-12-01 20:06:32.000,佰维存储：拟择机出售所持联芸科技部分或全部股票
财联社,2025-12-01 20:04:30.000,佰维存储：回购股份资金总额调整为8000万元-1.5亿元 回购股份价格上限上调至不超过182.07元/股
财联社,2025-12-01 20:01:09.000,市场监管总局：严打持证企业为无证主体“贴牌”等违法行为
财联社,2025-12-01 20:00:57.000,【电报解读】性能比肩GPT-5略低于Gemini-3.0-Pro，DeepSeek V3.2正式版发布！机构看好AI软硬件协同将优化大模型部署性能，这家公司完成DeepSeek-R1的接入与本地化部署
财联社,2025-12-01 20:00:19.000,中信证券维持戴尔“买入”评级 目标价160美元
财联社,2025-12-01 19:58:34.000,两连败 中国男篮76比90再输韩国
财联社,2025-12-01 19:56:40.000,中绿电：证券简称拟变更为绿发电力
财联社,2025-12-01 19:56:33.000,中粮科技：投资8.8亿元建设平凉25万吨/年淀粉糖及1万吨/年阿洛酮糖新建项目
财联社,2025-12-01 19:52:56.000,印尼洪灾和山体滑坡已致604人遇难
财联社,2025-12-01 19:52:00.000,俄外交部发言人：北约言论显露蓄意升级局势企图
财联社,2025-12-01 19:48:39.000,赛力斯11月新能源汽车销量55203辆 同比增长50%
财联社,2025-12-01 19:47:14.000,12月中国境内到日本的计划航班取消超40%
财联社,2025-12-01 19:45:21.000,日本民众要求调查美军基地“永久性化学物”污染问题
财联社,2025-12-01 19:43:58.000,深房中协：深圳二手房市场已逐步走出最低谷 交易量进入企稳阶段
财联社,2025-12-01 19:40:46.000,【机构调研】这家智能蓝牙穿戴SoC芯片厂商端侧AI处理器芯片相关销售收入实现数倍增长
财联社,2025-12-01 19:35:08.000,汇通控股：拟以3000万元-5000万元回购公司股份
同花顺,2025-12-01 19:34:57.000,荷兰和乌克兰将联合生产无人机
财联社,2025-12-01 19:29:57.000,凯旺科技：拟与稳尖科技设立液冷散热子公司
财联社,2025-12-01 19:29:42.000,汇通控股：拟约10亿元投建90万套高端新能源汽车造型部件及声学产品项目
同花顺,2025-12-01 19:26:35.000,加密货币市场跌势连绵 近10亿美元杠杆头寸被平仓
财联社,2025-12-01 19:26:04.000,孙正义称他“哭着”清仓英伟达：若非需要资金 原本一股也不会卖
财联社,2025-12-01 19:24:56.000,上汽产投人形机器人领域投资已涵盖本体、具身智能等  将落地上汽通用电芯上下料场景
财联社,2025-12-01 19:22:26.000,【电报解读】 苹果首款可折叠iPhone预计将于2026年秋季正式发布，机构测算年销量有望达到千万级水平，这家公司有系列柔性屏产品
财联社,2025-12-01 19:22:09.000,天邦食品：终止“天邦股份数智化猪场升级项目”
财联社,2025-12-01 19:20:12.000,大连出台北方首个好小区标准
财联社,2025-12-01 19:17:38.000,万林物流：公司控股股东协议转让股份终止
财联社,2025-12-01 19:16:45.000,拓斯达：股东杨双保拟减持不超1.19%股份
