来源,时间,标题
同花顺,2026-04-01 03:50:50,特朗普签署行政令收紧选举邮寄投票规则
同花顺,2026-04-01 03:46:24,广州市卫生健康委推进“港澳药械通”政策深入实施十条措施
同花顺,2026-04-01 03:44:24,普冉股份：从2026年4月15日起，对通用MCU相关产品价格进行上调
同花顺,2026-04-01 03:43:35,迦南智能：公司中标6303.82万元国家电网项目
同花顺,2026-04-01 03:41:33,国家数据局：以世界数据组织成立为契机 深入推进数字中国建设
同花顺,2026-04-01 03:40:17,以称监测到从也门发射的导弹
同花顺,2026-04-01 03:35:47,以军监测到自也门发射的导弹
同花顺,2026-04-01 03:35:32,古巴：感谢中国无条件支持
同花顺,2026-04-01 03:32:10,国台办：民进党当局乞求外部势力虚假“保护”只会以卵击石、自取灭亡
同花顺,2026-04-01 03:31:32,A股午评：上证指数高开震荡涨1.36% 全市场超4300家个股上涨
同花顺,2026-04-01 03:31:24,ETF午评：恒生创新药ETF领涨6.73%，标普油气ETF领跌5.46%
同花顺,2026-04-01 03:30:59,ETF两市成交额3713.96亿元
同花顺,2026-04-01 03:30:39,股指期货早盘收盘 主力合约全线上涨
同花顺,2026-04-01 02:59:49,拉普拉斯直线拉升触及涨停
同花顺,2026-04-01 02:57:45,联想杨元庆：上一财年营收将创新高 有望达到5600亿元
同花顺,2026-04-01 02:55:28,拉普拉斯中标特斯拉光伏项目第二期，订单规模近百亿
同花顺,2026-04-01 02:54:13,光伏设备板块短线拉升
同花顺,2026-04-01 02:50:31,加纳总统：愿同中方一道推动双边关系进一步发展
同花顺,2026-04-01 02:49:14,沃飞长空完成股改
同花顺,2026-04-01 02:47:53,光大期货：停火信号助推黄金价格强势反弹
同花顺,2026-04-01 02:45:23,ETF两市成交额超2500亿元
同花顺,2026-04-01 02:41:36,国台办回应台湾电影标写“中国台湾地区”：符合一个中国原则 无可指摘
同花顺,2026-04-01 02:41:29,现货白银失守74美元/盎司
同花顺,2026-04-01 02:40:26,国内航线燃油附加费4月5日起涨5倍，800公里以上调百元
同花顺,2026-04-01 02:36:22,国台办：台湾同胞的安全保障和利益福祉 始终系于两岸关系和平发展和祖国统一
同花顺,2026-04-01 02:29:20,日本茨城县地震后东海第二核电站未发现异常情况
同花顺,2026-04-01 02:27:46,沪深京三市成交额超1万亿元，较上日此时放量714亿元
同花顺,2026-04-01 02:22:13,国台办：民进党当局蓄意煽动两岸对立对抗 不得人心不会得逞
同花顺,2026-04-01 02:20:16,伊朗最高领袖致信黎真主党领导人
同花顺,2026-04-01 02:19:59,天兵科技天龙三号火箭或调整至4月3日发射
同花顺,2026-04-01 02:16:17,科创50指数涨幅扩大至3%
同花顺,2026-04-01 02:15:52,空中云汇获得马来西亚国家银行颁发的e-money牌照与MSB Class A牌照批准
同花顺,2026-04-01 01:52:29,但斌自曝入院手术，知情人士称预计其周四复工
同花顺,2026-04-01 01:51:03,轨交设备板块高开低走
同花顺,2026-04-01 01:44:17,沪深京三市成交额超5000亿元，较上日此时放量630亿元
同花顺,2026-04-01 01:43:32,半导体板块持续走高 芯原股份涨超10%
同花顺,2026-04-01 01:39:03,联合国发布报告：中东冲突升级可能引发严重经济后果
同花顺,2026-04-01 01:38:38,美军否认袭击伊朗体育馆 称“不会以平民为目标”
同花顺,2026-04-01 01:36:50,元件板块初盘走高
同花顺,2026-04-01 01:36:33,智谱港股涨超24%
同花顺,2026-04-01 01:34:48,浦发银行张健任浦银人寿董事长，夏云平任党委书记
同花顺,2026-04-01 01:34:28,阳光电源盘中跌超10%
同花顺,2026-04-01 01:33:28,上期所欧线集运主力合约暴跌9%
同花顺,2026-04-01 01:32:40,机场航运板块初盘走强 中国东航、华夏航空涨超5%
同花顺,2026-04-01 01:31:16,股指期货早盘开盘 主力合约集体高开
同花顺,2026-04-01 01:29:48,外交部部长助理蔡伟会见牙买加前总理戈尔丁
同花顺,2026-04-01 01:28:14,美国国务卿鲁比奥称结束伊朗战争终将到来 未来某个时候有可能与伊朗举行直接会谈
同花顺,2026-04-01 01:27:45,存储芯片板块大幅高开，德明利一字涨停
同花顺,2026-04-01 01:27:24,上期所欧线集运主力合约大跌7%
同花顺,2026-04-01 01:27:08,东软集团与贵州大数据产业集团签署产业发展合作协议
同花顺,2026-04-01 01:26:59,韩国股市KOSPI指数上涨6%
同花顺,2026-04-01 01:26:16,ETF开盘：1000增强ETF领涨9.73%，能源化工ETF领跌1.92%
同花顺,2026-04-01 01:06:35,华泰期货：特朗普表示愿意结束对伊朗军事行动，白银价格偏强
同花顺,2026-04-01 01:02:24,日经225指数向上触及53000点
同花顺,2026-04-01 01:02:11,上期所燃油主力合约大跌5% 郑商所瓶片主力合约跌超2%
同花顺,2026-04-01 01:01:54,西班牙强调美以无权决定世界规则
同花顺,2026-04-01 01:01:41,上期所沪银主力合约大涨6%
同花顺,2026-04-01 01:00:29,富时中国A50指数期货盘初涨1.23%
同花顺,2026-04-01 01:00:15,上期所欧线集运主力合约大跌5%
同花顺,2026-04-01 00:59:58,期市早盘开盘，国内期货主力合约多数上涨
同花顺,2026-04-01 00:59:36,3月31日362股获融资买入超亿元 新易盛获买入19.07亿元居首
同花顺,2026-04-01 00:59:34,中信期货：黄金阶段止跌修复，但核心定价仍围绕油价、利率与美元展开
同花顺,2026-04-01 00:58:30,西班牙国防大臣就拒绝支持美以对伊朗军事行动作说明
同花顺,2026-04-01 00:57:26,日本据悉考虑在5月追加释放石油储备
同花顺,2026-04-01 00:52:14,以空袭贝鲁特南部记者驻地窗户震碎
同花顺,2026-04-01 00:50:14,TikTok申请巴西金融科技牌照，以开展信贷和支付业务
同花顺,2026-04-01 00:49:39,三星西安工厂工艺升级，SK海力士提升两大工厂产能，韩国芯片巨头加大在华投资
同花顺,2026-04-01 00:46:49,两市融资余额较上日减少81.58亿元
同花顺,2026-04-01 00:41:14,美光计划研发堆叠式GDDR技术 预计2027年推出原型产品
同花顺,2026-04-01 00:41:01,三星、SK海力士股价涨幅扩大至8%
同花顺,2026-04-01 00:28:34,俄称控制又一居民点 乌称阻止俄军推进
同花顺,2026-04-01 00:27:59,现货黄金涨超1%
同花顺,2026-04-01 00:26:05,安徽：支持支付物业费提取住房公积金 等五项政策自2026年4月1日起施行
同花顺,2026-04-01 00:24:00,“北脑一号”多中心临床试验启动 首例受试者有望重获手部运动功能
同花顺,2026-04-01 00:22:49,华西证券：高端锂电+PCB产品放量，铜箔行业迎来量利上行期
同花顺,2026-04-01 00:18:50,高盛告知急于做空杠杆贷款的客户 其产品尚未准备就绪
同花顺,2026-04-01 00:18:31,现货黄金站上4710美元/盎司
同花顺,2026-04-01 00:16:43,中信证券：用电增速回归常态 结构变化重塑需求
同花顺,2026-04-01 00:16:26,欧洲Stoxx 50指数期货涨幅扩大至1.9%
同花顺,2026-04-01 00:14:47,韩国交易所于KOSPI 200期货上涨5%后启动KOSPI指数熔断机制
同花顺,2026-04-01 00:09:46,"SpaceX为代号为""Apex""的超大型IPO筹备了21家银行"
同花顺,2026-04-01 00:09:18,再吸3亿美元融资，斯坦福教授的镍氢电池落户常州
同花顺,2026-04-01 00:07:23,日经225指数涨幅扩大至3.4%
同花顺,2026-04-01 00:04:30,白宫说特朗普将就伊朗问题发表讲话
同花顺,2026-04-01 00:03:54,伊朗军方：已打击西门子等企业驻以色列分支机构
同花顺,2026-04-01 00:01:39,日韩股市集体高开 韩国综指高开5.49%
同花顺,2026-04-01 00:00:53,布伦特原油站上104美元/桶
同花顺,2026-03-31 23:59:41,现货黄金站上4700美元/盎司
同花顺,2026-03-31 23:51:51,国家知识产权局提示：使用智能体撰写专利申请文件可能诱发多重风险
