来源,时间,标题
财联社,2026-04-03 17:39:31,英法德意日等40多国开会 拒绝向伊朗支付通行费
财联社,2026-04-03 17:38:42,飞龙股份：一季度净利同比预降42.92%-59.23%
财联社,2026-04-03 17:38:21,中基协：无法与北京泰合万峰投资管理有限公司等6家私募基金管理人取得有效联系
财联社,2026-04-03 17:36:18,太空算力关键共性技术“揭榜挂帅”项目发布 单项最高资助1000万元
财联社,2026-04-03 17:35:20,招商轮船：预计相关航运市场运费率持续面临剧烈波动的风险
财联社,2026-04-03 17:35:15,新华制药：获得钠钾镁钙注射用浓溶液药品注册证书
财联社,2026-04-03 17:33:34,物产中大：拟以2亿至4亿元回购股份
财联社,2026-04-03 17:32:06,阿联酋天然气设施因起火暂停运营
财联社,2026-04-03 17:30:42,中科院院士陆建华：太空算力不解决通算网络问题 难形成商业闭环
财联社,2026-04-03 17:30:17,工信部信息通信发展司赵策：太空算力聚焦时空信息应用 助力低空经济与应急通信
财联社,2026-04-03 17:29:36,全球权威大模型盲测榜单公布 阿里千问3.6登顶中国最强编程模型
财联社,2026-04-03 17:26:12,乌称基辅州遭大规模袭击 已致人员伤亡
财联社,2026-04-03 17:23:33,工信部：有攻击者利用针对苹果公司终端产品的漏洞利用工具实施网络攻击活动 可导致信息窃取、系统受控等严重危害
财联社,2026-04-03 17:22:20,中国科学院微生物研究所团队合作揭示结核肉芽肿中胆固醇累积损伤固有-适应性免疫信号轴的新机制
财联社,2026-04-03 17:17:17,伊朗警告将摧毁美以在中东所有资产
同花顺,2026-04-03 17:16:45,美媒公布E-3预警机在沙特被摧毁卫星图
财联社,2026-04-03 17:15:33,*ST精伦：收到上交所拟终止上市事先告知书
同花顺,2026-04-03 17:11:13,伊朗称在波斯湾海域击落一架美军无人机
同花顺,2026-04-03 17:06:37,美科技公司在中东基础设施面临新风险
财联社,2026-04-03 17:06:24,仙鹤股份：实控人之一王明龙因涉嫌短线交易被立案
财联社,2026-04-03 17:05:31,证监会同意嘉德利上交所主板IPO注册
财联社,2026-04-03 17:05:17,担心风险、不满美对外干预 超2000名数学家抵制赴美参会
财联社,2026-04-03 17:04:04,豫光金铅：拟定增募资不超过18.39亿元 用于先进稀贵金属材料智造项目等
财联社,2026-04-03 17:02:30,上海合作组织开发银行多边磋商首次会议在北京举行
财联社,2026-04-03 17:01:47,李云泽：稳妥有序推进金融行业人工智能试点应用 建立健全人工智能安全开发应用治理架构
财联社,2026-04-03 17:00:53,殡葬领域6项行业标准出台
财联社,2026-04-03 17:00:12,四川路桥：下属企业中标南充至广安铁路60.69亿元项目并参与设立合伙企业
财联社,2026-04-03 16:53:51,华海药业：美沙拉秦肠溶片获药品注册证书
财联社,2026-04-03 16:53:10,澳大利亚对部分终止对华热轧钢卷反补贴调查
财联社,2026-04-03 16:52:48,中证指数修订中证华福福建100指数编制方案
财联社,2026-04-03 16:52:19,十部门：人工智能产品和服务应采取充分措施确保隐私数据得到有效保护
财联社,2026-04-03 16:50:56,甘肃省住房和城乡建设厅厅长苏海明接受审查调查
财联社,2026-04-03 16:50:23,以军称伊朗发射集束弹头导弹 击中以北部多地
财联社,2026-04-03 16:50:12,十部门：推广符合科技伦理的人工智能产品和服务 保护科技伦理审查技术知识产权
财联社,2026-04-03 16:48:49,十部门：开展人工智能科技活动应将科技伦理要求贯穿全过程
财联社,2026-04-03 16:44:54,梅德韦杰夫：欧盟正考虑组建一支完整军事力量
财联社,2026-04-03 16:43:41,*ST金比：韩妃投资业绩承诺方收到广东证监局行政监管措施决定书
财联社,2026-04-03 16:42:40,食品安全抽检不合格后怎么办？ 市场监管总局公开征求意见
财联社,2026-04-03 16:42:32,国家药监局：暂停一款印度原料药进口
财联社,2026-04-03 16:41:56,伊朗称摧毁以色列先进隐形巡航导弹
财联社,2026-04-03 16:40:05,乘联分会：2026年1-2月中国汽车出口155万辆 同比增长61%
财联社,2026-04-03 16:39:35,川金诺：一季度净利同比预降33.35%-47.24%
同花顺,2026-04-03 16:39:19,伊朗伊斯兰革命卫队：位于西加利利等地区的以色列军队集结中心及作战支援基地遭到精确打击
财联社,2026-04-03 16:39:16,乘联分会：2026年1-2月锂电池出口单价1.53万美元/吨、下降10%
财联社,2026-04-03 16:37:15,一艘液化天然气船沿阿曼海岸驶出霍尔木兹海峡 为伊朗战争以来首艘
财联社,2026-04-03 16:35:53,清明假期全国水路发送旅客预计403.5万人次
同花顺,2026-04-03 16:35:21,阿富汗兴都库什山区域发生5.8级地震
财联社,2026-04-03 16:35:14,乘联分会：2026年1-2月汽车行业利润435亿元 同比下降30%
财联社,2026-04-03 16:31:54,乘联分会：3月1-31日全国乘用车市场零售165.7万辆 环比增长60%
财联社,2026-04-03 16:31:20,乘联分会：3月全国乘用车新能源市场零售78.4万辆 环比增长69%
财联社,2026-04-03 16:30:28,美众议员：如果美国民众了解到情报机构有关外星生命报告 他们将“夜不能寐”
财联社,2026-04-03 16:28:51,博众精工：截至3月31日在手订单66.34亿元 同比增长163.78%
财联社,2026-04-03 16:28:48,日本EV补贴：BYD比丰田少4万人民币
财联社,2026-04-03 16:28:24,两部门：支持供销合作社所属研究机构等单位积极参与锂电池回收利用相关标准制定工作
财联社,2026-04-03 16:27:37,两部门：鼓励中国再生资源集团等龙头企业在锂电池电动自行车生产、销售集中的地区拓展锂电池回收、运输、处理一体化模式
财联社,2026-04-03 16:26:38,两部门：引导供销合作社再生资源回收企业规范锂电池回收、贮存等关键环节 加强与锂电池综合利用企业合作
财联社,2026-04-03 16:26:01,乌能源部称俄方袭击致多地居民断电
财联社,2026-04-03 16:24:57,美百余专家称对伊朗动武或犯战争罪
财联社,2026-04-03 16:21:52,明视脑机完成1.5亿元天使轮系列融资
财联社,2026-04-03 16:20:20,哈尔滨医科大学原党委书记张斌接受纪律审查和监察调查
财联社,2026-04-03 16:16:57,北京市新增15款已完成登记的生成式人工智能服务
财联社,2026-04-03 16:15:54,今年一季度 全国共新开国际航空货运航线47条
财联社,2026-04-03 16:14:53,广西计划年内基本实现西江干线船舶水污染物“零排放”
财联社,2026-04-03 16:13:44,阿斯顿·马丁在美召回3937辆汽车
财联社,2026-04-03 16:10:08,京东方A：拟36亿元-63亿元回购股份 贷款不超50亿元
财联社,2026-04-03 16:08:12,网信办就《小型个人信息处理者个人信息保护简化措施规定（征求意见稿）》公开征求意见
财联社,2026-04-03 16:06:57,伊朗红新月会仓库遭袭
财联社,2026-04-03 16:05:22,*ST精伦：股票触及交易类强制退市 4月7日起停牌
同花顺,2026-04-03 16:05:11,伊朗谴责美精确打击导弹致21人遇难
财联社,2026-04-03 16:03:29,炬光科技：激光雷达相关定点项目全部取消
财联社,2026-04-03 16:02:22,美国将从6日开始调整对进口钢、铝、铜及相关衍生产品加征的从价关税
财联社,2026-04-03 16:00:02,蔚来：犯罪嫌疑人控制4000余账号抹黑蔚来 已被采取刑事强制措施
财联社,2026-04-03 16:00:01,葛兰素史克超长效单抗新药新适应症在中国获批上市
财联社,2026-04-03 15:57:58,河北启动重大气象灾害（大风）Ⅳ级应急响应
财联社,2026-04-03 15:57:01,4月3日连板股分析：连板股晋级率不足二成 光通信板块一枝独秀
同花顺,2026-04-03 15:55:15,多国召开会议 讨论恢复霍尔木兹海峡通航
财联社,2026-04-03 15:52:01,上汽集团：今年将在不同品牌逐步推出搭载半固态电池的量产车型
财联社,2026-04-03 15:50:59,华东能源监管局会同华北能源监管局赴上海石油天然气交易中心开展专题调研
财联社,2026-04-03 15:47:41,西湖大学团队成功构建全球规模最大的人类泛基因组 发现13%未知序列
财联社,2026-04-03 15:47:33,小米金融旗下上海融资租赁公司增资至8亿 增幅约33%
财联社,2026-04-03 15:46:30,双塔食品：欧盟对中国豌豆蛋白反倾销调查 公司涉案产品倾销税率适用112.7%
财联社,2026-04-03 15:44:02,网信办征求意见：任何组织和个人提供、使用数字虚拟人服务应当尊重知识产权和商业道德 不得侵害他人依法享有的知识产权
财联社,2026-04-03 15:42:20,印度尼西亚对华热轧钢卷启动反倾销日落复审调查
同花顺,2026-04-03 15:38:08,白宫：特朗普已听取美军战机在伊朗坠毁简报 搜救仍在进行
财联社,2026-04-03 15:37:15,事关数字虚拟人信息服务 国家网信办公开征求意见
财联社,2026-04-03 15:36:56,国家网信办征求意见：禁止诱导未成年人沉迷数字虚拟人服务
财联社,2026-04-03 15:36:45,通用汽车一季度在华零售销量约35万辆
财联社,2026-04-03 15:35:21,甘李药业：GLR2037片完成Ⅰ期首例受试者给药
财联社,2026-04-03 15:35:16,越南对华热轧板卷作出反规避初裁
财联社,2026-04-03 15:30:21,北京太空算力创新中心发起筹建
财联社,2026-04-03 15:27:35,外交部：中美双方在禁毒执法等领域保持沟通合作 取得显著成效
财联社,2026-04-03 15:27:21,外交部：中方祝贺敏昂莱先生当选缅甸总统
财联社,2026-04-03 15:26:58,外交部：美方一再说三道四 暴露自身霸占巴拿马运河的图谋
同花顺,2026-04-03 15:26:36,恒信东方：4月8日开市起复牌并实施其他风险警示 股票简称变更为“ST恒信”
财联社,2026-04-03 15:26:20,外交部：美以对伊朗发动军事行动未经联合国安理会授权 违反国际法
财联社,2026-04-03 15:25:55,外交部：巴基斯坦和阿富汗愿意坐下来再次商谈 这是好事
财联社,2026-04-03 15:25:22,外交部回应伊朗桥梁遭袭：中方反对袭击民用设施 有关方应立即停火
财联社,2026-04-03 15:23:30,工信部批复设立深圳国家级互联网骨干直联点
财联社,2026-04-03 15:20:24,俄罗斯发射“联盟-2.1a”运载火箭 搭载军用卫星
财联社,2026-04-03 15:17:16,2026太空算力产业大会发布十大重点攻关项目
同花顺,2026-04-03 15:17:09,两部门部署加强电动自行车锂离子电池回收利用体系建设
财联社,2026-04-03 15:16:43,国债期货收盘多数上涨 30年期主力合约涨0.21%
财联社,2026-04-03 15:15:38,菲律宾对瓦楞原纸作出保障措施终裁
同花顺,2026-04-03 15:14:06,泽连斯基与埃及总统通了电话
同花顺,2026-04-03 15:11:33,巴西一架小型飞机坠毁 飞行员遇难
同花顺,2026-04-03 15:09:18,伊朗地方官员鼓励民众追捕美军飞行员
同花顺,2026-04-03 15:07:29,事关清明假期出行安全 国家防减救灾委办公室发布提醒
同花顺,2026-04-03 15:06:03,以军空袭黎巴嫩东部一宗教场所 造成2人死亡
财联社,2026-04-03 15:06:00,阶跃星辰变更为股份公司
财联社,2026-04-03 15:05:35,雷军名下有品信息科技公司减资至4000万
财联社,2026-04-03 15:03:34,泰国公主诗琳通将访华
财联社,2026-04-03 15:02:31,国内商品期货收盘涨跌不一 燃料油涨超7%
财联社,2026-04-03 15:01:57,收评：沪指缩量调整跌1% 全市场超4700只个股下挫
财联社,2026-04-03 15:00:05,中东战事延宕 日本3月原油进口量创新低
财联社,2026-04-03 14:57:14,赛力斯成立创鑫投资公司 注册资本5亿
财联社,2026-04-03 14:56:52,库迪咖啡旗下厦门科技公司增资至6.9亿
财联社,2026-04-03 14:55:55,韩法称将就霍尔木兹海峡航运安全加强合作
同花顺,2026-04-03 14:52:32,一架美军战机在伊朗境内被击落
财联社,2026-04-03 14:51:56,中东战事前16天美以就打掉260亿美元弹药 全球军火商正“狂揽订单”
财联社,2026-04-03 14:42:30,以色列称美以伊冲突已致以方超6500人受伤
财联社,2026-04-03 14:41:45,法国前总理说美帝走向衰落
财联社,2026-04-03 14:40:10,沪深两市成交额突破1.5万亿 较上一日此时缩量超1800亿
财联社,2026-04-03 14:40:01,西太平洋银行CEO警告称中东冲突可能引发澳大利亚经济衰退
同花顺,2026-04-03 14:38:03,阿联酋环球铝业：全面恢复原铝生产可能需要长达12个月的时间
同花顺,2026-04-03 14:35:50,北部湾港集团与中马钦州产业园区管委会座谈交流
财联社,2026-04-03 14:33:28,东航：4月5日起调整国内航线燃油附加费征收标准
财联社,2026-04-03 14:33:01,中国保险行业协会外资专委会召开全体会议
同花顺,2026-04-03 14:31:42,伊朗总统回应特朗普：“炸回石器时代”言论意味着大规模战争罪
财联社,2026-04-03 14:31:33,以军称在黎南部行动中打死多名真主党武装人员
财联社,2026-04-03 14:28:23,国家国防科技工业局商业航天司副司长于国斌：发展太空算力是突破地面算力瓶颈 保障数字经济可持续发展的战略选择
财联社,2026-04-03 14:26:42,4月3日全国农产品批发市场猪肉平均价格为15.15元/公斤 比昨天下降1.9%
财联社,2026-04-03 14:25:55,谷歌更新Gemini API定价 按推理使用分档计费
同花顺,2026-04-03 14:24:37,科威特拉响防空警报 多地响起巨大爆炸声
财联社,2026-04-03 14:23:35,主力资金监控：电新行业净流出超165亿
财联社,2026-04-03 14:23:15,敏昂莱当选缅甸总统
财联社,2026-04-03 14:21:28,交通运输部对重庆市万开达高速公路工程项目铁峰山隧道“3·30”瓦斯爆炸事故挂牌督办
财联社,2026-04-03 14:10:26,IMF最新预测：到2026年底美联储仅会降息一次
财联社,2026-04-03 14:06:25,Manner Coffee 全国门店单品豆咖啡涨价5元
同花顺,2026-04-03 14:04:18,白宫提交2027财年预算 国防开支飙升至1.5万亿美元
财联社,2026-04-03 14:01:01,苹果公司被曝正在以极高价格收购市面上所有可用移动DRAM芯片
财联社,2026-04-03 13:59:05,布隆迪霍乱疫情反弹 单日新增18例病例
同花顺,2026-04-03 13:56:34,世联行：2025年净亏损6.5亿元
财联社,2026-04-03 13:50:31,【金牌纪要库·风口会议】电动重卡渗透率3月突破四成，出口同比暴增230%，头部企业出海逻辑持续强化
财联社,2026-04-03 13:47:47,敏昂莱在缅甸联邦议会选举中赢得过半选票 将当选总统
同花顺,2026-04-03 13:47:43,国家数据局就数据产权登记工作指引公开征求意见
财联社,2026-04-03 13:45:22,俄副外长要求美国终止对古巴非法封锁
同花顺,2026-04-03 13:41:30,航锦科技：因涉嫌信息披露违法违规被立案
财联社,2026-04-03 13:40:05,俄罗斯一客运列车部分车厢脱轨 正核实伤亡情况
财联社,2026-04-03 13:33:58,【盘中宝】“政策加码+技术不断突破+基础设施不断完善”下该行业迎来三重支撑，Token调用量两年增长超千倍，这家企业打造了适配细分需求的产品矩阵
财联社,2026-04-03 13:18:24,【风口研报·公司】工信部力推“全光交换”应用部署，公司通过收购全面布局光纤器件业务，正联合开发OCS用下一代产品，将打造激光业务之余的第二成长曲线
同花顺,2026-04-03 13:16:56,准油股份：预计2025年度净利润为负值，可能被实施退市风险警示
财联社,2026-04-03 13:16:56,工业气体概念持续活跃 中船特气逼近20cm涨停
财联社,2026-04-03 13:16:52,商业航天概念持续调整 飞沃科技跌超10%
同花顺,2026-04-03 13:16:34,准油股份修正2025年度业绩预告 预计营业收入2.7亿元–2.95亿元
财联社,2026-04-03 13:16:08,美情报显示伊朗约半数导弹发射装置完好无损 美官方否认
财联社,2026-04-03 13:14:27,科威特国家石油公司一炼油厂遭袭起火
同花顺,2026-04-03 13:10:36,泰达股份：拟出售泰达能源51%股权
财联社,2026-04-03 13:10:36,深圳中院：大疆与影石专利权属纠纷案延期听证
同花顺,2026-04-03 13:10:16,山东章鼓：公司股票将于4月8日起被实施其他风险警示
财联社,2026-04-03 13:02:50,天龙三号运载火箭发射失利
财联社,2026-04-03 13:02:47,沪指跌逾1% 下跌个股近4700只
同花顺,2026-04-03 13:00:52,深交所：本周对151起证券异常交易行为采取了自律监管措施
同花顺,2026-04-03 12:59:34,全国消费品以旧换新工作推进电视电话会议在京召开
财联社,2026-04-03 12:56:37,知情人士称美将延迟交付日本订购的“战斧”导弹
财联社,2026-04-03 12:53:40,伊朗再称击落美军F35战机
同花顺,2026-04-03 12:52:06,千里科技：2025年净利润8440.82万元，同比增长110.93%
同花顺,2026-04-03 12:51:54,高乐股份：终止前次非公开发行股票事项
财联社,2026-04-03 12:49:03,俄罗斯一客运列车部分车厢脱轨
财联社,2026-04-03 12:48:38,宏明电子：公司部分电子元器件已应用于商业航天领域
财联社,2026-04-03 12:42:37,美国ITC发布对具有视频功能的笔记本电脑等的337部分终裁
同花顺,2026-04-03 12:42:23,博彦科技：拟出售美国数字技术服务业务
同花顺,2026-04-03 12:40:58,茂硕电源：2025年净亏损2.34亿元
同花顺,2026-04-03 12:40:09,强一股份：预计2026年第一季度净利润同比增加654.79%到761.60%
财联社,2026-04-03 12:39:54,山东：实施十二条举措护航汽车出海
财联社,2026-04-03 12:37:36,美军沙特基地一“萨德”反导雷达在伊朗袭击中受损
同花顺,2026-04-03 12:34:00,市场定价显示，美联储2026年降息押注下降
同花顺,2026-04-03 12:32:20,美国失业率小幅回落 低于预期
财联社,2026-04-03 12:32:18,美国对排量为99cc～225cc的涉华立式发动机及其零部件发起第一次双反日落复审调查
同花顺,2026-04-03 12:32:06,美元指数DXY短线大幅拉升
财联社,2026-04-03 12:31:40,【机构调研】这家公司建成国内首条全流程高端晶圆光刻胶量产线，超20款产品完成送样验证
财联社,2026-04-03 12:31:14,美国对涉华床垫发起第一次反补贴日落复审调查
同花顺,2026-04-03 12:30:31,3月非农大超预期 创逾一年高位
同花顺,2026-04-03 12:26:27,美媒：特朗普对两部长不满 正考虑进一步调整内阁
财联社,2026-04-03 12:24:32,中赋科技：“中环转2”距离停止交易仅剩最后半个交易日
财联社,2026-04-03 12:20:54,秀强股份：公司玻璃深加工产品暂未应用于太空光伏领域
财联社,2026-04-03 12:20:45,【盘中宝•数据】CPO+创新药+算力+芯片+PCB，五大热点一周以来获融资净买入情况（附表）
财联社,2026-04-03 12:18:21,2026年全国工业和信息化科技创新和产业创新融合发展工作座谈会在苏州召开
财联社,2026-04-03 12:16:32,纽瑞特医疗完成10亿元E轮融资
同花顺,2026-04-03 12:15:45,*ST沐邦：选举涂园华为董事长
同花顺,2026-04-03 12:09:40,中颖电子：拟向特定对象发行股票募集资金不超过10亿元
同花顺,2026-04-03 12:07:50,松芝股份：副董事长纪安康等三名高管拟减持股份
同花顺,2026-04-03 12:07:18,中科创达：董事长提议变更回购股份用途为注销
同花顺,2026-04-03 12:07:05,模塑科技：控股股东模塑集团拟减持不超过3%
财联社,2026-04-03 12:06:47,安信基金2025年净利1.3亿微降1.64% 国投瑞银规模与收入双降
同花顺,2026-04-03 12:06:29,博济医药：全资子公司“丹元糖痹软膏”获得药物临床试验批准通知书
财联社,2026-04-03 12:02:38,财联社4月3日午间新闻精选
同花顺,2026-04-03 12:02:18,*ST岩石：公司股票可能因市值低于5亿元被终止上市
同花顺,2026-04-03 12:02:09,妙可蓝多：一季度净利润7555.8万元，同比下降8.30%
财联社,2026-04-03 12:01:22,公安部、国家金融监督管理总局联合部署新一轮金融领域“黑灰产”违法犯罪集群打击工作
同花顺,2026-04-03 11:59:55,伊朗革命卫队证实其海军情报部门一高官遇难
同花顺,2026-04-03 11:57:39,招标股份：六一八发展、吴明禧、林力拟分别减持0.11%、0.01%、0.01%
同花顺,2026-04-03 11:57:33,亿利达：实控人将变更为桐乡市财政局，股票复牌
同花顺,2026-04-03 11:55:55,卓驭科技与立昇科技签署战略合作协议
财联社,2026-04-03 11:50:33,“十五五”电子信息制造业规划座谈会在武汉召开
同花顺,2026-04-03 11:46:31,4月3日 周五《新闻联播》要闻17条
财联社,2026-04-03 11:45:33,曙光数创将推出新一代智算中心基础设施整体解决方案
同花顺,2026-04-03 11:42:31,爱乐达：高管魏雪松拟减持0.0167%
同花顺,2026-04-03 11:42:20,金地集团：2025年净利润亏损132.81亿元
财联社,2026-04-03 11:41:22,4月3日午间涨停分析
同花顺,2026-04-03 11:40:56,科力装备：2025年净利润1.55亿元，同比增长3.33%
同花顺,2026-04-03 11:39:50,日本公司一艘液化天然气运输船通过霍尔木兹海峡
同花顺,2026-04-03 11:39:24,北京启动“清朗京华 聚力净播”直播生态治理专项行动
财联社,2026-04-03 11:37:59,中国常驻联合国代表傅聪：中方不认同伊朗对海合会国家的攻击 航道安全不应受扰
同花顺,2026-04-03 11:36:32,斯莱克：与北京科技大学签署技术开发合同
财联社,2026-04-03 11:36:19,新天科技：公司产品目前没有应用于氢能
同花顺,2026-04-03 11:36:18,本钢板材：2025年净利润亏损39.42亿元
财联社,2026-04-03 11:35:36,商务部发布第二批国家加工贸易产业园名单
同花顺,2026-04-03 11:35:34,环旭电子：2025年净利润18.53亿元，同比增长12.16%
财联社,2026-04-03 11:34:22,【掘金行业龙头】PCB+AI服务器+业绩高增长，已实现50层AI服务器PCB，并完成七阶HDI制造工艺验证，正推进M9材料认证，这家公司2025年净利同比增长超45%
同花顺,2026-04-03 11:32:07,金麒麟：2025年净利润1.36亿元，同比增长47.95%
财联社,2026-04-03 11:31:22,午评：沪指高开低走再度跌破3900点 全市场超4700只个股下跌
同花顺,2026-04-03 11:31:21,明新旭腾：股东明新资产拟减持不超过2%
财联社,2026-04-03 11:31:20,国内期货主力合约涨跌不一 多晶硅跌超5%
同花顺,2026-04-03 11:29:43,爱婴室：2025年净利润8145.68万元，同比下降23.45%
同花顺,2026-04-03 11:29:23,伊朗谴责美以不断升级的战争罪行和威胁言论
同花顺,2026-04-03 11:25:03,两部门启动“就业公共服务进校园百日行动”
同花顺,2026-04-03 11:24:30,铂科新材：拟与芯禾私募及其他合伙人共同投资设立芯禾景盛
财联社,2026-04-03 11:23:55,优必选科技招募首席科学家 年薪1500万元人民币起步 最高可达1.24亿
财联社,2026-04-03 11:18:01,【风口研报·公司】重型燃气轮机海外订单“零”的突破，这家公司已经形成以电力、储能、氢能、电子多赛道布局，以匹配全球能源投资增长与数据中心用电需求
财联社,2026-04-03 11:15:57,武汉公积金政策优化：可提取住房公积金用于危旧房改造
同花顺,2026-04-03 11:13:17,往期年报存在虚假记载被责令改正，菲林格尔：修正后的往期年报会先于2025年年报披露
财联社,2026-04-03 11:12:13,沪深两市成交额突破1万亿 较上一日此时缩量超1200亿
同花顺,2026-04-03 11:12:10,合众思壮：拟将江苏金威100%股权以4590.3万元挂牌转让
同花顺,2026-04-03 11:10:32,博腾股份：2025年净利润9633.99万元，同比增长133.48%
同花顺,2026-04-03 11:09:06,德源药业：达格列净二甲双胍缓释片（Ⅰ）获国家药监局签发药品注册证书
同花顺,2026-04-03 11:08:42,建研设计：2025年净利润2169.41万元，同比增长39.36%
同花顺,2026-04-03 11:08:31,ST朗源：2025年净亏损1497.1万元
财联社,2026-04-03 11:06:41,智元：将于4月7日开启 “智元AI发布周” 密集展示具身智能领域AI自研成果
财联社,2026-04-03 11:04:55,银华绍兴原水水利REIT：汤浦水库工程项目一季度原水收入同比下降68.8%
同花顺,2026-04-03 11:04:24,英联股份：财务总监黄咏松拟减持0.01%
同花顺,2026-04-03 11:04:16,湖南发展：2025年净利润7213.78万元，同比增长6.39%
财联社,2026-04-03 11:02:15,主力资金监控：宁德时代净卖出超11亿
财联社,2026-04-03 11:00:52,中美禁毒执法合作新成果 美方向中方遣返移交一名涉毒逃犯
同花顺,2026-04-03 11:00:48,云南锗业：控股子公司实施“高品质磷化铟单晶片建设项目”，计划总投资1.89亿元
同花顺,2026-04-03 11:00:22,珠海中富：拟定增募资不超9.33亿元
同花顺,2026-04-03 11:00:14,珠海中富：横琴兴赢拟认购定增股份持股18.03%，股票自2026年4月7日开市起复牌
财联社,2026-04-03 11:00:11,武汉公积金新政：首套住房贷款最高比例不超过房屋总价的80% 取消户籍限制
同花顺,2026-04-03 10:58:42,兴发集团：拟投资13.81亿元建设10万吨/年电池级磷酸铁锂项目
同花顺,2026-04-03 10:58:31,兴发集团：2025年净利润14.92亿元，同比下降6.83%
财联社,2026-04-03 10:57:41,美情报部门评估伊朗约半数导弹发射装置完好无损
同花顺,2026-04-03 10:57:19,全球首次！国星宇航硅基智能体调用太空算力通过信通院测试
同花顺,2026-04-03 10:57:04,海南发出首张矿业权抵押权不动产登记证明
财联社,2026-04-03 10:56:33,机器人概念局部异动 嵘泰股份涨停
